"Status","Start Time","Stop Time","Duration in ms","Parent Suite","Suite","Sub Suite","Test Class","Test Method","Name","Description"
"passed","Wed Apr 10 01:31:13 UTC 2024","Wed Apr 10 01:32:38 UTC 2024","85320","tests.integration.high_availability","test_replication","","","","test_no_replication_across_clusters","Test to ensure that writes to one cluster do not replicate to another cluster."
"passed","Wed Apr 10 01:30:50 UTC 2024","Wed Apr 10 01:31:13 UTC 2024","22151","tests.integration.high_availability","test_replication","","","","test_check_consistency","Test to write to primary, and read the same data back from replicas."
"passed","Wed Apr 10 01:30:56 UTC 2024","Wed Apr 10 01:33:27 UTC 2024","150765","tests.integration.high_availability","test_upgrade_rollback_incompat","","","","test_rollback",""
"broken","Wed Apr 10 01:32:47 UTC 2024","Wed Apr 10 01:48:59 UTC 2024","972553","tests.integration.high_availability","test_self_healing","","","","test_freeze_db_process","Test to send a SIGSTOP to the primary db process and ensure that the cluster self heals."
"passed","Wed Apr 10 01:35:00 UTC 2024","Wed Apr 10 01:35:14 UTC 2024","13525","tests.integration","test_charm","","","","test_custom_variables","Query database for custom variables."
"passed","Wed Apr 10 01:30:31 UTC 2024","Wed Apr 10 01:33:11 UTC 2024","159512","tests.integration.high_availability","test_upgrade_from_stable","","","","test_upgrade_from_stable","Test updating from stable channel."
"passed","Wed Apr 10 01:33:19 UTC 2024","Wed Apr 10 01:37:10 UTC 2024","231055","tests.integration.high_availability","test_upgrade","","","","test_fail_and_rollback",""
"passed","Wed Apr 10 01:35:14 UTC 2024","Wed Apr 10 01:35:21 UTC 2024","7499","tests.integration","test_charm","","","","test_log_rotation","Test the log rotation of text files."
"passed","Wed Apr 10 01:31:17 UTC 2024","Wed Apr 10 01:32:47 UTC 2024","90100","tests.integration.high_availability","test_self_healing","","","","test_kill_db_process","Test to send a SIGKILL to the primary db process and ensure that the cluster self heals."
"passed","Wed Apr 10 01:32:38 UTC 2024","Wed Apr 10 01:35:38 UTC 2024","179951","tests.integration.high_availability","test_replication","","","","test_scaling_without_data_loss","Test to ensure that data is preserved when a unit is scaled up and then down.

    Ensures that there are no running continuous writes as the extra data in the
    database makes scaling up slower.
    "
"passed","Wed Apr 10 01:30:30 UTC 2024","Wed Apr 10 01:33:19 UTC 2024","169025","tests.integration.high_availability","test_upgrade","","","","test_upgrade_from_edge",""
"passed","Wed Apr 10 01:30:54 UTC 2024","Wed Apr 10 01:32:36 UTC 2024","102513","tests.integration","test_backups","","","","test_backup","Test to create a backup and list backups."
"passed","Wed Apr 10 01:27:56 UTC 2024","Wed Apr 10 01:30:17 UTC 2024","141745","tests.integration.high_availability","test_upgrade","","","","test_deploy_latest","Simple test to ensure that the mysql and application charms get deployed."
"passed","Wed Apr 10 01:30:20 UTC 2024","Wed Apr 10 01:30:56 UTC 2024","35707","tests.integration.high_availability","test_upgrade_rollback_incompat","","","","test_upgrade_to_failling",""
"skipped","Wed Apr 10 01:49:00 UTC 2024","Wed Apr 10 01:49:00 UTC 2024","0","tests.integration.high_availability","test_self_healing","","","","test_graceful_full_cluster_crash_test","Test to send SIGTERM to all units and then ensure that the cluster recovers."
"passed","Wed Apr 10 01:30:17 UTC 2024","Wed Apr 10 01:30:31 UTC 2024","14379","tests.integration.high_availability","test_upgrade_from_stable","","","","test_pre_upgrade_check","Test that the pre-upgrade-check action runs successfully."
"skipped","Wed Apr 10 01:49:00 UTC 2024","Wed Apr 10 01:49:00 UTC 2024","0","tests.integration.high_availability","test_self_healing","","","","test_network_cut_affecting_an_instance","Test for a network cut affecting an instance."
"passed","Wed Apr 10 01:32:18 UTC 2024","Wed Apr 10 01:32:39 UTC 2024","21355","tests.integration.relations","test_database","","","","test_relation_broken","Remove relation and wait for the expected changes in status."
"passed","Wed Apr 10 01:30:17 UTC 2024","Wed Apr 10 01:30:30 UTC 2024","12327","tests.integration.high_availability","test_upgrade","","","","test_pre_upgrade_check","Test that the pre-upgrade-check action runs successfully."
"passed","Wed Apr 10 01:27:51 UTC 2024","Wed Apr 10 01:29:53 UTC 2024","122794","tests.integration","test_charm","","","","test_build_and_deploy","Build the mysql charm and deploy it."
"passed","Wed Apr 10 01:27:52 UTC 2024","Wed Apr 10 01:30:50 UTC 2024","178150","tests.integration.high_availability","test_replication","","","","test_build_and_deploy","Simple test to ensure that the mysql and application charms get deployed."
"passed","Wed Apr 10 01:28:18 UTC 2024","Wed Apr 10 01:31:17 UTC 2024","178896","tests.integration.high_availability","test_self_healing","","","","test_build_and_deploy","Simple test to ensure that the mysql and application charms get deployed."
"passed","Wed Apr 10 01:29:57 UTC 2024","Wed Apr 10 01:33:29 UTC 2024","212721","tests.integration","test_charm","","","","test_scale_up_and_down","Confirm that a new primary is elected when the current primary is torn down."
"skipped","Wed Apr 10 01:49:00 UTC 2024","Wed Apr 10 01:49:00 UTC 2024","0","tests.integration.high_availability","test_self_healing","","","","test_single_unit_pod_delete","Delete the pod in a single unit deployment and write data to new pod."
"passed","Wed Apr 10 01:34:29 UTC 2024","Wed Apr 10 01:34:38 UTC 2024","9156","tests.integration","test_charm","","","","test_password_rotation","Rotate password and confirm changes."
"passed","Wed Apr 10 01:34:38 UTC 2024","Wed Apr 10 01:34:47 UTC 2024","9137","tests.integration","test_charm","","","","test_password_rotation_silent","Rotate password and confirm changes."
"passed","Wed Apr 10 01:35:38 UTC 2024","Wed Apr 10 01:40:10 UTC 2024","272411","tests.integration.high_availability","test_replication","","","","test_kill_primary_check_reelection","Test to kill the primary under load and ensure re-election of primary."
"passed","Wed Apr 10 01:27:38 UTC 2024","Wed Apr 10 01:30:17 UTC 2024","158972","tests.integration.high_availability","test_upgrade_from_stable","","","","test_deploy_stable","Simple test to ensure that the mysql and application charms get deployed."
"passed","Wed Apr 10 01:29:14 UTC 2024","Wed Apr 10 01:30:54 UTC 2024","100011","tests.integration","test_backups","","","","test_build_and_deploy","Simple test to ensure that the mysql charm gets deployed."
"skipped","Wed Apr 10 01:31:41 UTC 2024","Wed Apr 10 01:31:41 UTC 2024","0","tests.integration.relations","test_database","","","","test_relation_creation_databag","Relate charms and wait for the expected changes in status."
"passed","Wed Apr 10 01:29:53 UTC 2024","Wed Apr 10 01:29:57 UTC 2024","3148","tests.integration","test_charm","","","","test_consistent_data_replication_across_cluster","Confirm that data is replicated from the primary node to all the replicas."
"passed","Wed Apr 10 01:31:41 UTC 2024","Wed Apr 10 01:32:18 UTC 2024","36578","tests.integration.relations","test_database","","","","test_relation_creation","Relate charms and wait for the expected changes in status."
"passed","Wed Apr 10 01:27:38 UTC 2024","Wed Apr 10 01:30:57 UTC 2024","198940","tests.integration.relations","test_mysql_root","","","","test_deploy_and_relate_osm_bundle","Test the deployment and relation with osm bundle with mysql replacing mariadb."
"skipped","Wed Apr 10 01:49:00 UTC 2024","Wed Apr 10 01:49:00 UTC 2024","0","tests.integration.high_availability","test_self_healing","","","","test_graceful_crash_of_primary","Test to send SIGTERM to primary instance and then verify recovery."
"passed","Wed Apr 10 01:30:57 UTC 2024","Wed Apr 10 01:31:31 UTC 2024","34375","tests.integration.relations","test_mysql_root","","","","test_osm_pol_operations","Test the existence of databases and tables created by osm-pol's migrations."
"passed","Wed Apr 10 01:28:06 UTC 2024","Wed Apr 10 01:30:16 UTC 2024","130023","tests.integration.high_availability","test_upgrade_rollback_incompat","","","","test_build_and_deploy","Simple test to ensure that the mysql and application charms get deployed."
"passed","Wed Apr 10 01:30:16 UTC 2024","Wed Apr 10 01:30:20 UTC 2024","4163","tests.integration.high_availability","test_upgrade_rollback_incompat","","","","test_pre_upgrade_check","Test that the pre-upgrade-check action runs successfully."
"passed","Wed Apr 10 01:34:47 UTC 2024","Wed Apr 10 01:34:56 UTC 2024","9156","tests.integration","test_charm","","","","test_password_rotation_root_user_implicit","Rotate password and confirm changes."
"passed","Wed Apr 10 01:32:36 UTC 2024","Wed Apr 10 01:36:29 UTC 2024","232655","tests.integration","test_backups","","","","test_restore_on_same_cluster","Test to restore a backup to the same mysql cluster."
"passed","Wed Apr 10 01:29:33 UTC 2024","Wed Apr 10 01:31:41 UTC 2024","128364","tests.integration.relations","test_database","","","","test_build_and_deploy","Build the charm and deploy 3 units to ensure a cluster is formed."
"passed","Wed Apr 10 01:34:56 UTC 2024","Wed Apr 10 01:35:00 UTC 2024","3980","tests.integration","test_charm","","","","test_exporter_endpoints","Test that endpoints are running."
"passed","Wed Apr 10 01:36:29 UTC 2024","Wed Apr 10 01:42:29 UTC 2024","359914","tests.integration","test_backups","","","","test_restore_on_new_cluster","Test to restore a backup on a new mysql cluster."
"passed","Wed Apr 10 01:33:29 UTC 2024","Wed Apr 10 01:34:29 UTC 2024","59671","tests.integration","test_charm","","","","test_scale_up_after_scale_down","Confirm storage reuse works."
