"Status","Start Time","Stop Time","Duration in ms","Parent Suite","Suite","Sub Suite","Test Class","Test Method","Name","Description"
"passed","Mon May 27 01:33:57 UTC 2024","Mon May 27 01:37:13 UTC 2024","196398","tests.integration.high_availability","test_upgrade","","","","test_fail_and_rollback",""
"passed","Mon May 27 01:30:55 UTC 2024","Mon May 27 01:32:30 UTC 2024","95537","tests.integration.high_availability","test_replication","","","","test_no_replication_across_clusters","Test to ensure that writes to one cluster do not replicate to another cluster."
"passed","Mon May 27 01:29:49 UTC 2024","Mon May 27 01:30:04 UTC 2024","14396","tests.integration.high_availability","test_upgrade_from_stable","","","","test_pre_upgrade_check","Test that the pre-upgrade-check action runs successfully."
"passed","Mon May 27 01:27:40 UTC 2024","Mon May 27 01:30:35 UTC 2024","174280","tests.integration.high_availability","test_self_healing","","","","test_build_and_deploy","Simple test to ensure that the mysql and application charms get deployed."
"passed","Mon May 27 01:27:26 UTC 2024","Mon May 27 01:29:49 UTC 2024","142890","tests.integration.high_availability","test_upgrade_from_stable","","","","test_deploy_stable","Simple test to ensure that the mysql and application charms get deployed."
"passed","Mon May 27 01:35:14 UTC 2024","Mon May 27 01:39:35 UTC 2024","260893","tests.integration.high_availability","test_async_replication","","","","test_failover","Test switchover on primary cluster fail."
"passed","Mon May 27 01:35:23 UTC 2024","Mon May 27 01:35:37 UTC 2024","13476","tests.integration","test_charm","","","","test_custom_variables","Query database for custom variables."
"passed","Mon May 27 01:27:37 UTC 2024","Mon May 27 01:29:57 UTC 2024","140008","tests.integration.high_availability","test_upgrade","","","","test_deploy_latest","Simple test to ensure that the mysql and application charms get deployed."
"passed","Mon May 27 01:29:57 UTC 2024","Mon May 27 01:30:11 UTC 2024","13374","tests.integration.high_availability","test_upgrade","","","","test_pre_upgrade_check","Test that the pre-upgrade-check action runs successfully."
"broken","Mon May 27 01:34:35 UTC 2024","Mon May 27 01:34:41 UTC 2024","6107","tests.integration.high_availability","test_self_healing","","","","test_graceful_crash_of_primary","Test to send SIGTERM to primary instance and then verify recovery."
"passed","Mon May 27 01:39:37 UTC 2024","Mon May 27 01:39:49 UTC 2024","12384","tests.integration.high_availability","test_async_replication","","","","test_rejoin_invalidated_cluster","Test rejoin invalidated cluster with."
"passed","Mon May 27 01:30:31 UTC 2024","Mon May 27 01:30:51 UTC 2024","20816","tests.integration.high_availability","test_replication","","","","test_check_consistency","Test to write to primary, and read the same data back from replicas."
"passed","Mon May 27 01:28:00 UTC 2024","Mon May 27 01:30:16 UTC 2024","135533","tests.integration","test_tls","","","","test_build_and_deploy","Build the charm and deploy 3 units to ensure a cluster is formed."
"passed","Mon May 27 01:27:46 UTC 2024","Mon May 27 01:29:43 UTC 2024","117341","tests.integration.high_availability","test_upgrade_rollback_incompat","","","","test_build_and_deploy","Simple test to ensure that the mysql and application charms get deployed."
"passed","Mon May 27 01:34:44 UTC 2024","Mon May 27 01:34:52 UTC 2024","8279","tests.integration.high_availability","test_async_replication","","","","test_data_replication","Test to write to primary, and read the same data back from replicas."
"passed","Mon May 27 01:29:50 UTC 2024","Mon May 27 01:30:18 UTC 2024","28235","tests.integration.relations","test_database","","","","test_relation_creation","Relate charms and wait for the expected changes in status."
"passed","Mon May 27 01:30:16 UTC 2024","Mon May 27 01:30:17 UTC 2024","1114","tests.integration","test_tls","","","","test_connection_before_tls","Ensure connections (with and without ssl) are possible before relating with TLS operator."
"passed","Mon May 27 01:29:43 UTC 2024","Mon May 27 01:29:48 UTC 2024","5119","tests.integration.high_availability","test_upgrade_rollback_incompat","","","","test_pre_upgrade_check","Test that the pre-upgrade-check action runs successfully."
"passed","Mon May 27 01:30:25 UTC 2024","Mon May 27 01:32:56 UTC 2024","150437","tests.integration.high_availability","test_upgrade_rollback_incompat","","","","test_rollback",""
"passed","Mon May 27 01:35:01 UTC 2024","Mon May 27 01:35:11 UTC 2024","10146","tests.integration","test_charm","","","","test_password_rotation_silent","Rotate password and confirm changes."
"passed","Mon May 27 01:31:17 UTC 2024","Mon May 27 01:31:51 UTC 2024","33417","tests.integration.relations","test_mysql_root","","","","test_osm_pol_operations","Test the existence of databases and tables created by osm-pol's migrations."
"passed","Mon May 27 01:35:23 UTC 2024","Mon May 27 01:39:16 UTC 2024","232528","tests.integration.high_availability","test_replication","","","","test_kill_primary_check_reelection","Test to kill the primary under load and ensure re-election of primary."
"skipped","Mon May 27 01:35:42 UTC 2024","Mon May 27 01:35:42 UTC 2024","0","tests.integration.high_availability","test_self_healing","","","","test_graceful_full_cluster_crash_test","Test to send SIGTERM to all units and then ensure that the cluster recovers."
"passed","Mon May 27 01:39:52 UTC 2024","Mon May 27 01:42:53 UTC 2024","180350","tests.integration.high_availability","test_async_replication","","","","test_remove_relation_and_relate","Test removing and re-relating the two mysql clusters."
"passed","Mon May 27 01:30:18 UTC 2024","Mon May 27 01:30:40 UTC 2024","21382","tests.integration.relations","test_database","","","","test_relation_broken","Remove relation and wait for the expected changes in status."
"passed","Mon May 27 01:32:37 UTC 2024","Mon May 27 01:33:42 UTC 2024","64972","tests.integration.high_availability","test_async_replication","","","","test_deploy_router_and_app","Deploy the router and the test application."
"passed","Mon May 27 01:30:44 UTC 2024","Mon May 27 01:32:37 UTC 2024","112474","tests.integration.high_availability","test_async_replication","","","","test_async_relate","Relate the two mysql clusters."
"passed","Mon May 27 01:30:17 UTC 2024","Mon May 27 01:31:27 UTC 2024","69645","tests.integration","test_tls","","","","test_enable_tls","Test for encryption enablement when relation to TLS charm."
"passed","Mon May 27 01:32:08 UTC 2024","Mon May 27 01:34:32 UTC 2024","143675","tests.integration.high_availability","test_self_healing","","","","test_freeze_db_process","Test to send a SIGSTOP to the primary db process and ensure that the cluster self heals."
"passed","Mon May 27 01:30:04 UTC 2024","Mon May 27 01:32:55 UTC 2024","171367","tests.integration.high_availability","test_upgrade_from_stable","","","","test_upgrade_from_stable","Test updating from stable channel."
"passed","Mon May 27 01:34:53 UTC 2024","Mon May 27 01:35:01 UTC 2024","8168","tests.integration","test_charm","","","","test_password_rotation","Rotate password and confirm changes."
"passed","Mon May 27 01:36:26 UTC 2024","Mon May 27 01:42:38 UTC 2024","371224","tests.integration","test_backups","","","","test_restore_on_new_cluster","Test to restore a backup on a new mysql cluster."
"passed","Mon May 27 01:27:44 UTC 2024","Mon May 27 01:29:42 UTC 2024","117768","tests.integration","test_charm","","","","test_build_and_deploy","Build the mysql charm and deploy it."
"passed","Mon May 27 01:32:31 UTC 2024","Mon May 27 01:35:21 UTC 2024","170261","tests.integration.high_availability","test_replication","","","","test_scaling_without_data_loss","Test to ensure that data is preserved when a unit is scaled up and then down.

    Ensures that there are no running continuous writes as the extra data in the
    database makes scaling up slower.
    "
"passed","Mon May 27 01:35:37 UTC 2024","Mon May 27 01:35:46 UTC 2024","9026","tests.integration","test_charm","","","","test_log_rotation","Test the log rotation of text files."
"passed","Mon May 27 01:27:32 UTC 2024","Mon May 27 01:31:17 UTC 2024","225350","tests.integration.relations","test_mysql_root","","","","test_deploy_and_relate_osm_bundle","Test the deployment and relation with osm bundle with mysql replacing mariadb."
"passed","Mon May 27 01:35:19 UTC 2024","Mon May 27 01:35:23 UTC 2024","3922","tests.integration","test_charm","","","","test_exporter_endpoints","Test that endpoints are running."
"passed","Mon May 27 01:30:13 UTC 2024","Mon May 27 01:33:54 UTC 2024","221088","tests.integration.high_availability","test_upgrade","","","","test_upgrade_from_edge",""
"passed","Mon May 27 01:35:11 UTC 2024","Mon May 27 01:35:19 UTC 2024","8138","tests.integration","test_charm","","","","test_password_rotation_root_user_implicit","Rotate password and confirm changes."
"passed","Mon May 27 01:31:27 UTC 2024","Mon May 27 01:32:07 UTC 2024","39914","tests.integration","test_tls","","","","test_rotate_tls_key","Verify rotating tls private keys restarts cluster with new certificates.

    This test rotates tls private keys to randomly generated keys.
    "
"passed","Mon May 27 01:32:07 UTC 2024","Mon May 27 01:32:37 UTC 2024","30121","tests.integration","test_tls","","","","test_disable_tls",""
"passed","Mon May 27 01:27:41 UTC 2024","Mon May 27 01:29:50 UTC 2024","129535","tests.integration.relations","test_database","","","","test_build_and_deploy","Build the charm and deploy 3 units to ensure a cluster is formed."
"passed","Mon May 27 01:29:45 UTC 2024","Mon May 27 01:33:20 UTC 2024","214603","tests.integration","test_charm","","","","test_scale_up_and_down","Confirm that a new primary is elected when the current primary is torn down."
"passed","Mon May 27 01:27:40 UTC 2024","Mon May 27 01:30:29 UTC 2024","168909","tests.integration.high_availability","test_replication","","","","test_build_and_deploy","Simple test to ensure that the mysql and application charms get deployed."
"passed","Mon May 27 01:33:20 UTC 2024","Mon May 27 01:34:53 UTC 2024","92808","tests.integration","test_charm","","","","test_scale_up_after_scale_down","Confirm storage reuse works."
"passed","Mon May 27 01:28:01 UTC 2024","Mon May 27 01:30:44 UTC 2024","163150","tests.integration.high_availability","test_async_replication","","","","test_build_and_deploy","Simple test to ensure that the mysql and application charms get deployed."
"passed","Mon May 27 01:29:48 UTC 2024","Mon May 27 01:30:25 UTC 2024","37384","tests.integration.high_availability","test_upgrade_rollback_incompat","","","","test_upgrade_to_failling",""
"skipped","Mon May 27 01:29:50 UTC 2024","Mon May 27 01:29:50 UTC 2024","0","tests.integration.relations","test_database","","","","test_relation_creation_databag","Relate charms and wait for the expected changes in status."
"skipped","Mon May 27 01:35:42 UTC 2024","Mon May 27 01:35:42 UTC 2024","0","tests.integration.high_availability","test_self_healing","","","","test_single_unit_pod_delete","Delete the pod in a single unit deployment and write data to new pod."
"passed","Mon May 27 01:30:37 UTC 2024","Mon May 27 01:32:05 UTC 2024","88552","tests.integration.high_availability","test_self_healing","","","","test_kill_db_process","Test to send a SIGKILL to the primary db process and ensure that the cluster self heals."
"passed","Mon May 27 01:32:01 UTC 2024","Mon May 27 01:36:26 UTC 2024","264893","tests.integration","test_backups","","","","test_restore_on_same_cluster","Test to restore a backup to the same mysql cluster."
"passed","Mon May 27 01:28:34 UTC 2024","Mon May 27 01:30:13 UTC 2024","99972","tests.integration","test_backups","","","","test_build_and_deploy","Simple test to ensure that the mysql charm gets deployed."
"passed","Mon May 27 01:29:42 UTC 2024","Mon May 27 01:29:45 UTC 2024","3148","tests.integration","test_charm","","","","test_consistent_data_replication_across_cluster","Confirm that data is replicated from the primary node to all the replicas."
"passed","Mon May 27 01:34:55 UTC 2024","Mon May 27 01:35:13 UTC 2024","17614","tests.integration.high_availability","test_async_replication","","","","test_standby_promotion","Test graceful promotion of a standby cluster to primary."
"skipped","Mon May 27 01:35:42 UTC 2024","Mon May 27 01:35:42 UTC 2024","0","tests.integration.high_availability","test_self_healing","","","","test_network_cut_affecting_an_instance","Test for a network cut affecting an instance."
"passed","Mon May 27 01:30:13 UTC 2024","Mon May 27 01:32:01 UTC 2024","107995","tests.integration","test_backups","","","","test_backup","Test to create a backup and list backups."
