"Status","Start Time","Stop Time","Duration in ms","Parent Suite","Suite","Sub Suite","Test Class","Test Method","Name","Description"
"passed","Sun May 12 01:28:37 UTC 2024","Sun May 12 01:30:33 UTC 2024","116142","tests.integration","test_charm","","","","test_build_and_deploy","Build the mysql charm and deploy it."
"passed","Sun May 12 01:35:46 UTC 2024","Sun May 12 01:36:04 UTC 2024","18006","tests.integration.high_availability","test_async_replication","","","","test_standby_promotion","Test graceful promotion of a standby cluster to primary."
"passed","Sun May 12 01:40:28 UTC 2024","Sun May 12 01:40:42 UTC 2024","14354","tests.integration.high_availability","test_async_replication","","","","test_rejoin_invalidated_cluster","Test rejoin invalidated cluster with."
"passed","Sun May 12 01:28:29 UTC 2024","Sun May 12 01:30:36 UTC 2024","126981","tests.integration.relations","test_database","","","","test_build_and_deploy","Build the charm and deploy 3 units to ensure a cluster is formed."
"passed","Sun May 12 01:35:46 UTC 2024","Sun May 12 01:35:50 UTC 2024","3957","tests.integration","test_charm","","","","test_exporter_endpoints","Test that endpoints are running."
"skipped","Sun May 12 01:46:33 UTC 2024","Sun May 12 01:46:33 UTC 2024","0","tests.integration.high_availability","test_self_healing","","","","test_single_unit_pod_delete","Delete the pod in a single unit deployment and write data to new pod."
"passed","Sun May 12 01:31:20 UTC 2024","Sun May 12 01:33:17 UTC 2024","117070","tests.integration.high_availability","test_async_replication","","","","test_async_relate","Relate the two mysql clusters."
"passed","Sun May 12 01:35:59 UTC 2024","Sun May 12 01:37:38 UTC 2024","99244","tests.integration.high_availability","test_self_healing","","","","test_graceful_crash_of_primary","Test to send SIGTERM to primary instance and then verify recovery."
"passed","Sun May 12 01:28:34 UTC 2024","Sun May 12 01:31:27 UTC 2024","172778","tests.integration.high_availability","test_replication","","","","test_build_and_deploy","Simple test to ensure that the mysql and application charms get deployed."
"passed","Sun May 12 01:31:16 UTC 2024","Sun May 12 01:31:20 UTC 2024","4118","tests.integration.high_availability","test_upgrade_rollback_incompat","","","","test_pre_upgrade_check","Test that the pre-upgrade-check action runs successfully."
"passed","Sun May 12 01:32:57 UTC 2024","Sun May 12 01:33:27 UTC 2024","30128","tests.integration","test_tls","","","","test_disable_tls",""
"passed","Sun May 12 01:32:19 UTC 2024","Sun May 12 01:33:49 UTC 2024","89455","tests.integration.high_availability","test_self_healing","","","","test_kill_db_process","Test to send a SIGKILL to the primary db process and ensure that the cluster self heals."
"failed","Sun May 12 01:41:21 UTC 2024","Sun May 12 01:46:32 UTC 2024","311078","tests.integration.high_availability","test_self_healing","","","","test_graceful_full_cluster_crash_test","Test to send SIGTERM to all units and then ensure that the cluster recovers."
"passed","Sun May 12 01:31:29 UTC 2024","Sun May 12 01:31:49 UTC 2024","20841","tests.integration.high_availability","test_replication","","","","test_check_consistency","Test to write to primary, and read the same data back from replicas."
"passed","Sun May 12 01:29:13 UTC 2024","Sun May 12 01:31:16 UTC 2024","122960","tests.integration.high_availability","test_upgrade_rollback_incompat","","","","test_build_and_deploy","Simple test to ensure that the mysql and application charms get deployed."
"passed","Sun May 12 01:35:34 UTC 2024","Sun May 12 01:35:43 UTC 2024","8243","tests.integration.high_availability","test_async_replication","","","","test_data_replication","Test to write to primary, and read the same data back from replicas."
"passed","Sun May 12 01:30:36 UTC 2024","Sun May 12 01:33:58 UTC 2024","202161","tests.integration","test_charm","","","","test_scale_up_and_down","Confirm that a new primary is elected when the current primary is torn down."
"passed","Sun May 12 01:33:52 UTC 2024","Sun May 12 01:35:56 UTC 2024","124016","tests.integration.high_availability","test_self_healing","","","","test_freeze_db_process","Test to send a SIGSTOP to the primary db process and ensure that the cluster self heals."
"passed","Sun May 12 01:35:50 UTC 2024","Sun May 12 01:36:04 UTC 2024","14522","tests.integration","test_charm","","","","test_custom_variables","Query database for custom variables."
"passed","Sun May 12 01:31:53 UTC 2024","Sun May 12 01:33:29 UTC 2024","96860","tests.integration.high_availability","test_replication","","","","test_no_replication_across_clusters","Test to ensure that writes to one cluster do not replicate to another cluster."
"passed","Sun May 12 01:28:33 UTC 2024","Sun May 12 01:31:45 UTC 2024","192129","tests.integration.relations","test_mysql_root","","","","test_deploy_and_relate_osm_bundle","Test the deployment and relation with osm bundle with mysql replacing mariadb."
"passed","Sun May 12 01:31:16 UTC 2024","Sun May 12 01:31:18 UTC 2024","1127","tests.integration","test_tls","","","","test_connection_before_tls","Ensure connections (with and without ssl) are possible before relating with TLS operator."
"skipped","Sun May 12 01:30:36 UTC 2024","Sun May 12 01:30:36 UTC 2024","0","tests.integration.relations","test_database","","","","test_relation_creation_databag","Relate charms and wait for the expected changes in status."
"passed","Sun May 12 01:36:04 UTC 2024","Sun May 12 01:36:10 UTC 2024","5366","tests.integration","test_charm","","","","test_log_rotation","Test the log rotation of text files."
"passed","Sun May 12 01:31:17 UTC 2024","Sun May 12 01:31:29 UTC 2024","12329","tests.integration.high_availability","test_upgrade_from_stable","","","","test_pre_upgrade_check","Test that the pre-upgrade-check action runs successfully."
"passed","Sun May 12 01:29:11 UTC 2024","Sun May 12 01:31:16 UTC 2024","125116","tests.integration","test_tls","","","","test_build_and_deploy","Build the charm and deploy 3 units to ensure a cluster is formed."
"passed","Sun May 12 01:33:29 UTC 2024","Sun May 12 01:37:34 UTC 2024","245406","tests.integration","test_backups","","","","test_restore_on_same_cluster","Test to restore a backup to the same mysql cluster."
"passed","Sun May 12 01:31:33 UTC 2024","Sun May 12 01:33:29 UTC 2024","115820","tests.integration","test_backups","","","","test_backup","Test to create a backup and list backups."
"passed","Sun May 12 01:29:02 UTC 2024","Sun May 12 01:32:17 UTC 2024","195721","tests.integration.high_availability","test_self_healing","","","","test_build_and_deploy","Simple test to ensure that the mysql and application charms get deployed."
"passed","Sun May 12 01:30:33 UTC 2024","Sun May 12 01:30:36 UTC 2024","3171","tests.integration","test_charm","","","","test_consistent_data_replication_across_cluster","Confirm that data is replicated from the primary node to all the replicas."
"passed","Sun May 12 01:32:18 UTC 2024","Sun May 12 01:32:57 UTC 2024","38850","tests.integration","test_tls","","","","test_rotate_tls_key","Verify rotating tls private keys restarts cluster with new certificates.

    This test rotates tls private keys to randomly generated keys.
    "
"passed","Sun May 12 01:35:18 UTC 2024","Sun May 12 01:35:27 UTC 2024","9158","tests.integration","test_charm","","","","test_password_rotation","Rotate password and confirm changes."
"passed","Sun May 12 01:37:34 UTC 2024","Sun May 12 01:43:39 UTC 2024","364316","tests.integration","test_backups","","","","test_restore_on_new_cluster","Test to restore a backup on a new mysql cluster."
"passed","Sun May 12 01:31:20 UTC 2024","Sun May 12 01:31:58 UTC 2024","37983","tests.integration.high_availability","test_upgrade_rollback_incompat","","","","test_upgrade_to_failling",""
"passed","Sun May 12 01:38:14 UTC 2024","Sun May 12 01:41:14 UTC 2024","180129","tests.integration.high_availability","test_self_healing","","","","test_network_cut_affecting_an_instance","Test for a network cut affecting an instance."
"passed","Sun May 12 01:33:35 UTC 2024","Sun May 12 01:36:22 UTC 2024","166151","tests.integration.high_availability","test_replication","","","","test_scaling_without_data_loss","Test to ensure that data is preserved when a unit is scaled up and then down.

    Ensures that there are no running continuous writes as the extra data in the
    database makes scaling up slower.
    "
"passed","Sun May 12 01:29:52 UTC 2024","Sun May 12 01:31:33 UTC 2024","100575","tests.integration","test_backups","","","","test_build_and_deploy","Simple test to ensure that the mysql charm gets deployed."
"passed","Sun May 12 01:31:18 UTC 2024","Sun May 12 01:32:18 UTC 2024","60522","tests.integration","test_tls","","","","test_enable_tls","Test for encryption enablement when relation to TLS charm."
"passed","Sun May 12 01:40:45 UTC 2024","Sun May 12 01:43:39 UTC 2024","173767","tests.integration.high_availability","test_async_replication","","","","test_remove_relation_and_relate","Test removing and re-relating the two mysql clusters."
"passed","Sun May 12 01:35:19 UTC 2024","Sun May 12 01:38:35 UTC 2024","195659","tests.integration.high_availability","test_upgrade","","","","test_fail_and_rollback",""
"passed","Sun May 12 01:28:47 UTC 2024","Sun May 12 01:31:17 UTC 2024","149638","tests.integration.high_availability","test_upgrade_from_stable","","","","test_deploy_stable","Simple test to ensure that the mysql and application charms get deployed."
"passed","Sun May 12 01:28:48 UTC 2024","Sun May 12 01:31:20 UTC 2024","151704","tests.integration.high_availability","test_async_replication","","","","test_build_and_deploy","Simple test to ensure that the mysql and application charms get deployed."
"passed","Sun May 12 01:33:58 UTC 2024","Sun May 12 01:35:18 UTC 2024","80038","tests.integration","test_charm","","","","test_scale_up_after_scale_down","Confirm storage reuse works."
"passed","Sun May 12 01:31:45 UTC 2024","Sun May 12 01:32:20 UTC 2024","35494","tests.integration.relations","test_mysql_root","","","","test_osm_pol_operations","Test the existence of databases and tables created by osm-pol's migrations."
"passed","Sun May 12 01:33:17 UTC 2024","Sun May 12 01:34:32 UTC 2024","75015","tests.integration.high_availability","test_async_replication","","","","test_deploy_router_and_app","Deploy the router and the test application."
"passed","Sun May 12 01:36:05 UTC 2024","Sun May 12 01:40:25 UTC 2024","260750","tests.integration.high_availability","test_async_replication","","","","test_failover","Test switchover on primary cluster fail."
"passed","Sun May 12 01:28:45 UTC 2024","Sun May 12 01:31:17 UTC 2024","151440","tests.integration.high_availability","test_upgrade","","","","test_deploy_latest","Simple test to ensure that the mysql and application charms get deployed."
"passed","Sun May 12 01:35:37 UTC 2024","Sun May 12 01:35:46 UTC 2024","9148","tests.integration","test_charm","","","","test_password_rotation_root_user_implicit","Rotate password and confirm changes."
"passed","Sun May 12 01:31:29 UTC 2024","Sun May 12 01:34:08 UTC 2024","158856","tests.integration.high_availability","test_upgrade_from_stable","","","","test_upgrade_from_stable","Test updating from stable channel."
"passed","Sun May 12 01:31:31 UTC 2024","Sun May 12 01:35:16 UTC 2024","224902","tests.integration.high_availability","test_upgrade","","","","test_upgrade_from_edge",""
"passed","Sun May 12 01:31:17 UTC 2024","Sun May 12 01:31:38 UTC 2024","20887","tests.integration.relations","test_database","","","","test_relation_broken","Remove relation and wait for the expected changes in status."
"passed","Sun May 12 01:30:36 UTC 2024","Sun May 12 01:31:17 UTC 2024","41073","tests.integration.relations","test_database","","","","test_relation_creation","Relate charms and wait for the expected changes in status."
"passed","Sun May 12 01:35:27 UTC 2024","Sun May 12 01:35:37 UTC 2024","9138","tests.integration","test_charm","","","","test_password_rotation_silent","Rotate password and confirm changes."
"passed","Sun May 12 01:31:17 UTC 2024","Sun May 12 01:31:29 UTC 2024","12362","tests.integration.high_availability","test_upgrade","","","","test_pre_upgrade_check","Test that the pre-upgrade-check action runs successfully."
"passed","Sun May 12 01:36:24 UTC 2024","Sun May 12 01:40:02 UTC 2024","218839","tests.integration.high_availability","test_replication","","","","test_kill_primary_check_reelection","Test to kill the primary under load and ensure re-election of primary."
"passed","Sun May 12 01:31:58 UTC 2024","Sun May 12 01:34:31 UTC 2024","152877","tests.integration.high_availability","test_upgrade_rollback_incompat","","","","test_rollback",""
