"Status","Start Time","Stop Time","Duration in ms","Parent Suite","Suite","Sub Suite","Test Class","Test Method","Name","Description"
"passed","Fri Jun 28 01:30:23 UTC 2024","Fri Jun 28 01:31:05 UTC 2024","41538","tests.integration.high_availability","test_upgrade_rollback_incompat","","","","test_upgrade_to_failling",""
"passed","Fri Jun 28 01:28:01 UTC 2024","Fri Jun 28 01:30:33 UTC 2024","151716","tests.integration.high_availability","test_upgrade","","","","test_deploy_latest","Simple test to ensure that the mysql and application charms get deployed."
"passed","Fri Jun 28 01:37:26 UTC 2024","Fri Jun 28 01:43:48 UTC 2024","381970","tests.integration","test_backups","","","","test_restore_on_new_cluster","Test to restore a backup on a new mysql cluster."
"skipped","Fri Jun 28 01:30:35 UTC 2024","Fri Jun 28 01:30:35 UTC 2024","0","tests.integration.relations","test_database","","","","test_relation_creation_databag","Relate charms and wait for the expected changes in status."
"passed","Fri Jun 28 01:39:57 UTC 2024","Fri Jun 28 01:43:32 UTC 2024","215033","tests.integration.high_availability","test_async_replication","","","","test_remove_relation_and_relate","Test removing and re-relating the two mysql clusters."
"passed","Fri Jun 28 01:27:55 UTC 2024","Fri Jun 28 01:31:17 UTC 2024","201962","tests.integration.high_availability","test_replication","","","","test_build_and_deploy","Simple test to ensure that the mysql and application charms get deployed."
"passed","Fri Jun 28 01:30:35 UTC 2024","Fri Jun 28 01:31:18 UTC 2024","42922","tests.integration.relations","test_database","","","","test_relation_creation","Relate charms and wait for the expected changes in status."
"passed","Fri Jun 28 01:28:00 UTC 2024","Fri Jun 28 01:30:17 UTC 2024","136356","tests.integration","test_tls","","","","test_build_and_deploy","Build the charm and deploy 3 units to ensure a cluster is formed."
"passed","Fri Jun 28 01:28:21 UTC 2024","Fri Jun 28 01:30:35 UTC 2024","133417","tests.integration.relations","test_database","","","","test_build_and_deploy","Build the charm and deploy 3 units to ensure a cluster is formed."
"failed","Fri Jun 28 01:31:43 UTC 2024","Fri Jun 28 01:33:34 UTC 2024","111064","tests.integration.high_availability","test_replication","","","","test_no_replication_across_clusters","Test to ensure that writes to one cluster do not replicate to another cluster."
"passed","Fri Jun 28 01:31:18 UTC 2024","Fri Jun 28 01:31:40 UTC 2024","22080","tests.integration.relations","test_database","","","","test_relation_broken","Remove relation and wait for the expected changes in status."
"passed","Fri Jun 28 01:35:20 UTC 2024","Fri Jun 28 01:39:37 UTC 2024","257612","tests.integration.high_availability","test_async_replication","","","","test_failover","Test switchover on primary cluster fail."
"passed","Fri Jun 28 01:33:49 UTC 2024","Fri Jun 28 01:35:19 UTC 2024","89568","tests.integration","test_charm","","","","test_scale_up_after_scale_down","Confirm storage reuse works."
"passed","Fri Jun 28 01:30:19 UTC 2024","Fri Jun 28 01:31:21 UTC 2024","62419","tests.integration","test_tls","","","","test_enable_tls","Test for encryption enablement when relation to TLS charm."
"passed","Fri Jun 28 01:32:01 UTC 2024","Fri Jun 28 01:32:32 UTC 2024","30131","tests.integration","test_tls","","","","test_disable_tls",""
"passed","Fri Jun 28 01:30:19 UTC 2024","Fri Jun 28 01:30:23 UTC 2024","4087","tests.integration.high_availability","test_upgrade_rollback_incompat","","","","test_pre_upgrade_check","Test that the pre-upgrade-check action runs successfully."
"passed","Fri Jun 28 01:33:43 UTC 2024","Fri Jun 28 01:37:29 UTC 2024","226013","tests.integration.high_availability","test_upgrade","","","","test_fail_and_rollback",""
"passed","Fri Jun 28 01:35:19 UTC 2024","Fri Jun 28 01:35:30 UTC 2024","11173","tests.integration","test_charm","","","","test_password_rotation","Rotate password and confirm changes."
"passed","Fri Jun 28 01:28:03 UTC 2024","Fri Jun 28 01:30:38 UTC 2024","154682","tests.integration.high_availability","test_upgrade_from_stable","","","","test_deploy_stable","Simple test to ensure that the mysql and application charms get deployed."
"passed","Fri Jun 28 01:30:22 UTC 2024","Fri Jun 28 01:33:49 UTC 2024","207253","tests.integration","test_charm","","","","test_scale_up_and_down","Confirm that a new primary is elected when the current primary is torn down."
"passed","Fri Jun 28 01:28:13 UTC 2024","Fri Jun 28 01:30:18 UTC 2024","124909","tests.integration","test_charm","","","","test_build_and_deploy","Build the mysql charm and deploy it."
"passed","Fri Jun 28 01:28:07 UTC 2024","Fri Jun 28 01:30:19 UTC 2024","132196","tests.integration.high_availability","test_upgrade_rollback_incompat","","","","test_build_and_deploy","Simple test to ensure that the mysql and application charms get deployed."
"passed","Fri Jun 28 01:30:18 UTC 2024","Fri Jun 28 01:30:22 UTC 2024","4144","tests.integration","test_charm","","","","test_consistent_data_replication_across_cluster","Confirm that data is replicated from the primary node to all the replicas."
"passed","Fri Jun 28 01:30:33 UTC 2024","Fri Jun 28 01:30:46 UTC 2024","13344","tests.integration.high_availability","test_upgrade","","","","test_pre_upgrade_check","Test that the pre-upgrade-check action runs successfully."
"passed","Fri Jun 28 01:49:20 UTC 2024","Fri Jun 28 01:52:39 UTC 2024","198933","tests.integration.high_availability","test_self_healing","","","","test_single_unit_pod_delete","Delete the pod in a single unit deployment and write data to new pod."
"passed","Fri Jun 28 01:28:01 UTC 2024","Fri Jun 28 01:30:59 UTC 2024","178121","tests.integration.high_availability","test_self_healing","","","","test_build_and_deploy","Simple test to ensure that the mysql and application charms get deployed."
"passed","Fri Jun 28 01:28:45 UTC 2024","Fri Jun 28 01:30:30 UTC 2024","104788","tests.integration","test_backups","","","","test_build_and_deploy","Simple test to ensure that the mysql charm gets deployed."
"passed","Fri Jun 28 01:39:39 UTC 2024","Fri Jun 28 01:39:54 UTC 2024","14412","tests.integration.high_availability","test_async_replication","","","","test_rejoin_invalidated_cluster","Test rejoin invalidated cluster with."
"passed","Fri Jun 28 01:43:40 UTC 2024","Fri Jun 28 01:49:19 UTC 2024","339545","tests.integration.high_availability","test_self_healing","","","","test_graceful_full_cluster_crash_test","Test to send SIGTERM to all units and then ensure that the cluster recovers."
"passed","Fri Jun 28 01:30:51 UTC 2024","Fri Jun 28 01:33:55 UTC 2024","183603","tests.integration.high_availability","test_upgrade_from_stable","","","","test_upgrade_from_stable","Test updating from stable channel."
"passed","Fri Jun 28 01:32:32 UTC 2024","Fri Jun 28 01:37:26 UTC 2024","293795","tests.integration","test_backups","","","","test_restore_on_same_cluster","Test to restore a backup to the same mysql cluster."
"passed","Fri Jun 28 01:30:38 UTC 2024","Fri Jun 28 01:30:51 UTC 2024","13388","tests.integration.high_availability","test_upgrade_from_stable","","","","test_pre_upgrade_check","Test that the pre-upgrade-check action runs successfully."
"passed","Fri Jun 28 01:30:48 UTC 2024","Fri Jun 28 01:32:30 UTC 2024","102211","tests.integration.high_availability","test_async_replication","","","","test_create_replication","Run the create replication and wait for the applications to settle."
"passed","Fri Jun 28 01:32:34 UTC 2024","Fri Jun 28 01:36:48 UTC 2024","253891","tests.integration.high_availability","test_self_healing","","","","test_freeze_db_process","Test to send a SIGSTOP to the primary db process and ensure that the cluster self heals."
"passed","Fri Jun 28 01:30:30 UTC 2024","Fri Jun 28 01:32:32 UTC 2024","122864","tests.integration","test_backups","","","","test_backup","Test to create a backup and list backups."
"passed","Fri Jun 28 01:30:17 UTC 2024","Fri Jun 28 01:30:19 UTC 2024","2130","tests.integration","test_tls","","","","test_connection_before_tls","Ensure connections (with and without ssl) are possible before relating with TLS operator."
"passed","Fri Jun 28 01:28:02 UTC 2024","Fri Jun 28 01:30:44 UTC 2024","162593","tests.integration.high_availability","test_async_replication","","","","test_build_and_deploy","Simple test to ensure that the mysql and application charms get deployed."
"passed","Fri Jun 28 01:31:19 UTC 2024","Fri Jun 28 01:31:40 UTC 2024","20857","tests.integration.high_availability","test_replication","","","","test_check_consistency","Test to write to primary, and read the same data back from replicas."
"passed","Fri Jun 28 01:32:30 UTC 2024","Fri Jun 28 01:33:47 UTC 2024","76498","tests.integration.high_availability","test_async_replication","","","","test_deploy_router_and_app","Deploy the router and the test application."
"passed","Fri Jun 28 01:36:14 UTC 2024","Fri Jun 28 01:36:23 UTC 2024","8661","tests.integration","test_charm","","","","test_log_rotation","Test the log rotation of text files."
"passed","Fri Jun 28 01:31:21 UTC 2024","Fri Jun 28 01:32:01 UTC 2024","40292","tests.integration","test_tls","","","","test_rotate_tls_key","Verify rotating tls private keys restarts cluster with new certificates.

    This test rotates tls private keys to randomly generated keys.
    "
"passed","Fri Jun 28 01:30:44 UTC 2024","Fri Jun 28 01:30:48 UTC 2024","3682","tests.integration.high_availability","test_async_replication","","","","test_async_relate","Relate the two mysql clusters."
"passed","Fri Jun 28 01:35:00 UTC 2024","Fri Jun 28 01:35:18 UTC 2024","18391","tests.integration.high_availability","test_async_replication","","","","test_standby_promotion","Test graceful promotion of a standby cluster to primary."
"passed","Fri Jun 28 01:35:55 UTC 2024","Fri Jun 28 01:36:14 UTC 2024","18502","tests.integration","test_charm","","","","test_custom_variables","Query database for custom variables."
"passed","Fri Jun 28 01:36:51 UTC 2024","Fri Jun 28 01:38:39 UTC 2024","108246","tests.integration.high_availability","test_self_healing","","","","test_graceful_crash_of_primary","Test to send SIGTERM to primary instance and then verify recovery."
"passed","Fri Jun 28 01:30:48 UTC 2024","Fri Jun 28 01:33:39 UTC 2024","170812","tests.integration.high_availability","test_upgrade","","","","test_upgrade_from_edge",""
"passed","Fri Jun 28 01:39:14 UTC 2024","Fri Jun 28 01:43:31 UTC 2024","257177","tests.integration.high_availability","test_self_healing","","","","test_network_cut_affecting_an_instance","Test for a network cut affecting an instance."
"passed","Fri Jun 28 01:31:05 UTC 2024","Fri Jun 28 01:33:27 UTC 2024","142043","tests.integration.high_availability","test_upgrade_rollback_incompat","","","","test_rollback",""
"passed","Fri Jun 28 01:35:40 UTC 2024","Fri Jun 28 01:35:51 UTC 2024","11150","tests.integration","test_charm","","","","test_password_rotation_root_user_implicit","Rotate password and confirm changes."
"passed","Fri Jun 28 01:31:01 UTC 2024","Fri Jun 28 01:32:31 UTC 2024","89603","tests.integration.high_availability","test_self_healing","","","","test_kill_db_process","Test to send a SIGKILL to the primary db process and ensure that the cluster self heals."
"passed","Fri Jun 28 01:35:30 UTC 2024","Fri Jun 28 01:35:40 UTC 2024","10145","tests.integration","test_charm","","","","test_password_rotation_silent","Rotate password and confirm changes."
"passed","Fri Jun 28 01:34:49 UTC 2024","Fri Jun 28 01:34:57 UTC 2024","8217","tests.integration.high_availability","test_async_replication","","","","test_data_replication","Test to write to primary, and read the same data back from replicas."
"passed","Fri Jun 28 01:35:51 UTC 2024","Fri Jun 28 01:35:55 UTC 2024","3957","tests.integration","test_charm","","","","test_exporter_endpoints","Test that endpoints are running."
"passed","Fri Jun 28 01:33:35 UTC 2024","Fri Jun 28 01:36:23 UTC 2024","167361","tests.integration.high_availability","test_replication","","","","test_scaling_without_data_loss","Test to ensure that data is preserved when a unit is scaled up and then down.

    Ensures that there are no running continuous writes as the extra data in the
    database makes scaling up slower.
    "
"passed","Fri Jun 28 01:30:17 UTC 2024","Fri Jun 28 01:30:50 UTC 2024","33201","tests.integration.relations","test_mysql_root","","","","test_osm_pol_operations","Test the existence of databases and tables created by osm-pol's migrations."
"passed","Fri Jun 28 01:27:43 UTC 2024","Fri Jun 28 01:30:17 UTC 2024","153472","tests.integration.relations","test_mysql_root","","","","test_deploy_and_relate_osm_bundle","Test the deployment and relation with osm bundle with mysql replacing mariadb."
"passed","Fri Jun 28 01:36:25 UTC 2024","Fri Jun 28 01:40:05 UTC 2024","220346","tests.integration.high_availability","test_replication","","","","test_kill_primary_check_reelection","Test to kill the primary under load and ensure re-election of primary."
