"DESCRIPTION","DURATION IN MS","NAME","PARENT SUITE","START TIME","STATUS","STOP TIME","SUB SUITE","SUITE","TEST CLASS","TEST METHOD"
"Test graceful promotion of a standby cluster to primary.","32555","test_standby_promotion","tests.integration.integration.high_availability","2025-12-22","passed","2025-12-22","","test_async_replication","",""
"Relate the two MySQL clusters.","39702","test_async_relate","tests.integration.integration.high_availability","2025-12-22","passed","2025-12-22","","test_async_replication_upgrade","",""
"Test to write to primary, and read the same data back from replicas.","19518","test_data_replication","tests.integration.integration.high_availability","2025-12-22","passed","2025-12-22","","test_async_replication_upgrade","",""
"Simple test to ensure that the MySQL and application charms get deployed.","123684","test_deploy_highly_available_cluster","tests.integration.integration.high_availability","2025-12-22","passed","2025-12-22","","test_self_healing_network_cut","",""
"Confirm that data is replicated from the primary node to all the replicas.","22390","test_consistent_data_replication_across_cluster","tests.integration.integration.high_availability","2025-12-22","passed","2025-12-22","","test_replication_data_consistency","",""
"Test to send SIGTERM to primary instance and then verify recovery.","185617","test_graceful_crash_of_primary","tests.integration.integration.high_availability","2025-12-22","passed","2025-12-22","","test_self_healing_stop_primary","",""
"Test switchover on primary cluster fail.","296232","test_failover","tests.integration.integration.high_availability","2025-12-22","passed","2025-12-22","","test_async_replication","",""
"Confirm that data is replicated from the primary node to all the replicas.","4247","test_consistent_data_replication_across_cluster","tests.integration.integration","2025-12-22","passed","2025-12-22","","test_charm","",""
"Confirm that a new primary is elected when the current primary is torn down.","268010","test_scale_up_and_down","tests.integration.integration","2025-12-22","passed","2025-12-22","","test_charm","",""
"Verify rotating tls private keys restarts cluster with new certificates.

    This test rotates tls private keys to randomly generated keys.
    ","42274","test_rotate_tls_key","tests.integration.integration","2025-12-22","passed","2025-12-22","","test_tls","",""
"Test that the pre-upgrade-check action runs successfully.","","test_pre_upgrade_check","tests.integration.integration.high_availability","","unknown","","","test_upgrade_from_stable","",""
"Rotate password and confirm changes.","11162","test_password_rotation","tests.integration.integration","2025-12-22","passed","2025-12-22","","test_charm","",""
"Test the deployment and relation with osm bundle with mysql replacing mariadb.","173285","test_deploy_and_relate_osm_bundle","tests.integration.integration","2025-12-22","passed","2025-12-22","","test_osm_integration_bundle","",""
"Test for cluster data isolation.

    This test creates a new cluster, create a new table on both cluster, write a single record with
    the application name for each cluster, retrieve and compare these records, asserting they are
    not the same.
    ","82335","test_cluster_data_isolation","tests.integration.integration.high_availability","2025-12-22","passed","2025-12-22","","test_replication_data_isolation","",""
"","4806","test_saturate_max_connections","tests.integration.integration","2025-12-22","passed","2025-12-22","","test_saturate_max_connections","",""
"Remove relation and wait for the expected changes in status.","16656","test_relation_broken","tests.integration.integration.relations","2025-12-22","passed","2025-12-22","","test_database","",""
"Rotate password and confirm changes.","13177","test_password_rotation_root_user_implicit","tests.integration.integration","2025-12-22","passed","2025-12-22","","test_charm","",""
"Query database for custom variables.","24812","test_custom_variables","tests.integration.integration","2025-12-22","passed","2025-12-22","","test_charm","",""
"Tries deploying an arm64 charm on amd64 host.","59292","test_arm_charm_on_amd_host","tests.integration.integration","2025-12-22","passed","2025-12-22","","test_architecture","",""
"Test to write to primary, and read the same data back from replicas.","36573","test_data_replication","tests.integration.integration.high_availability","2025-12-22","passed","2025-12-22","","test_async_replication","",""
"Build and deploy for AWS.","212311","test_build_and_deploy_aws","tests.integration.integration","2025-12-22","passed","2025-12-22","","test_backup_pitr_aws","",""
"Scale database and routers.","715833","test_scale_out","tests.integration.integration","2025-12-22","passed","2025-12-22","","test_multi_relations","",""
"Simple test to ensure that the MySQL and application charms get deployed.","151748","test_deploy_highly_available_cluster","tests.integration.integration.high_availability","2025-12-22","passed","2025-12-22","","test_self_healing_node_drain","",""
"Simple test to ensure that the MySQL and application charms get deployed.","137780","test_deploy_highly_available_cluster","tests.integration.integration.high_availability","2025-12-22","passed","2025-12-22","","test_replication_logs_rotation","",""
"Build the charm and deploy 1 units to ensure a cluster is formed.","6187","test_build_and_deploy","tests.integration.integration","2025-12-22","passed","2025-12-22","","test_saturate_max_connections","",""
"Relate charms and wait for the expected changes in status.","3585","test_relation_creation","tests.integration.integration.relations","2025-12-22","passed","2025-12-22","","test_database","",""
"Test to restore a backup to the same mysql cluster.","249222","test_restore_on_same_cluster","tests.integration.integration","2025-12-22","passed","2025-12-22","","test_backup_gcp","",""
"Build the charm and deploy 1 units to ensure a cluster is formed.","27324","test_build_and_deploy","tests.integration.integration","2025-12-22","passed","2025-12-22","","test_multi_relations","",""
"Upgrade the two MySQL clusters.","662915","test_upgrade_from_edge","tests.integration.integration.high_availability","2025-12-22","passed","2025-12-22","","test_async_replication_upgrade","",""
"Test the DBA predefined role.","21182","test_charmed_dba_role","tests.integration.integration.roles","2025-12-22","passed","2025-12-22","","test_instance_dba_role","",""
"Confirm that a new primary is elected when the current primary is tear down.","411182","test_kill_primary_check_reelection","tests.integration.integration.high_availability","2025-12-22","passed","2025-12-22","","test_replication_reelection","",""
"Tries deploying an amd64 charm on arm64 host.","0","test_amd_charm_on_arm_host","tests.integration.integration","2025-12-22","skipped","2025-12-22","","test_architecture","",""
"Simple test to ensure that the mysql charm gets deployed.","","test_build_and_deploy","tests.integration.integration","","unknown","","","test_backup_ceph","",""
"Update the second cluster.","","test_upgrade_from_stable","tests.integration.integration.high_availability","","unknown","","","test_upgrade_from_stable","",""
"Test that the pre-upgrade-check action runs successfully.","5568","test_pre_upgrade_check","tests.integration.integration.high_availability","2025-12-22","passed","2025-12-22","","test_upgrade_rollback_incompat","",""
"Test to restore a backup on a new mysql cluster.","","test_restore_on_new_cluster","tests.integration.integration","","unknown","","","test_backup_ceph","",""
"Simple test to ensure that the MySQL and application charms get deployed.","149773","test_deploy_highly_available_cluster","tests.integration.integration.high_availability","2025-12-22","passed","2025-12-22","","test_self_healing_pod","",""
"Simple test to ensure that the mysql and data-integrator charms get deployed.","135305","test_build_and_deploy","tests.integration.integration.roles","2025-12-22","passed","2025-12-22","","test_instance_roles","",""
"Test an upgrade failure and its rollback.","363890","test_fail_and_rollback","tests.integration.integration.high_availability","2025-12-22","passed","2025-12-22","","test_upgrade","",""
"Test that the pre-upgrade-check action runs successfully.","18048","test_pre_upgrade_check","tests.integration.integration.high_availability","2025-12-22","passed","2025-12-22","","test_upgrade","",""
"Simple test to ensure that the MySQL and application charms get deployed.","151331","test_deploy_highly_available_cluster","tests.integration.integration.high_availability","2025-12-22","passed","2025-12-22","","test_replication_scaling","",""
"Test upgrade rollback to a healthy revision.","331797","test_rollback","tests.integration.integration.high_availability","2025-12-22","passed","2025-12-22","","test_upgrade_rollback_incompat","",""
"Relate all the applications to the database.","195306","test_relate_all","tests.integration.integration","2025-12-22","passed","2025-12-22","","test_multi_relations","",""
"Test that endpoints are running.","4404","test_exporter_endpoints","tests.integration.integration","2025-12-22","passed","2025-12-22","","test_charm","",""
"Test the log rotation of text files.","5118","test_log_rotation","tests.integration.integration.high_availability","2025-12-22","passed","2025-12-22","","test_replication_logs_rotation","",""
"Test removing and re-relating the two mysql clusters.","75033","test_unrelate_and_relate","tests.integration.integration.high_availability","2025-12-22","broken","2025-12-22","","test_async_replication","",""
"The cluster manual re-join test.

    A graceful restart is performed in one of the instances (choosing Primary to make it painful).
    In order to verify that the instance can come back ONLINE, after disabling automatic re-join
    ","195622","test_cluster_manual_rejoin","tests.integration.integration.high_availability","2025-12-22","passed","2025-12-22","","test_self_healing_restart_graceful","",""
"Relate charms and wait for the expected changes in status.","0","test_relation_creation_databag","tests.integration.integration.relations","2025-12-22","skipped","2025-12-22","","test_database","",""
"Scale database and routers.","245288","test_scale_in","tests.integration.integration","2025-12-22","passed","2025-12-22","","test_multi_relations","",""
"Test the charmed_read predefined role.","25822","test_charmed_read_role","tests.integration.integration.roles","2025-12-22","passed","2025-12-22","","test_instance_roles","",""
"Simple test to ensure that the MySQL and application charms get deployed.","133535","test_deploy_highly_available_cluster","tests.integration.integration.high_availability","2025-12-22","passed","2025-12-22","","test_replication_reelection","",""
"Test the labeling of k8s endpoints when apps with same cluster-name deployed.","2077","test_labeling_of_k8s_endpoints","tests.integration.integration.high_availability","2025-12-22","broken","2025-12-22","","test_replication_unit_endpoints","",""
"Test the charmed_dml role.","37544","test_charmed_dml_role","tests.integration.integration.roles","2025-12-22","passed","2025-12-22","","test_instance_roles","",""
"Simple test to ensure that the mysql and data-integrator charms get deployed.","126321","test_build_and_deploy","tests.integration.integration.roles","2025-12-22","passed","2025-12-22","","test_instance_dba_role","",""
"Relate charms before they have time to properly start.

    It simulates a Terraform-like deployment strategy
    ","153314","test_relation_creation_eager","tests.integration.integration.relations","2025-12-22","passed","2025-12-22","","test_mysql_root","",""
"Test to send a SIGKILL to the primary db process and ensure that the cluster self heals.","97368","test_kill_db_process","tests.integration.integration.high_availability","2025-12-22","passed","2025-12-22","","test_self_healing_process_killed","",""
"Test the database-level DBA role.","40863","test_charmed_dba_role","tests.integration.integration.roles","2025-12-22","passed","2025-12-22","","test_database_dba_role","",""
"Test for a network cut affecting an instance.","172899","test_network_cut_affecting_an_instance","tests.integration.integration.high_availability","2025-12-22","passed","2025-12-22","","test_self_healing_network_cut","",""
"Deploy the test application.","26390","test_deploy_test_app","tests.integration.integration.high_availability","2025-12-22","passed","2025-12-22","","test_async_replication_upgrade","",""
"Simple test to ensure that the MySQL and application charms get deployed.","26599","test_deploy_highly_available_cluster_2","tests.integration.integration.high_availability","2025-12-22","broken","2025-12-22","","test_replication_unit_endpoints","",""
"Build the charm and deploy 3 units to ensure a cluster is formed.","138387","test_build_and_deploy","tests.integration.integration","2025-12-22","passed","2025-12-22","","test_tls","",""
"Simple test to ensure that the MySQL and application charms get deployed.","132234","test_deploy_highly_available_cluster","tests.integration.integration.high_availability","2025-12-22","passed","2025-12-22","","test_replication_data_isolation","",""
"Run the create-replication action and wait for the applications to settle.","96601","test_create_replication","tests.integration.integration.high_availability","2025-12-22","broken","2025-12-22","","test_async_replication","",""
"Simple test to ensure that the mysql charm gets deployed.","172130","test_build_and_deploy","tests.integration.integration","2025-12-22","passed","2025-12-22","","test_backup_gcp","",""
"Test to restore a backup on a new mysql cluster.","477964","test_restore_on_new_cluster","tests.integration.integration","2025-12-22","passed","2025-12-22","","test_backup_aws","",""
"Build the mysql charm and deploy it.","135570","test_build_and_deploy","tests.integration.integration","2025-12-22","passed","2025-12-22","","test_charm","",""
"Simple test to ensure that the mysql charm gets deployed.","177707","test_build_and_deploy","tests.integration.integration","2025-12-22","passed","2025-12-22","","test_backup_aws","",""
"Test to restore a backup to the same mysql cluster.","","test_restore_on_same_cluster","tests.integration.integration","","unknown","","","test_backup_ceph","",""
"Test the promote-to-primary command after losing the majority of nodes, with force flag.","252945","test_cluster_failover_after_majority_loss","tests.integration.integration.high_availability","2025-12-22","passed","2025-12-22","","test_primary_switchover","",""
"Relate charms before they have time to properly start.

    It simulates a Terraform-like deployment strategy
    ","153856","test_relation_creation_eager","tests.integration.integration.relations","2025-12-22","passed","2025-12-22","","test_database","",""
"","30208","test_disable_tls","tests.integration.integration","2025-12-22","passed","2025-12-22","","test_tls","",""
"Test rejoin invalidated cluster with.","41146","test_rejoin_invalidated_cluster","tests.integration.integration.high_availability","2025-12-22","passed","2025-12-22","","test_async_replication","",""
"Simple test to ensure that the MySQL application charms get deployed.","138416","test_build_and_deploy","tests.integration.integration.high_availability","2025-12-22","broken","2025-12-22","","test_async_replication","",""
"Simple test to ensure that the MySQL and application charms get deployed.","130835","test_deploy_highly_available_cluster","tests.integration.integration.high_availability","2025-12-22","passed","2025-12-22","","test_replication_data_consistency","",""
"","62985","test_deploy_and_relate_test_app","tests.integration.integration","2025-12-22","passed","2025-12-22","","test_saturate_max_connections","",""
"Update the second cluster.","362387","test_upgrade_from_edge","tests.integration.integration.high_availability","2025-12-22","passed","2025-12-22","","test_upgrade","",""
"Simple test to ensure that the MySQL and application charms get deployed.","127426","test_deploy_highly_available_cluster_1","tests.integration.integration.high_availability","2025-12-22","passed","2025-12-22","","test_replication_unit_endpoints","",""
"Pause test.

    A graceful simultaneous restart of all instances,
    check primary election after the start, write and read data
    ","140529","test_graceful_full_cluster_crash","tests.integration.integration.high_availability","2025-12-22","passed","2025-12-22","","test_self_healing_stop_all","",""
"Simple test to ensure that the MySQL and application charms get deployed.","66248","test_deploy_single_unit_cluster","tests.integration.integration.high_availability","2025-12-22","passed","2025-12-22","","test_self_healing_setup_crash","",""
"Simple test to ensure that the MySQL and application charms get deployed.","138533","test_deploy_highly_available_cluster","tests.integration.integration.high_availability","2025-12-22","passed","2025-12-22","","test_self_healing_process_killed","",""
"Ensure connections (with and without ssl) are possible before relating with TLS operator.","3309","test_connection_before_tls","tests.integration.integration","2025-12-22","passed","2025-12-22","","test_tls","",""
"Test to send a SIGSTOP to the primary db process and ensure that the cluster self heals.","261422","test_freeze_db_process","tests.integration.integration.high_availability","2025-12-22","passed","2025-12-22","","test_self_healing_process_frozen","",""
"Run the create-replication action and wait for the applications to settle.","200466","test_create_replication","tests.integration.integration.high_availability","2025-12-22","passed","2025-12-22","","test_async_replication_upgrade","",""
"Test behavior when node drains - pod is evicted and pvs are rotated.","132924","test_pod_eviction_and_pvc_deletion","tests.integration.integration.high_availability","2025-12-22","passed","2025-12-22","","test_self_healing_node_drain","",""
"Simple test to ensure that the MySQL and application charms get deployed.","138194","test_deploy_latest","tests.integration.integration.high_availability","2025-12-22","passed","2025-12-22","","test_upgrade","",""
"Simple test to ensure that the MySQL and application charms get deployed.","","test_deploy_stable","tests.integration.integration.high_availability","","unknown","","","test_upgrade_from_stable","",""
"Simple test to ensure that the MySQL and application charms get deployed.","133315","test_deploy_highly_available_cluster","tests.integration.integration.high_availability","2025-12-22","passed","2025-12-22","","test_self_healing_stop_all","",""
"Test to restore a backup to the same mysql cluster.","241807","test_restore_on_same_cluster","tests.integration.integration","2025-12-22","passed","2025-12-22","","test_backup_aws","",""
"Test for encryption enablement when relation to TLS charm.","62833","test_enable_tls","tests.integration.integration","2025-12-22","passed","2025-12-22","","test_tls","",""
"Simple test to ensure that the MySQL and application charms get deployed.","134178","test_deploy_highly_available_cluster","tests.integration.integration.high_availability","2025-12-22","passed","2025-12-22","","test_self_healing_stop_primary","",""
"Test to create a backup and list backups.","61545","test_backup","tests.integration.integration","2025-12-22","passed","2025-12-22","","test_backup_gcp","",""
"","44212","test_upgrade_to_failing","tests.integration.integration.high_availability","2025-12-22","passed","2025-12-22","","test_upgrade_rollback_incompat","",""
"Test to create a backup and list backups.","55586","test_backup","tests.integration.integration","2025-12-22","passed","2025-12-22","","test_backup_aws","",""
"Delete the pod in a single unit deployment and write data to new pod.","703610","test_single_unit_pod_delete","tests.integration.integration.high_availability","2025-12-22","passed","2025-12-22","","test_self_healing_pod","",""
"Test to create a backup and list backups.","","test_backup","tests.integration.integration","","unknown","","","test_backup_ceph","",""
"Deploy the router and the test application.","67556","test_deploy_router_and_app","tests.integration.integration.high_availability","2025-12-22","passed","2025-12-22","","test_async_replication","",""
"Build the charm and deploy 3 units to ensure a cluster is formed.","9412","test_build_and_deploy","tests.integration.integration.relations","2025-12-22","passed","2025-12-22","","test_database","",""
"Simple test to ensure that the MySQL and application charms get deployed.","123323","test_deploy_highly_available_cluster","tests.integration.integration.high_availability","2025-12-22","passed","2025-12-22","","test_self_healing_process_frozen","",""
"Test that the primary node can be switched over.","14805","test_cluster_switchover","tests.integration.integration.high_availability","2025-12-22","passed","2025-12-22","","test_primary_switchover","",""
"Simple test to ensure that the MySQL and application charms get deployed.","125954","test_build_and_deploy","tests.integration.integration.high_availability","2025-12-22","passed","2025-12-22","","test_upgrade_rollback_incompat","",""
"Test COS integrations formed before mysql is allocated and deployed.","94792","test_deploy_bundle_with_cos_integrations","tests.integration.integration","2025-12-22","passed","2025-12-22","","test_cos_integration_bundle","",""
"Build the charm and deploy 3 units to ensure a cluster is formed.","8656","test_build_and_deploy","tests.integration.integration.relations","2025-12-22","passed","2025-12-22","","test_mysql_root","",""
"Simple test to ensure that the mysql and data-integrator charms get deployed.","136966","test_build_and_deploy","tests.integration.integration.roles","2025-12-22","passed","2025-12-22","","test_database_dba_role","",""
"Test to restore a backup on a new mysql cluster.","543064","test_restore_on_new_cluster","tests.integration.integration","2025-12-22","passed","2025-12-22","","test_backup_gcp","",""
"Test that data is preserved during scale up and scale down.","209681","test_scaling_without_data_loss","tests.integration.integration.high_availability","2025-12-22","passed","2025-12-22","","test_replication_scaling","",""
"Build and deploy for AWS.","204855","test_build_and_deploy_gcp","tests.integration.integration","2025-12-22","passed","2025-12-22","","test_backup_pitr_gcp","",""
"Simple test to ensure that the MySQL and application charms get deployed.","138294","test_deploy_highly_available_cluster","tests.integration.integration.high_availability","2025-12-22","passed","2025-12-22","","test_self_healing_restart_graceful","",""
"Test the existence of databases and tables created by osm-pol's migrations.","34403","test_osm_pol_operations","tests.integration.integration","2025-12-22","passed","2025-12-22","","test_osm_integration_bundle","",""
"Confirm storage reuse works.","114836","test_scale_up_after_scale_down","tests.integration.integration","2025-12-22","passed","2025-12-22","","test_charm","",""
"Pitr tests.","210540","test_pitr_aws","tests.integration.integration","2025-12-22","passed","2025-12-22","","test_backup_pitr_gcp","",""
"Pitr tests.","303570","test_pitr_aws","tests.integration.integration","2025-12-22","passed","2025-12-22","","test_backup_pitr_aws","",""
"Test primary crash during startup.

    It must recover/end setup when the primary got offline.
    ","98956","test_crash_during_cluster_setup","tests.integration.integration.high_availability","2025-12-22","passed","2025-12-22","","test_self_healing_setup_crash","",""
"Simple test to ensure that the MySQL application charms get deployed.","177459","test_build_and_deploy","tests.integration.integration.high_availability","2025-12-22","passed","2025-12-22","","test_async_replication_upgrade","",""
"Ensure scaling down to zero and back up works.","181045","test_scale_up_from_zero","tests.integration.integration","2025-12-22","passed","2025-12-22","","test_charm","",""
"Rotate password and confirm changes.","11173","test_password_rotation_silent","tests.integration.integration","2025-12-22","passed","2025-12-22","","test_charm","",""
"Relate the two MySQL clusters.","50757","test_async_relate","tests.integration.integration.high_availability","2025-12-22","passed","2025-12-22","","test_async_replication","",""
