"DESCRIPTION","DURATION IN MS","NAME","PARENT SUITE","START TIME","STATUS","STOP TIME","SUB SUITE","SUITE","TEST CLASS","TEST METHOD"
"Build the charm and deploy 3 units to ensure a cluster is formed.","131779","test_build_and_deploy","tests.integration.relations","Sat Mar 01 01:29:20 UTC 2025","passed","Sat Mar 01 01:31:32 UTC 2025","","test_database","",""
"Deploy the router and the test application.","80963","test_deploy_router_and_app","tests.integration.high_availability","Sat Mar 01 01:32:25 UTC 2025","passed","Sat Mar 01 01:33:46 UTC 2025","","test_async_replication","",""
"","180821","test_rollback","tests.integration.high_availability","Sat Mar 01 01:31:51 UTC 2025","passed","Sat Mar 01 01:34:52 UTC 2025","","test_upgrade_rollback_incompat","",""
"Build the charm and deploy 3 units to ensure a cluster is formed.","153701","test_build_and_deploy","tests.integration","Sat Mar 01 01:28:43 UTC 2025","passed","Sat Mar 01 01:31:17 UTC 2025","","test_tls","",""
"Test to create a backup and list backups.","42598","test_backup","tests.integration","Sat Mar 01 01:31:12 UTC 2025","passed","Sat Mar 01 01:31:54 UTC 2025","","test_backup_gcp","",""
"Build the mysql charm and deploy it.","134191","test_build_and_deploy","tests.integration","Sat Mar 01 01:28:40 UTC 2025","passed","Sat Mar 01 01:30:54 UTC 2025","","test_charm","",""
"Remove relation and wait for the expected changes in status.","23562","test_relation_broken","tests.integration.relations","Sat Mar 01 01:32:19 UTC 2025","passed","Sat Mar 01 01:32:43 UTC 2025","","test_database","",""
"","159269","test_upgrade_from_edge","tests.integration.high_availability","Sat Mar 01 01:33:56 UTC 2025","passed","Sat Mar 01 01:36:35 UTC 2025","","test_upgrade","",""
"Rotate password and confirm changes.","14175","test_password_rotation_root_user_implicit","tests.integration","Sat Mar 01 01:40:04 UTC 2025","passed","Sat Mar 01 01:40:18 UTC 2025","","test_charm","",""
"Tries deploying an arm64 charm on amd64 host.","58884","test_arm_charm_on_amd_host","tests.integration","Sat Mar 01 01:28:54 UTC 2025","passed","Sat Mar 01 01:29:53 UTC 2025","","test_architecture","",""
"","48478","test_upgrade_to_failling","tests.integration.high_availability","Sat Mar 01 01:31:02 UTC 2025","passed","Sat Mar 01 01:31:51 UTC 2025","","test_upgrade_rollback_incompat","",""
"Scale database and routers.","230273","test_scale_in","tests.integration","Sat Mar 01 01:39:37 UTC 2025","passed","Sat Mar 01 01:43:28 UTC 2025","","test_multi_relations","",""
"Test to send SIGTERM to all units and then ensure that the cluster recovers.","277052","test_graceful_full_cluster_crash_test","tests.integration.high_availability","Sat Mar 01 01:32:23 UTC 2025","passed","Sat Mar 01 01:37:00 UTC 2025","","test_self_healing_stop_all","",""
"Build the charm and deploy 1 units to ensure a cluster is formed.","31205","test_build_and_deploy","tests.integration","Sat Mar 01 01:28:41 UTC 2025","passed","Sat Mar 01 01:29:12 UTC 2025","","test_multi_relations","",""
"Test to write to primary, and read the same data back from replicas.","8518","test_data_replication","tests.integration.high_availability","Sat Mar 01 01:36:46 UTC 2025","passed","Sat Mar 01 01:36:55 UTC 2025","","test_async_replication","",""
"Scale database and routers.","465254","test_scale_out","tests.integration","Sat Mar 01 01:31:52 UTC 2025","passed","Sat Mar 01 01:39:37 UTC 2025","","test_multi_relations","",""
"Relate the two mysql clusters.","4958","test_async_relate","tests.integration.high_availability","Sat Mar 01 01:32:20 UTC 2025","passed","Sat Mar 01 01:32:25 UTC 2025","","test_async_replication","",""
"Test to restore a backup on a new mysql cluster.","276532","test_restore_on_new_cluster","tests.integration","Sat Mar 01 01:34:17 UTC 2025","passed","Sat Mar 01 01:38:54 UTC 2025","","test_backup_aws","",""
"Simple test to ensure that the mysql and application charms get deployed.","187994","test_build_and_deploy","tests.integration.high_availability","Sat Mar 01 01:29:12 UTC 2025","passed","Sat Mar 01 01:32:20 UTC 2025","","test_async_replication","",""
"Ensure connections (with and without ssl) are possible before relating with TLS operator.","2271","test_connection_before_tls","tests.integration","Sat Mar 01 01:31:17 UTC 2025","passed","Sat Mar 01 01:31:19 UTC 2025","","test_tls","",""
"Test to kill the primary under load and ensure re-election of primary.","221357","test_kill_primary_check_reelection","tests.integration.high_availability","Sat Mar 01 01:32:29 UTC 2025","passed","Sat Mar 01 01:36:11 UTC 2025","","test_replication_reelection","",""
"Test to send SIGTERM to primary instance and then verify recovery.","98300","test_graceful_crash_of_primary","tests.integration.high_availability","Sat Mar 01 01:31:53 UTC 2025","passed","Sat Mar 01 01:33:32 UTC 2025","","test_self_healing_stop_primary","",""
"Test to send a SIGSTOP to the primary db process and ensure that the cluster self heals.","285534","test_freeze_db_process","tests.integration.high_availability","Sat Mar 01 01:32:02 UTC 2025","passed","Sat Mar 01 01:36:47 UTC 2025","","test_self_healing_process_frozen","",""
"Test to restore a backup to the same mysql cluster.","165015","test_restore_on_same_cluster","tests.integration","Sat Mar 01 01:33:10 UTC 2025","passed","Sat Mar 01 01:35:56 UTC 2025","","test_backup_ceph","",""
"Simple test to ensure that the mysql and application charms get deployed.","126581","test_build_and_deploy","tests.integration.high_availability","Sat Mar 01 01:28:50 UTC 2025","passed","Sat Mar 01 01:30:56 UTC 2025","","test_upgrade_rollback_incompat","",""
"The cluster manual re-join test.

    A graceful restart is performed in one of the instances (choosing Primary to make it painful).
    In order to verify that the instance can come back ONLINE, after disabling automatic re-join
    ","100016","test_cluster_manual_rejoin","tests.integration.high_availability","Sat Mar 01 01:32:21 UTC 2025","passed","Sat Mar 01 01:34:01 UTC 2025","","test_self_healing_restart_graceful","",""
"Test to create a backup and list backups.","45774","test_backup","tests.integration","Sat Mar 01 01:32:23 UTC 2025","passed","Sat Mar 01 01:33:08 UTC 2025","","test_backup_ceph","",""
"","30258","test_disable_tls","tests.integration","Sat Mar 01 01:33:06 UTC 2025","passed","Sat Mar 01 01:33:37 UTC 2025","","test_tls","",""
"Test for encryption enablement when relation to TLS charm.","64075","test_enable_tls","tests.integration","Sat Mar 01 01:31:19 UTC 2025","passed","Sat Mar 01 01:32:23 UTC 2025","","test_tls","",""
"Ensure scaling down to zero and back up works.","163321","test_scale_up_from_zero","tests.integration","Sat Mar 01 01:36:55 UTC 2025","passed","Sat Mar 01 01:39:38 UTC 2025","","test_charm","",""
"Simple test to ensure that the mysql charm gets deployed.","122034","test_build_and_deploy","tests.integration","Sat Mar 01 01:30:19 UTC 2025","passed","Sat Mar 01 01:32:21 UTC 2025","","test_backup_ceph","",""
"Test to restore a backup to the same mysql cluster.","167709","test_restore_on_same_cluster","tests.integration","Sat Mar 01 01:31:56 UTC 2025","passed","Sat Mar 01 01:34:44 UTC 2025","","test_backup_gcp","",""
"Test that endpoints are running.","3961","test_exporter_endpoints","tests.integration","Sat Mar 01 01:40:18 UTC 2025","passed","Sat Mar 01 01:40:22 UTC 2025","","test_charm","",""
"Simple test to ensure that the mysql charm gets deployed.","116134","test_build_and_deploy","tests.integration","Sat Mar 01 01:29:14 UTC 2025","passed","Sat Mar 01 01:31:10 UTC 2025","","test_backup_gcp","",""
"Test switchover on primary cluster fail.","293607","test_failover","tests.integration.high_availability","Sat Mar 01 01:37:25 UTC 2025","passed","Sat Mar 01 01:42:19 UTC 2025","","test_async_replication","",""
"Relate charms and wait for the expected changes in status.","47212","test_relation_creation","tests.integration.relations","Sat Mar 01 01:31:32 UTC 2025","passed","Sat Mar 01 01:32:19 UTC 2025","","test_database","",""
"Test removing and re-relating the two mysql clusters.","633086","test_remove_relation_and_relate","tests.integration.high_availability","Sat Mar 01 01:42:50 UTC 2025","broken","Sat Mar 01 01:53:23 UTC 2025","","test_async_replication","",""
"Test updating from stable channel.","214587","test_upgrade_from_stable","tests.integration.high_availability","Sat Mar 01 01:34:18 UTC 2025","passed","Sat Mar 01 01:37:53 UTC 2025","","test_upgrade_from_stable","",""
"Test the log rotation of text files.

    Run continuous writes to ensure that audit log plugin is loaded and active
    when mysql-test-app runs start-continuous-writes (by logging into mysql).
    ","5939","test_log_rotation","tests.integration.high_availability","Sat Mar 01 01:32:32 UTC 2025","passed","Sat Mar 01 01:32:38 UTC 2025","","test_log_rotation","",""
"Delete the pod in a single unit deployment and write data to new pod.","241872","test_single_unit_pod_delete","tests.integration.high_availability","Sat Mar 01 01:32:36 UTC 2025","passed","Sat Mar 01 01:36:38 UTC 2025","","test_self_healing_pod","",""
"Test the existence of databases and tables created by osm-pol's migrations.","34385","test_osm_pol_operations","tests.integration.relations","Sat Mar 01 01:33:17 UTC 2025","passed","Sat Mar 01 01:33:51 UTC 2025","","test_mysql_root","",""
"Test for a network cut affecting an instance.","334128","test_network_cut_affecting_an_instance","tests.integration.high_availability","Sat Mar 01 01:33:05 UTC 2025","passed","Sat Mar 01 01:38:39 UTC 2025","","test_self_healing_network_cut","",""
"Test to restore a backup on a new mysql cluster.","298945","test_restore_on_new_cluster","tests.integration","Sat Mar 01 01:35:56 UTC 2025","passed","Sat Mar 01 01:40:54 UTC 2025","","test_backup_ceph","",""
"Test behavior when node drains - pod is evicted and pvs are rotated.","161859","test_pod_eviction_and_pvc_deletion","tests.integration.high_availability","Sat Mar 01 01:32:21 UTC 2025","passed","Sat Mar 01 01:35:03 UTC 2025","","test_node_drain","",""
"Rotate password and confirm changes.","12163","test_password_rotation","tests.integration","Sat Mar 01 01:39:38 UTC 2025","passed","Sat Mar 01 01:39:51 UTC 2025","","test_charm","",""
"Test to ensure that data is preserved when a unit is scaled up and then down.

    Ensures that there are no running continuous writes as the extra data in the
    database makes scaling up slower.
    ","203482","test_scaling_without_data_loss","tests.integration.high_availability","Sat Mar 01 01:32:29 UTC 2025","passed","Sat Mar 01 01:35:53 UTC 2025","","test_replication_scaling","",""
"Test the deployment and relation with osm bundle with mysql replacing mariadb.","276787","test_deploy_and_relate_osm_bundle","tests.integration.relations","Sat Mar 01 01:28:40 UTC 2025","passed","Sat Mar 01 01:33:17 UTC 2025","","test_mysql_root","",""
"Test to ensure that writes to one cluster do not replicate to another cluster.","85229","test_no_replication_across_clusters","tests.integration.high_availability","Sat Mar 01 01:32:04 UTC 2025","passed","Sat Mar 01 01:33:29 UTC 2025","","test_replication_data_isolation","",""
"","240591","test_fail_and_rollback","tests.integration.high_availability","Sat Mar 01 01:36:42 UTC 2025","passed","Sat Mar 01 01:40:43 UTC 2025","","test_upgrade","",""
"Test that the pre-upgrade-check action runs successfully.","17588","test_pre_upgrade_check","tests.integration.high_availability","Sat Mar 01 01:33:34 UTC 2025","passed","Sat Mar 01 01:33:52 UTC 2025","","test_upgrade","",""
"Simple test to ensure that the mysql and application charms get deployed.","266009","test_deploy_stable","tests.integration.high_availability","Sat Mar 01 01:29:32 UTC 2025","passed","Sat Mar 01 01:33:58 UTC 2025","","test_upgrade_from_stable","",""
"","62481","test_deploy_and_relate_test_app","tests.integration","Sat Mar 01 01:28:43 UTC 2025","passed","Sat Mar 01 01:29:46 UTC 2025","","test_saturate_max_connections","",""
"Confirm that data is replicated from the primary node to all the replicas.","4352","test_consistent_data_replication_across_cluster","tests.integration","Sat Mar 01 01:30:54 UTC 2025","passed","Sat Mar 01 01:30:59 UTC 2025","","test_charm","",""
"Test that the pre-upgrade-check action runs successfully.","18619","test_pre_upgrade_check","tests.integration.high_availability","Sat Mar 01 01:33:58 UTC 2025","passed","Sat Mar 01 01:34:16 UTC 2025","","test_upgrade_from_stable","",""
"","4750","test_saturate_max_connections","tests.integration","Sat Mar 01 01:29:46 UTC 2025","passed","Sat Mar 01 01:29:51 UTC 2025","","test_saturate_max_connections","",""
"Confirm that a new primary is elected when the current primary is torn down.","264101","test_scale_up_and_down","tests.integration","Sat Mar 01 01:30:59 UTC 2025","passed","Sat Mar 01 01:35:23 UTC 2025","","test_charm","",""
"Test primary crash during startup.

    It must recover/end setup when the primary got offline.
    ","193050","test_crash_during_cluster_setup","tests.integration.high_availability","Sat Mar 01 01:28:37 UTC 2025","passed","Sat Mar 01 01:31:50 UTC 2025","","test_crash_during_setup","",""
"Confirm storage reuse works.","92341","test_scale_up_after_scale_down","tests.integration","Sat Mar 01 01:35:23 UTC 2025","passed","Sat Mar 01 01:36:55 UTC 2025","","test_charm","",""
"Test graceful promotion of a standby cluster to primary.","26684","test_standby_promotion","tests.integration.high_availability","Sat Mar 01 01:36:58 UTC 2025","passed","Sat Mar 01 01:37:24 UTC 2025","","test_async_replication","",""
"Query database for custom variables.","25135","test_custom_variables","tests.integration","Sat Mar 01 01:40:22 UTC 2025","passed","Sat Mar 01 01:40:47 UTC 2025","","test_charm","",""
"Run the create replication and wait for the applications to settle.","118148","test_create_replication","tests.integration.high_availability","Sat Mar 01 01:33:46 UTC 2025","passed","Sat Mar 01 01:35:44 UTC 2025","","test_async_replication","",""
"Test the labeling of k8s endpoints when apps with same cluster-name deployed.","462105","test_labeling_of_k8s_endpoints","tests.integration.high_availability","Sat Mar 01 01:28:43 UTC 2025","passed","Sat Mar 01 01:36:25 UTC 2025","","test_k8s_endpoints","",""
"Test to create a backup and list backups.","55912","test_backup","tests.integration","Sat Mar 01 01:30:37 UTC 2025","passed","Sat Mar 01 01:31:33 UTC 2025","","test_backup_aws","",""
"Simple test to ensure that the mysql charm gets deployed.","111794","test_build_and_deploy","tests.integration","Sat Mar 01 01:28:43 UTC 2025","passed","Sat Mar 01 01:30:35 UTC 2025","","test_backup_aws","",""
"Relate charms and wait for the expected changes in status.","0","test_relation_creation_databag","tests.integration.relations","Sat Mar 01 01:31:32 UTC 2025","skipped","Sat Mar 01 01:31:32 UTC 2025","","test_database","",""
"Test to write to primary, and read the same data back from replicas.","18920","test_check_consistency","tests.integration.high_availability","Sat Mar 01 01:32:57 UTC 2025","passed","Sat Mar 01 01:33:16 UTC 2025","","test_replication_data_consistency","",""
"Verify rotating tls private keys restarts cluster with new certificates.

    This test rotates tls private keys to randomly generated keys.
    ","43039","test_rotate_tls_key","tests.integration","Sat Mar 01 01:32:23 UTC 2025","passed","Sat Mar 01 01:33:06 UTC 2025","","test_tls","",""
"Test rejoin invalidated cluster with.","25701","test_rejoin_invalidated_cluster","tests.integration.high_availability","Sat Mar 01 01:42:21 UTC 2025","passed","Sat Mar 01 01:42:47 UTC 2025","","test_async_replication","",""
"Test to restore a backup on a new mysql cluster.","277989","test_restore_on_new_cluster","tests.integration","Sat Mar 01 01:34:44 UTC 2025","passed","Sat Mar 01 01:39:22 UTC 2025","","test_backup_gcp","",""
"Test that the pre-upgrade-check action runs successfully.","6102","test_pre_upgrade_check","tests.integration.high_availability","Sat Mar 01 01:30:56 UTC 2025","passed","Sat Mar 01 01:31:02 UTC 2025","","test_upgrade_rollback_incompat","",""
"Build the charm and deploy 1 units to ensure a cluster is formed.","6990","test_build_and_deploy","tests.integration","Sat Mar 01 01:28:36 UTC 2025","passed","Sat Mar 01 01:28:43 UTC 2025","","test_saturate_max_connections","",""
"Rotate password and confirm changes.","13169","test_password_rotation_silent","tests.integration","Sat Mar 01 01:39:51 UTC 2025","passed","Sat Mar 01 01:40:04 UTC 2025","","test_charm","",""
"Test COS integrations formed before mysql is allocated and deployed.","95977","test_deploy_bundle_with_cos_integrations","tests.integration","Sat Mar 01 01:28:40 UTC 2025","passed","Sat Mar 01 01:30:16 UTC 2025","","test_cos_integration_bundle","",""
"Test to restore a backup to the same mysql cluster.","162111","test_restore_on_same_cluster","tests.integration","Sat Mar 01 01:31:35 UTC 2025","passed","Sat Mar 01 01:34:17 UTC 2025","","test_backup_aws","",""
"Relate all the applications to the database.","160316","test_relate_all","tests.integration","Sat Mar 01 01:29:12 UTC 2025","passed","Sat Mar 01 01:31:52 UTC 2025","","test_multi_relations","",""
"Simple test to ensure that the mysql and application charms get deployed.","282962","test_deploy_latest","tests.integration.high_availability","Sat Mar 01 01:28:51 UTC 2025","passed","Sat Mar 01 01:33:34 UTC 2025","","test_upgrade","",""
"Tries deploying an amd64 charm on arm64 host.","0","test_amd_charm_on_arm_host","tests.integration","Sat Mar 01 01:29:53 UTC 2025","skipped","Sat Mar 01 01:29:53 UTC 2025","","test_architecture","",""
"Test to send a SIGKILL to the primary db process and ensure that the cluster self heals.","111045","test_kill_db_process","tests.integration.high_availability","Sat Mar 01 01:32:22 UTC 2025","passed","Sat Mar 01 01:34:13 UTC 2025","","test_self_healing_process_killed","",""
