"DESCRIPTION","DURATION IN MS","NAME","PARENT SUITE","START TIME","STATUS","STOP TIME","SUB SUITE","SUITE","TEST CLASS","TEST METHOD"
"Simple test to ensure that the mysql and application charms get deployed.","157975","test_deploy_latest","tests.integration.high_availability","Tue Sep 02 01:49:40 UTC 2025","passed","Tue Sep 02 01:52:18 UTC 2025","","test_upgrade","",""
"Test the existence of databases and tables created by osm-pol's migrations.","","test_osm_pol_operations","tests.integration","","unknown","","","test_osm_integration_bundle","",""
"Test to send SIGTERM to all units and then ensure that the cluster recovers.","","test_graceful_full_cluster_crash_test","tests.integration.high_availability","","unknown","","","test_self_healing_stop_all","",""
"Run the create replication and wait for the applications to settle.","149050","test_create_replication","tests.integration.high_availability","Tue Sep 02 01:54:10 UTC 2025","passed","Tue Sep 02 01:56:39 UTC 2025","","test_async_replication","",""
"Tries deploying an amd64 charm on arm64 host.","0","test_amd_charm_on_arm_host","tests.integration","Tue Sep 02 01:51:43 UTC 2025","skipped","Tue Sep 02 01:51:43 UTC 2025","","test_architecture","",""
"Confirm that a new primary is elected when the current primary is torn down.","289314","test_scale_up_and_down","tests.integration","Tue Sep 02 01:52:31 UTC 2025","passed","Tue Sep 02 01:57:21 UTC 2025","","test_charm","",""
"Test the deployment and relation with osm bundle with mysql replacing mariadb.","","test_deploy_and_relate_osm_bundle","tests.integration","","unknown","","","test_osm_integration_bundle","",""
"Build the charm and deploy 3 units to ensure a cluster is formed.","7185","test_build_and_deploy","tests.integration.relations","Tue Sep 02 01:49:37 UTC 2025","passed","Tue Sep 02 01:49:44 UTC 2025","","test_mysql_root","",""
"Rotate password and confirm changes.","11155","test_password_rotation","tests.integration","Tue Sep 02 02:01:26 UTC 2025","passed","Tue Sep 02 02:01:37 UTC 2025","","test_charm","",""
"Test that the pre-upgrade-check action runs successfully.","4063","test_pre_upgrade_check","tests.integration.high_availability","Tue Sep 02 01:52:17 UTC 2025","passed","Tue Sep 02 01:52:21 UTC 2025","","test_upgrade_rollback_incompat","",""
"Confirm storage reuse works.","80660","test_scale_up_after_scale_down","tests.integration","Tue Sep 02 01:57:21 UTC 2025","passed","Tue Sep 02 01:58:41 UTC 2025","","test_charm","",""
"Test for a network cut affecting an instance.","4097","test_network_cut_affecting_an_instance","tests.integration.high_availability","Tue Sep 02 01:53:15 UTC 2025","broken","Tue Sep 02 01:53:19 UTC 2025","","test_self_healing_network_cut","",""
"Test removing and re-relating the two mysql clusters.","0","test_remove_relation_and_relate","tests.integration.high_availability","Tue Sep 02 01:56:50 UTC 2025","skipped","Tue Sep 02 01:56:50 UTC 2025","","test_async_replication","",""
"Build and deploy for AWS.","","test_build_and_deploy_gcp","tests.integration","","unknown","","","test_backup_pitr_gcp","",""
"Test to restore a backup on a new mysql cluster.","","test_restore_on_new_cluster","tests.integration","","unknown","","","test_backup_gcp","",""
"Build and deploy for AWS.","223034","test_build_and_deploy_aws","tests.integration","Tue Sep 02 01:49:34 UTC 2025","passed","Tue Sep 02 01:53:17 UTC 2025","","test_backup_pitr_aws","",""
"Remove relation and wait for the expected changes in status.","23000","test_relation_broken","tests.integration.relations","Tue Sep 02 01:53:19 UTC 2025","passed","Tue Sep 02 01:53:42 UTC 2025","","test_database","",""
"Pitr tests.","","test_pitr_aws","tests.integration","","unknown","","","test_backup_pitr_gcp","",""
"Scale database and routers.","","test_scale_out","tests.integration","","unknown","","","test_multi_relations","",""
"Test to restore a backup to the same mysql cluster.","162907","test_restore_on_same_cluster","tests.integration","Tue Sep 02 01:53:00 UTC 2025","passed","Tue Sep 02 01:55:43 UTC 2025","","test_backup_ceph","",""
"Test to ensure that writes to one cluster do not replicate to another cluster.","","test_no_replication_across_clusters","tests.integration.high_availability","","unknown","","","test_replication_data_isolation","",""
"Tries deploying an arm64 charm on amd64 host.","57148","test_arm_charm_on_amd_host","tests.integration","Tue Sep 02 01:50:46 UTC 2025","passed","Tue Sep 02 01:51:43 UTC 2025","","test_architecture","",""
"Build the mysql charm and deploy it.","138238","test_build_and_deploy","tests.integration","Tue Sep 02 01:50:09 UTC 2025","passed","Tue Sep 02 01:52:27 UTC 2025","","test_charm","",""
"Test updating from stable channel.","175155","test_upgrade_from_stable","tests.integration.high_availability","Tue Sep 02 01:53:01 UTC 2025","broken","Tue Sep 02 01:55:56 UTC 2025","","test_upgrade_from_stable","",""
"The cluster manual re-join test.

    A graceful restart is performed in one of the instances (choosing Primary to make it painful).
    In order to verify that the instance can come back ONLINE, after disabling automatic re-join
    ","","test_cluster_manual_rejoin","tests.integration.high_availability","","unknown","","","test_self_healing_restart_graceful","",""
"Rotate password and confirm changes.","13187","test_password_rotation_root_user_implicit","tests.integration","Tue Sep 02 02:01:50 UTC 2025","passed","Tue Sep 02 02:02:04 UTC 2025","","test_charm","",""
"Test to write to primary, and read the same data back from replicas.","8117","test_data_replication","tests.integration.high_availability","Tue Sep 02 01:56:41 UTC 2025","broken","Tue Sep 02 01:56:49 UTC 2025","","test_async_replication","",""
"Test to restore a backup on a new mysql cluster.","543330","test_restore_on_new_cluster","tests.integration","Tue Sep 02 01:55:43 UTC 2025","passed","Tue Sep 02 02:04:46 UTC 2025","","test_backup_ceph","",""
"Query database for custom variables.","24811","test_custom_variables","tests.integration","Tue Sep 02 02:02:08 UTC 2025","passed","Tue Sep 02 02:02:32 UTC 2025","","test_charm","",""
"Test to send a SIGKILL to the primary db process and ensure that the cluster self heals.","4095","test_kill_db_process","tests.integration.high_availability","Tue Sep 02 01:53:21 UTC 2025","broken","Tue Sep 02 01:53:25 UTC 2025","","test_self_healing_process_killed","",""
"Build the charm and deploy 3 units to ensure a cluster is formed.","155171","test_build_and_deploy","tests.integration","Tue Sep 02 01:50:02 UTC 2025","passed","Tue Sep 02 01:52:38 UTC 2025","","test_tls","",""
"Ensure scaling down to zero and back up works.","164649","test_scale_up_from_zero","tests.integration","Tue Sep 02 01:58:41 UTC 2025","passed","Tue Sep 02 02:01:26 UTC 2025","","test_charm","",""
"Relate charms and wait for the expected changes in status.","31154","test_relation_creation","tests.integration.relations","Tue Sep 02 01:52:48 UTC 2025","passed","Tue Sep 02 01:53:19 UTC 2025","","test_database","",""
"","30285","test_disable_tls","tests.integration","Tue Sep 02 01:54:30 UTC 2025","passed","Tue Sep 02 01:55:00 UTC 2025","","test_tls","",""
"Test to create a backup and list backups.","","test_backup","tests.integration","","unknown","","","test_backup_gcp","",""
"","296247","test_rollback","tests.integration.high_availability","Tue Sep 02 01:53:03 UTC 2025","passed","Tue Sep 02 01:57:59 UTC 2025","","test_upgrade_rollback_incompat","",""
"Simple test to ensure that the mysql and application charms get deployed.","168724","test_build_and_deploy","tests.integration.high_availability","Tue Sep 02 01:49:29 UTC 2025","passed","Tue Sep 02 01:52:18 UTC 2025","","test_async_replication","",""
"Simple test to ensure that the mysql and application charms get deployed.","132782","test_build_and_deploy","tests.integration.high_availability","Tue Sep 02 01:50:04 UTC 2025","passed","Tue Sep 02 01:52:17 UTC 2025","","test_upgrade_rollback_incompat","",""
"Test to restore a backup to the same mysql cluster.","","test_restore_on_same_cluster","tests.integration","","unknown","","","test_backup_aws","",""
"","0","test_fail_and_rollback","tests.integration.high_availability","Tue Sep 02 01:52:46 UTC 2025","skipped","Tue Sep 02 01:52:46 UTC 2025","","test_upgrade","",""
"Test that the primary node can be switched over.","13221","test_cluster_switchover","tests.integration.high_availability","Tue Sep 02 01:52:38 UTC 2025","passed","Tue Sep 02 01:52:51 UTC 2025","","test_primary_switchover","",""
"Confirm that data is replicated from the primary node to all the replicas.","4255","test_consistent_data_replication_across_cluster","tests.integration","Tue Sep 02 01:52:27 UTC 2025","passed","Tue Sep 02 01:52:31 UTC 2025","","test_charm","",""
"Delete the pod in a single unit deployment and write data to new pod.","253917","test_single_unit_pod_delete","tests.integration.high_availability","Tue Sep 02 01:52:43 UTC 2025","passed","Tue Sep 02 01:56:57 UTC 2025","","test_self_healing_pod","",""
"Pitr tests.","271122","test_pitr_aws","tests.integration","Tue Sep 02 01:53:17 UTC 2025","passed","Tue Sep 02 01:57:48 UTC 2025","","test_backup_pitr_aws","",""
"","601895","test_deploy_and_relate_test_app","tests.integration","Tue Sep 02 01:49:38 UTC 2025","broken","Tue Sep 02 01:59:39 UTC 2025","","test_saturate_max_connections","",""
"Rotate password and confirm changes.","13169","test_password_rotation_silent","tests.integration","Tue Sep 02 02:01:37 UTC 2025","passed","Tue Sep 02 02:01:50 UTC 2025","","test_charm","",""
"Test for encryption enablement when relation to TLS charm.","69227","test_enable_tls","tests.integration","Tue Sep 02 01:52:40 UTC 2025","passed","Tue Sep 02 01:53:49 UTC 2025","","test_tls","",""
"Simple test to ensure that the mysql charm gets deployed.","","test_build_and_deploy","tests.integration","","unknown","","","test_backup_gcp","",""
"Verify rotating tls private keys restarts cluster with new certificates.

    This test rotates tls private keys to randomly generated keys.
    ","41178","test_rotate_tls_key","tests.integration","Tue Sep 02 01:53:49 UTC 2025","passed","Tue Sep 02 01:54:30 UTC 2025","","test_tls","",""
"Test switchover on primary cluster fail.","0","test_failover","tests.integration.high_availability","Tue Sep 02 01:56:50 UTC 2025","skipped","Tue Sep 02 01:56:50 UTC 2025","","test_async_replication","",""
"Relate charms before they have time to properly start.

    It simulates a Terraform-like deployment strategy
    ","163222","test_relation_creation_eager","tests.integration.relations","Tue Sep 02 01:50:04 UTC 2025","passed","Tue Sep 02 01:52:48 UTC 2025","","test_database","",""
"Test that the pre-upgrade-check action runs successfully.","15566","test_pre_upgrade_check","tests.integration.high_availability","Tue Sep 02 01:52:43 UTC 2025","passed","Tue Sep 02 01:52:59 UTC 2025","","test_upgrade_from_stable","",""
"Relate charms and wait for the expected changes in status.","0","test_relation_creation_databag","tests.integration.relations","Tue Sep 02 01:52:48 UTC 2025","skipped","Tue Sep 02 01:52:48 UTC 2025","","test_database","",""
"Simple test to ensure that the mysql charm gets deployed.","111008","test_build_and_deploy","tests.integration","Tue Sep 02 01:50:23 UTC 2025","passed","Tue Sep 02 01:52:14 UTC 2025","","test_backup_ceph","",""
"Test to create a backup and list backups.","42185","test_backup","tests.integration","Tue Sep 02 01:52:16 UTC 2025","passed","Tue Sep 02 01:52:58 UTC 2025","","test_backup_ceph","",""
"Build the charm and deploy 1 units to ensure a cluster is formed.","7874","test_build_and_deploy","tests.integration","Tue Sep 02 01:49:30 UTC 2025","passed","Tue Sep 02 01:49:38 UTC 2025","","test_saturate_max_connections","",""
"Test to restore a backup on a new mysql cluster.","","test_restore_on_new_cluster","tests.integration","","unknown","","","test_backup_aws","",""
"","2096","test_upgrade_from_edge","tests.integration.high_availability","Tue Sep 02 01:52:43 UTC 2025","broken","Tue Sep 02 01:52:45 UTC 2025","","test_upgrade","",""
"Ensure connections (with and without ssl) are possible before relating with TLS operator.","2204","test_connection_before_tls","tests.integration","Tue Sep 02 01:52:38 UTC 2025","passed","Tue Sep 02 01:52:40 UTC 2025","","test_tls","",""
"Test to restore a backup to the same mysql cluster.","","test_restore_on_same_cluster","tests.integration","","unknown","","","test_backup_gcp","",""
"Test rejoin invalidated cluster with.","0","test_rejoin_invalidated_cluster","tests.integration.high_availability","Tue Sep 02 01:56:50 UTC 2025","skipped","Tue Sep 02 01:56:50 UTC 2025","","test_async_replication","",""
"","0","test_saturate_max_connections","tests.integration","Tue Sep 02 01:59:40 UTC 2025","skipped","Tue Sep 02 01:59:40 UTC 2025","","test_saturate_max_connections","",""
"Relate the two mysql clusters.","10989","test_async_relate","tests.integration.high_availability","Tue Sep 02 01:52:18 UTC 2025","passed","Tue Sep 02 01:52:29 UTC 2025","","test_async_replication","",""
"Relate charms before they have time to properly start.

    It simulates a Terraform-like deployment strategy
    ","132823","test_relation_creation_eager","tests.integration.relations","Tue Sep 02 01:49:44 UTC 2025","passed","Tue Sep 02 01:51:57 UTC 2025","","test_mysql_root","",""
"Test to send SIGTERM to primary instance and then verify recovery.","4108","test_graceful_crash_of_primary","tests.integration.high_availability","Tue Sep 02 01:52:57 UTC 2025","broken","Tue Sep 02 01:53:01 UTC 2025","","test_self_healing_stop_primary","",""
"Test to send a SIGSTOP to the primary db process and ensure that the cluster self heals.","4100","test_freeze_db_process","tests.integration.high_availability","Tue Sep 02 01:52:35 UTC 2025","broken","Tue Sep 02 01:52:39 UTC 2025","","test_self_healing_process_frozen","",""
"Build the charm and deploy 1 units to ensure a cluster is formed.","","test_build_and_deploy","tests.integration","","unknown","","","test_multi_relations","",""
"Test to ensure that data is preserved when a unit is scaled up and then down.

    Ensures that there are no running continuous writes as the extra data in the
    database makes scaling up slower.
    ","233760","test_scaling_without_data_loss","tests.integration.high_availability","Tue Sep 02 01:53:27 UTC 2025","passed","Tue Sep 02 01:57:21 UTC 2025","","test_replication_scaling","",""
"Test primary crash during startup.

    It must recover/end setup when the primary got offline.
    ","","test_crash_during_cluster_setup","tests.integration.high_availability","","unknown","","","test_crash_during_setup","",""
"Test that endpoints are running.","4149","test_exporter_endpoints","tests.integration","Tue Sep 02 02:02:04 UTC 2025","passed","Tue Sep 02 02:02:08 UTC 2025","","test_charm","",""
"Test COS integrations formed before mysql is allocated and deployed.","","test_deploy_bundle_with_cos_integrations","tests.integration","","unknown","","","test_cos_integration_bundle","",""
"Test the log rotation of text files.

    Run continuous writes to ensure that audit log plugin is loaded and active
    when mysql-test-app runs start-continuous-writes (by logging into mysql).
    ","6268","test_log_rotation","tests.integration.high_availability","Tue Sep 02 01:52:31 UTC 2025","passed","Tue Sep 02 01:52:38 UTC 2025","","test_log_rotation","",""
"","42072","test_upgrade_to_failling","tests.integration.high_availability","Tue Sep 02 01:52:21 UTC 2025","passed","Tue Sep 02 01:53:03 UTC 2025","","test_upgrade_rollback_incompat","",""
"Test that the pre-upgrade-check action runs successfully.","21616","test_pre_upgrade_check","tests.integration.high_availability","Tue Sep 02 01:52:18 UTC 2025","passed","Tue Sep 02 01:52:39 UTC 2025","","test_upgrade","",""
"Test graceful promotion of a standby cluster to primary.","0","test_standby_promotion","tests.integration.high_availability","Tue Sep 02 01:56:50 UTC 2025","skipped","Tue Sep 02 01:56:50 UTC 2025","","test_async_replication","",""
"Build the charm and deploy 3 units to ensure a cluster is formed.","6253","test_build_and_deploy","tests.integration.relations","Tue Sep 02 01:49:58 UTC 2025","passed","Tue Sep 02 01:50:04 UTC 2025","","test_database","",""
"Simple test to ensure that the mysql and application charms get deployed.","156427","test_deploy_stable","tests.integration.high_availability","Tue Sep 02 01:50:07 UTC 2025","passed","Tue Sep 02 01:52:43 UTC 2025","","test_upgrade_from_stable","",""
"Simple test to ensure that the mysql charm gets deployed.","","test_build_and_deploy","tests.integration","","unknown","","","test_backup_aws","",""
"Test to kill the primary under load and ensure re-election of primary.","2078","test_kill_primary_check_reelection","tests.integration.high_availability","Tue Sep 02 01:52:34 UTC 2025","broken","Tue Sep 02 01:52:37 UTC 2025","","test_replication_reelection","",""
"Test behavior when node drains - pod is evicted and pvs are rotated.","4104","test_pod_eviction_and_pvc_deletion","tests.integration.high_availability","Tue Sep 02 01:52:47 UTC 2025","broken","Tue Sep 02 01:52:51 UTC 2025","","test_node_drain","",""
"Deploy the router and the test application.","100372","test_deploy_router_and_app","tests.integration.high_availability","Tue Sep 02 01:52:29 UTC 2025","passed","Tue Sep 02 01:54:10 UTC 2025","","test_async_replication","",""
"Test to create a backup and list backups.","","test_backup","tests.integration","","unknown","","","test_backup_aws","",""
"Test the promote-to-primary command after losing the majority of nodes, with force flag.","281778","test_cluster_failover_after_majority_loss","tests.integration.high_availability","Tue Sep 02 01:52:51 UTC 2025","passed","Tue Sep 02 01:57:33 UTC 2025","","test_primary_switchover","",""
"Test the labeling of k8s endpoints when apps with same cluster-name deployed.","419696","test_labeling_of_k8s_endpoints","tests.integration.high_availability","Tue Sep 02 01:49:25 UTC 2025","passed","Tue Sep 02 01:56:24 UTC 2025","","test_k8s_endpoints","",""
"Test to write to primary, and read the same data back from replicas.","","test_check_consistency","tests.integration.high_availability","","unknown","","","test_replication_data_consistency","",""
"Scale database and routers.","","test_scale_in","tests.integration","","unknown","","","test_multi_relations","",""
"Relate all the applications to the database.","","test_relate_all","tests.integration","","unknown","","","test_multi_relations","",""
