"Status","Start Time","Stop Time","Duration in ms","Parent Suite","Suite","Sub Suite","Test Class","Test Method","Name","Description"
"passed","Sun Jun 30 01:37:56 UTC 2024","Sun Jun 30 01:39:00 UTC 2024","64261","tests.integration.high_availability","test_self_healing","","","","test_graceful_crash_of_primary","Test to send SIGTERM to primary instance and then verify recovery."
"passed","Sun Jun 30 01:28:58 UTC 2024","Sun Jun 30 01:31:17 UTC 2024","139303","tests.integration","test_tls","","","","test_build_and_deploy","Build the charm and deploy 3 units to ensure a cluster is formed."
"passed","Sun Jun 30 01:35:54 UTC 2024","Sun Jun 30 01:40:12 UTC 2024","258467","tests.integration.high_availability","test_async_replication","","","","test_failover","Test switchover on primary cluster fail."
"passed","Sun Jun 30 01:31:05 UTC 2024","Sun Jun 30 01:35:00 UTC 2024","234644","tests.integration","test_charm","","","","test_scale_up_and_down","Confirm that a new primary is elected when the current primary is torn down."
"passed","Sun Jun 30 01:28:14 UTC 2024","Sun Jun 30 01:30:21 UTC 2024","127042","tests.integration.high_availability","test_upgrade_rollback_incompat","","","","test_build_and_deploy","Simple test to ensure that the mysql and application charms get deployed."
"passed","Sun Jun 30 01:31:19 UTC 2024","Sun Jun 30 01:32:28 UTC 2024","68709","tests.integration","test_tls","","","","test_enable_tls","Test for encryption enablement when relation to TLS charm."
"passed","Sun Jun 30 01:36:35 UTC 2024","Sun Jun 30 01:36:45 UTC 2024","10153","tests.integration","test_charm","","","","test_password_rotation_silent","Rotate password and confirm changes."
"passed","Sun Jun 30 01:32:06 UTC 2024","Sun Jun 30 01:33:40 UTC 2024","93482","tests.integration.high_availability","test_replication","","","","test_no_replication_across_clusters","Test to ensure that writes to one cluster do not replicate to another cluster."
"passed","Sun Jun 30 01:31:21 UTC 2024","Sun Jun 30 01:31:55 UTC 2024","34279","tests.integration.relations","test_mysql_root","","","","test_osm_pol_operations","Test the existence of databases and tables created by osm-pol's migrations."
"passed","Sun Jun 30 01:33:00 UTC 2024","Sun Jun 30 01:37:53 UTC 2024","292711","tests.integration.high_availability","test_self_healing","","","","test_freeze_db_process","Test to send a SIGSTOP to the primary db process and ensure that the cluster self heals."
"passed","Sun Jun 30 01:31:21 UTC 2024","Sun Jun 30 01:33:17 UTC 2024","116279","tests.integration.high_availability","test_async_replication","","","","test_create_replication","Run the create replication and wait for the applications to settle."
"passed","Sun Jun 30 01:31:18 UTC 2024","Sun Jun 30 01:31:21 UTC 2024","3168","tests.integration.high_availability","test_async_replication","","","","test_async_relate","Relate the two mysql clusters."
"passed","Sun Jun 30 01:31:29 UTC 2024","Sun Jun 30 01:33:31 UTC 2024","122780","tests.integration","test_backups","","","","test_backup","Test to create a backup and list backups."
"passed","Sun Jun 30 01:33:17 UTC 2024","Sun Jun 30 01:34:23 UTC 2024","65278","tests.integration.high_availability","test_async_replication","","","","test_deploy_router_and_app","Deploy the router and the test application."
"passed","Sun Jun 30 01:28:25 UTC 2024","Sun Jun 30 01:30:33 UTC 2024","127372","tests.integration.relations","test_database","","","","test_build_and_deploy","Build the charm and deploy 3 units to ensure a cluster is formed."
"passed","Sun Jun 30 01:36:45 UTC 2024","Sun Jun 30 01:36:56 UTC 2024","11161","tests.integration","test_charm","","","","test_password_rotation_root_user_implicit","Rotate password and confirm changes."
"passed","Sun Jun 30 01:40:14 UTC 2024","Sun Jun 30 01:40:28 UTC 2024","14300","tests.integration.high_availability","test_async_replication","","","","test_rejoin_invalidated_cluster","Test rejoin invalidated cluster with."
"passed","Sun Jun 30 01:28:31 UTC 2024","Sun Jun 30 01:31:18 UTC 2024","166477","tests.integration.high_availability","test_async_replication","","","","test_build_and_deploy","Simple test to ensure that the mysql and application charms get deployed."
"skipped","Sun Jun 30 01:29:03 UTC 2024","Sun Jun 30 01:29:03 UTC 2024","0","tests.integration.high_availability","test_upgrade_from_stable","","","","test_upgrade_from_stable","Test updating from stable channel."
"skipped","Sun Jun 30 01:29:03 UTC 2024","Sun Jun 30 01:29:03 UTC 2024","0","tests.integration.high_availability","test_upgrade_from_stable","","","","test_pre_upgrade_check","Test that the pre-upgrade-check action runs successfully."
"passed","Sun Jun 30 01:37:50 UTC 2024","Sun Jun 30 01:43:47 UTC 2024","356693","tests.integration","test_backups","","","","test_restore_on_new_cluster","Test to restore a backup on a new mysql cluster."
"passed","Sun Jun 30 01:36:34 UTC 2024","Sun Jun 30 01:40:06 UTC 2024","212010","tests.integration.high_availability","test_replication","","","","test_kill_primary_check_reelection","Test to kill the primary under load and ensure re-election of primary."
"passed","Sun Jun 30 01:28:21 UTC 2024","Sun Jun 30 01:31:19 UTC 2024","177723","tests.integration.high_availability","test_self_healing","","","","test_build_and_deploy","Simple test to ensure that the mysql and application charms get deployed."
"passed","Sun Jun 30 01:35:00 UTC 2024","Sun Jun 30 01:36:23 UTC 2024","83610","tests.integration","test_charm","","","","test_scale_up_after_scale_down","Confirm storage reuse works."
"passed","Sun Jun 30 01:40:31 UTC 2024","Sun Jun 30 01:43:56 UTC 2024","204368","tests.integration.high_availability","test_async_replication","","","","test_remove_relation_and_relate","Test removing and re-relating the two mysql clusters."
"passed","Sun Jun 30 01:32:28 UTC 2024","Sun Jun 30 01:33:08 UTC 2024","39905","tests.integration","test_tls","","","","test_rotate_tls_key","Verify rotating tls private keys restarts cluster with new certificates.

    This test rotates tls private keys to randomly generated keys.
    "
"passed","Sun Jun 30 01:33:08 UTC 2024","Sun Jun 30 01:33:38 UTC 2024","30128","tests.integration","test_tls","","","","test_disable_tls",""
"passed","Sun Jun 30 01:36:23 UTC 2024","Sun Jun 30 01:36:35 UTC 2024","11163","tests.integration","test_charm","","","","test_password_rotation","Rotate password and confirm changes."
"passed","Sun Jun 30 01:31:41 UTC 2024","Sun Jun 30 01:32:03 UTC 2024","21941","tests.integration.high_availability","test_replication","","","","test_check_consistency","Test to write to primary, and read the same data back from replicas."
"passed","Sun Jun 30 01:30:21 UTC 2024","Sun Jun 30 01:30:25 UTC 2024","4088","tests.integration.high_availability","test_upgrade_rollback_incompat","","","","test_pre_upgrade_check","Test that the pre-upgrade-check action runs successfully."
"passed","Sun Jun 30 01:49:17 UTC 2024","Sun Jun 30 01:52:16 UTC 2024","179240","tests.integration.high_availability","test_self_healing","","","","test_single_unit_pod_delete","Delete the pod in a single unit deployment and write data to new pod."
"passed","Sun Jun 30 01:30:33 UTC 2024","Sun Jun 30 01:31:18 UTC 2024","44917","tests.integration.relations","test_database","","","","test_relation_creation","Relate charms and wait for the expected changes in status."
"passed","Sun Jun 30 01:34:51 UTC 2024","Sun Jun 30 01:38:14 UTC 2024","202989","tests.integration.high_availability","test_upgrade","","","","test_fail_and_rollback",""
"passed","Sun Jun 30 01:28:35 UTC 2024","Sun Jun 30 01:31:17 UTC 2024","161983","tests.integration.high_availability","test_upgrade","","","","test_deploy_latest","Simple test to ensure that the mysql and application charms get deployed."
"passed","Sun Jun 30 01:30:25 UTC 2024","Sun Jun 30 01:31:09 UTC 2024","43853","tests.integration.high_availability","test_upgrade_rollback_incompat","","","","test_upgrade_to_failling",""
"passed","Sun Jun 30 01:28:43 UTC 2024","Sun Jun 30 01:31:21 UTC 2024","158424","tests.integration.relations","test_mysql_root","","","","test_deploy_and_relate_osm_bundle","Test the deployment and relation with osm bundle with mysql replacing mariadb."
"passed","Sun Jun 30 01:37:22 UTC 2024","Sun Jun 30 01:37:31 UTC 2024","8505","tests.integration","test_charm","","","","test_log_rotation","Test the log rotation of text files."
"passed","Sun Jun 30 01:33:31 UTC 2024","Sun Jun 30 01:37:50 UTC 2024","259022","tests.integration","test_backups","","","","test_restore_on_same_cluster","Test to restore a backup to the same mysql cluster."
"passed","Sun Jun 30 01:28:42 UTC 2024","Sun Jun 30 01:31:39 UTC 2024","176891","tests.integration.high_availability","test_replication","","","","test_build_and_deploy","Simple test to ensure that the mysql and application charms get deployed."
"passed","Sun Jun 30 01:31:18 UTC 2024","Sun Jun 30 01:31:39 UTC 2024","21330","tests.integration.relations","test_database","","","","test_relation_broken","Remove relation and wait for the expected changes in status."
"passed","Sun Jun 30 01:31:21 UTC 2024","Sun Jun 30 01:32:57 UTC 2024","95709","tests.integration.high_availability","test_self_healing","","","","test_kill_db_process","Test to send a SIGKILL to the primary db process and ensure that the cluster self heals."
"passed","Sun Jun 30 01:31:01 UTC 2024","Sun Jun 30 01:31:05 UTC 2024","4165","tests.integration","test_charm","","","","test_consistent_data_replication_across_cluster","Confirm that data is replicated from the primary node to all the replicas."
"passed","Sun Jun 30 01:31:17 UTC 2024","Sun Jun 30 01:31:32 UTC 2024","14380","tests.integration.high_availability","test_upgrade","","","","test_pre_upgrade_check","Test that the pre-upgrade-check action runs successfully."
"passed","Sun Jun 30 01:29:44 UTC 2024","Sun Jun 30 01:31:29 UTC 2024","104836","tests.integration","test_backups","","","","test_build_and_deploy","Simple test to ensure that the mysql charm gets deployed."
"skipped","Sun Jun 30 01:30:33 UTC 2024","Sun Jun 30 01:30:33 UTC 2024","0","tests.integration.relations","test_database","","","","test_relation_creation_databag","Relate charms and wait for the expected changes in status."
"passed","Sun Jun 30 01:35:37 UTC 2024","Sun Jun 30 01:35:53 UTC 2024","15332","tests.integration.high_availability","test_async_replication","","","","test_standby_promotion","Test graceful promotion of a standby cluster to primary."
"passed","Sun Jun 30 01:37:00 UTC 2024","Sun Jun 30 01:37:22 UTC 2024","22536","tests.integration","test_charm","","","","test_custom_variables","Query database for custom variables."
"broken","Sun Jun 30 01:28:47 UTC 2024","Sun Jun 30 01:29:03 UTC 2024","15503","tests.integration.high_availability","test_upgrade_from_stable","","","","test_deploy_stable","Simple test to ensure that the mysql and application charms get deployed."
"passed","Sun Jun 30 01:33:41 UTC 2024","Sun Jun 30 01:36:31 UTC 2024","170650","tests.integration.high_availability","test_replication","","","","test_scaling_without_data_loss","Test to ensure that data is preserved when a unit is scaled up and then down.

    Ensures that there are no running continuous writes as the extra data in the
    database makes scaling up slower.
    "
"passed","Sun Jun 30 01:39:37 UTC 2024","Sun Jun 30 01:43:33 UTC 2024","236115","tests.integration.high_availability","test_self_healing","","","","test_network_cut_affecting_an_instance","Test for a network cut affecting an instance."
"passed","Sun Jun 30 01:31:17 UTC 2024","Sun Jun 30 01:31:19 UTC 2024","2125","tests.integration","test_tls","","","","test_connection_before_tls","Ensure connections (with and without ssl) are possible before relating with TLS operator."
"passed","Sun Jun 30 01:29:01 UTC 2024","Sun Jun 30 01:31:01 UTC 2024","119964","tests.integration","test_charm","","","","test_build_and_deploy","Build the mysql charm and deploy it."
"passed","Sun Jun 30 01:31:34 UTC 2024","Sun Jun 30 01:34:47 UTC 2024","193768","tests.integration.high_availability","test_upgrade","","","","test_upgrade_from_edge",""
"passed","Sun Jun 30 01:31:09 UTC 2024","Sun Jun 30 01:33:43 UTC 2024","154115","tests.integration.high_availability","test_upgrade_rollback_incompat","","","","test_rollback",""
"passed","Sun Jun 30 01:35:26 UTC 2024","Sun Jun 30 01:35:34 UTC 2024","8221","tests.integration.high_availability","test_async_replication","","","","test_data_replication","Test to write to primary, and read the same data back from replicas."
"passed","Sun Jun 30 01:36:56 UTC 2024","Sun Jun 30 01:37:00 UTC 2024","3990","tests.integration","test_charm","","","","test_exporter_endpoints","Test that endpoints are running."
"passed","Sun Jun 30 01:43:46 UTC 2024","Sun Jun 30 01:49:16 UTC 2024","329821","tests.integration.high_availability","test_self_healing","","","","test_graceful_full_cluster_crash_test","Test to send SIGTERM to all units and then ensure that the cluster recovers."
