"DESCRIPTION","DURATION IN MS","NAME","PARENT SUITE","START TIME","STATUS","STOP TIME","SUB SUITE","SUITE","TEST CLASS","TEST METHOD"
"Test to restore a backup to the same mysql cluster.","165546","test_restore_on_same_cluster","tests.integration","Thu Aug 14 02:01:05 UTC 2025","passed","Thu Aug 14 02:03:51 UTC 2025","","test_backup_ceph","",""
"Build the charm and deploy 1 units to ensure a cluster is formed.","6313","test_build_and_deploy","tests.integration","Thu Aug 14 01:58:09 UTC 2025","passed","Thu Aug 14 01:58:15 UTC 2025","","test_saturate_max_connections","",""
"Test the deployment and relation with osm bundle with mysql replacing mariadb.","144444","test_deploy_and_relate_osm_bundle","tests.integration","Thu Aug 14 01:57:19 UTC 2025","passed","Thu Aug 14 01:59:43 UTC 2025","","test_osm_integration_bundle","",""
"Build and deploy for AWS.","210070","test_build_and_deploy_gcp","tests.integration","Thu Aug 14 01:57:20 UTC 2025","passed","Thu Aug 14 02:00:50 UTC 2025","","test_backup_pitr_gcp","",""
"Test to write to primary, and read the same data back from replicas.","26823","test_check_consistency","tests.integration.high_availability","Thu Aug 14 02:01:31 UTC 2025","passed","Thu Aug 14 02:01:58 UTC 2025","","test_replication_data_consistency","",""
"Test updating from stable channel.","221017","test_upgrade_from_stable","tests.integration.high_availability","Thu Aug 14 02:00:00 UTC 2025","passed","Thu Aug 14 02:03:41 UTC 2025","","test_upgrade_from_stable","",""
"Rotate password and confirm changes.","13175","test_password_rotation_root_user_implicit","tests.integration","Thu Aug 14 02:09:43 UTC 2025","passed","Thu Aug 14 02:09:56 UTC 2025","","test_charm","",""
"Test to send a SIGKILL to the primary db process and ensure that the cluster self heals.","112257","test_kill_db_process","tests.integration.high_availability","Thu Aug 14 02:00:51 UTC 2025","passed","Thu Aug 14 02:02:43 UTC 2025","","test_self_healing_process_killed","",""
"Test to send SIGTERM to primary instance and then verify recovery.","168081","test_graceful_crash_of_primary","tests.integration.high_availability","Thu Aug 14 02:00:51 UTC 2025","passed","Thu Aug 14 02:03:39 UTC 2025","","test_self_healing_stop_primary","",""
"Build the charm and deploy 3 units to ensure a cluster is formed.","146311","test_build_and_deploy","tests.integration","Thu Aug 14 01:57:20 UTC 2025","passed","Thu Aug 14 01:59:46 UTC 2025","","test_tls","",""
"Build the charm and deploy 3 units to ensure a cluster is formed.","7469","test_build_and_deploy","tests.integration.relations","Thu Aug 14 01:57:25 UTC 2025","passed","Thu Aug 14 01:57:32 UTC 2025","","test_database","",""
"Test removing and re-relating the two mysql clusters.","304684","test_remove_relation_and_relate","tests.integration.high_availability","Thu Aug 14 02:13:39 UTC 2025","passed","Thu Aug 14 02:18:44 UTC 2025","","test_async_replication","",""
"Relate charms before they have time to properly start.

    It simulates a Terraform-like deployment strategy
    ","166005","test_relation_creation_eager","tests.integration.relations","Thu Aug 14 01:57:32 UTC 2025","passed","Thu Aug 14 02:00:18 UTC 2025","","test_database","",""
"Delete the pod in a single unit deployment and write data to new pod.","276230","test_single_unit_pod_delete","tests.integration.high_availability","Thu Aug 14 02:00:31 UTC 2025","passed","Thu Aug 14 02:05:07 UTC 2025","","test_self_healing_pod","",""
"Simple test to ensure that the mysql charm gets deployed.","117341","test_build_and_deploy","tests.integration","Thu Aug 14 01:57:57 UTC 2025","passed","Thu Aug 14 01:59:55 UTC 2025","","test_backup_gcp","",""
"Test to kill the primary under load and ensure re-election of primary.","255395","test_kill_primary_check_reelection","tests.integration.high_availability","Thu Aug 14 02:00:28 UTC 2025","passed","Thu Aug 14 02:04:43 UTC 2025","","test_replication_reelection","",""
"Test to restore a backup to the same mysql cluster.","156311","test_restore_on_same_cluster","tests.integration","Thu Aug 14 02:00:43 UTC 2025","passed","Thu Aug 14 02:03:19 UTC 2025","","test_backup_gcp","",""
"Test that the pre-upgrade-check action runs successfully.","9080","test_pre_upgrade_check","tests.integration.high_availability","Thu Aug 14 01:59:24 UTC 2025","passed","Thu Aug 14 01:59:33 UTC 2025","","test_upgrade_rollback_incompat","",""
"Test rejoin invalidated cluster with.","25588","test_rejoin_invalidated_cluster","tests.integration.high_availability","Thu Aug 14 02:13:10 UTC 2025","passed","Thu Aug 14 02:13:36 UTC 2025","","test_async_replication","",""
"","30178","test_disable_tls","tests.integration","Thu Aug 14 02:01:38 UTC 2025","passed","Thu Aug 14 02:02:08 UTC 2025","","test_tls","",""
"Test for encryption enablement when relation to TLS charm.","60074","test_enable_tls","tests.integration","Thu Aug 14 01:59:58 UTC 2025","passed","Thu Aug 14 02:00:58 UTC 2025","","test_tls","",""
"Deploy the router and the test application.","77491","test_deploy_router_and_app","tests.integration.high_availability","Thu Aug 14 02:00:55 UTC 2025","passed","Thu Aug 14 02:02:12 UTC 2025","","test_async_replication","",""
"Test to create a backup and list backups.","41694","test_backup","tests.integration","Thu Aug 14 02:00:22 UTC 2025","passed","Thu Aug 14 02:01:03 UTC 2025","","test_backup_ceph","",""
"Test that the pre-upgrade-check action runs successfully.","14505","test_pre_upgrade_check","tests.integration.high_availability","Thu Aug 14 01:59:44 UTC 2025","passed","Thu Aug 14 01:59:58 UTC 2025","","test_upgrade_from_stable","",""
"Test the labeling of k8s endpoints when apps with same cluster-name deployed.","377458","test_labeling_of_k8s_endpoints","tests.integration.high_availability","Thu Aug 14 01:57:18 UTC 2025","passed","Thu Aug 14 02:03:36 UTC 2025","","test_k8s_endpoints","",""
"Rotate password and confirm changes.","11160","test_password_rotation","tests.integration","Thu Aug 14 02:09:20 UTC 2025","passed","Thu Aug 14 02:09:31 UTC 2025","","test_charm","",""
"Test graceful promotion of a standby cluster to primary.","33574","test_standby_promotion","tests.integration.high_availability","Thu Aug 14 02:05:33 UTC 2025","passed","Thu Aug 14 02:06:06 UTC 2025","","test_async_replication","",""
"Pitr tests.","308357","test_pitr_aws","tests.integration","Thu Aug 14 02:01:46 UTC 2025","passed","Thu Aug 14 02:06:54 UTC 2025","","test_backup_pitr_aws","",""
"","209441","test_upgrade_from_edge","tests.integration.high_availability","Thu Aug 14 02:01:27 UTC 2025","passed","Thu Aug 14 02:04:57 UTC 2025","","test_upgrade","",""
"Verify rotating tls private keys restarts cluster with new certificates.

    This test rotates tls private keys to randomly generated keys.
    ","39879","test_rotate_tls_key","tests.integration","Thu Aug 14 02:00:58 UTC 2025","passed","Thu Aug 14 02:01:38 UTC 2025","","test_tls","",""
"Test switchover on primary cluster fail.","420135","test_failover","tests.integration.high_availability","Thu Aug 14 02:06:07 UTC 2025","passed","Thu Aug 14 02:13:07 UTC 2025","","test_async_replication","",""
"Test for a network cut affecting an instance.","262856","test_network_cut_affecting_an_instance","tests.integration.high_availability","Thu Aug 14 02:01:14 UTC 2025","passed","Thu Aug 14 02:05:36 UTC 2025","","test_self_healing_network_cut","",""
"Test to send a SIGSTOP to the primary db process and ensure that the cluster self heals.","310673","test_freeze_db_process","tests.integration.high_availability","Thu Aug 14 02:00:42 UTC 2025","passed","Thu Aug 14 02:05:52 UTC 2025","","test_self_healing_process_frozen","",""
"","270025","test_fail_and_rollback","tests.integration.high_availability","Thu Aug 14 02:05:05 UTC 2025","passed","Thu Aug 14 02:09:35 UTC 2025","","test_upgrade","",""
"Test to restore a backup on a new mysql cluster.","526099","test_restore_on_new_cluster","tests.integration","Thu Aug 14 02:02:36 UTC 2025","passed","Thu Aug 14 02:11:22 UTC 2025","","test_backup_aws","",""
"Scale database and routers.","225227","test_scale_in","tests.integration","Thu Aug 14 02:08:48 UTC 2025","passed","Thu Aug 14 02:12:34 UTC 2025","","test_multi_relations","",""
"Simple test to ensure that the mysql and application charms get deployed.","151447","test_deploy_stable","tests.integration.high_availability","Thu Aug 14 01:57:12 UTC 2025","passed","Thu Aug 14 01:59:44 UTC 2025","","test_upgrade_from_stable","",""
"Test primary crash during startup.

    It must recover/end setup when the primary got offline.
    ","161616","test_crash_during_cluster_setup","tests.integration.high_availability","Thu Aug 14 01:57:16 UTC 2025","passed","Thu Aug 14 01:59:58 UTC 2025","","test_crash_during_setup","",""
"Relate the two mysql clusters.","4400","test_async_relate","tests.integration.high_availability","Thu Aug 14 02:00:51 UTC 2025","passed","Thu Aug 14 02:00:55 UTC 2025","","test_async_replication","",""
"Build the charm and deploy 1 units to ensure a cluster is formed.","35658","test_build_and_deploy","tests.integration","Thu Aug 14 01:57:57 UTC 2025","passed","Thu Aug 14 01:58:33 UTC 2025","","test_multi_relations","",""
"Relate charms and wait for the expected changes in status.","0","test_relation_creation_databag","tests.integration.relations","Thu Aug 14 02:00:18 UTC 2025","skipped","Thu Aug 14 02:00:18 UTC 2025","","test_database","",""
"Test that the pre-upgrade-check action runs successfully.","24543","test_pre_upgrade_check","tests.integration.high_availability","Thu Aug 14 02:00:59 UTC 2025","passed","Thu Aug 14 02:01:23 UTC 2025","","test_upgrade","",""
"Relate all the applications to the database.","150380","test_relate_all","tests.integration","Thu Aug 14 01:58:33 UTC 2025","passed","Thu Aug 14 02:01:03 UTC 2025","","test_multi_relations","",""
"Pitr tests.","253553","test_pitr_aws","tests.integration","Thu Aug 14 02:00:50 UTC 2025","passed","Thu Aug 14 02:05:03 UTC 2025","","test_backup_pitr_gcp","",""
"Simple test to ensure that the mysql and application charms get deployed.","166856","test_build_and_deploy","tests.integration.high_availability","Thu Aug 14 01:58:04 UTC 2025","passed","Thu Aug 14 02:00:51 UTC 2025","","test_async_replication","",""
"Query database for custom variables.","25865","test_custom_variables","tests.integration","Thu Aug 14 02:10:00 UTC 2025","passed","Thu Aug 14 02:10:26 UTC 2025","","test_charm","",""
"Confirm that a new primary is elected when the current primary is torn down.","261162","test_scale_up_and_down","tests.integration","Thu Aug 14 02:00:32 UTC 2025","passed","Thu Aug 14 02:04:53 UTC 2025","","test_charm","",""
"Test behavior when node drains - pod is evicted and pvs are rotated.","167512","test_pod_eviction_and_pvc_deletion","tests.integration.high_availability","Thu Aug 14 02:00:42 UTC 2025","passed","Thu Aug 14 02:03:29 UTC 2025","","test_node_drain","",""
"Relate charms before they have time to properly start.

    It simulates a Terraform-like deployment strategy
    ","156359","test_relation_creation_eager","tests.integration.relations","Thu Aug 14 01:57:21 UTC 2025","passed","Thu Aug 14 01:59:57 UTC 2025","","test_mysql_root","",""
"Test the log rotation of text files.

    Run continuous writes to ensure that audit log plugin is loaded and active
    when mysql-test-app runs start-continuous-writes (by logging into mysql).
    ","5648","test_log_rotation","tests.integration.high_availability","Thu Aug 14 02:01:19 UTC 2025","passed","Thu Aug 14 02:01:24 UTC 2025","","test_log_rotation","",""
"Build the mysql charm and deploy it.","149127","test_build_and_deploy","tests.integration","Thu Aug 14 01:57:55 UTC 2025","passed","Thu Aug 14 02:00:24 UTC 2025","","test_charm","",""
"Test COS integrations formed before mysql is allocated and deployed.","96434","test_deploy_bundle_with_cos_integrations","tests.integration","Thu Aug 14 01:57:40 UTC 2025","passed","Thu Aug 14 01:59:16 UTC 2025","","test_cos_integration_bundle","",""
"The cluster manual re-join test.

    A graceful restart is performed in one of the instances (choosing Primary to make it painful).
    In order to verify that the instance can come back ONLINE, after disabling automatic re-join
    ","88203","test_cluster_manual_rejoin","tests.integration.high_availability","Thu Aug 14 02:00:51 UTC 2025","passed","Thu Aug 14 02:02:19 UTC 2025","","test_self_healing_restart_graceful","",""
"Simple test to ensure that the mysql and application charms get deployed.","171877","test_deploy_latest","tests.integration.high_availability","Thu Aug 14 01:58:07 UTC 2025","passed","Thu Aug 14 02:00:59 UTC 2025","","test_upgrade","",""
"Rotate password and confirm changes.","11163","test_password_rotation_silent","tests.integration","Thu Aug 14 02:09:31 UTC 2025","passed","Thu Aug 14 02:09:43 UTC 2025","","test_charm","",""
"Test to send SIGTERM to all units and then ensure that the cluster recovers.","264868","test_graceful_full_cluster_crash_test","tests.integration.high_availability","Thu Aug 14 02:01:32 UTC 2025","passed","Thu Aug 14 02:05:57 UTC 2025","","test_self_healing_stop_all","",""
"Test to write to primary, and read the same data back from replicas.","8371","test_data_replication","tests.integration.high_availability","Thu Aug 14 02:05:21 UTC 2025","passed","Thu Aug 14 02:05:29 UTC 2025","","test_async_replication","",""
"Test the existence of databases and tables created by osm-pol's migrations.","34281","test_osm_pol_operations","tests.integration","Thu Aug 14 01:59:43 UTC 2025","passed","Thu Aug 14 02:00:18 UTC 2025","","test_osm_integration_bundle","",""
"Build the charm and deploy 3 units to ensure a cluster is formed.","7060","test_build_and_deploy","tests.integration.relations","Thu Aug 14 01:57:13 UTC 2025","passed","Thu Aug 14 01:57:21 UTC 2025","","test_mysql_root","",""
"Simple test to ensure that the mysql charm gets deployed.","108459","test_build_and_deploy","tests.integration","Thu Aug 14 01:58:31 UTC 2025","passed","Thu Aug 14 02:00:20 UTC 2025","","test_backup_ceph","",""
"Ensure connections (with and without ssl) are possible before relating with TLS operator.","11270","test_connection_before_tls","tests.integration","Thu Aug 14 01:59:46 UTC 2025","passed","Thu Aug 14 01:59:58 UTC 2025","","test_tls","",""
"Test that endpoints are running.","4068","test_exporter_endpoints","tests.integration","Thu Aug 14 02:09:56 UTC 2025","passed","Thu Aug 14 02:10:00 UTC 2025","","test_charm","",""
"Relate charms and wait for the expected changes in status.","15738","test_relation_creation","tests.integration.relations","Thu Aug 14 02:00:18 UTC 2025","passed","Thu Aug 14 02:00:34 UTC 2025","","test_database","",""
"Simple test to ensure that the mysql and application charms get deployed.","126901","test_build_and_deploy","tests.integration.high_availability","Thu Aug 14 01:57:17 UTC 2025","passed","Thu Aug 14 01:59:24 UTC 2025","","test_upgrade_rollback_incompat","",""
"Confirm that data is replicated from the primary node to all the replicas.","8281","test_consistent_data_replication_across_cluster","tests.integration","Thu Aug 14 02:00:24 UTC 2025","passed","Thu Aug 14 02:00:32 UTC 2025","","test_charm","",""
"Test to restore a backup to the same mysql cluster.","160758","test_restore_on_same_cluster","tests.integration","Thu Aug 14 01:59:56 UTC 2025","passed","Thu Aug 14 02:02:36 UTC 2025","","test_backup_aws","",""
"","297358","test_rollback","tests.integration.high_availability","Thu Aug 14 02:00:16 UTC 2025","passed","Thu Aug 14 02:05:13 UTC 2025","","test_upgrade_rollback_incompat","",""
"Test to create a backup and list backups.","38866","test_backup","tests.integration","Thu Aug 14 01:59:15 UTC 2025","passed","Thu Aug 14 01:59:54 UTC 2025","","test_backup_aws","",""
"Confirm storage reuse works.","85525","test_scale_up_after_scale_down","tests.integration","Thu Aug 14 02:04:53 UTC 2025","passed","Thu Aug 14 02:06:19 UTC 2025","","test_charm","",""
"Test to restore a backup on a new mysql cluster.","569139","test_restore_on_new_cluster","tests.integration","Thu Aug 14 02:03:51 UTC 2025","passed","Thu Aug 14 02:13:20 UTC 2025","","test_backup_ceph","",""
"Tries deploying an arm64 charm on amd64 host.","46572","test_arm_charm_on_amd_host","tests.integration","Thu Aug 14 01:57:26 UTC 2025","passed","Thu Aug 14 01:58:12 UTC 2025","","test_architecture","",""
"Tries deploying an amd64 charm on arm64 host.","0","test_amd_charm_on_arm_host","tests.integration","Thu Aug 14 01:58:12 UTC 2025","skipped","Thu Aug 14 01:58:12 UTC 2025","","test_architecture","",""
"","42454","test_upgrade_to_failling","tests.integration.high_availability","Thu Aug 14 01:59:33 UTC 2025","passed","Thu Aug 14 02:00:16 UTC 2025","","test_upgrade_rollback_incompat","",""
"Remove relation and wait for the expected changes in status.","42870","test_relation_broken","tests.integration.relations","Thu Aug 14 02:00:34 UTC 2025","passed","Thu Aug 14 02:01:17 UTC 2025","","test_database","",""
"Test to restore a backup on a new mysql cluster.","578594","test_restore_on_new_cluster","tests.integration","Thu Aug 14 02:03:19 UTC 2025","passed","Thu Aug 14 02:12:57 UTC 2025","","test_backup_gcp","",""
"Scale database and routers.","465239","test_scale_out","tests.integration","Thu Aug 14 02:01:03 UTC 2025","passed","Thu Aug 14 02:08:48 UTC 2025","","test_multi_relations","",""
"","5745","test_saturate_max_connections","tests.integration","Thu Aug 14 01:59:13 UTC 2025","passed","Thu Aug 14 01:59:18 UTC 2025","","test_saturate_max_connections","",""
"Run the create replication and wait for the applications to settle.","186632","test_create_replication","tests.integration.high_availability","Thu Aug 14 02:02:12 UTC 2025","passed","Thu Aug 14 02:05:19 UTC 2025","","test_async_replication","",""
"Test to ensure that writes to one cluster do not replicate to another cluster.","75308","test_no_replication_across_clusters","tests.integration.high_availability","Thu Aug 14 02:00:43 UTC 2025","passed","Thu Aug 14 02:01:59 UTC 2025","","test_replication_data_isolation","",""
"Test to create a backup and list backups.","43703","test_backup","tests.integration","Thu Aug 14 01:59:57 UTC 2025","passed","Thu Aug 14 02:00:40 UTC 2025","","test_backup_gcp","",""
"Ensure scaling down to zero and back up works.","181417","test_scale_up_from_zero","tests.integration","Thu Aug 14 02:06:19 UTC 2025","passed","Thu Aug 14 02:09:20 UTC 2025","","test_charm","",""
"Simple test to ensure that the mysql charm gets deployed.","107600","test_build_and_deploy","tests.integration","Thu Aug 14 01:57:25 UTC 2025","passed","Thu Aug 14 01:59:13 UTC 2025","","test_backup_aws","",""
"Build and deploy for AWS.","224465","test_build_and_deploy_aws","tests.integration","Thu Aug 14 01:58:01 UTC 2025","passed","Thu Aug 14 02:01:46 UTC 2025","","test_backup_pitr_aws","",""
"Test to ensure that data is preserved when a unit is scaled up and then down.

    Ensures that there are no running continuous writes as the extra data in the
    database makes scaling up slower.
    ","248109","test_scaling_without_data_loss","tests.integration.high_availability","Thu Aug 14 02:00:22 UTC 2025","passed","Thu Aug 14 02:04:31 UTC 2025","","test_replication_scaling","",""
"","57674","test_deploy_and_relate_test_app","tests.integration","Thu Aug 14 01:58:15 UTC 2025","passed","Thu Aug 14 01:59:13 UTC 2025","","test_saturate_max_connections","",""
