"DESCRIPTION","DURATION IN MS","NAME","PARENT SUITE","START TIME","STATUS","STOP TIME","SUB SUITE","SUITE","TEST CLASS","TEST METHOD"
"Update the second cluster.","295933","test_upgrade_from_stable","tests.integration.high_availability","2025-10-20","passed","2025-10-20","","test_upgrade_from_stable","",""
"Test an upgrade failure and its rollback.","77169","test_fail_and_rollback","tests.integration.high_availability","2025-10-20","broken","2025-10-20","","test_upgrade","",""
"Test to send SIGTERM to primary instance and then verify recovery.","108284","test_graceful_crash_of_primary","tests.integration.high_availability","2025-10-20","passed","2025-10-20","","test_self_healing_stop_primary","",""
"Tries deploying an arm64 charm on amd64 host.","55619","test_arm_charm_on_amd_host","tests.integration","2025-10-20","passed","2025-10-20","","test_architecture","",""
"Ensure scaling down to zero and back up works.","152468","test_scale_up_from_zero","tests.integration","2025-10-20","passed","2025-10-20","","test_charm","",""
"Test to create a backup and list backups.","61119","test_backup","tests.integration","2025-10-20","passed","2025-10-20","","test_backup_aws","",""
"Test to write to primary, and read the same data back from replicas.","24935","test_data_replication","tests.integration.high_availability","2025-10-20","passed","2025-10-20","","test_async_replication","",""
"Build and deploy for AWS.","229340","test_build_and_deploy_aws","tests.integration","2025-10-20","passed","2025-10-20","","test_backup_pitr_aws","",""
"Run the create-replication action and wait for the applications to settle.","203541","test_create_replication","tests.integration.high_availability","2025-10-20","passed","2025-10-20","","test_async_replication","",""
"Test the database-level DBA role.","56992","test_charmed_dba_role","tests.integration.roles","2025-10-20","passed","2025-10-20","","test_database_dba_role","",""
"Test graceful promotion of a standby cluster to primary.","46216","test_standby_promotion","tests.integration.high_availability","2025-10-20","passed","2025-10-20","","test_async_replication","",""
"Test to send a SIGKILL to the primary db process and ensure that the cluster self heals.","133647","test_kill_db_process","tests.integration.high_availability","2025-10-20","passed","2025-10-20","","test_self_healing_process_killed","",""
"Test the promote-to-primary command after losing the majority of nodes, with force flag.","263738","test_cluster_failover_after_majority_loss","tests.integration.high_availability","2025-10-20","passed","2025-10-20","","test_primary_switchover","",""
"Simple test to ensure that the MySQL and application charms get deployed.","129766","test_deploy_highly_available_cluster","tests.integration.high_availability","2025-10-20","passed","2025-10-20","","test_replication_data_consistency","",""
"Simple test to ensure that the mysql and data-integrator charms get deployed.","150163","test_build_and_deploy","tests.integration.roles","2025-10-20","passed","2025-10-20","","test_instance_dba_role","",""
"Confirm that a new primary is elected when the current primary is torn down.","300802","test_scale_up_and_down","tests.integration","2025-10-20","passed","2025-10-20","","test_charm","",""
"Test the labeling of k8s endpoints when apps with same cluster-name deployed.","399212","test_labeling_of_k8s_endpoints","tests.integration.high_availability","2025-10-20","passed","2025-10-20","","test_k8s_endpoints","",""
"Simple test to ensure that the mysql and data-integrator charms get deployed.","165113","test_build_and_deploy","tests.integration.roles","2025-10-20","passed","2025-10-20","","test_instance_roles","",""
"Test for a network cut affecting an instance.","350352","test_network_cut_affecting_an_instance","tests.integration.high_availability","2025-10-20","passed","2025-10-20","","test_self_healing_network_cut","",""
"Test switchover on primary cluster fail.","297882","test_failover","tests.integration.high_availability","2025-10-20","passed","2025-10-20","","test_async_replication","",""
"Query database for custom variables.","24842","test_custom_variables","tests.integration","2025-10-20","passed","2025-10-20","","test_charm","",""
"Deploy the router and the test application.","52343","test_deploy_router_and_app","tests.integration.high_availability","2025-10-20","passed","2025-10-20","","test_async_replication","",""
"Test for encryption enablement when relation to TLS charm.","63099","test_enable_tls","tests.integration","2025-10-20","passed","2025-10-20","","test_tls","",""
"Test primary crash during startup.

    It must recover/end setup when the primary got offline.
    ","158679","test_crash_during_cluster_setup","tests.integration.high_availability","2025-10-20","passed","2025-10-20","","test_crash_during_setup","",""
"Test that the pre-upgrade-check action runs successfully.","21951","test_pre_upgrade_check","tests.integration.high_availability","2025-10-20","passed","2025-10-20","","test_upgrade_from_stable","",""
"Simple test to ensure that the mysql and data-integrator charms get deployed.","165736","test_build_and_deploy","tests.integration.roles","2025-10-20","passed","2025-10-20","","test_database_dba_role","",""
"Test that the pre-upgrade-check action runs successfully.","5540","test_pre_upgrade_check","tests.integration.high_availability","2025-10-20","passed","2025-10-20","","test_upgrade_rollback_incompat","",""
"","44853","test_upgrade_to_failing","tests.integration.high_availability","2025-10-20","passed","2025-10-20","","test_upgrade_rollback_incompat","",""
"Build the mysql charm and deploy it.","122423","test_build_and_deploy","tests.integration","2025-10-20","passed","2025-10-20","","test_charm","",""
"Simple test to ensure that the MySQL application charms get deployed.","170918","test_build_and_deploy","tests.integration.high_availability","2025-10-20","passed","2025-10-20","","test_async_replication_upgrade","",""
"Test the charmed_dml role.","110205","test_charmed_dml_role","tests.integration.roles","2025-10-20","passed","2025-10-20","","test_instance_roles","",""
"Test the log rotation of text files.

    Run continuous writes to ensure that audit log plugin is loaded and active
    when mysql-test-app runs start-continuous-writes (by logging into mysql).
    ","5968","test_log_rotation","tests.integration.high_availability","2025-10-20","passed","2025-10-20","","test_log_rotation","",""
"Tries deploying an amd64 charm on arm64 host.","0","test_amd_charm_on_arm_host","tests.integration","2025-10-20","skipped","2025-10-20","","test_architecture","",""
"","5707","test_saturate_max_connections","tests.integration","2025-10-20","passed","2025-10-20","","test_saturate_max_connections","",""
"Test rejoin invalidated cluster with.","49697","test_rejoin_invalidated_cluster","tests.integration.high_availability","2025-10-20","passed","2025-10-20","","test_async_replication","",""
"Test that the primary node can be switched over.","43435","test_cluster_switchover","tests.integration.high_availability","2025-10-20","passed","2025-10-20","","test_primary_switchover","",""
"Test the existence of databases and tables created by osm-pol's migrations.","34350","test_osm_pol_operations","tests.integration","2025-10-20","passed","2025-10-20","","test_osm_integration_bundle","",""
"Test the charmed_read predefined role.","52041","test_charmed_read_role","tests.integration.roles","2025-10-20","passed","2025-10-20","","test_instance_roles","",""
"Test to restore a backup to the same mysql cluster.","214668","test_restore_on_same_cluster","tests.integration","2025-10-20","passed","2025-10-20","","test_backup_aws","",""
"Simple test to ensure that the MySQL and application charms get deployed.","141491","test_deploy_stable","tests.integration.high_availability","2025-10-20","passed","2025-10-20","","test_upgrade_from_stable","",""
"Build the charm and deploy 3 units to ensure a cluster is formed.","139503","test_build_and_deploy","tests.integration","2025-10-20","passed","2025-10-20","","test_tls","",""
"Simple test to ensure that the MySQL and application charms get deployed.","133694","test_deploy_latest","tests.integration.high_availability","2025-10-20","passed","2025-10-20","","test_upgrade","",""
"Test to restore a backup on a new mysql cluster.","566117","test_restore_on_new_cluster","tests.integration","2025-10-20","passed","2025-10-20","","test_backup_aws","",""
"Test COS integrations formed before mysql is allocated and deployed.","94472","test_deploy_bundle_with_cos_integrations","tests.integration","2025-10-20","passed","2025-10-20","","test_cos_integration_bundle","",""
"Relate charms and wait for the expected changes in status.","0","test_relation_creation_databag","tests.integration.relations","2025-10-20","skipped","2025-10-20","","test_database","",""
"Simple test to ensure that the mysql charm gets deployed.","169775","test_build_and_deploy","tests.integration","2025-10-20","passed","2025-10-20","","test_backup_aws","",""
"Test to restore a backup to the same mysql cluster.","219736","test_restore_on_same_cluster","tests.integration","2025-10-20","passed","2025-10-20","","test_backup_ceph","",""
"Relate charms before they have time to properly start.

    It simulates a Terraform-like deployment strategy
    ","159490","test_relation_creation_eager","tests.integration.relations","2025-10-20","passed","2025-10-20","","test_database","",""
"Test for cluster data isolation.

    This test creates a new cluster, create a new table on both cluster, write a single record with
    the application name for each cluster, retrieve and compare these records, asserting they are
    not the same.
    ","79687","test_cluster_data_isolation","tests.integration.high_availability","2025-10-20","passed","2025-10-20","","test_replication_data_isolation","",""
"Rotate password and confirm changes.","14180","test_password_rotation_root_user_implicit","tests.integration","2025-10-20","passed","2025-10-20","","test_charm","",""
"Build the charm and deploy 3 units to ensure a cluster is formed.","7011","test_build_and_deploy","tests.integration.relations","2025-10-20","passed","2025-10-20","","test_mysql_root","",""
"Ensure connections (with and without ssl) are possible before relating with TLS operator.","2188","test_connection_before_tls","tests.integration","2025-10-20","passed","2025-10-20","","test_tls","",""
"Confirm that a new primary is elected when the current primary is tear down.","108210","test_kill_primary_check_reelection","tests.integration.high_availability","2025-10-20","passed","2025-10-20","","test_replication_reelection","",""
"Scale database and routers.","272043","test_scale_in","tests.integration","2025-10-20","passed","2025-10-20","","test_multi_relations","",""
"Test to send a SIGSTOP to the primary db process and ensure that the cluster self heals.","479951","test_freeze_db_process","tests.integration.high_availability","2025-10-20","passed","2025-10-20","","test_self_healing_process_frozen","",""
"Scale database and routers.","740746","test_scale_out","tests.integration","2025-10-20","passed","2025-10-20","","test_multi_relations","",""
"Test that endpoints are running.","4315","test_exporter_endpoints","tests.integration","2025-10-20","passed","2025-10-20","","test_charm","",""
"Relate charms before they have time to properly start.

    It simulates a Terraform-like deployment strategy
    ","170514","test_relation_creation_eager","tests.integration.relations","2025-10-20","passed","2025-10-20","","test_mysql_root","",""
"Relate all the applications to the database.","195440","test_relate_all","tests.integration","2025-10-20","passed","2025-10-20","","test_multi_relations","",""
"Test to create a backup and list backups.","44719","test_backup","tests.integration","2025-10-20","passed","2025-10-20","","test_backup_gcp","",""
"Rotate password and confirm changes.","11185","test_password_rotation_silent","tests.integration","2025-10-20","passed","2025-10-20","","test_charm","",""
"Deploy the test application.","27737","test_deploy_test_app","tests.integration.high_availability","2025-10-20","passed","2025-10-20","","test_async_replication_upgrade","",""
"Relate charms and wait for the expected changes in status.","33129","test_relation_creation","tests.integration.relations","2025-10-20","passed","2025-10-20","","test_database","",""
"Build and deploy for AWS.","246669","test_build_and_deploy_gcp","tests.integration","2025-10-20","passed","2025-10-20","","test_backup_pitr_gcp","",""
"Relate the two MySQL clusters.","42726","test_async_relate","tests.integration.high_availability","2025-10-20","passed","2025-10-20","","test_async_replication_upgrade","",""
"Confirm that data is replicated from the primary node to all the replicas.","4250","test_consistent_data_replication_across_cluster","tests.integration","2025-10-20","passed","2025-10-20","","test_charm","",""
"Relate the two MySQL clusters.","38863","test_async_relate","tests.integration.high_availability","2025-10-20","passed","2025-10-20","","test_async_replication","",""
"Test behavior when node drains - pod is evicted and pvs are rotated.","153065","test_pod_eviction_and_pvc_deletion","tests.integration.high_availability","2025-10-20","passed","2025-10-20","","test_node_drain","",""
"Test the deployment and relation with osm bundle with mysql replacing mariadb.","162451","test_deploy_and_relate_osm_bundle","tests.integration","2025-10-20","passed","2025-10-20","","test_osm_integration_bundle","",""
"Upgrade the two MySQL clusters.","721253","test_upgrade_from_edge","tests.integration.high_availability","2025-10-20","passed","2025-10-20","","test_async_replication_upgrade","",""
"Simple test to ensure that the MySQL and application charms get deployed.","134402","test_build_and_deploy","tests.integration.high_availability","2025-10-20","passed","2025-10-20","","test_upgrade_rollback_incompat","",""
"","30304","test_disable_tls","tests.integration","2025-10-20","passed","2025-10-20","","test_tls","",""
"","62106","test_deploy_and_relate_test_app","tests.integration","2025-10-20","passed","2025-10-20","","test_saturate_max_connections","",""
"Build the charm and deploy 1 units to ensure a cluster is formed.","32982","test_build_and_deploy","tests.integration","2025-10-20","passed","2025-10-20","","test_multi_relations","",""
"Update the second cluster.","292471","test_upgrade_from_edge","tests.integration.high_availability","2025-10-20","passed","2025-10-20","","test_upgrade","",""
"Simple test to ensure that the MySQL application charms get deployed.","169106","test_build_and_deploy","tests.integration.high_availability","2025-10-20","passed","2025-10-20","","test_async_replication","",""
"Test to write to primary, and read the same data back from replicas.","78117","test_data_replication","tests.integration.high_availability","2025-10-20","passed","2025-10-20","","test_async_replication_upgrade","",""
"Test that data is preserved during scale up and scale down.","188926","test_scaling_without_data_loss","tests.integration.high_availability","2025-10-20","passed","2025-10-20","","test_replication_scaling","",""
"Confirm storage reuse works.","87973","test_scale_up_after_scale_down","tests.integration","2025-10-20","passed","2025-10-20","","test_charm","",""
"Rotate password and confirm changes.","11157","test_password_rotation","tests.integration","2025-10-20","passed","2025-10-20","","test_charm","",""
"Verify rotating tls private keys restarts cluster with new certificates.

    This test rotates tls private keys to randomly generated keys.
    ","41077","test_rotate_tls_key","tests.integration","2025-10-20","passed","2025-10-20","","test_tls","",""
"Pitr tests.","251783","test_pitr_aws","tests.integration","2025-10-20","passed","2025-10-20","","test_backup_pitr_gcp","",""
"Simple test to ensure that the mysql charm gets deployed.","184794","test_build_and_deploy","tests.integration","2025-10-20","passed","2025-10-20","","test_backup_gcp","",""
"Test upgrade rollback to a healthy revision.","340510","test_rollback","tests.integration.high_availability","2025-10-20","passed","2025-10-20","","test_upgrade_rollback_incompat","",""
"Simple test to ensure that the MySQL and application charms get deployed.","128181","test_deploy_highly_available_cluster","tests.integration.high_availability","2025-10-20","passed","2025-10-20","","test_replication_scaling","",""
"Simple test to ensure that the MySQL and application charms get deployed.","125131","test_deploy_highly_available_cluster","tests.integration.high_availability","2025-10-20","passed","2025-10-20","","test_replication_data_isolation","",""
"Test removing and re-relating the two mysql clusters.","933035","test_unrelate_and_relate","tests.integration.high_availability","2025-10-20","broken","2025-10-20","","test_async_replication","",""
"Test to restore a backup to the same mysql cluster.","221739","test_restore_on_same_cluster","tests.integration","2025-10-20","passed","2025-10-20","","test_backup_gcp","",""
"Test the DBA predefined role.","32564","test_charmed_dba_role","tests.integration.roles","2025-10-20","passed","2025-10-20","","test_instance_dba_role","",""
"Test that the pre-upgrade-check action runs successfully.","18797","test_pre_upgrade_check","tests.integration.high_availability","2025-10-20","passed","2025-10-20","","test_upgrade","",""
"Delete the pod in a single unit deployment and write data to new pod.","255227","test_single_unit_pod_delete","tests.integration.high_availability","2025-10-20","passed","2025-10-20","","test_self_healing_pod","",""
"Test to send SIGTERM to all units and then ensure that the cluster recovers.","346381","test_graceful_full_cluster_crash_test","tests.integration.high_availability","2025-10-20","passed","2025-10-20","","test_self_healing_stop_all","",""
"Test to create a backup and list backups.","43303","test_backup","tests.integration","2025-10-20","passed","2025-10-20","","test_backup_ceph","",""
"Build the charm and deploy 3 units to ensure a cluster is formed.","8121","test_build_and_deploy","tests.integration.relations","2025-10-20","passed","2025-10-20","","test_database","",""
"Build the charm and deploy 1 units to ensure a cluster is formed.","7696","test_build_and_deploy","tests.integration","2025-10-20","passed","2025-10-20","","test_saturate_max_connections","",""
"Test to restore a backup on a new mysql cluster.","493647","test_restore_on_new_cluster","tests.integration","2025-10-20","passed","2025-10-20","","test_backup_ceph","",""
"Remove relation and wait for the expected changes in status.","23410","test_relation_broken","tests.integration.relations","2025-10-20","passed","2025-10-20","","test_database","",""
"The cluster manual re-join test.

    A graceful restart is performed in one of the instances (choosing Primary to make it painful).
    In order to verify that the instance can come back ONLINE, after disabling automatic re-join
    ","75739","test_cluster_manual_rejoin","tests.integration.high_availability","2025-10-20","passed","2025-10-20","","test_self_healing_restart_graceful","",""
"Simple test to ensure that the mysql charm gets deployed.","176880","test_build_and_deploy","tests.integration","2025-10-20","passed","2025-10-20","","test_backup_ceph","",""
"Confirm that data is replicated from the primary node to all the replicas.","23490","test_consistent_data_replication_across_cluster","tests.integration.high_availability","2025-10-20","passed","2025-10-20","","test_replication_data_consistency","",""
"Pitr tests.","301515","test_pitr_aws","tests.integration","2025-10-20","passed","2025-10-20","","test_backup_pitr_aws","",""
"Run the create-replication action and wait for the applications to settle.","148724","test_create_replication","tests.integration.high_availability","2025-10-20","passed","2025-10-20","","test_async_replication_upgrade","",""
"Simple test to ensure that the MySQL and application charms get deployed.","134573","test_deploy_highly_available_cluster","tests.integration.high_availability","2025-10-20","passed","2025-10-20","","test_replication_reelection","",""
"Test to restore a backup on a new mysql cluster.","499007","test_restore_on_new_cluster","tests.integration","2025-10-20","passed","2025-10-20","","test_backup_gcp","",""
