"Status","Start Time","Stop Time","Duration in ms","Parent Suite","Suite","Sub Suite","Test Class","Test Method","Name","Description"
"passed","Wed Jul 10 01:46:04 UTC 2024","Wed Jul 10 01:46:12 UTC 2024","8234","tests.integration.high_availability","test_async_replication","","","","test_data_replication","Test to write to primary, and read the same data back from replicas."
"passed","Wed Jul 10 01:41:55 UTC 2024","Wed Jul 10 01:42:45 UTC 2024","49635","tests.integration","test_backup_aws","","","","test_backup","Test to create a backup and list backups."
"passed","Wed Jul 10 01:40:21 UTC 2024","Wed Jul 10 01:42:06 UTC 2024","105015","tests.integration","test_backup_gcp","","","","test_build_and_deploy","Simple test to ensure that the mysql charm gets deployed."
"passed","Wed Jul 10 01:42:45 UTC 2024","Wed Jul 10 01:45:47 UTC 2024","182582","tests.integration","test_backup_aws","","","","test_restore_on_same_cluster","Test to restore a backup to the same mysql cluster."
"passed","Wed Jul 10 01:48:25 UTC 2024","Wed Jul 10 01:52:07 UTC 2024","222146","tests.integration.high_availability","test_replication","","","","test_kill_primary_check_reelection","Test to kill the primary under load and ensure re-election of primary."
"passed","Wed Jul 10 01:48:10 UTC 2024","Wed Jul 10 01:48:35 UTC 2024","24574","tests.integration","test_charm","","","","test_custom_variables","Query database for custom variables."
"skipped","Wed Jul 10 01:40:33 UTC 2024","Wed Jul 10 01:40:33 UTC 2024","0","tests.integration.relations","test_database","","","","test_relation_creation_databag","Relate charms and wait for the expected changes in status."
"passed","Wed Jul 10 01:40:02 UTC 2024","Wed Jul 10 01:42:47 UTC 2024","164610","tests.integration.high_availability","test_async_replication","","","","test_build_and_deploy","Simple test to ensure that the mysql and application charms get deployed."
"passed","Wed Jul 10 02:03:58 UTC 2024","Wed Jul 10 02:06:38 UTC 2024","159584","tests.integration.high_availability","test_self_healing","","","","test_single_unit_pod_delete","Delete the pod in a single unit deployment and write data to new pod."
"passed","Wed Jul 10 01:44:43 UTC 2024","Wed Jul 10 01:46:01 UTC 2024","78356","tests.integration.high_availability","test_async_replication","","","","test_deploy_router_and_app","Deploy the router and the test application."
"passed","Wed Jul 10 01:42:53 UTC 2024","Wed Jul 10 01:44:25 UTC 2024","91657","tests.integration.high_availability","test_self_healing","","","","test_kill_db_process","Test to send a SIGKILL to the primary db process and ensure that the cluster self heals."
"passed","Wed Jul 10 01:39:45 UTC 2024","Wed Jul 10 01:41:44 UTC 2024","119012","tests.integration","test_tls","","","","test_build_and_deploy","Build the charm and deploy 3 units to ensure a cluster is formed."
"passed","Wed Jul 10 01:48:35 UTC 2024","Wed Jul 10 01:48:41 UTC 2024","6051","tests.integration","test_charm","","","","test_log_rotation","Test the log rotation of text files."
"passed","Wed Jul 10 01:39:21 UTC 2024","Wed Jul 10 01:41:44 UTC 2024","142744","tests.integration.high_availability","test_upgrade","","","","test_deploy_latest","Simple test to ensure that the mysql and application charms get deployed."
"passed","Wed Jul 10 01:43:20 UTC 2024","Wed Jul 10 01:43:41 UTC 2024","20832","tests.integration.high_availability","test_replication","","","","test_check_consistency","Test to write to primary, and read the same data back from replicas."
"passed","Wed Jul 10 01:42:05 UTC 2024","Wed Jul 10 01:44:36 UTC 2024","151836","tests.integration.high_availability","test_upgrade_rollback_incompat","","","","test_rollback",""
"passed","Wed Jul 10 01:45:28 UTC 2024","Wed Jul 10 01:49:43 UTC 2024","254416","tests.integration","test_backup_gcp","","","","test_restore_on_new_cluster","Test to restore a backup on a new mysql cluster."
"passed","Wed Jul 10 01:40:05 UTC 2024","Wed Jul 10 01:43:18 UTC 2024","192626","tests.integration.high_availability","test_replication","","","","test_build_and_deploy","Simple test to ensure that the mysql and application charms get deployed."
"passed","Wed Jul 10 01:46:38 UTC 2024","Wed Jul 10 01:50:55 UTC 2024","257644","tests.integration.high_availability","test_async_replication","","","","test_failover","Test switchover on primary cluster fail."
"passed","Wed Jul 10 01:42:33 UTC 2024","Wed Jul 10 01:42:47 UTC 2024","14356","tests.integration.high_availability","test_upgrade_from_stable","","","","test_pre_upgrade_check","Test that the pre-upgrade-check action runs successfully."
"passed","Wed Jul 10 01:42:51 UTC 2024","Wed Jul 10 01:44:43 UTC 2024","111836","tests.integration.high_availability","test_async_replication","","","","test_create_replication","Run the create replication and wait for the applications to settle."
"passed","Wed Jul 10 01:42:16 UTC 2024","Wed Jul 10 01:42:50 UTC 2024","34192","tests.integration.relations","test_mysql_root","","","","test_osm_pol_operations","Test the existence of databases and tables created by osm-pol's migrations."
"passed","Wed Jul 10 01:40:07 UTC 2024","Wed Jul 10 01:42:19 UTC 2024","131597","tests.integration","test_charm","","","","test_build_and_deploy","Build the mysql charm and deploy it."
"passed","Wed Jul 10 01:45:11 UTC 2024","Wed Jul 10 01:48:23 UTC 2024","191403","tests.integration.high_availability","test_replication","","","","test_scaling_without_data_loss","Test to ensure that data is preserved when a unit is scaled up and then down.

    Ensures that there are no running continuous writes as the extra data in the
    database makes scaling up slower.
    "
"skipped","Wed Jul 10 01:40:33 UTC 2024","Wed Jul 10 01:40:33 UTC 2024","0","tests.integration.relations","test_database","","","","test_relation_broken","Remove relation and wait for the expected changes in status."
"passed","Wed Jul 10 01:51:20 UTC 2024","Wed Jul 10 01:54:54 UTC 2024","213489","tests.integration.high_availability","test_async_replication","","","","test_remove_relation_and_relate","Test removing and re-relating the two mysql clusters."
"skipped","Wed Jul 10 01:40:33 UTC 2024","Wed Jul 10 01:40:33 UTC 2024","0","tests.integration.relations","test_database","","","","test_relation_creation","Relate charms and wait for the expected changes in status."
"passed","Wed Jul 10 01:42:19 UTC 2024","Wed Jul 10 01:42:23 UTC 2024","4156","tests.integration","test_charm","","","","test_consistent_data_replication_across_cluster","Confirm that data is replicated from the primary node to all the replicas."
"passed","Wed Jul 10 01:41:44 UTC 2024","Wed Jul 10 01:41:57 UTC 2024","13338","tests.integration.high_availability","test_upgrade","","","","test_pre_upgrade_check","Test that the pre-upgrade-check action runs successfully."
"passed","Wed Jul 10 01:45:59 UTC 2024","Wed Jul 10 01:47:30 UTC 2024","91917","tests.integration","test_charm","","","","test_scale_up_after_scale_down","Confirm storage reuse works."
"passed","Wed Jul 10 01:45:15 UTC 2024","Wed Jul 10 01:49:12 UTC 2024","236614","tests.integration.high_availability","test_upgrade","","","","test_fail_and_rollback",""
"passed","Wed Jul 10 01:42:23 UTC 2024","Wed Jul 10 01:45:58 UTC 2024","215448","tests.integration","test_charm","","","","test_scale_up_and_down","Confirm that a new primary is elected when the current primary is torn down."
"passed","Wed Jul 10 01:46:29 UTC 2024","Wed Jul 10 01:50:37 UTC 2024","248587","tests.integration","test_backup_ceph","","","","test_restore_on_new_cluster","Test to restore a backup on a new mysql cluster."
"passed","Wed Jul 10 01:47:53 UTC 2024","Wed Jul 10 01:48:06 UTC 2024","13190","tests.integration","test_charm","","","","test_password_rotation_root_user_implicit","Rotate password and confirm changes."
"passed","Wed Jul 10 01:43:56 UTC 2024","Wed Jul 10 01:46:29 UTC 2024","152812","tests.integration","test_backup_ceph","","","","test_restore_on_same_cluster","Test to restore a backup to the same mysql cluster."
"passed","Wed Jul 10 01:42:47 UTC 2024","Wed Jul 10 01:42:51 UTC 2024","4157","tests.integration.high_availability","test_async_replication","","","","test_async_relate","Relate the two mysql clusters."
"passed","Wed Jul 10 01:42:06 UTC 2024","Wed Jul 10 01:42:51 UTC 2024","45460","tests.integration","test_backup_gcp","","","","test_backup","Test to create a backup and list backups."
"passed","Wed Jul 10 01:39:38 UTC 2024","Wed Jul 10 01:42:16 UTC 2024","157646","tests.integration.relations","test_mysql_root","","","","test_deploy_and_relate_osm_bundle","Test the deployment and relation with osm bundle with mysql replacing mariadb."
"passed","Wed Jul 10 01:43:44 UTC 2024","Wed Jul 10 01:45:10 UTC 2024","86284","tests.integration.high_availability","test_replication","","","","test_no_replication_across_clusters","Test to ensure that writes to one cluster do not replicate to another cluster."
"passed","Wed Jul 10 01:41:46 UTC 2024","Wed Jul 10 01:42:55 UTC 2024","68521","tests.integration","test_tls","","","","test_enable_tls","Test for encryption enablement when relation to TLS charm."
"passed","Wed Jul 10 01:45:47 UTC 2024","Wed Jul 10 01:50:18 UTC 2024","271001","tests.integration","test_backup_aws","","","","test_restore_on_new_cluster","Test to restore a backup on a new mysql cluster."
"passed","Wed Jul 10 01:39:59 UTC 2024","Wed Jul 10 01:41:55 UTC 2024","115544","tests.integration","test_backup_aws","","","","test_build_and_deploy","Simple test to ensure that the mysql charm gets deployed."
"passed","Wed Jul 10 01:39:23 UTC 2024","Wed Jul 10 01:41:23 UTC 2024","120339","tests.integration.high_availability","test_upgrade_rollback_incompat","","","","test_build_and_deploy","Simple test to ensure that the mysql and application charms get deployed."
"passed","Wed Jul 10 01:58:05 UTC 2024","Wed Jul 10 02:03:56 UTC 2024","350868","tests.integration.high_availability","test_self_healing","","","","test_graceful_full_cluster_crash_test","Test to send SIGTERM to all units and then ensure that the cluster recovers."
"passed","Wed Jul 10 01:53:26 UTC 2024","Wed Jul 10 01:57:52 UTC 2024","266138","tests.integration.high_availability","test_self_healing","","","","test_network_cut_affecting_an_instance","Test for a network cut affecting an instance."
"passed","Wed Jul 10 01:50:59 UTC 2024","Wed Jul 10 01:51:17 UTC 2024","18399","tests.integration.high_availability","test_async_replication","","","","test_rejoin_invalidated_cluster","Test rejoin invalidated cluster with."
"passed","Wed Jul 10 01:42:51 UTC 2024","Wed Jul 10 01:45:28 UTC 2024","156939","tests.integration","test_backup_gcp","","","","test_restore_on_same_cluster","Test to restore a backup to the same mysql cluster."
"passed","Wed Jul 10 01:41:27 UTC 2024","Wed Jul 10 01:42:05 UTC 2024","37252","tests.integration.high_availability","test_upgrade_rollback_incompat","","","","test_upgrade_to_failling",""
"passed","Wed Jul 10 01:46:15 UTC 2024","Wed Jul 10 01:46:37 UTC 2024","21369","tests.integration.high_availability","test_async_replication","","","","test_standby_promotion","Test graceful promotion of a standby cluster to primary."
"passed","Wed Jul 10 01:41:23 UTC 2024","Wed Jul 10 01:43:12 UTC 2024","108037","tests.integration","test_backup_ceph","","","","test_build_and_deploy","Simple test to ensure that the mysql charm gets deployed."
"passed","Wed Jul 10 01:47:42 UTC 2024","Wed Jul 10 01:47:53 UTC 2024","11172","tests.integration","test_charm","","","","test_password_rotation_silent","Rotate password and confirm changes."
"passed","Wed Jul 10 01:43:12 UTC 2024","Wed Jul 10 01:43:56 UTC 2024","44326","tests.integration","test_backup_ceph","","","","test_backup","Test to create a backup and list backups."
"passed","Wed Jul 10 01:39:51 UTC 2024","Wed Jul 10 01:42:51 UTC 2024","180115","tests.integration.high_availability","test_self_healing","","","","test_build_and_deploy","Simple test to ensure that the mysql and application charms get deployed."
"passed","Wed Jul 10 01:41:23 UTC 2024","Wed Jul 10 01:41:27 UTC 2024","4078","tests.integration.high_availability","test_upgrade_rollback_incompat","","","","test_pre_upgrade_check","Test that the pre-upgrade-check action runs successfully."
"passed","Wed Jul 10 01:43:36 UTC 2024","Wed Jul 10 01:44:06 UTC 2024","30123","tests.integration","test_tls","","","","test_disable_tls",""
"passed","Wed Jul 10 01:41:59 UTC 2024","Wed Jul 10 01:45:12 UTC 2024","192858","tests.integration.high_availability","test_upgrade","","","","test_upgrade_from_edge",""
"passed","Wed Jul 10 01:42:55 UTC 2024","Wed Jul 10 01:43:36 UTC 2024","41001","tests.integration","test_tls","","","","test_rotate_tls_key","Verify rotating tls private keys restarts cluster with new certificates.

    This test rotates tls private keys to randomly generated keys.
    "
"passed","Wed Jul 10 01:44:28 UTC 2024","Wed Jul 10 01:50:44 UTC 2024","376402","tests.integration.high_availability","test_self_healing","","","","test_freeze_db_process","Test to send a SIGSTOP to the primary db process and ensure that the cluster self heals."
"passed","Wed Jul 10 01:42:47 UTC 2024","Wed Jul 10 01:45:48 UTC 2024","180329","tests.integration.high_availability","test_upgrade_from_stable","","","","test_upgrade_from_stable","Test updating from stable channel."
"passed","Wed Jul 10 01:50:47 UTC 2024","Wed Jul 10 01:52:51 UTC 2024","123342","tests.integration.high_availability","test_self_healing","","","","test_graceful_crash_of_primary","Test to send SIGTERM to primary instance and then verify recovery."
"passed","Wed Jul 10 01:39:54 UTC 2024","Wed Jul 10 01:42:33 UTC 2024","159298","tests.integration.high_availability","test_upgrade_from_stable","","","","test_deploy_stable","Simple test to ensure that the mysql and application charms get deployed."
"passed","Wed Jul 10 01:48:06 UTC 2024","Wed Jul 10 01:48:10 UTC 2024","3994","tests.integration","test_charm","","","","test_exporter_endpoints","Test that endpoints are running."
"passed","Wed Jul 10 01:47:30 UTC 2024","Wed Jul 10 01:47:42 UTC 2024","11173","tests.integration","test_charm","","","","test_password_rotation","Rotate password and confirm changes."
"broken","Wed Jul 10 01:40:10 UTC 2024","Wed Jul 10 01:40:33 UTC 2024","22672","tests.integration.relations","test_database","","","","test_build_and_deploy","Build the charm and deploy 3 units to ensure a cluster is formed."
"passed","Wed Jul 10 01:41:44 UTC 2024","Wed Jul 10 01:41:46 UTC 2024","2112","tests.integration","test_tls","","","","test_connection_before_tls","Ensure connections (with and without ssl) are possible before relating with TLS operator."
