"DESCRIPTION","DURATION IN MS","NAME","PARENT SUITE","START TIME","STATUS","STOP TIME","SUB SUITE","SUITE","TEST CLASS","TEST METHOD"
"Simple test to ensure that the mysql charm gets deployed.","113506","test_build_and_deploy","tests.integration","Mon Sep 09 01:32:09 UTC 2024","passed","Mon Sep 09 01:34:02 UTC 2024","","test_backup_ceph","",""
"Confirm that data is replicated from the primary node to all the replicas.","4152","test_consistent_data_replication_across_cluster","tests.integration","Mon Sep 09 01:34:19 UTC 2024","passed","Mon Sep 09 01:34:23 UTC 2024","","test_charm","",""
"Test the existence of databases and tables created by osm-pol's migrations.","35193","test_osm_pol_operations","tests.integration.relations","Mon Sep 09 01:34:17 UTC 2024","passed","Mon Sep 09 01:34:53 UTC 2024","","test_mysql_root","",""
"","","test_fail_and_rollback","tests.integration.high_availability","","unknown","","","test_upgrade","",""
"Confirm storage reuse works.","81572","test_scale_up_after_scale_down","tests.integration","Mon Sep 09 01:38:36 UTC 2024","passed","Mon Sep 09 01:39:57 UTC 2024","","test_charm","",""
"Simple test to ensure that the mysql charm gets deployed.","111184","test_build_and_deploy","tests.integration","Mon Sep 09 01:32:10 UTC 2024","passed","Mon Sep 09 01:34:01 UTC 2024","","test_backup_aws","",""
"Test updating from stable channel.","175158","test_upgrade_from_stable","tests.integration.high_availability","Mon Sep 09 01:34:11 UTC 2024","passed","Mon Sep 09 01:37:06 UTC 2024","","test_upgrade_from_stable","",""
"Test to restore a backup on a new mysql cluster.","294379","test_restore_on_new_cluster","tests.integration","Mon Sep 09 01:36:56 UTC 2024","passed","Mon Sep 09 01:41:50 UTC 2024","","test_backup_gcp","",""
"Test to create a backup and list backups.","42380","test_backup","tests.integration","Mon Sep 09 01:34:04 UTC 2024","passed","Mon Sep 09 01:34:47 UTC 2024","","test_backup_ceph","",""
"Rotate password and confirm changes.","14177","test_password_rotation_root_user_implicit","tests.integration","Mon Sep 09 01:40:22 UTC 2024","passed","Mon Sep 09 01:40:36 UTC 2024","","test_charm","",""
"Test removing and re-relating the two mysql clusters.","236234","test_remove_relation_and_relate","tests.integration.high_availability","Mon Sep 09 01:45:57 UTC 2024","passed","Mon Sep 09 01:49:53 UTC 2024","","test_async_replication","",""
"Test to write to primary, and read the same data back from replicas.","8266","test_data_replication","tests.integration.high_availability","Mon Sep 09 01:40:43 UTC 2024","passed","Mon Sep 09 01:40:51 UTC 2024","","test_async_replication","",""
"Test to send SIGTERM to all units and then ensure that the cluster recovers.","317793","test_graceful_full_cluster_crash_test","tests.integration.high_availability","Mon Sep 09 01:34:22 UTC 2024","passed","Mon Sep 09 01:39:40 UTC 2024","","test_self_healing","",""
"Test behavior when node drains - pod is evicted and pvs are rotated.","153979","test_pod_eviction_and_pvc_deletion","tests.integration.high_availability","Mon Sep 09 01:34:55 UTC 2024","passed","Mon Sep 09 01:37:29 UTC 2024","","test_node_drain","",""
"Build the charm and deploy 3 units to ensure a cluster is formed.","132192","test_build_and_deploy","tests.integration.relations","Mon Sep 09 01:31:24 UTC 2024","passed","Mon Sep 09 01:33:36 UTC 2024","","test_database","",""
"Delete the pod in a single unit deployment and write data to new pod.","175131","test_single_unit_pod_delete","tests.integration.high_availability","Mon Sep 09 01:34:26 UTC 2024","passed","Mon Sep 09 01:37:21 UTC 2024","","test_self_healing","",""
"Test that the pre-upgrade-check action runs successfully.","17499","test_pre_upgrade_check","tests.integration.high_availability","Mon Sep 09 01:33:51 UTC 2024","passed","Mon Sep 09 01:34:09 UTC 2024","","test_upgrade_from_stable","",""
"Relate charms and wait for the expected changes in status.","0","test_relation_creation_databag","tests.integration.relations","Mon Sep 09 01:33:36 UTC 2024","skipped","Mon Sep 09 01:33:36 UTC 2024","","test_database","",""
"Deploy the router and the test application.","81662","test_deploy_router_and_app","tests.integration.high_availability","Mon Sep 09 01:38:19 UTC 2024","passed","Mon Sep 09 01:39:40 UTC 2024","","test_async_replication","",""
"Test to restore a backup to the same mysql cluster.","172898","test_restore_on_same_cluster","tests.integration","Mon Sep 09 01:34:03 UTC 2024","passed","Mon Sep 09 01:36:56 UTC 2024","","test_backup_gcp","",""
"Test rejoin invalidated cluster with.","15429","test_rejoin_invalidated_cluster","tests.integration.high_availability","Mon Sep 09 01:45:38 UTC 2024","passed","Mon Sep 09 01:45:54 UTC 2024","","test_async_replication","",""
"Simple test to ensure that the mysql and application charms get deployed.","157441","test_deploy_stable","tests.integration.high_availability","Mon Sep 09 01:31:14 UTC 2024","passed","Mon Sep 09 01:33:51 UTC 2024","","test_upgrade_from_stable","",""
"Simple test to ensure that the mysql and application charms get deployed.","169599","test_deploy_latest","tests.integration.high_availability","Mon Sep 09 01:31:29 UTC 2024","passed","Mon Sep 09 01:34:18 UTC 2024","","test_upgrade","",""
"Test to create a backup and list backups.","38154","test_backup","tests.integration","Mon Sep 09 01:34:03 UTC 2024","passed","Mon Sep 09 01:34:42 UTC 2024","","test_backup_aws","",""
"Test that endpoints are running.","4017","test_exporter_endpoints","tests.integration","Mon Sep 09 01:40:36 UTC 2024","passed","Mon Sep 09 01:40:40 UTC 2024","","test_charm","",""
"Test to ensure that data is preserved when a unit is scaled up and then down.

    Ensures that there are no running continuous writes as the extra data in the
    database makes scaling up slower.
    ","246311","test_scaling_without_data_loss","tests.integration.high_availability","Mon Sep 09 01:34:21 UTC 2024","passed","Mon Sep 09 01:38:28 UTC 2024","","test_replication","",""
"Simple test to ensure that the mysql and application charms get deployed.","119902","test_build_and_deploy","tests.integration.high_availability","Mon Sep 09 01:31:20 UTC 2024","passed","Mon Sep 09 01:33:20 UTC 2024","","test_upgrade_rollback_incompat","",""
"Test that the pre-upgrade-check action runs successfully.","15355","test_pre_upgrade_check","tests.integration.high_availability","Mon Sep 09 01:34:18 UTC 2024","passed","Mon Sep 09 01:34:33 UTC 2024","","test_upgrade","",""
"Test to restore a backup on a new mysql cluster.","278989","test_restore_on_new_cluster","tests.integration","Mon Sep 09 01:37:45 UTC 2024","passed","Mon Sep 09 01:42:24 UTC 2024","","test_backup_aws","",""
"Rotate password and confirm changes.","12178","test_password_rotation_silent","tests.integration","Mon Sep 09 01:40:10 UTC 2024","passed","Mon Sep 09 01:40:22 UTC 2024","","test_charm","",""
"Test that the pre-upgrade-check action runs successfully.","5122","test_pre_upgrade_check","tests.integration.high_availability","Mon Sep 09 01:33:20 UTC 2024","passed","Mon Sep 09 01:33:25 UTC 2024","","test_upgrade_rollback_incompat","",""
"Test to write to primary, and read the same data back from replicas.","6455","test_check_consistency","tests.integration.high_availability","Mon Sep 09 01:34:40 UTC 2024","passed","Mon Sep 09 01:34:46 UTC 2024","","test_replication","",""
"Relate the two mysql clusters.","4672","test_async_relate","tests.integration.high_availability","Mon Sep 09 01:34:19 UTC 2024","passed","Mon Sep 09 01:34:24 UTC 2024","","test_async_replication","",""
"Test to kill the primary under load and ensure re-election of primary.","","test_kill_primary_check_reelection","tests.integration.high_availability","","unknown","","","test_replication","",""
"Build the charm and deploy 3 units to ensure a cluster is formed.","129816","test_build_and_deploy","tests.integration","Mon Sep 09 01:31:10 UTC 2024","passed","Mon Sep 09 01:33:20 UTC 2024","","test_tls","",""
"Test to restore a backup to the same mysql cluster.","180911","test_restore_on_same_cluster","tests.integration","Mon Sep 09 01:34:44 UTC 2024","passed","Mon Sep 09 01:37:45 UTC 2024","","test_backup_aws","",""
"","145279","test_upgrade_from_edge","tests.integration.high_availability","Mon Sep 09 01:34:38 UTC 2024","passed","Mon Sep 09 01:37:03 UTC 2024","","test_upgrade","",""
"","145109","test_rollback","tests.integration.high_availability","Mon Sep 09 01:34:10 UTC 2024","passed","Mon Sep 09 01:36:35 UTC 2024","","test_upgrade_rollback_incompat","",""
"Query database for custom variables.","25595","test_custom_variables","tests.integration","Mon Sep 09 01:40:40 UTC 2024","passed","Mon Sep 09 01:41:06 UTC 2024","","test_charm","",""
"Verify rotating tls private keys restarts cluster with new certificates.

    This test rotates tls private keys to randomly generated keys.
    ","42101","test_rotate_tls_key","tests.integration","Mon Sep 09 01:34:32 UTC 2024","passed","Mon Sep 09 01:35:14 UTC 2024","","test_tls","",""
"Relate charms and wait for the expected changes in status.","41892","test_relation_creation","tests.integration.relations","Mon Sep 09 01:33:36 UTC 2024","passed","Mon Sep 09 01:34:18 UTC 2024","","test_database","",""
"Test the log rotation of text files.

    Run continuous writes to ensure that audit log plugin is loaded and active
    when mysql-test-app runs start-continuous-writes (by logging into mysql).
    ","9840","test_log_rotation","tests.integration.high_availability","Mon Sep 09 01:34:33 UTC 2024","passed","Mon Sep 09 01:34:43 UTC 2024","","test_log_rotation","",""
"Confirm that a new primary is elected when the current primary is torn down.","252411","test_scale_up_and_down","tests.integration","Mon Sep 09 01:34:23 UTC 2024","passed","Mon Sep 09 01:38:36 UTC 2024","","test_charm","",""
"Test to restore a backup to the same mysql cluster.","176387","test_restore_on_same_cluster","tests.integration","Mon Sep 09 01:34:49 UTC 2024","passed","Mon Sep 09 01:37:45 UTC 2024","","test_backup_ceph","",""
"Test for a network cut affecting an instance.","200307","test_network_cut_affecting_an_instance","tests.integration.high_availability","Mon Sep 09 01:35:00 UTC 2024","passed","Mon Sep 09 01:38:20 UTC 2024","","test_self_healing","",""
"Test the deployment and relation with osm bundle with mysql replacing mariadb.","157555","test_deploy_and_relate_osm_bundle","tests.integration.relations","Mon Sep 09 01:31:40 UTC 2024","passed","Mon Sep 09 01:34:17 UTC 2024","","test_mysql_root","",""
"Build the mysql charm and deploy it.","149720","test_build_and_deploy","tests.integration","Mon Sep 09 01:31:50 UTC 2024","passed","Mon Sep 09 01:34:19 UTC 2024","","test_charm","",""
"Test to send a SIGSTOP to the primary db process and ensure that the cluster self heals.","","test_freeze_db_process","tests.integration.high_availability","","unknown","","","test_self_healing","",""
"Test for encryption enablement when relation to TLS charm.","69910","test_enable_tls","tests.integration","Mon Sep 09 01:33:22 UTC 2024","passed","Mon Sep 09 01:34:32 UTC 2024","","test_tls","",""
"Test switchover on primary cluster fail.","258642","test_failover","tests.integration.high_availability","Mon Sep 09 01:41:16 UTC 2024","passed","Mon Sep 09 01:45:35 UTC 2024","","test_async_replication","",""
"","45508","test_upgrade_to_failling","tests.integration.high_availability","Mon Sep 09 01:33:25 UTC 2024","passed","Mon Sep 09 01:34:10 UTC 2024","","test_upgrade_rollback_incompat","",""
"Simple test to ensure that the mysql charm gets deployed.","112949","test_build_and_deploy","tests.integration","Mon Sep 09 01:31:20 UTC 2024","passed","Mon Sep 09 01:33:13 UTC 2024","","test_backup_gcp","",""
"Test to create a backup and list backups.","46393","test_backup","tests.integration","Mon Sep 09 01:33:15 UTC 2024","passed","Mon Sep 09 01:34:01 UTC 2024","","test_backup_gcp","",""
"Ensure connections (with and without ssl) are possible before relating with TLS operator.","2120","test_connection_before_tls","tests.integration","Mon Sep 09 01:33:20 UTC 2024","passed","Mon Sep 09 01:33:22 UTC 2024","","test_tls","",""
"Test to ensure that writes to one cluster do not replicate to another cluster.","110425","test_no_replication_across_clusters","tests.integration.high_availability","Mon Sep 09 01:34:41 UTC 2024","passed","Mon Sep 09 01:36:32 UTC 2024","","test_replication","",""
"Simple test to ensure that the mysql and application charms get deployed.","183344","test_build_and_deploy","tests.integration.high_availability","Mon Sep 09 01:31:16 UTC 2024","passed","Mon Sep 09 01:34:19 UTC 2024","","test_async_replication","",""
"","30121","test_disable_tls","tests.integration","Mon Sep 09 01:35:14 UTC 2024","passed","Mon Sep 09 01:35:44 UTC 2024","","test_tls","",""
"Remove relation and wait for the expected changes in status.","22476","test_relation_broken","tests.integration.relations","Mon Sep 09 01:34:18 UTC 2024","passed","Mon Sep 09 01:34:40 UTC 2024","","test_database","",""
"Test graceful promotion of a standby cluster to primary.","21400","test_standby_promotion","tests.integration.high_availability","Mon Sep 09 01:40:54 UTC 2024","passed","Mon Sep 09 01:41:15 UTC 2024","","test_async_replication","",""
"Test to send SIGTERM to primary instance and then verify recovery.","51587","test_graceful_crash_of_primary","tests.integration.high_availability","Mon Sep 09 01:34:59 UTC 2024","passed","Mon Sep 09 01:35:50 UTC 2024","","test_self_healing","",""
"Run the create replication and wait for the applications to settle.","235126","test_create_replication","tests.integration.high_availability","Mon Sep 09 01:34:24 UTC 2024","passed","Mon Sep 09 01:38:19 UTC 2024","","test_async_replication","",""
"Test to send a SIGKILL to the primary db process and ensure that the cluster self heals.","77937","test_kill_db_process","tests.integration.high_availability","Mon Sep 09 01:34:23 UTC 2024","passed","Mon Sep 09 01:35:41 UTC 2024","","test_self_healing","",""
"Test to restore a backup on a new mysql cluster.","275748","test_restore_on_new_cluster","tests.integration","Mon Sep 09 01:37:45 UTC 2024","passed","Mon Sep 09 01:42:21 UTC 2024","","test_backup_ceph","",""
"Rotate password and confirm changes.","12207","test_password_rotation","tests.integration","Mon Sep 09 01:39:57 UTC 2024","passed","Mon Sep 09 01:40:10 UTC 2024","","test_charm","",""
