"DESCRIPTION","DURATION IN MS","NAME","PARENT SUITE","START TIME","STATUS","STOP TIME","SUB SUITE","SUITE","TEST CLASS","TEST METHOD"
"Tries deploying an arm64 charm on amd64 host.","56943","test_arm_charm_on_amd_host","tests.integration","2025-10-04","passed","2025-10-04","","test_architecture","",""
"Test to ensure that writes to one cluster do not replicate to another cluster.","89637","test_no_replication_across_clusters","tests.integration.high_availability","2025-10-04","passed","2025-10-04","","test_replication_data_isolation","",""
"Upgrade the two MySQL clusters.","762601","test_upgrade_from_edge","tests.integration.high_availability","2025-10-04","passed","2025-10-04","","test_async_replication_upgrade","",""
"Simple test to ensure that the mysql and data-integrator charms get deployed.","153940","test_build_and_deploy","tests.integration.roles","2025-10-04","passed","2025-10-04","","test_database_dba_role","",""
"The cluster manual re-join test.

    A graceful restart is performed in one of the instances (choosing Primary to make it painful).
    In order to verify that the instance can come back ONLINE, after disabling automatic re-join
    ","65534","test_cluster_manual_rejoin","tests.integration.high_availability","2025-10-04","passed","2025-10-04","","test_self_healing_restart_graceful","",""
"Test the promote-to-primary command after losing the majority of nodes, with force flag.","286624","test_cluster_failover_after_majority_loss","tests.integration.high_availability","2025-10-04","passed","2025-10-04","","test_primary_switchover","",""
"Relate charms and wait for the expected changes in status.","0","test_relation_creation_databag","tests.integration.relations","2025-10-04","skipped","2025-10-04","","test_database","",""
"","3766","test_saturate_max_connections","tests.integration","2025-10-04","passed","2025-10-04","","test_saturate_max_connections","",""
"","62461","test_deploy_and_relate_test_app","tests.integration","2025-10-04","passed","2025-10-04","","test_saturate_max_connections","",""
"Test for a network cut affecting an instance.","256736","test_network_cut_affecting_an_instance","tests.integration.high_availability","2025-10-04","passed","2025-10-04","","test_self_healing_network_cut","",""
"Test to create a backup and list backups.","42703","test_backup","tests.integration","2025-10-04","passed","2025-10-04","","test_backup_aws","",""
"Test to create a backup and list backups.","51811","test_backup","tests.integration","2025-10-04","passed","2025-10-04","","test_backup_ceph","",""
"","50088","test_upgrade_to_failing","tests.integration.high_availability","2025-10-04","passed","2025-10-04","","test_upgrade_rollback_incompat","",""
"Update the second cluster.","283357","test_upgrade_from_edge","tests.integration.high_availability","2025-10-04","passed","2025-10-04","","test_upgrade","",""
"Test that the pre-upgrade-check action runs successfully.","21952","test_pre_upgrade_check","tests.integration.high_availability","2025-10-04","passed","2025-10-04","","test_upgrade_from_stable","",""
"Simple test to ensure that the MySQL and application charms get deployed.","142273","test_deploy_latest","tests.integration.high_availability","2025-10-04","passed","2025-10-04","","test_upgrade","",""
"Test behavior when node drains - pod is evicted and pvs are rotated.","130286","test_pod_eviction_and_pvc_deletion","tests.integration.high_availability","2025-10-04","passed","2025-10-04","","test_node_drain","",""
"Confirm that a new primary is elected when the current primary is torn down.","273085","test_scale_up_and_down","tests.integration","2025-10-04","passed","2025-10-04","","test_charm","",""
"Test rejoin invalidated cluster with.","3134","test_rejoin_invalidated_cluster","tests.integration.high_availability","2025-10-04","broken","2025-10-04","","test_async_replication","",""
"Relate charms before they have time to properly start.

    It simulates a Terraform-like deployment strategy
    ","148899","test_relation_creation_eager","tests.integration.relations","2025-10-04","passed","2025-10-04","","test_database","",""
"Test switchover on primary cluster fail.","2906","test_failover","tests.integration.high_availability","2025-10-04","broken","2025-10-04","","test_async_replication","",""
"Test that the pre-upgrade-check action runs successfully.","5574","test_pre_upgrade_check","tests.integration.high_availability","2025-10-04","passed","2025-10-04","","test_upgrade_rollback_incompat","",""
"Build the charm and deploy 1 units to ensure a cluster is formed.","6411","test_build_and_deploy","tests.integration","2025-10-04","passed","2025-10-04","","test_saturate_max_connections","",""
"Rotate password and confirm changes.","11159","test_password_rotation_silent","tests.integration","2025-10-04","passed","2025-10-04","","test_charm","",""
"Test to write to primary, and read the same data back from replicas.","26775","test_check_consistency","tests.integration.high_availability","2025-10-04","passed","2025-10-04","","test_replication_data_consistency","",""
"Simple test to ensure that the MySQL application charms get deployed.","764918","test_build_and_deploy","tests.integration.high_availability","2025-10-04","broken","2025-10-04","","test_async_replication","",""
"Test graceful promotion of a standby cluster to primary.","3228","test_standby_promotion","tests.integration.high_availability","2025-10-04","broken","2025-10-04","","test_async_replication","",""
"Test to restore a backup on a new mysql cluster.","541803","test_restore_on_new_cluster","tests.integration","2025-10-04","passed","2025-10-04","","test_backup_ceph","",""
"Test to kill the primary under load and ensure re-election of primary.","259101","test_kill_primary_check_reelection","tests.integration.high_availability","2025-10-04","passed","2025-10-04","","test_replication_reelection","",""
"Ensure scaling down to zero and back up works.","171648","test_scale_up_from_zero","tests.integration","2025-10-04","passed","2025-10-04","","test_charm","",""
"Run the create-replication action and wait for the applications to settle.","240375","test_create_replication","tests.integration.high_availability","2025-10-04","passed","2025-10-04","","test_async_replication_upgrade","",""
"Build and deploy for AWS.","214619","test_build_and_deploy_aws","tests.integration","2025-10-04","passed","2025-10-04","","test_backup_pitr_aws","",""
"Confirm storage reuse works.","87384","test_scale_up_after_scale_down","tests.integration","2025-10-04","passed","2025-10-04","","test_charm","",""
"Test the DBA predefined role.","30718","test_charmed_dba_role","tests.integration.roles","2025-10-04","passed","2025-10-04","","test_instance_dba_role","",""
"Test COS integrations formed before mysql is allocated and deployed.","90825","test_deploy_bundle_with_cos_integrations","tests.integration","2025-10-04","passed","2025-10-04","","test_cos_integration_bundle","",""
"Test to send a SIGKILL to the primary db process and ensure that the cluster self heals.","147602","test_kill_db_process","tests.integration.high_availability","2025-10-04","passed","2025-10-04","","test_self_healing_process_killed","",""
"Scale database and routers.","282101","test_scale_in","tests.integration","2025-10-04","passed","2025-10-04","","test_multi_relations","",""
"Rotate password and confirm changes.","14190","test_password_rotation_root_user_implicit","tests.integration","2025-10-04","passed","2025-10-04","","test_charm","",""
"Pitr tests.","230965","test_pitr_aws","tests.integration","2025-10-04","passed","2025-10-04","","test_backup_pitr_gcp","",""
"Scale database and routers.","815848","test_scale_out","tests.integration","2025-10-04","passed","2025-10-04","","test_multi_relations","",""
"Deploy the router and the test application.","59395","test_deploy_router_and_app","tests.integration.high_availability","2025-10-04","passed","2025-10-04","","test_async_replication","",""
"Simple test to ensure that the mysql and data-integrator charms get deployed.","168927","test_build_and_deploy","tests.integration.roles","2025-10-04","passed","2025-10-04","","test_instance_dba_role","",""
"Test to send SIGTERM to primary instance and then verify recovery.","134809","test_graceful_crash_of_primary","tests.integration.high_availability","2025-10-04","passed","2025-10-04","","test_self_healing_stop_primary","",""
"Build the charm and deploy 1 units to ensure a cluster is formed.","38769","test_build_and_deploy","tests.integration","2025-10-04","passed","2025-10-04","","test_multi_relations","",""
"Relate the two MySQL clusters.","35439","test_async_relate","tests.integration.high_availability","2025-10-04","passed","2025-10-04","","test_async_replication_upgrade","",""
"Build the charm and deploy 3 units to ensure a cluster is formed.","7028","test_build_and_deploy","tests.integration.relations","2025-10-04","passed","2025-10-04","","test_mysql_root","",""
"Simple test to ensure that the MySQL and application charms get deployed.","116813","test_build_and_deploy","tests.integration.high_availability","2025-10-04","passed","2025-10-04","","test_upgrade_rollback_incompat","",""
"Test that endpoints are running.","4035","test_exporter_endpoints","tests.integration","2025-10-04","passed","2025-10-04","","test_charm","",""
"Test to send a SIGSTOP to the primary db process and ensure that the cluster self heals.","451652","test_freeze_db_process","tests.integration.high_availability","2025-10-04","passed","2025-10-04","","test_self_healing_process_frozen","",""
"Test the labeling of k8s endpoints when apps with same cluster-name deployed.","433280","test_labeling_of_k8s_endpoints","tests.integration.high_availability","2025-10-04","passed","2025-10-04","","test_k8s_endpoints","",""
"Test to restore a backup to the same mysql cluster.","223007","test_restore_on_same_cluster","tests.integration","2025-10-04","passed","2025-10-04","","test_backup_ceph","",""
"Build the charm and deploy 3 units to ensure a cluster is formed.","122881","test_build_and_deploy","tests.integration","2025-10-04","passed","2025-10-04","","test_tls","",""
"Ensure connections (with and without ssl) are possible before relating with TLS operator.","2196","test_connection_before_tls","tests.integration","2025-10-04","passed","2025-10-04","","test_tls","",""
"Build and deploy for AWS.","188115","test_build_and_deploy_gcp","tests.integration","2025-10-04","passed","2025-10-04","","test_backup_pitr_gcp","",""
"","30164","test_disable_tls","tests.integration","2025-10-04","passed","2025-10-04","","test_tls","",""
"Test for encryption enablement when relation to TLS charm.","62119","test_enable_tls","tests.integration","2025-10-04","passed","2025-10-04","","test_tls","",""
"Build the mysql charm and deploy it.","123949","test_build_and_deploy","tests.integration","2025-10-04","passed","2025-10-04","","test_charm","",""
"Simple test to ensure that the MySQL application charms get deployed.","159862","test_build_and_deploy","tests.integration.high_availability","2025-10-04","passed","2025-10-04","","test_async_replication_upgrade","",""
"Test that the pre-upgrade-check action runs successfully.","24232","test_pre_upgrade_check","tests.integration.high_availability","2025-10-04","passed","2025-10-04","","test_upgrade","",""
"Test the charmed_dml role.","90428","test_charmed_dml_role","tests.integration.roles","2025-10-04","passed","2025-10-04","","test_instance_roles","",""
"Test that the primary node can be switched over.","50761","test_cluster_switchover","tests.integration.high_availability","2025-10-04","passed","2025-10-04","","test_primary_switchover","",""
"Simple test to ensure that the MySQL and application charms get deployed.","129073","test_deploy_stable","tests.integration.high_availability","2025-10-04","passed","2025-10-04","","test_upgrade_from_stable","",""
"Remove relation and wait for the expected changes in status.","22841","test_relation_broken","tests.integration.relations","2025-10-04","passed","2025-10-04","","test_database","",""
"Relate all the applications to the database.","170378","test_relate_all","tests.integration","2025-10-04","passed","2025-10-04","","test_multi_relations","",""
"Test to restore a backup to the same mysql cluster.","207916","test_restore_on_same_cluster","tests.integration","2025-10-04","passed","2025-10-04","","test_backup_aws","",""
"Test to send SIGTERM to all units and then ensure that the cluster recovers.","276581","test_graceful_full_cluster_crash_test","tests.integration.high_availability","2025-10-04","passed","2025-10-04","","test_self_healing_stop_all","",""
"Test to restore a backup to the same mysql cluster.","222229","test_restore_on_same_cluster","tests.integration","2025-10-04","passed","2025-10-04","","test_backup_gcp","",""
"Simple test to ensure that the mysql charm gets deployed.","172947","test_build_and_deploy","tests.integration","2025-10-04","passed","2025-10-04","","test_backup_gcp","",""
"Rotate password and confirm changes.","11153","test_password_rotation","tests.integration","2025-10-04","passed","2025-10-04","","test_charm","",""
"Test upgrade rollback to a healthy revision.","345017","test_rollback","tests.integration.high_availability","2025-10-04","passed","2025-10-04","","test_upgrade_rollback_incompat","",""
"Test the existence of databases and tables created by osm-pol's migrations.","34338","test_osm_pol_operations","tests.integration","2025-10-04","passed","2025-10-04","","test_osm_integration_bundle","",""
"Test the deployment and relation with osm bundle with mysql replacing mariadb.","154135","test_deploy_and_relate_osm_bundle","tests.integration","2025-10-04","passed","2025-10-04","","test_osm_integration_bundle","",""
"Simple test to ensure that the mysql charm gets deployed.","172183","test_build_and_deploy","tests.integration","2025-10-04","passed","2025-10-04","","test_backup_ceph","",""
"Test to restore a backup on a new mysql cluster.","579900","test_restore_on_new_cluster","tests.integration","2025-10-04","passed","2025-10-04","","test_backup_aws","",""
"Relate charms before they have time to properly start.

    It simulates a Terraform-like deployment strategy
    ","153094","test_relation_creation_eager","tests.integration.relations","2025-10-04","passed","2025-10-04","","test_mysql_root","",""
"Test to write to primary, and read the same data back from replicas.","58838","test_data_replication","tests.integration.high_availability","2025-10-04","passed","2025-10-04","","test_async_replication_upgrade","",""
"Deploy the test application.","25794","test_deploy_test_app","tests.integration.high_availability","2025-10-04","passed","2025-10-04","","test_async_replication_upgrade","",""
"Simple test to ensure that the mysql charm gets deployed.","176245","test_build_and_deploy","tests.integration","2025-10-04","passed","2025-10-04","","test_backup_aws","",""
"Query database for custom variables.","24828","test_custom_variables","tests.integration","2025-10-04","passed","2025-10-04","","test_charm","",""
"Run the create-replication action and wait for the applications to settle.","312331","test_create_replication","tests.integration.high_availability","2025-10-04","broken","2025-10-04","","test_async_replication","",""
"Test to ensure that data is preserved when a unit is scaled up and then down.

    Ensures that there are no running continuous writes as the extra data in the
    database makes scaling up slower.
    ","260365","test_scaling_without_data_loss","tests.integration.high_availability","2025-10-04","passed","2025-10-04","","test_replication_scaling","",""
"Test to restore a backup on a new mysql cluster.","576890","test_restore_on_new_cluster","tests.integration","2025-10-04","passed","2025-10-04","","test_backup_gcp","",""
"Relate the two MySQL clusters.","325277","test_async_relate","tests.integration.high_availability","2025-10-04","broken","2025-10-04","","test_async_replication","",""
"Build the charm and deploy 3 units to ensure a cluster is formed.","7913","test_build_and_deploy","tests.integration.relations","2025-10-04","passed","2025-10-04","","test_database","",""
"Test an upgrade failure and its rollback.","313747","test_fail_and_rollback","tests.integration.high_availability","2025-10-04","passed","2025-10-04","","test_upgrade","",""
"Test removing and re-relating the two mysql clusters.","633365","test_unrelate_and_relate","tests.integration.high_availability","2025-10-04","broken","2025-10-04","","test_async_replication","",""
"Test primary crash during startup.

    It must recover/end setup when the primary got offline.
    ","143616","test_crash_during_cluster_setup","tests.integration.high_availability","2025-10-04","broken","2025-10-04","","test_crash_during_setup","",""
"Verify rotating tls private keys restarts cluster with new certificates.

    This test rotates tls private keys to randomly generated keys.
    ","41016","test_rotate_tls_key","tests.integration","2025-10-04","passed","2025-10-04","","test_tls","",""
"Test the database-level DBA role.","60688","test_charmed_dba_role","tests.integration.roles","2025-10-04","passed","2025-10-04","","test_database_dba_role","",""
"Test to create a backup and list backups.","42976","test_backup","tests.integration","2025-10-04","passed","2025-10-04","","test_backup_gcp","",""
"Update the second cluster.","312607","test_upgrade_from_stable","tests.integration.high_availability","2025-10-04","passed","2025-10-04","","test_upgrade_from_stable","",""
"Tries deploying an amd64 charm on arm64 host.","0","test_amd_charm_on_arm_host","tests.integration","2025-10-04","skipped","2025-10-04","","test_architecture","",""
"Relate charms and wait for the expected changes in status.","19772","test_relation_creation","tests.integration.relations","2025-10-04","passed","2025-10-04","","test_database","",""
"Test the charmed_read predefined role.","60059","test_charmed_read_role","tests.integration.roles","2025-10-04","passed","2025-10-04","","test_instance_roles","",""
"Test the log rotation of text files.

    Run continuous writes to ensure that audit log plugin is loaded and active
    when mysql-test-app runs start-continuous-writes (by logging into mysql).
    ","6063","test_log_rotation","tests.integration.high_availability","2025-10-04","passed","2025-10-04","","test_log_rotation","",""
"Delete the pod in a single unit deployment and write data to new pod.","242366","test_single_unit_pod_delete","tests.integration.high_availability","2025-10-04","passed","2025-10-04","","test_self_healing_pod","",""
"Confirm that data is replicated from the primary node to all the replicas.","4242","test_consistent_data_replication_across_cluster","tests.integration","2025-10-04","passed","2025-10-04","","test_charm","",""
"Pitr tests.","307978","test_pitr_aws","tests.integration","2025-10-04","passed","2025-10-04","","test_backup_pitr_aws","",""
"Simple test to ensure that the mysql and data-integrator charms get deployed.","154773","test_build_and_deploy","tests.integration.roles","2025-10-04","passed","2025-10-04","","test_instance_roles","",""
"Test to write to primary, and read the same data back from replicas.","79083","test_data_replication","tests.integration.high_availability","2025-10-04","broken","2025-10-04","","test_async_replication","",""
