"DESCRIPTION","DURATION IN MS","NAME","PARENT SUITE","START TIME","STATUS","STOP TIME","SUB SUITE","SUITE","TEST CLASS","TEST METHOD"
"Query database for custom variables.","0","test_custom_variables","tests.integration","Sat Feb 15 01:45:57 UTC 2025","skipped","Sat Feb 15 01:45:57 UTC 2025","","test_charm","",""
"Delete the pod in a single unit deployment and write data to new pod.","247008","test_single_unit_pod_delete","tests.integration.high_availability","Sat Feb 15 01:32:52 UTC 2025","passed","Sat Feb 15 01:36:59 UTC 2025","","test_self_healing_6","",""
"Test graceful promotion of a standby cluster to primary.","23707","test_standby_promotion","tests.integration.high_availability","Sat Feb 15 01:37:52 UTC 2025","passed","Sat Feb 15 01:38:16 UTC 2025","","test_async_replication","",""
"Test for a network cut affecting an instance.","270989","test_network_cut_affecting_an_instance","tests.integration.high_availability","Sat Feb 15 01:32:41 UTC 2025","passed","Sat Feb 15 01:37:12 UTC 2025","","test_self_healing_4","",""
"Tries deploying an arm64 charm on amd64 host.","59974","test_arm_charm_on_amd_host","tests.integration","Sat Feb 15 01:29:31 UTC 2025","passed","Sat Feb 15 01:30:31 UTC 2025","","test_architecture","",""
"Simple test to ensure that the mysql charm gets deployed.","114768","test_build_and_deploy","tests.integration","Sat Feb 15 01:28:44 UTC 2025","passed","Sat Feb 15 01:30:38 UTC 2025","","test_backup_aws","",""
"","49972","test_upgrade_to_failling","tests.integration.high_availability","Sat Feb 15 01:31:38 UTC 2025","passed","Sat Feb 15 01:32:28 UTC 2025","","test_upgrade_rollback_incompat","",""
"Remove relation and wait for the expected changes in status.","23615","test_relation_broken","tests.integration.relations","Sat Feb 15 01:31:35 UTC 2025","passed","Sat Feb 15 01:31:58 UTC 2025","","test_database","",""
"","3826","test_saturate_max_connections","tests.integration","Sat Feb 15 01:30:03 UTC 2025","passed","Sat Feb 15 01:30:07 UTC 2025","","test_saturate_max_connections","",""
"Test that the pre-upgrade-check action runs successfully.","17576","test_pre_upgrade_check","tests.integration.high_availability","Sat Feb 15 01:32:18 UTC 2025","passed","Sat Feb 15 01:32:36 UTC 2025","","test_upgrade","",""
"Test the existence of databases and tables created by osm-pol's migrations.","34408","test_osm_pol_operations","tests.integration.relations","Sat Feb 15 01:31:45 UTC 2025","passed","Sat Feb 15 01:32:19 UTC 2025","","test_mysql_root","",""
"Test to write to primary, and read the same data back from replicas.","37092","test_check_consistency","tests.integration.high_availability","Sat Feb 15 01:32:30 UTC 2025","passed","Sat Feb 15 01:33:07 UTC 2025","","test_replication_1","",""
"Test to send SIGTERM to primary instance and then verify recovery.","81494","test_graceful_crash_of_primary","tests.integration.high_availability","Sat Feb 15 01:31:55 UTC 2025","passed","Sat Feb 15 01:33:17 UTC 2025","","test_self_healing_3","",""
"Run the create replication and wait for the applications to settle.","242946","test_create_replication","tests.integration.high_availability","Sat Feb 15 01:32:24 UTC 2025","passed","Sat Feb 15 01:36:27 UTC 2025","","test_async_replication","",""
"Test rejoin invalidated cluster with.","25659","test_rejoin_invalidated_cluster","tests.integration.high_availability","Sat Feb 15 01:43:13 UTC 2025","passed","Sat Feb 15 01:43:38 UTC 2025","","test_async_replication","",""
"Confirm that a new primary is elected when the current primary is torn down.","900043","test_scale_up_and_down","tests.integration","Sat Feb 15 01:30:57 UTC 2025","broken","Sat Feb 15 01:45:57 UTC 2025","","test_charm","",""
"Verify rotating tls private keys restarts cluster with new certificates.

    This test rotates tls private keys to randomly generated keys.
    ","41947","test_rotate_tls_key","tests.integration","Sat Feb 15 01:32:54 UTC 2025","passed","Sat Feb 15 01:33:36 UTC 2025","","test_tls","",""
"Confirm that data is replicated from the primary node to all the replicas.","4357","test_consistent_data_replication_across_cluster","tests.integration","Sat Feb 15 01:30:53 UTC 2025","passed","Sat Feb 15 01:30:57 UTC 2025","","test_charm","",""
"Test to send SIGTERM to all units and then ensure that the cluster recovers.","305192","test_graceful_full_cluster_crash_test","tests.integration.high_availability","Sat Feb 15 01:32:21 UTC 2025","passed","Sat Feb 15 01:37:27 UTC 2025","","test_self_healing_5","",""
"Test that endpoints are running.","0","test_exporter_endpoints","tests.integration","Sat Feb 15 01:45:57 UTC 2025","skipped","Sat Feb 15 01:45:57 UTC 2025","","test_charm","",""
"Simple test to ensure that the mysql and application charms get deployed.","167995","test_deploy_stable","tests.integration.high_availability","Sat Feb 15 01:28:47 UTC 2025","passed","Sat Feb 15 01:31:35 UTC 2025","","test_upgrade_from_stable","",""
"Test to create a backup and list backups.","43636","test_backup","tests.integration","Sat Feb 15 01:31:25 UTC 2025","passed","Sat Feb 15 01:32:09 UTC 2025","","test_backup_gcp","",""
"","220314","test_fail_and_rollback","tests.integration.high_availability","Sat Feb 15 01:35:44 UTC 2025","passed","Sat Feb 15 01:39:24 UTC 2025","","test_upgrade","",""
"Test to restore a backup on a new mysql cluster.","287007","test_restore_on_new_cluster","tests.integration","Sat Feb 15 01:35:33 UTC 2025","passed","Sat Feb 15 01:40:20 UTC 2025","","test_backup_gcp","",""
"Test to restore a backup on a new mysql cluster.","272852","test_restore_on_new_cluster","tests.integration","Sat Feb 15 01:34:17 UTC 2025","passed","Sat Feb 15 01:38:50 UTC 2025","","test_backup_aws","",""
"Test for encryption enablement when relation to TLS charm.","63558","test_enable_tls","tests.integration","Sat Feb 15 01:31:50 UTC 2025","passed","Sat Feb 15 01:32:54 UTC 2025","","test_tls","",""
"Test the log rotation of text files.

    Run continuous writes to ensure that audit log plugin is loaded and active
    when mysql-test-app runs start-continuous-writes (by logging into mysql).
    ","7625","test_log_rotation","tests.integration.high_availability","Sat Feb 15 01:32:00 UTC 2025","passed","Sat Feb 15 01:32:08 UTC 2025","","test_log_rotation","",""
"Rotate password and confirm changes.","0","test_password_rotation_root_user_implicit","tests.integration","Sat Feb 15 01:45:57 UTC 2025","skipped","Sat Feb 15 01:45:57 UTC 2025","","test_charm","",""
"Confirm storage reuse works.","0","test_scale_up_after_scale_down","tests.integration","Sat Feb 15 01:45:57 UTC 2025","skipped","Sat Feb 15 01:45:57 UTC 2025","","test_charm","",""
"Simple test to ensure that the mysql and application charms get deployed.","129940","test_build_and_deploy","tests.integration.high_availability","Sat Feb 15 01:29:24 UTC 2025","passed","Sat Feb 15 01:31:34 UTC 2025","","test_upgrade_rollback_incompat","",""
"Test to send a SIGKILL to the primary db process and ensure that the cluster self heals.","131760","test_kill_db_process","tests.integration.high_availability","Sat Feb 15 01:31:54 UTC 2025","passed","Sat Feb 15 01:34:06 UTC 2025","","test_self_healing_1","",""
"Relate the two mysql clusters.","4907","test_async_relate","tests.integration.high_availability","Sat Feb 15 01:32:19 UTC 2025","passed","Sat Feb 15 01:32:24 UTC 2025","","test_async_replication","",""
"Scale database and routers.","225248","test_scale_in","tests.integration","Sat Feb 15 01:39:44 UTC 2025","passed","Sat Feb 15 01:43:29 UTC 2025","","test_multi_relations","",""
"Test to restore a backup to the same mysql cluster.","163199","test_restore_on_same_cluster","tests.integration","Sat Feb 15 01:31:34 UTC 2025","passed","Sat Feb 15 01:34:17 UTC 2025","","test_backup_aws","",""
"Test to restore a backup on a new mysql cluster.","289321","test_restore_on_new_cluster","tests.integration","Sat Feb 15 01:35:31 UTC 2025","passed","Sat Feb 15 01:40:20 UTC 2025","","test_backup_ceph","",""
"Relate all the applications to the database.","155351","test_relate_all","tests.integration","Sat Feb 15 01:29:08 UTC 2025","passed","Sat Feb 15 01:31:43 UTC 2025","","test_multi_relations","",""
"Ensure connections (with and without ssl) are possible before relating with TLS operator.","2259","test_connection_before_tls","tests.integration","Sat Feb 15 01:31:48 UTC 2025","passed","Sat Feb 15 01:31:50 UTC 2025","","test_tls","",""
"Rotate password and confirm changes.","0","test_password_rotation_silent","tests.integration","Sat Feb 15 01:45:57 UTC 2025","skipped","Sat Feb 15 01:45:57 UTC 2025","","test_charm","",""
"Test updating from stable channel.","215766","test_upgrade_from_stable","tests.integration.high_availability","Sat Feb 15 01:31:55 UTC 2025","passed","Sat Feb 15 01:35:31 UTC 2025","","test_upgrade_from_stable","",""
"Test to write to primary, and read the same data back from replicas.","8492","test_data_replication","tests.integration.high_availability","Sat Feb 15 01:37:41 UTC 2025","passed","Sat Feb 15 01:37:49 UTC 2025","","test_async_replication","",""
"Test the deployment and relation with osm bundle with mysql replacing mariadb.","159166","test_deploy_and_relate_osm_bundle","tests.integration.relations","Sat Feb 15 01:29:06 UTC 2025","passed","Sat Feb 15 01:31:45 UTC 2025","","test_mysql_root","",""
"Test that the pre-upgrade-check action runs successfully.","17606","test_pre_upgrade_check","tests.integration.high_availability","Sat Feb 15 01:31:35 UTC 2025","passed","Sat Feb 15 01:31:53 UTC 2025","","test_upgrade_from_stable","",""
"Test behavior when node drains - pod is evicted and pvs are rotated.","149887","test_pod_eviction_and_pvc_deletion","tests.integration.high_availability","Sat Feb 15 01:32:22 UTC 2025","passed","Sat Feb 15 01:34:52 UTC 2025","","test_node_drain","",""
"Test to kill the primary under load and ensure re-election of primary.","229533","test_kill_primary_check_reelection","tests.integration.high_availability","Sat Feb 15 01:32:04 UTC 2025","passed","Sat Feb 15 01:35:53 UTC 2025","","test_replication_4","",""
"Build the charm and deploy 1 units to ensure a cluster is formed.","29828","test_build_and_deploy","tests.integration","Sat Feb 15 01:28:38 UTC 2025","passed","Sat Feb 15 01:29:08 UTC 2025","","test_multi_relations","",""
"The cluster manual re-join test.

    A graceful restart is performed in one of the instances (choosing Primary to make it painful).
    In order to verify that the instance can come back ONLINE, after disabling automatic re-join
    ","74763","test_cluster_manual_rejoin","tests.integration.high_availability","Sat Feb 15 01:31:53 UTC 2025","passed","Sat Feb 15 01:33:08 UTC 2025","","test_self_healing_7","",""
"Simple test to ensure that the mysql and application charms get deployed.","170556","test_deploy_latest","tests.integration.high_availability","Sat Feb 15 01:29:28 UTC 2025","passed","Sat Feb 15 01:32:18 UTC 2025","","test_upgrade","",""
"Test to create a backup and list backups.","51735","test_backup","tests.integration","Sat Feb 15 01:30:40 UTC 2025","passed","Sat Feb 15 01:31:32 UTC 2025","","test_backup_aws","",""
"Relate charms and wait for the expected changes in status.","0","test_relation_creation_databag","tests.integration.relations","Sat Feb 15 01:30:58 UTC 2025","skipped","Sat Feb 15 01:30:58 UTC 2025","","test_database","",""
"Relate charms and wait for the expected changes in status.","36566","test_relation_creation","tests.integration.relations","Sat Feb 15 01:30:58 UTC 2025","passed","Sat Feb 15 01:31:35 UTC 2025","","test_database","",""
"Build the mysql charm and deploy it.","124725","test_build_and_deploy","tests.integration","Sat Feb 15 01:28:48 UTC 2025","passed","Sat Feb 15 01:30:53 UTC 2025","","test_charm","",""
"","30250","test_disable_tls","tests.integration","Sat Feb 15 01:33:36 UTC 2025","passed","Sat Feb 15 01:34:06 UTC 2025","","test_tls","",""
"Test COS integrations formed before mysql is allocated and deployed.","88056","test_deploy_bundle_with_cos_integrations","tests.integration","Sat Feb 15 01:28:48 UTC 2025","passed","Sat Feb 15 01:30:16 UTC 2025","","test_cos_integration_bundle","",""
"","186992","test_rollback","tests.integration.high_availability","Sat Feb 15 01:32:28 UTC 2025","passed","Sat Feb 15 01:35:35 UTC 2025","","test_upgrade_rollback_incompat","",""
"","57286","test_deploy_and_relate_test_app","tests.integration","Sat Feb 15 01:29:05 UTC 2025","passed","Sat Feb 15 01:30:03 UTC 2025","","test_saturate_max_connections","",""
"Build the charm and deploy 1 units to ensure a cluster is formed.","6359","test_build_and_deploy","tests.integration","Sat Feb 15 01:28:59 UTC 2025","passed","Sat Feb 15 01:29:05 UTC 2025","","test_saturate_max_connections","",""
"Build the charm and deploy 3 units to ensure a cluster is formed.","166784","test_build_and_deploy","tests.integration","Sat Feb 15 01:29:01 UTC 2025","passed","Sat Feb 15 01:31:48 UTC 2025","","test_tls","",""
"Test the labeling of k8s endpoints when apps with same cluster-name deployed.","369830","test_labeling_of_k8s_endpoints","tests.integration.high_availability","Sat Feb 15 01:28:42 UTC 2025","passed","Sat Feb 15 01:34:52 UTC 2025","","test_k8s_endpoints","",""
"Test to create a backup and list backups.","45157","test_backup","tests.integration","Sat Feb 15 01:31:26 UTC 2025","passed","Sat Feb 15 01:32:11 UTC 2025","","test_backup_ceph","",""
"Deploy the router and the test application.","71461","test_deploy_router_and_app","tests.integration.high_availability","Sat Feb 15 01:36:27 UTC 2025","passed","Sat Feb 15 01:37:39 UTC 2025","","test_async_replication","",""
"Test to ensure that data is preserved when a unit is scaled up and then down.

    Ensures that there are no running continuous writes as the extra data in the
    database makes scaling up slower.
    ","211861","test_scaling_without_data_loss","tests.integration.high_availability","Sat Feb 15 01:32:56 UTC 2025","passed","Sat Feb 15 01:36:28 UTC 2025","","test_replication_3","",""
"Scale database and routers.","480261","test_scale_out","tests.integration","Sat Feb 15 01:31:43 UTC 2025","passed","Sat Feb 15 01:39:44 UTC 2025","","test_multi_relations","",""
"Simple test to ensure that the mysql charm gets deployed.","116294","test_build_and_deploy","tests.integration","Sat Feb 15 01:29:27 UTC 2025","passed","Sat Feb 15 01:31:23 UTC 2025","","test_backup_gcp","",""
"Simple test to ensure that the mysql charm gets deployed.","112904","test_build_and_deploy","tests.integration","Sat Feb 15 01:29:31 UTC 2025","passed","Sat Feb 15 01:31:24 UTC 2025","","test_backup_ceph","",""
"Simple test to ensure that the mysql and application charms get deployed.","172301","test_build_and_deploy","tests.integration.high_availability","Sat Feb 15 01:29:27 UTC 2025","passed","Sat Feb 15 01:32:19 UTC 2025","","test_async_replication","",""
"Test removing and re-relating the two mysql clusters.","630209","test_remove_relation_and_relate","tests.integration.high_availability","Sat Feb 15 01:43:41 UTC 2025","broken","Sat Feb 15 01:54:11 UTC 2025","","test_async_replication","",""
"","178894","test_upgrade_from_edge","tests.integration.high_availability","Sat Feb 15 01:32:40 UTC 2025","passed","Sat Feb 15 01:35:39 UTC 2025","","test_upgrade","",""
"Test to restore a backup to the same mysql cluster.","201968","test_restore_on_same_cluster","tests.integration","Sat Feb 15 01:32:11 UTC 2025","passed","Sat Feb 15 01:35:33 UTC 2025","","test_backup_gcp","",""
"Test to send a SIGSTOP to the primary db process and ensure that the cluster self heals.","291457","test_freeze_db_process","tests.integration.high_availability","Sat Feb 15 01:32:22 UTC 2025","passed","Sat Feb 15 01:37:13 UTC 2025","","test_self_healing_2","",""
"Tries deploying an amd64 charm on arm64 host.","0","test_amd_charm_on_arm_host","tests.integration","Sat Feb 15 01:30:31 UTC 2025","skipped","Sat Feb 15 01:30:31 UTC 2025","","test_architecture","",""
"Ensure scaling down to zero and back up works.","0","test_scale_up_from_zero","tests.integration","Sat Feb 15 01:45:57 UTC 2025","skipped","Sat Feb 15 01:45:57 UTC 2025","","test_charm","",""
"Test to ensure that writes to one cluster do not replicate to another cluster.","86711","test_no_replication_across_clusters","tests.integration.high_availability","Sat Feb 15 01:32:43 UTC 2025","passed","Sat Feb 15 01:34:10 UTC 2025","","test_replication_2","",""
"Test that the pre-upgrade-check action runs successfully.","4059","test_pre_upgrade_check","tests.integration.high_availability","Sat Feb 15 01:31:34 UTC 2025","passed","Sat Feb 15 01:31:38 UTC 2025","","test_upgrade_rollback_incompat","",""
"Test primary crash during startup.

    It must recover/end setup when the primary got offline.
    ","163120","test_crash_during_cluster_setup","tests.integration.high_availability","Sat Feb 15 01:28:47 UTC 2025","passed","Sat Feb 15 01:31:30 UTC 2025","","test_crash_during_setup","",""
"Test switchover on primary cluster fail.","293500","test_failover","tests.integration.high_availability","Sat Feb 15 01:38:17 UTC 2025","passed","Sat Feb 15 01:43:10 UTC 2025","","test_async_replication","",""
"Test to restore a backup to the same mysql cluster.","197247","test_restore_on_same_cluster","tests.integration","Sat Feb 15 01:32:13 UTC 2025","passed","Sat Feb 15 01:35:31 UTC 2025","","test_backup_ceph","",""
"Build the charm and deploy 3 units to ensure a cluster is formed.","129503","test_build_and_deploy","tests.integration.relations","Sat Feb 15 01:28:49 UTC 2025","passed","Sat Feb 15 01:30:58 UTC 2025","","test_database","",""
"Rotate password and confirm changes.","0","test_password_rotation","tests.integration","Sat Feb 15 01:45:57 UTC 2025","skipped","Sat Feb 15 01:45:57 UTC 2025","","test_charm","",""
