"DESCRIPTION","DURATION IN MS","NAME","PARENT SUITE","START TIME","STATUS","STOP TIME","SUB SUITE","SUITE","TEST CLASS","TEST METHOD"
"Test the existence of databases and tables created by osm-pol's migrations.","34420","test_osm_pol_operations","tests.integration.relations","Mon Jul 14 01:31:52 UTC 2025","passed","Mon Jul 14 01:32:26 UTC 2025","","test_mysql_root","",""
"Test to send SIGTERM to primary instance and then verify recovery.","88367","test_graceful_crash_of_primary","tests.integration.high_availability","Mon Jul 14 01:33:22 UTC 2025","passed","Mon Jul 14 01:34:51 UTC 2025","","test_self_healing_stop_primary","",""
"Test removing and re-relating the two mysql clusters.","269547","test_remove_relation_and_relate","tests.integration.high_availability","Mon Jul 14 01:44:24 UTC 2025","passed","Mon Jul 14 01:48:54 UTC 2025","","test_async_replication","",""
"","42177","test_upgrade_to_failling","tests.integration.high_availability","Mon Jul 14 01:31:22 UTC 2025","passed","Mon Jul 14 01:32:04 UTC 2025","","test_upgrade_rollback_incompat","",""
"Relate charms and wait for the expected changes in status.","37888","test_relation_creation","tests.integration.relations","Mon Jul 14 01:30:58 UTC 2025","passed","Mon Jul 14 01:31:36 UTC 2025","","test_database","",""
"Deploy the router and the test application.","79996","test_deploy_router_and_app","tests.integration.high_availability","Mon Jul 14 01:31:51 UTC 2025","passed","Mon Jul 14 01:33:11 UTC 2025","","test_async_replication","",""
"","321449","test_rollback","tests.integration.high_availability","Mon Jul 14 01:32:04 UTC 2025","passed","Mon Jul 14 01:37:25 UTC 2025","","test_upgrade_rollback_incompat","",""
"Test behavior when node drains - pod is evicted and pvs are rotated.","159275","test_pod_eviction_and_pvc_deletion","tests.integration.high_availability","Mon Jul 14 01:33:23 UTC 2025","passed","Mon Jul 14 01:36:02 UTC 2025","","test_node_drain","",""
"Test to restore a backup to the same mysql cluster.","172620","test_restore_on_same_cluster","tests.integration","Mon Jul 14 01:31:49 UTC 2025","passed","Mon Jul 14 01:34:42 UTC 2025","","test_backup_aws","",""
"Build the charm and deploy 1 units to ensure a cluster is formed.","29263","test_build_and_deploy","tests.integration","Mon Jul 14 01:28:50 UTC 2025","passed","Mon Jul 14 01:29:19 UTC 2025","","test_multi_relations","",""
"Test to restore a backup to the same mysql cluster.","184361","test_restore_on_same_cluster","tests.integration","Mon Jul 14 01:33:13 UTC 2025","passed","Mon Jul 14 01:36:17 UTC 2025","","test_backup_ceph","",""
"Build the charm and deploy 3 units to ensure a cluster is formed.","125078","test_build_and_deploy","tests.integration.relations","Mon Jul 14 01:28:53 UTC 2025","passed","Mon Jul 14 01:30:58 UTC 2025","","test_database","",""
"Build and deploy for AWS.","226128","test_build_and_deploy_gcp","tests.integration","Mon Jul 14 01:29:31 UTC 2025","passed","Mon Jul 14 01:33:17 UTC 2025","","test_backup_pitr_gcp","",""
"Pitr tests.","253823","test_pitr_aws","tests.integration","Mon Jul 14 01:33:17 UTC 2025","passed","Mon Jul 14 01:37:31 UTC 2025","","test_backup_pitr_gcp","",""
"Test to ensure that data is preserved when a unit is scaled up and then down.

    Ensures that there are no running continuous writes as the extra data in the
    database makes scaling up slower.
    ","228722","test_scaling_without_data_loss","tests.integration.high_availability","Mon Jul 14 01:32:19 UTC 2025","passed","Mon Jul 14 01:36:08 UTC 2025","","test_replication_scaling","",""
"Run the create replication and wait for the applications to settle.","189183","test_create_replication","tests.integration.high_availability","Mon Jul 14 01:33:11 UTC 2025","passed","Mon Jul 14 01:36:20 UTC 2025","","test_async_replication","",""
"Test to send SIGTERM to all units and then ensure that the cluster recovers.","304561","test_graceful_full_cluster_crash_test","tests.integration.high_availability","Mon Jul 14 01:32:53 UTC 2025","passed","Mon Jul 14 01:37:58 UTC 2025","","test_self_healing_stop_all","",""
"Test graceful promotion of a standby cluster to primary.","21680","test_standby_promotion","tests.integration.high_availability","Mon Jul 14 01:36:34 UTC 2025","passed","Mon Jul 14 01:36:55 UTC 2025","","test_async_replication","",""
"Rotate password and confirm changes.","11161","test_password_rotation","tests.integration","Mon Jul 14 01:40:36 UTC 2025","passed","Mon Jul 14 01:40:47 UTC 2025","","test_charm","",""
"Test to restore a backup on a new mysql cluster.","510282","test_restore_on_new_cluster","tests.integration","Mon Jul 14 01:36:17 UTC 2025","passed","Mon Jul 14 01:44:48 UTC 2025","","test_backup_ceph","",""
"Test to restore a backup on a new mysql cluster.","530731","test_restore_on_new_cluster","tests.integration","Mon Jul 14 01:34:42 UTC 2025","passed","Mon Jul 14 01:43:33 UTC 2025","","test_backup_aws","",""
"Relate the two mysql clusters.","3979","test_async_relate","tests.integration.high_availability","Mon Jul 14 01:31:47 UTC 2025","passed","Mon Jul 14 01:31:51 UTC 2025","","test_async_replication","",""
"Test switchover on primary cluster fail.","416251","test_failover","tests.integration.high_availability","Mon Jul 14 01:36:56 UTC 2025","passed","Mon Jul 14 01:43:53 UTC 2025","","test_async_replication","",""
"","3751","test_saturate_max_connections","tests.integration","Mon Jul 14 01:30:30 UTC 2025","passed","Mon Jul 14 01:30:34 UTC 2025","","test_saturate_max_connections","",""
"Delete the pod in a single unit deployment and write data to new pod.","230972","test_single_unit_pod_delete","tests.integration.high_availability","Mon Jul 14 01:31:53 UTC 2025","passed","Mon Jul 14 01:35:44 UTC 2025","","test_self_healing_pod","",""
"Confirm that data is replicated from the primary node to all the replicas.","4355","test_consistent_data_replication_across_cluster","tests.integration","Mon Jul 14 01:31:20 UTC 2025","passed","Mon Jul 14 01:31:24 UTC 2025","","test_charm","",""
"Test for a network cut affecting an instance.","231702","test_network_cut_affecting_an_instance","tests.integration.high_availability","Mon Jul 14 01:32:46 UTC 2025","passed","Mon Jul 14 01:36:38 UTC 2025","","test_self_healing_network_cut","",""
"","30245","test_disable_tls","tests.integration","Mon Jul 14 01:32:42 UTC 2025","passed","Mon Jul 14 01:33:13 UTC 2025","","test_tls","",""
"","62352","test_deploy_and_relate_test_app","tests.integration","Mon Jul 14 01:29:28 UTC 2025","passed","Mon Jul 14 01:30:30 UTC 2025","","test_saturate_max_connections","",""
"","235004","test_fail_and_rollback","tests.integration.high_availability","Mon Jul 14 01:35:14 UTC 2025","passed","Mon Jul 14 01:39:09 UTC 2025","","test_upgrade","",""
"Simple test to ensure that the mysql and application charms get deployed.","167985","test_deploy_stable","tests.integration.high_availability","Mon Jul 14 01:29:29 UTC 2025","passed","Mon Jul 14 01:32:17 UTC 2025","","test_upgrade_from_stable","",""
"Build the charm and deploy 1 units to ensure a cluster is formed.","6702","test_build_and_deploy","tests.integration","Mon Jul 14 01:29:21 UTC 2025","passed","Mon Jul 14 01:29:28 UTC 2025","","test_saturate_max_connections","",""
"Test to ensure that writes to one cluster do not replicate to another cluster.","88970","test_no_replication_across_clusters","tests.integration.high_availability","Mon Jul 14 01:31:57 UTC 2025","passed","Mon Jul 14 01:33:26 UTC 2025","","test_replication_data_isolation","",""
"Rotate password and confirm changes.","11169","test_password_rotation_silent","tests.integration","Mon Jul 14 01:40:47 UTC 2025","passed","Mon Jul 14 01:40:58 UTC 2025","","test_charm","",""
"Test that endpoints are running.","3977","test_exporter_endpoints","tests.integration","Mon Jul 14 01:41:12 UTC 2025","passed","Mon Jul 14 01:41:16 UTC 2025","","test_charm","",""
"Test for encryption enablement when relation to TLS charm.","63526","test_enable_tls","tests.integration","Mon Jul 14 01:30:58 UTC 2025","passed","Mon Jul 14 01:32:01 UTC 2025","","test_tls","",""
"Test to send a SIGSTOP to the primary db process and ensure that the cluster self heals.","374187","test_freeze_db_process","tests.integration.high_availability","Mon Jul 14 01:32:38 UTC 2025","passed","Mon Jul 14 01:38:52 UTC 2025","","test_self_healing_process_frozen","",""
"Pitr tests.","301939","test_pitr_aws","tests.integration","Mon Jul 14 01:32:52 UTC 2025","passed","Mon Jul 14 01:37:53 UTC 2025","","test_backup_pitr_aws","",""
"Verify rotating tls private keys restarts cluster with new certificates.

    This test rotates tls private keys to randomly generated keys.
    ","40989","test_rotate_tls_key","tests.integration","Mon Jul 14 01:32:01 UTC 2025","passed","Mon Jul 14 01:32:42 UTC 2025","","test_tls","",""
"Tries deploying an arm64 charm on amd64 host.","57965","test_arm_charm_on_amd_host","tests.integration","Mon Jul 14 01:28:43 UTC 2025","passed","Mon Jul 14 01:29:41 UTC 2025","","test_architecture","",""
"Scale database and routers.","450343","test_scale_out","tests.integration","Mon Jul 14 01:32:00 UTC 2025","passed","Mon Jul 14 01:39:30 UTC 2025","","test_multi_relations","",""
"Confirm storage reuse works.","80963","test_scale_up_after_scale_down","tests.integration","Mon Jul 14 01:36:21 UTC 2025","passed","Mon Jul 14 01:37:42 UTC 2025","","test_charm","",""
"Test to write to primary, and read the same data back from replicas.","27214","test_check_consistency","tests.integration.high_availability","Mon Jul 14 01:31:54 UTC 2025","passed","Mon Jul 14 01:32:21 UTC 2025","","test_replication_data_consistency","",""
"The cluster manual re-join test.

    A graceful restart is performed in one of the instances (choosing Primary to make it painful).
    In order to verify that the instance can come back ONLINE, after disabling automatic re-join
    ","84355","test_cluster_manual_rejoin","tests.integration.high_availability","Mon Jul 14 01:32:22 UTC 2025","passed","Mon Jul 14 01:33:47 UTC 2025","","test_self_healing_restart_graceful","",""
"Test primary crash during startup.

    It must recover/end setup when the primary got offline.
    ","143914","test_crash_during_cluster_setup","tests.integration.high_availability","Mon Jul 14 01:29:39 UTC 2025","broken","Mon Jul 14 01:32:03 UTC 2025","","test_crash_during_setup","",""
"Test to restore a backup to the same mysql cluster.","184239","test_restore_on_same_cluster","tests.integration","Mon Jul 14 01:31:51 UTC 2025","passed","Mon Jul 14 01:34:55 UTC 2025","","test_backup_gcp","",""
"Query database for custom variables.","25161","test_custom_variables","tests.integration","Mon Jul 14 01:41:16 UTC 2025","passed","Mon Jul 14 01:41:41 UTC 2025","","test_charm","",""
"Test the log rotation of text files.

    Run continuous writes to ensure that audit log plugin is loaded and active
    when mysql-test-app runs start-continuous-writes (by logging into mysql).
    ","5580","test_log_rotation","tests.integration.high_availability","Mon Jul 14 01:31:53 UTC 2025","passed","Mon Jul 14 01:31:58 UTC 2025","","test_log_rotation","",""
"Simple test to ensure that the mysql charm gets deployed.","113421","test_build_and_deploy","tests.integration","Mon Jul 14 01:30:33 UTC 2025","passed","Mon Jul 14 01:32:26 UTC 2025","","test_backup_ceph","",""
"Test that the pre-upgrade-check action runs successfully.","17637","test_pre_upgrade_check","tests.integration.high_availability","Mon Jul 14 01:32:17 UTC 2025","passed","Mon Jul 14 01:32:35 UTC 2025","","test_upgrade_from_stable","",""
"Tries deploying an amd64 charm on arm64 host.","0","test_amd_charm_on_arm_host","tests.integration","Mon Jul 14 01:29:41 UTC 2025","skipped","Mon Jul 14 01:29:41 UTC 2025","","test_architecture","",""
"Simple test to ensure that the mysql and application charms get deployed.","130080","test_build_and_deploy","tests.integration.high_availability","Mon Jul 14 01:29:06 UTC 2025","passed","Mon Jul 14 01:31:17 UTC 2025","","test_upgrade_rollback_incompat","",""
"Build and deploy for AWS.","193517","test_build_and_deploy_aws","tests.integration","Mon Jul 14 01:29:38 UTC 2025","passed","Mon Jul 14 01:32:52 UTC 2025","","test_backup_pitr_aws","",""
"Test that the pre-upgrade-check action runs successfully.","20685","test_pre_upgrade_check","tests.integration.high_availability","Mon Jul 14 01:31:32 UTC 2025","passed","Mon Jul 14 01:31:53 UTC 2025","","test_upgrade","",""
"Test to send a SIGKILL to the primary db process and ensure that the cluster self heals.","106627","test_kill_db_process","tests.integration.high_availability","Mon Jul 14 01:32:21 UTC 2025","passed","Mon Jul 14 01:34:07 UTC 2025","","test_self_healing_process_killed","",""
"Remove relation and wait for the expected changes in status.","22454","test_relation_broken","tests.integration.relations","Mon Jul 14 01:31:36 UTC 2025","passed","Mon Jul 14 01:31:59 UTC 2025","","test_database","",""
"Test COS integrations formed before mysql is allocated and deployed.","89567","test_deploy_bundle_with_cos_integrations","tests.integration","Mon Jul 14 01:28:53 UTC 2025","passed","Mon Jul 14 01:30:23 UTC 2025","","test_cos_integration_bundle","",""
"Scale database and routers.","210341","test_scale_in","tests.integration","Mon Jul 14 01:39:30 UTC 2025","passed","Mon Jul 14 01:43:00 UTC 2025","","test_multi_relations","",""
"Test the labeling of k8s endpoints when apps with same cluster-name deployed.","402581","test_labeling_of_k8s_endpoints","tests.integration.high_availability","Mon Jul 14 01:29:02 UTC 2025","passed","Mon Jul 14 01:35:44 UTC 2025","","test_k8s_endpoints","",""
"Build the mysql charm and deploy it.","138012","test_build_and_deploy","tests.integration","Mon Jul 14 01:29:02 UTC 2025","passed","Mon Jul 14 01:31:20 UTC 2025","","test_charm","",""
"Rotate password and confirm changes.","14185","test_password_rotation_root_user_implicit","tests.integration","Mon Jul 14 01:40:58 UTC 2025","passed","Mon Jul 14 01:41:12 UTC 2025","","test_charm","",""
"Ensure scaling down to zero and back up works.","173464","test_scale_up_from_zero","tests.integration","Mon Jul 14 01:37:42 UTC 2025","passed","Mon Jul 14 01:40:36 UTC 2025","","test_charm","",""
"Ensure connections (with and without ssl) are possible before relating with TLS operator.","2272","test_connection_before_tls","tests.integration","Mon Jul 14 01:30:56 UTC 2025","passed","Mon Jul 14 01:30:58 UTC 2025","","test_tls","",""
"Build the charm and deploy 3 units to ensure a cluster is formed.","134285","test_build_and_deploy","tests.integration","Mon Jul 14 01:28:41 UTC 2025","passed","Mon Jul 14 01:30:56 UTC 2025","","test_tls","",""
"Test to restore a backup on a new mysql cluster.","503822","test_restore_on_new_cluster","tests.integration","Mon Jul 14 01:34:55 UTC 2025","passed","Mon Jul 14 01:43:19 UTC 2025","","test_backup_gcp","",""
"","191356","test_upgrade_from_edge","tests.integration.high_availability","Mon Jul 14 01:31:57 UTC 2025","passed","Mon Jul 14 01:35:08 UTC 2025","","test_upgrade","",""
"Confirm that a new primary is elected when the current primary is torn down.","297053","test_scale_up_and_down","tests.integration","Mon Jul 14 01:31:24 UTC 2025","passed","Mon Jul 14 01:36:21 UTC 2025","","test_charm","",""
"Simple test to ensure that the mysql and application charms get deployed.","174665","test_build_and_deploy","tests.integration.high_availability","Mon Jul 14 01:28:52 UTC 2025","passed","Mon Jul 14 01:31:47 UTC 2025","","test_async_replication","",""
"Test rejoin invalidated cluster with.","26791","test_rejoin_invalidated_cluster","tests.integration.high_availability","Mon Jul 14 01:43:55 UTC 2025","passed","Mon Jul 14 01:44:21 UTC 2025","","test_async_replication","",""
"Relate charms and wait for the expected changes in status.","0","test_relation_creation_databag","tests.integration.relations","Mon Jul 14 01:30:58 UTC 2025","skipped","Mon Jul 14 01:30:58 UTC 2025","","test_database","",""
"Test updating from stable channel.","205700","test_upgrade_from_stable","tests.integration.high_availability","Mon Jul 14 01:32:37 UTC 2025","passed","Mon Jul 14 01:36:03 UTC 2025","","test_upgrade_from_stable","",""
"Simple test to ensure that the mysql and application charms get deployed.","163936","test_deploy_latest","tests.integration.high_availability","Mon Jul 14 01:28:48 UTC 2025","passed","Mon Jul 14 01:31:32 UTC 2025","","test_upgrade","",""
"Test to create a backup and list backups.","41284","test_backup","tests.integration","Mon Jul 14 01:31:06 UTC 2025","passed","Mon Jul 14 01:31:47 UTC 2025","","test_backup_aws","",""
"Relate all the applications to the database.","160395","test_relate_all","tests.integration","Mon Jul 14 01:29:19 UTC 2025","passed","Mon Jul 14 01:32:00 UTC 2025","","test_multi_relations","",""
"Test to create a backup and list backups.","42939","test_backup","tests.integration","Mon Jul 14 01:32:28 UTC 2025","passed","Mon Jul 14 01:33:11 UTC 2025","","test_backup_ceph","",""
"Test the deployment and relation with osm bundle with mysql replacing mariadb.","149292","test_deploy_and_relate_osm_bundle","tests.integration.relations","Mon Jul 14 01:29:23 UTC 2025","passed","Mon Jul 14 01:31:52 UTC 2025","","test_mysql_root","",""
"Test to kill the primary under load and ensure re-election of primary.","","test_kill_primary_check_reelection","tests.integration.high_availability","","unknown","","","test_replication_reelection","",""
"Simple test to ensure that the mysql charm gets deployed.","107323","test_build_and_deploy","tests.integration","Mon Jul 14 01:29:17 UTC 2025","passed","Mon Jul 14 01:31:04 UTC 2025","","test_backup_aws","",""
"Test that the pre-upgrade-check action runs successfully.","5100","test_pre_upgrade_check","tests.integration.high_availability","Mon Jul 14 01:31:17 UTC 2025","passed","Mon Jul 14 01:31:22 UTC 2025","","test_upgrade_rollback_incompat","",""
"Test to create a backup and list backups.","52329","test_backup","tests.integration","Mon Jul 14 01:30:56 UTC 2025","passed","Mon Jul 14 01:31:49 UTC 2025","","test_backup_gcp","",""
"Simple test to ensure that the mysql charm gets deployed.","116198","test_build_and_deploy","tests.integration","Mon Jul 14 01:28:58 UTC 2025","passed","Mon Jul 14 01:30:54 UTC 2025","","test_backup_gcp","",""
"Test to write to primary, and read the same data back from replicas.","8548","test_data_replication","tests.integration.high_availability","Mon Jul 14 01:36:22 UTC 2025","passed","Mon Jul 14 01:36:31 UTC 2025","","test_async_replication","",""
