"DESCRIPTION","DURATION IN MS","NAME","PARENT SUITE","START TIME","STATUS","STOP TIME","SUB SUITE","SUITE","TEST CLASS","TEST METHOD"
"Simple test to ensure that the MySQL and application charms get deployed.","129343","test_deploy_highly_available_cluster","tests.integration.high_availability","2025-11-11","passed","2025-11-11","","test_self_healing_process_frozen","",""
"Build the charm and deploy 1 units to ensure a cluster is formed.","34009","test_build_and_deploy","tests.integration","2025-11-11","passed","2025-11-11","","test_multi_relations","",""
"Test to write to primary, and read the same data back from replicas.","21851","test_data_replication","tests.integration.high_availability","2025-11-11","passed","2025-11-11","","test_async_replication_upgrade","",""
"Simple test to ensure that the MySQL application charms get deployed.","171665","test_build_and_deploy","tests.integration.high_availability","2025-11-11","passed","2025-11-11","","test_async_replication_upgrade","",""
"Rotate password and confirm changes.","12176","test_password_rotation","tests.integration","2025-11-11","passed","2025-11-11","","test_charm","",""
"Test the database-level DBA role.","74974","test_charmed_dba_role","tests.integration.roles","2025-11-11","passed","2025-11-11","","test_database_dba_role","",""
"Simple test to ensure that the MySQL and application charms get deployed.","150161","test_deploy_highly_available_cluster","tests.integration.high_availability","2025-11-11","passed","2025-11-11","","test_replication_scaling","",""
"Test for encryption enablement when relation to TLS charm.","64283","test_enable_tls","tests.integration","2025-11-11","passed","2025-11-11","","test_tls","",""
"Test rejoin invalidated cluster with.","37482","test_rejoin_invalidated_cluster","tests.integration.high_availability","2025-11-11","passed","2025-11-11","","test_async_replication","",""
"Scale database and routers.","251605","test_scale_in","tests.integration","2025-11-11","passed","2025-11-11","","test_multi_relations","",""
"Simple test to ensure that the MySQL and application charms get deployed.","123487","test_deploy_highly_available_cluster","tests.integration.high_availability","2025-11-11","passed","2025-11-11","","test_replication_reelection","",""
"Test removing and re-relating the two mysql clusters.","317164","test_unrelate_and_relate","tests.integration.high_availability","2025-11-11","passed","2025-11-11","","test_async_replication","",""
"Build the charm and deploy 1 units to ensure a cluster is formed.","6865","test_build_and_deploy","tests.integration","2025-11-11","passed","2025-11-11","","test_saturate_max_connections","",""
"Simple test to ensure that the MySQL and application charms get deployed.","137090","test_deploy_highly_available_cluster","tests.integration.high_availability","2025-11-11","passed","2025-11-11","","test_self_healing_restart_graceful","",""
"Simple test to ensure that the mysql and data-integrator charms get deployed.","176244","test_build_and_deploy","tests.integration.roles","2025-11-11","passed","2025-11-11","","test_database_dba_role","",""
"","4702","test_saturate_max_connections","tests.integration","2025-11-11","passed","2025-11-11","","test_saturate_max_connections","",""
"Test to restore a backup to the same mysql cluster.","218693","test_restore_on_same_cluster","tests.integration","2025-11-11","passed","2025-11-11","","test_backup_gcp","",""
"Test to restore a backup on a new mysql cluster.","560974","test_restore_on_new_cluster","tests.integration","2025-11-11","passed","2025-11-11","","test_backup_ceph","",""
"Ensure connections (with and without ssl) are possible before relating with TLS operator.","2206","test_connection_before_tls","tests.integration","2025-11-11","passed","2025-11-11","","test_tls","",""
"Update the second cluster.","379116","test_upgrade_from_edge","tests.integration.high_availability","2025-11-11","passed","2025-11-11","","test_upgrade","",""
"Confirm that data is replicated from the primary node to all the replicas.","4247","test_consistent_data_replication_across_cluster","tests.integration","2025-11-11","passed","2025-11-11","","test_charm","",""
"Test to send a SIGKILL to the primary db process and ensure that the cluster self heals.","97133","test_kill_db_process","tests.integration.high_availability","2025-11-11","passed","2025-11-11","","test_self_healing_process_killed","",""
"Simple test to ensure that the MySQL and application charms get deployed.","130804","test_deploy_highly_available_cluster","tests.integration.high_availability","2025-11-11","passed","2025-11-11","","test_replication_logs_rotation","",""
"Test the promote-to-primary command after losing the majority of nodes, with force flag.","280963","test_cluster_failover_after_majority_loss","tests.integration.high_availability","2025-11-11","passed","2025-11-11","","test_primary_switchover","",""
"Simple test to ensure that the mysql charm gets deployed.","183358","test_build_and_deploy","tests.integration","2025-11-11","passed","2025-11-11","","test_backup_ceph","",""
"Simple test to ensure that the MySQL and application charms get deployed.","130993","test_deploy_highly_available_cluster","tests.integration.high_availability","2025-11-11","passed","2025-11-11","","test_replication_data_consistency","",""
"Test an upgrade failure and its rollback.","467828","test_fail_and_rollback","tests.integration.high_availability","2025-11-11","passed","2025-11-11","","test_upgrade","",""
"Test that the primary node can be switched over.","20314","test_cluster_switchover","tests.integration.high_availability","2025-11-11","passed","2025-11-11","","test_primary_switchover","",""
"Simple test to ensure that the mysql charm gets deployed.","186476","test_build_and_deploy","tests.integration","2025-11-11","passed","2025-11-11","","test_backup_gcp","",""
"Rotate password and confirm changes.","12171","test_password_rotation_silent","tests.integration","2025-11-11","passed","2025-11-11","","test_charm","",""
"Rotate password and confirm changes.","13181","test_password_rotation_root_user_implicit","tests.integration","2025-11-11","passed","2025-11-11","","test_charm","",""
"Test that data is preserved during scale up and scale down.","194078","test_scaling_without_data_loss","tests.integration.high_availability","2025-11-11","passed","2025-11-11","","test_replication_scaling","",""
"Confirm that a new primary is elected when the current primary is torn down.","269894","test_scale_up_and_down","tests.integration","2025-11-11","passed","2025-11-11","","test_charm","",""
"Run the create-replication action and wait for the applications to settle.","225068","test_create_replication","tests.integration.high_availability","2025-11-11","passed","2025-11-11","","test_async_replication_upgrade","",""
"Simple test to ensure that the MySQL and application charms get deployed.","60793","test_deploy_single_unit_cluster","tests.integration.high_availability","2025-11-11","passed","2025-11-11","","test_self_healing_setup_crash","",""
"Test that the pre-upgrade-check action runs successfully.","16129","test_pre_upgrade_check","tests.integration.high_availability","2025-11-11","passed","2025-11-11","","test_upgrade","",""
"Test the charmed_read predefined role.","68127","test_charmed_read_role","tests.integration.roles","2025-11-11","passed","2025-11-11","","test_instance_roles","",""
"Upgrade the two MySQL clusters.","658014","test_upgrade_from_edge","tests.integration.high_availability","2025-11-11","passed","2025-11-11","","test_async_replication_upgrade","",""
"Verify rotating tls private keys restarts cluster with new certificates.

    This test rotates tls private keys to randomly generated keys.
    ","42211","test_rotate_tls_key","tests.integration","2025-11-11","passed","2025-11-11","","test_tls","",""
"Simple test to ensure that the MySQL and application charms get deployed.","131886","test_deploy_highly_available_cluster","tests.integration.high_availability","2025-11-11","passed","2025-11-11","","test_self_healing_pod","",""
"Simple test to ensure that the mysql charm gets deployed.","170145","test_build_and_deploy","tests.integration","2025-11-11","passed","2025-11-11","","test_backup_aws","",""
"Test the log rotation of text files.","5048","test_log_rotation","tests.integration.high_availability","2025-11-11","passed","2025-11-11","","test_replication_logs_rotation","",""
"Test the labeling of k8s endpoints when apps with same cluster-name deployed.","3072","test_labeling_of_k8s_endpoints","tests.integration.high_availability","2025-11-11","passed","2025-11-11","","test_replication_unit_endpoints","",""
"Test that the pre-upgrade-check action runs successfully.","5533","test_pre_upgrade_check","tests.integration.high_availability","2025-11-11","passed","2025-11-11","","test_upgrade_rollback_incompat","",""
"Test to restore a backup to the same mysql cluster.","222110","test_restore_on_same_cluster","tests.integration","2025-11-11","passed","2025-11-11","","test_backup_aws","",""
"Simple test to ensure that the MySQL application charms get deployed.","162697","test_build_and_deploy","tests.integration.high_availability","2025-11-11","passed","2025-11-11","","test_async_replication","",""
"Test to create a backup and list backups.","52514","test_backup","tests.integration","2025-11-11","passed","2025-11-11","","test_backup_ceph","",""
"Relate charms before they have time to properly start.

    It simulates a Terraform-like deployment strategy
    ","153159","test_relation_creation_eager","tests.integration.relations","2025-11-11","passed","2025-11-11","","test_mysql_root","",""
"Test switchover on primary cluster fail.","316347","test_failover","tests.integration.high_availability","2025-11-11","passed","2025-11-11","","test_async_replication","",""
"Simple test to ensure that the MySQL and application charms get deployed.","201111","test_deploy_highly_available_cluster_1","tests.integration.high_availability","2025-11-11","passed","2025-11-11","","test_replication_unit_endpoints","",""
"Relate all the applications to the database.","170302","test_relate_all","tests.integration","2025-11-11","passed","2025-11-11","","test_multi_relations","",""
"Relate charms and wait for the expected changes in status.","0","test_relation_creation_databag","tests.integration.relations","2025-11-11","skipped","2025-11-11","","test_database","",""
"Test to create a backup and list backups.","50680","test_backup","tests.integration","2025-11-11","passed","2025-11-11","","test_backup_gcp","",""
"Relate the two MySQL clusters.","39878","test_async_relate","tests.integration.high_availability","2025-11-11","passed","2025-11-11","","test_async_replication_upgrade","",""
"Scale database and routers.","795540","test_scale_out","tests.integration","2025-11-11","passed","2025-11-11","","test_multi_relations","",""
"Query database for custom variables.","25910","test_custom_variables","tests.integration","2025-11-11","passed","2025-11-11","","test_charm","",""
"Simple test to ensure that the MySQL and application charms get deployed.","133161","test_deploy_highly_available_cluster","tests.integration.high_availability","2025-11-11","passed","2025-11-11","","test_replication_data_isolation","",""
"","72693","test_deploy_and_relate_test_app","tests.integration","2025-11-11","passed","2025-11-11","","test_saturate_max_connections","",""
"Simple test to ensure that the MySQL and application charms get deployed.","133417","test_deploy_highly_available_cluster","tests.integration.high_availability","2025-11-11","passed","2025-11-11","","test_self_healing_node_drain","",""
"Simple test to ensure that the MySQL and application charms get deployed.","138171","test_deploy_highly_available_cluster","tests.integration.high_availability","2025-11-11","passed","2025-11-11","","test_self_healing_stop_all","",""
"Pause test.

    A graceful simultaneous restart of all instances,
    check primary election after the start, write and read data
    ","204848","test_graceful_full_cluster_crash","tests.integration.high_availability","2025-11-11","passed","2025-11-11","","test_self_healing_stop_all","",""
"Relate charms before they have time to properly start.

    It simulates a Terraform-like deployment strategy
    ","156150","test_relation_creation_eager","tests.integration.relations","2025-11-11","passed","2025-11-11","","test_database","",""
"Simple test to ensure that the MySQL and application charms get deployed.","129226","test_deploy_highly_available_cluster","tests.integration.high_availability","2025-11-11","passed","2025-11-11","","test_self_healing_stop_primary","",""
"Test that the pre-upgrade-check action runs successfully.","25131","test_pre_upgrade_check","tests.integration.high_availability","2025-11-11","passed","2025-11-11","","test_upgrade_from_stable","",""
"Test for cluster data isolation.

    This test creates a new cluster, create a new table on both cluster, write a single record with
    the application name for each cluster, retrieve and compare these records, asserting they are
    not the same.
    ","86822","test_cluster_data_isolation","tests.integration.high_availability","2025-11-11","passed","2025-11-11","","test_replication_data_isolation","",""
"","43377","test_upgrade_to_failing","tests.integration.high_availability","2025-11-11","passed","2025-11-11","","test_upgrade_rollback_incompat","",""
"Pitr tests.","281876","test_pitr_aws","tests.integration","2025-11-11","passed","2025-11-11","","test_backup_pitr_aws","",""
"Relate charms and wait for the expected changes in status.","16030","test_relation_creation","tests.integration.relations","2025-11-11","passed","2025-11-11","","test_database","",""
"Simple test to ensure that the mysql and data-integrator charms get deployed.","149111","test_build_and_deploy","tests.integration.roles","2025-11-11","passed","2025-11-11","","test_instance_dba_role","",""
"Test COS integrations formed before mysql is allocated and deployed.","95894","test_deploy_bundle_with_cos_integrations","tests.integration","2025-11-11","passed","2025-11-11","","test_cos_integration_bundle","",""
"Build the charm and deploy 3 units to ensure a cluster is formed.","6414","test_build_and_deploy","tests.integration.relations","2025-11-11","passed","2025-11-11","","test_database","",""
"The cluster manual re-join test.

    A graceful restart is performed in one of the instances (choosing Primary to make it painful).
    In order to verify that the instance can come back ONLINE, after disabling automatic re-join
    ","193017","test_cluster_manual_rejoin","tests.integration.high_availability","2025-11-11","passed","2025-11-11","","test_self_healing_restart_graceful","",""
"Build and deploy for AWS.","248679","test_build_and_deploy_gcp","tests.integration","2025-11-11","passed","2025-11-11","","test_backup_pitr_gcp","",""
"Build the mysql charm and deploy it.","126157","test_build_and_deploy","tests.integration","2025-11-11","passed","2025-11-11","","test_charm","",""
"Deploy the router and the test application.","58769","test_deploy_router_and_app","tests.integration.high_availability","2025-11-11","passed","2025-11-11","","test_async_replication","",""
"Test to restore a backup on a new mysql cluster.","584330","test_restore_on_new_cluster","tests.integration","2025-11-11","passed","2025-11-11","","test_backup_gcp","",""
"Ensure scaling down to zero and back up works.","158323","test_scale_up_from_zero","tests.integration","2025-11-11","passed","2025-11-11","","test_charm","",""
"Deploy the test application.","25717","test_deploy_test_app","tests.integration.high_availability","2025-11-11","passed","2025-11-11","","test_async_replication_upgrade","",""
"Simple test to ensure that the MySQL and application charms get deployed.","138567","test_deploy_latest","tests.integration.high_availability","2025-11-11","passed","2025-11-11","","test_upgrade","",""
"Simple test to ensure that the mysql and data-integrator charms get deployed.","162533","test_build_and_deploy","tests.integration.roles","2025-11-11","passed","2025-11-11","","test_instance_roles","",""
"Tries deploying an amd64 charm on arm64 host.","0","test_amd_charm_on_arm_host","tests.integration","2025-11-11","skipped","2025-11-11","","test_architecture","",""
"Confirm that a new primary is elected when the current primary is tear down.","431496","test_kill_primary_check_reelection","tests.integration.high_availability","2025-11-11","passed","2025-11-11","","test_replication_reelection","",""
"Test to restore a backup to the same mysql cluster.","222619","test_restore_on_same_cluster","tests.integration","2025-11-11","passed","2025-11-11","","test_backup_ceph","",""
"Test to send SIGTERM to primary instance and then verify recovery.","198440","test_graceful_crash_of_primary","tests.integration.high_availability","2025-11-11","passed","2025-11-11","","test_self_healing_stop_primary","",""
"Simple test to ensure that the MySQL and application charms get deployed.","114779","test_build_and_deploy","tests.integration.high_availability","2025-11-11","passed","2025-11-11","","test_upgrade_rollback_incompat","",""
"","30187","test_disable_tls","tests.integration","2025-11-11","passed","2025-11-11","","test_tls","",""
"Remove relation and wait for the expected changes in status.","35737","test_relation_broken","tests.integration.relations","2025-11-11","passed","2025-11-11","","test_database","",""
"Test primary crash during startup.

    It must recover/end setup when the primary got offline.
    ","107743","test_crash_during_cluster_setup","tests.integration.high_availability","2025-11-11","passed","2025-11-11","","test_self_healing_setup_crash","",""
"Test that endpoints are running.","4213","test_exporter_endpoints","tests.integration","2025-11-11","passed","2025-11-11","","test_charm","",""
"Test to restore a backup on a new mysql cluster.","542509","test_restore_on_new_cluster","tests.integration","2025-11-11","passed","2025-11-11","","test_backup_aws","",""
"Test for a network cut affecting an instance.","145172","test_network_cut_affecting_an_instance","tests.integration.high_availability","2025-11-11","passed","2025-11-11","","test_self_healing_network_cut","",""
"Update the second cluster.","379646","test_upgrade_from_stable","tests.integration.high_availability","2025-11-11","passed","2025-11-11","","test_upgrade_from_stable","",""
"Test the deployment and relation with osm bundle with mysql replacing mariadb.","179508","test_deploy_and_relate_osm_bundle","tests.integration","2025-11-11","passed","2025-11-11","","test_osm_integration_bundle","",""
"Confirm storage reuse works.","79172","test_scale_up_after_scale_down","tests.integration","2025-11-11","passed","2025-11-11","","test_charm","",""
"Pitr tests.","260919","test_pitr_aws","tests.integration","2025-11-11","passed","2025-11-11","","test_backup_pitr_gcp","",""
"Build and deploy for AWS.","239898","test_build_and_deploy_aws","tests.integration","2025-11-11","passed","2025-11-11","","test_backup_pitr_aws","",""
"Test behavior when node drains - pod is evicted and pvs are rotated.","113301","test_pod_eviction_and_pvc_deletion","tests.integration.high_availability","2025-11-11","passed","2025-11-11","","test_self_healing_node_drain","",""
"Test the charmed_dml role.","98483","test_charmed_dml_role","tests.integration.roles","2025-11-11","passed","2025-11-11","","test_instance_roles","",""
"Tries deploying an arm64 charm on amd64 host.","57352","test_arm_charm_on_amd_host","tests.integration","2025-11-11","passed","2025-11-11","","test_architecture","",""
"Test to create a backup and list backups.","55789","test_backup","tests.integration","2025-11-11","passed","2025-11-11","","test_backup_aws","",""
"Confirm that data is replicated from the primary node to all the replicas.","22914","test_consistent_data_replication_across_cluster","tests.integration.high_availability","2025-11-11","passed","2025-11-11","","test_replication_data_consistency","",""
"Simple test to ensure that the MySQL and application charms get deployed.","1211768","test_deploy_highly_available_cluster_2","tests.integration.high_availability","2025-11-11","broken","2025-11-11","","test_replication_unit_endpoints","",""
"Test graceful promotion of a standby cluster to primary.","48007","test_standby_promotion","tests.integration.high_availability","2025-11-11","passed","2025-11-11","","test_async_replication","",""
"Run the create-replication action and wait for the applications to settle.","211445","test_create_replication","tests.integration.high_availability","2025-11-11","passed","2025-11-11","","test_async_replication","",""
"Build the charm and deploy 3 units to ensure a cluster is formed.","128663","test_build_and_deploy","tests.integration","2025-11-11","passed","2025-11-11","","test_tls","",""
"Test to send a SIGSTOP to the primary db process and ensure that the cluster self heals.","204678","test_freeze_db_process","tests.integration.high_availability","2025-11-11","passed","2025-11-11","","test_self_healing_process_frozen","",""
"Simple test to ensure that the MySQL and application charms get deployed.","129762","test_deploy_stable","tests.integration.high_availability","2025-11-11","passed","2025-11-11","","test_upgrade_from_stable","",""
"Relate the two MySQL clusters.","35105","test_async_relate","tests.integration.high_availability","2025-11-11","passed","2025-11-11","","test_async_replication","",""
"Simple test to ensure that the MySQL and application charms get deployed.","114752","test_deploy_highly_available_cluster","tests.integration.high_availability","2025-11-11","passed","2025-11-11","","test_self_healing_process_killed","",""
"Simple test to ensure that the MySQL and application charms get deployed.","137093","test_deploy_highly_available_cluster","tests.integration.high_availability","2025-11-11","passed","2025-11-11","","test_self_healing_network_cut","",""
"Build the charm and deploy 3 units to ensure a cluster is formed.","6280","test_build_and_deploy","tests.integration.relations","2025-11-11","passed","2025-11-11","","test_mysql_root","",""
"Test upgrade rollback to a healthy revision.","335733","test_rollback","tests.integration.high_availability","2025-11-11","passed","2025-11-11","","test_upgrade_rollback_incompat","",""
"Delete the pod in a single unit deployment and write data to new pod.","762393","test_single_unit_pod_delete","tests.integration.high_availability","2025-11-11","passed","2025-11-11","","test_self_healing_pod","",""
"Test the DBA predefined role.","41062","test_charmed_dba_role","tests.integration.roles","2025-11-11","passed","2025-11-11","","test_instance_dba_role","",""
"Test to write to primary, and read the same data back from replicas.","19474","test_data_replication","tests.integration.high_availability","2025-11-11","passed","2025-11-11","","test_async_replication","",""
"Test the existence of databases and tables created by osm-pol's migrations.","34329","test_osm_pol_operations","tests.integration","2025-11-11","passed","2025-11-11","","test_osm_integration_bundle","",""
