"Status","Start Time","Stop Time","Duration in ms","Parent Suite","Suite","Sub Suite","Test Class","Test Method","Name","Description"
"passed","Mon Jun 03 01:38:45 UTC 2024","Mon Jun 03 01:39:02 UTC 2024","16595","tests.integration.high_availability","test_async_replication","","","","test_standby_promotion","Test graceful promotion of a standby cluster to primary."
"passed","Mon Jun 03 01:34:07 UTC 2024","Mon Jun 03 01:37:43 UTC 2024","215503","tests.integration.high_availability","test_upgrade","","","","test_upgrade_from_edge",""
"passed","Mon Jun 03 01:31:30 UTC 2024","Mon Jun 03 01:33:31 UTC 2024","121324","tests.integration.relations","test_database","","","","test_build_and_deploy","Build the charm and deploy 3 units to ensure a cluster is formed."
"passed","Mon Jun 03 01:34:17 UTC 2024","Mon Jun 03 01:35:18 UTC 2024","60611","tests.integration","test_tls","","","","test_enable_tls","Test for encryption enablement when relation to TLS charm."
"passed","Mon Jun 03 01:34:07 UTC 2024","Mon Jun 03 01:37:06 UTC 2024","179102","tests.integration.high_availability","test_upgrade_from_stable","","","","test_upgrade_from_stable","Test updating from stable channel."
"passed","Mon Jun 03 01:34:08 UTC 2024","Mon Jun 03 01:36:07 UTC 2024","118909","tests.integration","test_backups","","","","test_backup","Test to create a backup and list backups."
"passed","Mon Jun 03 01:35:18 UTC 2024","Mon Jun 03 01:35:58 UTC 2024","39769","tests.integration","test_tls","","","","test_rotate_tls_key","Verify rotating tls private keys restarts cluster with new certificates.

    This test rotates tls private keys to randomly generated keys.
    "
"passed","Mon Jun 03 01:34:16 UTC 2024","Mon Jun 03 01:34:17 UTC 2024","1114","tests.integration","test_tls","","","","test_connection_before_tls","Ensure connections (with and without ssl) are possible before relating with TLS operator."
"skipped","Mon Jun 03 01:31:58 UTC 2024","Mon Jun 03 01:31:58 UTC 2024","0","tests.integration","test_charm","","","","test_password_rotation_silent","Rotate password and confirm changes."
"passed","Mon Jun 03 01:31:38 UTC 2024","Mon Jun 03 01:33:52 UTC 2024","134037","tests.integration.high_availability","test_upgrade","","","","test_deploy_latest","Simple test to ensure that the mysql and application charms get deployed."
"passed","Mon Jun 03 01:34:23 UTC 2024","Mon Jun 03 01:36:17 UTC 2024","114431","tests.integration.high_availability","test_async_replication","","","","test_async_relate","Relate the two mysql clusters."
"passed","Mon Jun 03 01:40:27 UTC 2024","Mon Jun 03 01:46:36 UTC 2024","368448","tests.integration","test_backups","","","","test_restore_on_new_cluster","Test to restore a backup on a new mysql cluster."
"passed","Mon Jun 03 01:39:03 UTC 2024","Mon Jun 03 01:43:20 UTC 2024","256670","tests.integration.high_availability","test_async_replication","","","","test_failover","Test switchover on primary cluster fail."
"passed","Mon Jun 03 01:34:15 UTC 2024","Mon Jun 03 01:36:46 UTC 2024","150762","tests.integration.high_availability","test_upgrade_rollback_incompat","","","","test_rollback",""
"passed","Mon Jun 03 01:35:58 UTC 2024","Mon Jun 03 01:36:28 UTC 2024","30125","tests.integration","test_tls","","","","test_disable_tls",""
"passed","Mon Jun 03 01:33:31 UTC 2024","Mon Jun 03 01:33:58 UTC 2024","26390","tests.integration.relations","test_database","","","","test_relation_creation","Relate charms and wait for the expected changes in status."
"skipped","Mon Jun 03 01:31:58 UTC 2024","Mon Jun 03 01:31:58 UTC 2024","0","tests.integration","test_charm","","","","test_custom_variables","Query database for custom variables."
"passed","Mon Jun 03 01:37:46 UTC 2024","Mon Jun 03 01:47:04 UTC 2024","558322","tests.integration.high_availability","test_upgrade","","","","test_fail_and_rollback",""
"skipped","Mon Jun 03 01:31:58 UTC 2024","Mon Jun 03 01:31:58 UTC 2024","0","tests.integration","test_charm","","","","test_password_rotation_root_user_implicit","Rotate password and confirm changes."
"skipped","Mon Jun 03 01:31:58 UTC 2024","Mon Jun 03 01:31:58 UTC 2024","0","tests.integration","test_charm","","","","test_password_rotation","Rotate password and confirm changes."
"skipped","Mon Jun 03 01:33:31 UTC 2024","Mon Jun 03 01:33:31 UTC 2024","0","tests.integration.relations","test_database","","","","test_relation_creation_databag","Relate charms and wait for the expected changes in status."
"passed","Mon Jun 03 01:31:42 UTC 2024","Mon Jun 03 01:35:16 UTC 2024","214623","tests.integration.relations","test_mysql_root","","","","test_deploy_and_relate_osm_bundle","Test the deployment and relation with osm bundle with mysql replacing mariadb."
"skipped","Mon Jun 03 01:31:58 UTC 2024","Mon Jun 03 01:31:58 UTC 2024","0","tests.integration","test_charm","","","","test_scale_up_after_scale_down","Confirm storage reuse works."
"passed","Mon Jun 03 01:43:22 UTC 2024","Mon Jun 03 01:43:37 UTC 2024","15320","tests.integration.high_availability","test_async_replication","","","","test_rejoin_invalidated_cluster","Test rejoin invalidated cluster with."
"passed","Mon Jun 03 01:33:39 UTC 2024","Mon Jun 03 01:34:15 UTC 2024","36569","tests.integration.high_availability","test_upgrade_rollback_incompat","","","","test_upgrade_to_failling",""
"passed","Mon Jun 03 01:32:05 UTC 2024","Mon Jun 03 01:34:16 UTC 2024","131588","tests.integration","test_tls","","","","test_build_and_deploy","Build the charm and deploy 3 units to ensure a cluster is formed."
"passed","Mon Jun 03 01:31:21 UTC 2024","Mon Jun 03 01:33:32 UTC 2024","131566","tests.integration.high_availability","test_upgrade_rollback_incompat","","","","test_build_and_deploy","Simple test to ensure that the mysql and application charms get deployed."
"skipped","Mon Jun 03 01:31:58 UTC 2024","Mon Jun 03 01:31:58 UTC 2024","0","tests.integration","test_charm","","","","test_log_rotation","Test the log rotation of text files."
"passed","Mon Jun 03 01:35:16 UTC 2024","Mon Jun 03 01:36:21 UTC 2024","64478","tests.integration.relations","test_mysql_root","","","","test_osm_pol_operations","Test the existence of databases and tables created by osm-pol's migrations."
"broken","Mon Jun 03 01:31:42 UTC 2024","Mon Jun 03 01:31:58 UTC 2024","16227","tests.integration","test_charm","","","","test_build_and_deploy","Build the mysql charm and deploy it."
"skipped","Mon Jun 03 01:31:58 UTC 2024","Mon Jun 03 01:31:58 UTC 2024","0","tests.integration","test_charm","","","","test_scale_up_and_down","Confirm that a new primary is elected when the current primary is torn down."
"passed","Mon Jun 03 01:33:52 UTC 2024","Mon Jun 03 01:34:07 UTC 2024","14437","tests.integration.high_availability","test_upgrade_from_stable","","","","test_pre_upgrade_check","Test that the pre-upgrade-check action runs successfully."
"passed","Mon Jun 03 01:32:25 UTC 2024","Mon Jun 03 01:34:08 UTC 2024","103523","tests.integration","test_backups","","","","test_build_and_deploy","Simple test to ensure that the mysql charm gets deployed."
"passed","Mon Jun 03 01:33:52 UTC 2024","Mon Jun 03 01:34:05 UTC 2024","13433","tests.integration.high_availability","test_upgrade","","","","test_pre_upgrade_check","Test that the pre-upgrade-check action runs successfully."
"passed","Mon Jun 03 01:33:32 UTC 2024","Mon Jun 03 01:33:39 UTC 2024","6192","tests.integration.high_availability","test_upgrade_rollback_incompat","","","","test_pre_upgrade_check","Test that the pre-upgrade-check action runs successfully."
"passed","Mon Jun 03 01:43:40 UTC 2024","Mon Jun 03 01:46:34 UTC 2024","173487","tests.integration.high_availability","test_async_replication","","","","test_remove_relation_and_relate","Test removing and re-relating the two mysql clusters."
"passed","Mon Jun 03 01:36:17 UTC 2024","Mon Jun 03 01:37:32 UTC 2024","74498","tests.integration.high_availability","test_async_replication","","","","test_deploy_router_and_app","Deploy the router and the test application."
"passed","Mon Jun 03 01:31:54 UTC 2024","Mon Jun 03 01:34:23 UTC 2024","148370","tests.integration.high_availability","test_async_replication","","","","test_build_and_deploy","Simple test to ensure that the mysql and application charms get deployed."
"passed","Mon Jun 03 01:33:58 UTC 2024","Mon Jun 03 01:34:20 UTC 2024","22506","tests.integration.relations","test_database","","","","test_relation_broken","Remove relation and wait for the expected changes in status."
"passed","Mon Jun 03 01:36:07 UTC 2024","Mon Jun 03 01:40:27 UTC 2024","260345","tests.integration","test_backups","","","","test_restore_on_same_cluster","Test to restore a backup to the same mysql cluster."
"skipped","Mon Jun 03 01:31:58 UTC 2024","Mon Jun 03 01:31:58 UTC 2024","0","tests.integration","test_charm","","","","test_consistent_data_replication_across_cluster","Confirm that data is replicated from the primary node to all the replicas."
"skipped","Mon Jun 03 01:31:58 UTC 2024","Mon Jun 03 01:31:58 UTC 2024","0","tests.integration","test_charm","","","","test_exporter_endpoints","Test that endpoints are running."
"passed","Mon Jun 03 01:31:34 UTC 2024","Mon Jun 03 01:33:52 UTC 2024","138797","tests.integration.high_availability","test_upgrade_from_stable","","","","test_deploy_stable","Simple test to ensure that the mysql and application charms get deployed."
"passed","Mon Jun 03 01:38:34 UTC 2024","Mon Jun 03 01:38:42 UTC 2024","8214","tests.integration.high_availability","test_async_replication","","","","test_data_replication","Test to write to primary, and read the same data back from replicas."
