"DESCRIPTION","DURATION IN MS","NAME","PARENT SUITE","START TIME","STATUS","STOP TIME","SUB SUITE","SUITE","TEST CLASS","TEST METHOD"
"","178081","test_rollback","tests.integration.high_availability","Thu Nov 07 01:34:43 UTC 2024","passed","Thu Nov 07 01:37:41 UTC 2024","","test_upgrade_rollback_incompat","",""
"Test to write to primary, and read the same data back from replicas.","8269","test_data_replication","tests.integration.high_availability","Thu Nov 07 01:41:30 UTC 2024","passed","Thu Nov 07 01:41:39 UTC 2024","","test_async_replication","",""
"Test to restore a backup on a new mysql cluster.","279995","test_restore_on_new_cluster","tests.integration","Thu Nov 07 01:37:19 UTC 2024","passed","Thu Nov 07 01:41:59 UTC 2024","","test_backup_aws","",""
"Test to restore a backup to the same mysql cluster.","165258","test_restore_on_same_cluster","tests.integration","Thu Nov 07 01:34:34 UTC 2024","passed","Thu Nov 07 01:37:19 UTC 2024","","test_backup_aws","",""
"","4144","test_saturate_max_connections","tests.integration","Thu Nov 07 01:33:25 UTC 2024","passed","Thu Nov 07 01:33:30 UTC 2024","","test_saturate_max_connections","",""
"Relate charms and wait for the expected changes in status.","","test_relation_creation","tests.integration.relations","","unknown","","","test_database","",""
"Test that the pre-upgrade-check action runs successfully.","18486","test_pre_upgrade_check","tests.integration.high_availability","Thu Nov 07 01:34:48 UTC 2024","passed","Thu Nov 07 01:35:06 UTC 2024","","test_upgrade_from_stable","",""
"Rotate password and confirm changes.","12189","test_password_rotation","tests.integration","Thu Nov 07 01:40:48 UTC 2024","passed","Thu Nov 07 01:41:00 UTC 2024","","test_charm","",""
"Test that the pre-upgrade-check action runs successfully.","9132","test_pre_upgrade_check","tests.integration.high_availability","Thu Nov 07 01:33:47 UTC 2024","passed","Thu Nov 07 01:33:57 UTC 2024","","test_upgrade_rollback_incompat","",""
"Test removing and re-relating the two mysql clusters.","245072","test_remove_relation_and_relate","tests.integration.high_availability","Thu Nov 07 01:46:58 UTC 2024","passed","Thu Nov 07 01:51:03 UTC 2024","","test_async_replication","",""
"","30117","test_disable_tls","tests.integration","Thu Nov 07 01:36:10 UTC 2024","passed","Thu Nov 07 01:36:40 UTC 2024","","test_tls","",""
"Test to ensure that data is preserved when a unit is scaled up and then down.

    Ensures that there are no running continuous writes as the extra data in the
    database makes scaling up slower.
    ","243824","test_scaling_without_data_loss","tests.integration.high_availability","Thu Nov 07 01:35:20 UTC 2024","passed","Thu Nov 07 01:39:24 UTC 2024","","test_replication","",""
"Test to send SIGTERM to all units and then ensure that the cluster recovers.","364260","test_graceful_full_cluster_crash_test","tests.integration.high_availability","Thu Nov 07 01:35:36 UTC 2024","passed","Thu Nov 07 01:41:41 UTC 2024","","test_self_healing","",""
"Remove relation and wait for the expected changes in status.","","test_relation_broken","tests.integration.relations","","unknown","","","test_database","",""
"Test graceful promotion of a standby cluster to primary.","27511","test_standby_promotion","tests.integration.high_availability","Thu Nov 07 01:41:42 UTC 2024","passed","Thu Nov 07 01:42:09 UTC 2024","","test_async_replication","",""
"Test to kill the primary under load and ensure re-election of primary.","204863","test_kill_primary_check_reelection","tests.integration.high_availability","Thu Nov 07 01:35:29 UTC 2024","passed","Thu Nov 07 01:38:53 UTC 2024","","test_replication","",""
"Test to restore a backup to the same mysql cluster.","168550","test_restore_on_same_cluster","tests.integration","Thu Nov 07 01:35:53 UTC 2024","passed","Thu Nov 07 01:38:41 UTC 2024","","test_backup_ceph","",""
"Confirm storage reuse works.","88835","test_scale_up_after_scale_down","tests.integration","Thu Nov 07 01:39:19 UTC 2024","passed","Thu Nov 07 01:40:48 UTC 2024","","test_charm","",""
"Test the log rotation of text files.

    Run continuous writes to ensure that audit log plugin is loaded and active
    when mysql-test-app runs start-continuous-writes (by logging into mysql).
    ","9386","test_log_rotation","tests.integration.high_availability","Thu Nov 07 01:34:48 UTC 2024","passed","Thu Nov 07 01:34:57 UTC 2024","","test_log_rotation","",""
"Ensure connections (with and without ssl) are possible before relating with TLS operator.","2117","test_connection_before_tls","tests.integration","Thu Nov 07 01:34:17 UTC 2024","passed","Thu Nov 07 01:34:19 UTC 2024","","test_tls","",""
"Test to restore a backup to the same mysql cluster.","176094","test_restore_on_same_cluster","tests.integration","Thu Nov 07 01:34:21 UTC 2024","passed","Thu Nov 07 01:37:17 UTC 2024","","test_backup_gcp","",""
"Scale database and routers.","455290","test_scale_out","tests.integration","Thu Nov 07 01:34:52 UTC 2024","passed","Thu Nov 07 01:42:28 UTC 2024","","test_multi_relations","",""
"Simple test to ensure that the mysql charm gets deployed.","109817","test_build_and_deploy","tests.integration","Thu Nov 07 01:31:37 UTC 2024","passed","Thu Nov 07 01:33:26 UTC 2024","","test_backup_gcp","",""
"Simple test to ensure that the mysql and application charms get deployed.","","test_deploy_latest","tests.integration.high_availability","","unknown","","","test_upgrade","",""
"Simple test to ensure that the mysql and application charms get deployed.","175011","test_deploy_stable","tests.integration.high_availability","Thu Nov 07 01:31:53 UTC 2024","passed","Thu Nov 07 01:34:48 UTC 2024","","test_upgrade_from_stable","",""
"Delete the pod in a single unit deployment and write data to new pod.","231472","test_single_unit_pod_delete","tests.integration.high_availability","Thu Nov 07 01:35:51 UTC 2024","passed","Thu Nov 07 01:39:43 UTC 2024","","test_self_healing","",""
"Test to create a backup and list backups.","54263","test_backup","tests.integration","Thu Nov 07 01:33:38 UTC 2024","passed","Thu Nov 07 01:34:32 UTC 2024","","test_backup_aws","",""
"Test the labeling of k8s endpoints when apps with same cluster-name deployed.","407753","test_labeling_of_k8s_endpoints","tests.integration.high_availability","Thu Nov 07 01:31:51 UTC 2024","passed","Thu Nov 07 01:38:39 UTC 2024","","test_k8s_endpoints","",""
"","46233","test_upgrade_to_failling","tests.integration.high_availability","Thu Nov 07 01:33:57 UTC 2024","passed","Thu Nov 07 01:34:43 UTC 2024","","test_upgrade_rollback_incompat","",""
"Test switchover on primary cluster fail.","262656","test_failover","tests.integration.high_availability","Thu Nov 07 01:42:10 UTC 2024","passed","Thu Nov 07 01:46:33 UTC 2024","","test_async_replication","",""
"Relate the two mysql clusters.","5165","test_async_relate","tests.integration.high_availability","Thu Nov 07 01:35:26 UTC 2024","passed","Thu Nov 07 01:35:32 UTC 2024","","test_async_replication","",""
"Test to create a backup and list backups.","50882","test_backup","tests.integration","Thu Nov 07 01:33:28 UTC 2024","passed","Thu Nov 07 01:34:19 UTC 2024","","test_backup_gcp","",""
"Test rejoin invalidated cluster with.","19457","test_rejoin_invalidated_cluster","tests.integration.high_availability","Thu Nov 07 01:46:35 UTC 2024","passed","Thu Nov 07 01:46:55 UTC 2024","","test_async_replication","",""
"Test updating from stable channel.","176310","test_upgrade_from_stable","tests.integration.high_availability","Thu Nov 07 01:35:08 UTC 2024","passed","Thu Nov 07 01:38:04 UTC 2024","","test_upgrade_from_stable","",""
"Test to send a SIGKILL to the primary db process and ensure that the cluster self heals.","86902","test_kill_db_process","tests.integration.high_availability","Thu Nov 07 01:35:27 UTC 2024","passed","Thu Nov 07 01:36:54 UTC 2024","","test_self_healing","",""
"Test COS integrations formed before mysql is allocated and deployed.","78960","test_deploy_bundle_with_cos_integrations","tests.integration","Thu Nov 07 01:32:12 UTC 2024","passed","Thu Nov 07 01:33:31 UTC 2024","","test_cos_integration_bundle","",""
"Rotate password and confirm changes.","14181","test_password_rotation_root_user_implicit","tests.integration","Thu Nov 07 01:41:13 UTC 2024","passed","Thu Nov 07 01:41:27 UTC 2024","","test_charm","",""
"Relate all the applications to the database.","160311","test_relate_all","tests.integration","Thu Nov 07 01:32:12 UTC 2024","passed","Thu Nov 07 01:34:52 UTC 2024","","test_multi_relations","",""
"Simple test to ensure that the mysql and application charms get deployed.","114440","test_build_and_deploy","tests.integration.high_availability","Thu Nov 07 01:31:53 UTC 2024","passed","Thu Nov 07 01:33:47 UTC 2024","","test_upgrade_rollback_incompat","",""
"Build the charm and deploy 1 units to ensure a cluster is formed.","9930","test_build_and_deploy","tests.integration","Thu Nov 07 01:32:18 UTC 2024","passed","Thu Nov 07 01:32:28 UTC 2024","","test_saturate_max_connections","",""
"Test the deployment and relation with osm bundle with mysql replacing mariadb.","149632","test_deploy_and_relate_osm_bundle","tests.integration.relations","Thu Nov 07 01:32:17 UTC 2024","passed","Thu Nov 07 01:34:47 UTC 2024","","test_mysql_root","",""
"Verify rotating tls private keys restarts cluster with new certificates.

    This test rotates tls private keys to randomly generated keys.
    ","40888","test_rotate_tls_key","tests.integration","Thu Nov 07 01:35:29 UTC 2024","passed","Thu Nov 07 01:36:10 UTC 2024","","test_tls","",""
"Query database for custom variables.","24531","test_custom_variables","tests.integration","Thu Nov 07 01:41:31 UTC 2024","passed","Thu Nov 07 01:41:56 UTC 2024","","test_charm","",""
"Test to restore a backup on a new mysql cluster.","321687","test_restore_on_new_cluster","tests.integration","Thu Nov 07 01:37:17 UTC 2024","passed","Thu Nov 07 01:42:39 UTC 2024","","test_backup_gcp","",""
"","","test_fail_and_rollback","tests.integration.high_availability","","unknown","","","test_upgrade","",""
"Test the existence of databases and tables created by osm-pol's migrations.","34211","test_osm_pol_operations","tests.integration.relations","Thu Nov 07 01:34:47 UTC 2024","passed","Thu Nov 07 01:35:21 UTC 2024","","test_mysql_root","",""
"Simple test to ensure that the mysql charm gets deployed.","110034","test_build_and_deploy","tests.integration","Thu Nov 07 01:33:16 UTC 2024","passed","Thu Nov 07 01:35:06 UTC 2024","","test_backup_ceph","",""
"Scale database and routers.","225307","test_scale_in","tests.integration","Thu Nov 07 01:42:28 UTC 2024","passed","Thu Nov 07 01:46:13 UTC 2024","","test_multi_relations","",""
"Confirm that data is replicated from the primary node to all the replicas.","4221","test_consistent_data_replication_across_cluster","tests.integration","Thu Nov 07 01:34:56 UTC 2024","passed","Thu Nov 07 01:35:00 UTC 2024","","test_charm","",""
"Test for a network cut affecting an instance.","201678","test_network_cut_affecting_an_instance","tests.integration.high_availability","Thu Nov 07 01:35:14 UTC 2024","passed","Thu Nov 07 01:38:36 UTC 2024","","test_self_healing","",""
"Run the create replication and wait for the applications to settle.","227498","test_create_replication","tests.integration.high_availability","Thu Nov 07 01:35:32 UTC 2024","passed","Thu Nov 07 01:39:19 UTC 2024","","test_async_replication","",""
"Build the charm and deploy 1 units to ensure a cluster is formed.","31750","test_build_and_deploy","tests.integration","Thu Nov 07 01:31:40 UTC 2024","passed","Thu Nov 07 01:32:12 UTC 2024","","test_multi_relations","",""
"Test to write to primary, and read the same data back from replicas.","7606","test_check_consistency","tests.integration.high_availability","Thu Nov 07 01:34:55 UTC 2024","passed","Thu Nov 07 01:35:02 UTC 2024","","test_replication","",""
"Simple test to ensure that the mysql charm gets deployed.","110384","test_build_and_deploy","tests.integration","Thu Nov 07 01:31:45 UTC 2024","passed","Thu Nov 07 01:33:36 UTC 2024","","test_backup_aws","",""
"Build the charm and deploy 3 units to ensure a cluster is formed.","134655","test_build_and_deploy","tests.integration","Thu Nov 07 01:32:03 UTC 2024","passed","Thu Nov 07 01:34:17 UTC 2024","","test_tls","",""
"Test to send a SIGSTOP to the primary db process and ensure that the cluster self heals.","308910","test_freeze_db_process","tests.integration.high_availability","Thu Nov 07 01:35:34 UTC 2024","passed","Thu Nov 07 01:40:43 UTC 2024","","test_self_healing","",""
"Test that endpoints are running.","4036","test_exporter_endpoints","tests.integration","Thu Nov 07 01:41:27 UTC 2024","passed","Thu Nov 07 01:41:31 UTC 2024","","test_charm","",""
"Test to ensure that writes to one cluster do not replicate to another cluster.","105148","test_no_replication_across_clusters","tests.integration.high_availability","Thu Nov 07 01:35:43 UTC 2024","passed","Thu Nov 07 01:37:28 UTC 2024","","test_replication","",""
"Test that the pre-upgrade-check action runs successfully.","","test_pre_upgrade_check","tests.integration.high_availability","","unknown","","","test_upgrade","",""
"Test behavior when node drains - pod is evicted and pvs are rotated.","119961","test_pod_eviction_and_pvc_deletion","tests.integration.high_availability","Thu Nov 07 01:35:34 UTC 2024","passed","Thu Nov 07 01:37:34 UTC 2024","","test_node_drain","",""
"Test to send SIGTERM to primary instance and then verify recovery.","122742","test_graceful_crash_of_primary","tests.integration.high_availability","Thu Nov 07 01:35:27 UTC 2024","passed","Thu Nov 07 01:37:29 UTC 2024","","test_self_healing","",""
"Rotate password and confirm changes.","13182","test_password_rotation_silent","tests.integration","Thu Nov 07 01:41:00 UTC 2024","passed","Thu Nov 07 01:41:13 UTC 2024","","test_charm","",""
"Relate charms and wait for the expected changes in status.","","test_relation_creation_databag","tests.integration.relations","","unknown","","","test_database","",""
"","57637","test_deploy_and_relate_test_app","tests.integration","Thu Nov 07 01:32:28 UTC 2024","passed","Thu Nov 07 01:33:25 UTC 2024","","test_saturate_max_connections","",""
"Simple test to ensure that the mysql and application charms get deployed.","182359","test_build_and_deploy","tests.integration.high_availability","Thu Nov 07 01:32:24 UTC 2024","passed","Thu Nov 07 01:35:26 UTC 2024","","test_async_replication","",""
"","","test_upgrade_from_edge","tests.integration.high_availability","","unknown","","","test_upgrade","",""
"Test to restore a backup on a new mysql cluster.","310857","test_restore_on_new_cluster","tests.integration","Thu Nov 07 01:38:41 UTC 2024","passed","Thu Nov 07 01:43:52 UTC 2024","","test_backup_ceph","",""
"Deploy the router and the test application.","69158","test_deploy_router_and_app","tests.integration.high_availability","Thu Nov 07 01:39:19 UTC 2024","passed","Thu Nov 07 01:40:28 UTC 2024","","test_async_replication","",""
"","216995","test_crash_during_cluster_setup","tests.integration.high_availability","Thu Nov 07 01:31:45 UTC 2024","passed","Thu Nov 07 01:35:22 UTC 2024","","test_crash_during_setup","",""
"Confirm that a new primary is elected when the current primary is torn down.","259050","test_scale_up_and_down","tests.integration","Thu Nov 07 01:35:00 UTC 2024","passed","Thu Nov 07 01:39:19 UTC 2024","","test_charm","",""
"Test to create a backup and list backups.","42934","test_backup","tests.integration","Thu Nov 07 01:35:08 UTC 2024","passed","Thu Nov 07 01:35:51 UTC 2024","","test_backup_ceph","",""
"Build the mysql charm and deploy it.","159549","test_build_and_deploy","tests.integration","Thu Nov 07 01:32:16 UTC 2024","passed","Thu Nov 07 01:34:56 UTC 2024","","test_charm","",""
"Build the charm and deploy 3 units to ensure a cluster is formed.","","test_build_and_deploy","tests.integration.relations","","unknown","","","test_database","",""
"Test for encryption enablement when relation to TLS charm.","69674","test_enable_tls","tests.integration","Thu Nov 07 01:34:19 UTC 2024","passed","Thu Nov 07 01:35:29 UTC 2024","","test_tls","",""
