"Status","Start Time","Stop Time","Duration in ms","Parent Suite","Suite","Sub Suite","Test Class","Test Method","Name","Description"
"passed","Mon Jun 17 01:32:18 UTC 2024","Mon Jun 17 01:32:22 UTC 2024","3657","tests.integration.high_availability","test_async_replication","","","","test_async_relate","Relate the two mysql clusters."
"passed","Mon Jun 17 01:31:36 UTC 2024","Mon Jun 17 01:31:42 UTC 2024","6323","tests.integration.high_availability","test_upgrade_rollback_incompat","","","","test_pre_upgrade_check","Test that the pre-upgrade-check action runs successfully."
"passed","Mon Jun 17 01:36:35 UTC 2024","Mon Jun 17 01:36:46 UTC 2024","11164","tests.integration","test_charm","","","","test_password_rotation","Rotate password and confirm changes."
"passed","Mon Jun 17 01:36:38 UTC 2024","Mon Jun 17 01:36:46 UTC 2024","8228","tests.integration.high_availability","test_async_replication","","","","test_data_replication","Test to write to primary, and read the same data back from replicas."
"passed","Mon Jun 17 01:35:08 UTC 2024","Mon Jun 17 01:38:53 UTC 2024","224601","tests.integration.high_availability","test_upgrade","","","","test_fail_and_rollback",""
"passed","Mon Jun 17 01:32:19 UTC 2024","Mon Jun 17 01:32:59 UTC 2024","39881","tests.integration","test_tls","","","","test_rotate_tls_key","Verify rotating tls private keys restarts cluster with new certificates.

    This test rotates tls private keys to randomly generated keys.
    "
"passed","Mon Jun 17 01:31:20 UTC 2024","Mon Jun 17 01:32:19 UTC 2024","59837","tests.integration","test_tls","","","","test_enable_tls","Test for encryption enablement when relation to TLS charm."
"passed","Mon Jun 17 01:31:17 UTC 2024","Mon Jun 17 01:31:46 UTC 2024","29260","tests.integration.relations","test_database","","","","test_relation_creation","Relate charms and wait for the expected changes in status."
"passed","Mon Jun 17 01:31:58 UTC 2024","Mon Jun 17 01:32:13 UTC 2024","14403","tests.integration.high_availability","test_upgrade_from_stable","","","","test_pre_upgrade_check","Test that the pre-upgrade-check action runs successfully."
"passed","Mon Jun 17 01:29:36 UTC 2024","Mon Jun 17 01:32:18 UTC 2024","162722","tests.integration.high_availability","test_async_replication","","","","test_build_and_deploy","Simple test to ensure that the mysql and application charms get deployed."
"skipped","Mon Jun 17 01:31:17 UTC 2024","Mon Jun 17 01:31:17 UTC 2024","0","tests.integration.relations","test_database","","","","test_relation_creation_databag","Relate charms and wait for the expected changes in status."
"passed","Mon Jun 17 01:37:14 UTC 2024","Mon Jun 17 01:37:38 UTC 2024","24564","tests.integration","test_charm","","","","test_custom_variables","Query database for custom variables."
"passed","Mon Jun 17 01:34:18 UTC 2024","Mon Jun 17 01:35:36 UTC 2024","78296","tests.integration.high_availability","test_async_replication","","","","test_deploy_router_and_app","Deploy the router and the test application."
"passed","Mon Jun 17 01:32:22 UTC 2024","Mon Jun 17 01:34:18 UTC 2024","115662","tests.integration.high_availability","test_async_replication","","","","test_create_replication","Run the create replication and wait for the applications to settle."
"passed","Mon Jun 17 01:37:38 UTC 2024","Mon Jun 17 01:37:44 UTC 2024","6131","tests.integration","test_charm","","","","test_log_rotation","Test the log rotation of text files."
"passed","Mon Jun 17 01:36:50 UTC 2024","Mon Jun 17 01:37:05 UTC 2024","15296","tests.integration.high_availability","test_async_replication","","","","test_standby_promotion","Test graceful promotion of a standby cluster to primary."
"passed","Mon Jun 17 01:32:00 UTC 2024","Mon Jun 17 01:33:51 UTC 2024","111003","tests.integration","test_backups","","","","test_backup","Test to create a backup and list backups."
"passed","Mon Jun 17 01:29:11 UTC 2024","Mon Jun 17 01:31:17 UTC 2024","126684","tests.integration","test_tls","","","","test_build_and_deploy","Build the charm and deploy 3 units to ensure a cluster is formed."
"passed","Mon Jun 17 01:32:20 UTC 2024","Mon Jun 17 01:34:55 UTC 2024","155118","tests.integration.high_availability","test_upgrade_rollback_incompat","","","","test_rollback",""
"passed","Mon Jun 17 01:31:35 UTC 2024","Mon Jun 17 01:31:50 UTC 2024","14410","tests.integration.high_availability","test_upgrade","","","","test_pre_upgrade_check","Test that the pre-upgrade-check action runs successfully."
"passed","Mon Jun 17 01:37:10 UTC 2024","Mon Jun 17 01:37:14 UTC 2024","3978","tests.integration","test_charm","","","","test_exporter_endpoints","Test that endpoints are running."
"passed","Mon Jun 17 01:29:11 UTC 2024","Mon Jun 17 01:31:35 UTC 2024","144706","tests.integration.high_availability","test_upgrade","","","","test_deploy_latest","Simple test to ensure that the mysql and application charms get deployed."
"passed","Mon Jun 17 01:31:19 UTC 2024","Mon Jun 17 01:31:23 UTC 2024","4164","tests.integration","test_charm","","","","test_consistent_data_replication_across_cluster","Confirm that data is replicated from the primary node to all the replicas."
"passed","Mon Jun 17 01:37:06 UTC 2024","Mon Jun 17 01:41:24 UTC 2024","258618","tests.integration.high_availability","test_async_replication","","","","test_failover","Test switchover on primary cluster fail."
"passed","Mon Jun 17 01:30:11 UTC 2024","Mon Jun 17 01:32:00 UTC 2024","109446","tests.integration","test_backups","","","","test_build_and_deploy","Simple test to ensure that the mysql charm gets deployed."
"passed","Mon Jun 17 01:29:13 UTC 2024","Mon Jun 17 01:32:18 UTC 2024","185279","tests.integration.high_availability","test_replication","","","","test_build_and_deploy","Simple test to ensure that the mysql and application charms get deployed."
"passed","Mon Jun 17 01:29:09 UTC 2024","Mon Jun 17 01:31:17 UTC 2024","127184","tests.integration.relations","test_database","","","","test_build_and_deploy","Build the charm and deploy 3 units to ensure a cluster is formed."
"passed","Mon Jun 17 01:32:13 UTC 2024","Mon Jun 17 01:35:07 UTC 2024","174794","tests.integration.high_availability","test_upgrade_from_stable","","","","test_upgrade_from_stable","Test updating from stable channel."
"passed","Mon Jun 17 01:31:17 UTC 2024","Mon Jun 17 01:31:20 UTC 2024","2125","tests.integration","test_tls","","","","test_connection_before_tls","Ensure connections (with and without ssl) are possible before relating with TLS operator."
"passed","Mon Jun 17 01:29:15 UTC 2024","Mon Jun 17 01:31:19 UTC 2024","124312","tests.integration","test_charm","","","","test_build_and_deploy","Build the mysql charm and deploy it."
"passed","Mon Jun 17 01:37:25 UTC 2024","Mon Jun 17 01:41:09 UTC 2024","223951","tests.integration.high_availability","test_replication","","","","test_kill_primary_check_reelection","Test to kill the primary under load and ensure re-election of primary."
"passed","Mon Jun 17 01:31:52 UTC 2024","Mon Jun 17 01:35:05 UTC 2024","192906","tests.integration.high_availability","test_upgrade","","","","test_upgrade_from_edge",""
"passed","Mon Jun 17 01:32:44 UTC 2024","Mon Jun 17 01:34:31 UTC 2024","106514","tests.integration.high_availability","test_replication","","","","test_no_replication_across_clusters","Test to ensure that writes to one cluster do not replicate to another cluster."
"passed","Mon Jun 17 01:29:30 UTC 2024","Mon Jun 17 01:31:36 UTC 2024","126148","tests.integration.high_availability","test_upgrade_rollback_incompat","","","","test_build_and_deploy","Simple test to ensure that the mysql and application charms get deployed."
"passed","Mon Jun 17 01:31:46 UTC 2024","Mon Jun 17 01:32:17 UTC 2024","30837","tests.integration.relations","test_database","","","","test_relation_broken","Remove relation and wait for the expected changes in status."
"passed","Mon Jun 17 01:32:59 UTC 2024","Mon Jun 17 01:33:29 UTC 2024","30124","tests.integration","test_tls","","","","test_disable_tls",""
"passed","Mon Jun 17 01:31:23 UTC 2024","Mon Jun 17 01:35:19 UTC 2024","235490","tests.integration","test_charm","","","","test_scale_up_and_down","Confirm that a new primary is elected when the current primary is torn down."
"passed","Mon Jun 17 01:29:22 UTC 2024","Mon Jun 17 01:31:54 UTC 2024","152599","tests.integration.relations","test_mysql_root","","","","test_deploy_and_relate_osm_bundle","Test the deployment and relation with osm bundle with mysql replacing mariadb."
"passed","Mon Jun 17 01:31:54 UTC 2024","Mon Jun 17 01:32:28 UTC 2024","34209","tests.integration.relations","test_mysql_root","","","","test_osm_pol_operations","Test the existence of databases and tables created by osm-pol's migrations."
"passed","Mon Jun 17 01:32:20 UTC 2024","Mon Jun 17 01:32:41 UTC 2024","20862","tests.integration.high_availability","test_replication","","","","test_check_consistency","Test to write to primary, and read the same data back from replicas."
"passed","Mon Jun 17 01:41:26 UTC 2024","Mon Jun 17 01:41:42 UTC 2024","15436","tests.integration.high_availability","test_async_replication","","","","test_rejoin_invalidated_cluster","Test rejoin invalidated cluster with."
"passed","Mon Jun 17 01:31:42 UTC 2024","Mon Jun 17 01:32:20 UTC 2024","37580","tests.integration.high_availability","test_upgrade_rollback_incompat","","","","test_upgrade_to_failling",""
"passed","Mon Jun 17 01:41:45 UTC 2024","Mon Jun 17 01:45:09 UTC 2024","203801","tests.integration.high_availability","test_async_replication","","","","test_remove_relation_and_relate","Test removing and re-relating the two mysql clusters."
"passed","Mon Jun 17 01:38:33 UTC 2024","Mon Jun 17 01:44:53 UTC 2024","380234","tests.integration","test_backups","","","","test_restore_on_new_cluster","Test to restore a backup on a new mysql cluster."
"passed","Mon Jun 17 01:33:51 UTC 2024","Mon Jun 17 01:38:33 UTC 2024","282265","tests.integration","test_backups","","","","test_restore_on_same_cluster","Test to restore a backup to the same mysql cluster."
"passed","Mon Jun 17 01:36:57 UTC 2024","Mon Jun 17 01:37:10 UTC 2024","13189","tests.integration","test_charm","","","","test_password_rotation_root_user_implicit","Rotate password and confirm changes."
"passed","Mon Jun 17 01:36:46 UTC 2024","Mon Jun 17 01:36:57 UTC 2024","10160","tests.integration","test_charm","","","","test_password_rotation_silent","Rotate password and confirm changes."
"passed","Mon Jun 17 01:35:19 UTC 2024","Mon Jun 17 01:36:35 UTC 2024","76709","tests.integration","test_charm","","","","test_scale_up_after_scale_down","Confirm storage reuse works."
"passed","Mon Jun 17 01:29:30 UTC 2024","Mon Jun 17 01:31:58 UTC 2024","148342","tests.integration.high_availability","test_upgrade_from_stable","","","","test_deploy_stable","Simple test to ensure that the mysql and application charms get deployed."
"passed","Mon Jun 17 01:34:32 UTC 2024","Mon Jun 17 01:37:23 UTC 2024","170962","tests.integration.high_availability","test_replication","","","","test_scaling_without_data_loss","Test to ensure that data is preserved when a unit is scaled up and then down.

    Ensures that there are no running continuous writes as the extra data in the
    database makes scaling up slower.
    "
