"Status","Start Time","Stop Time","Duration in ms","Parent Suite","Suite","Sub Suite","Test Class","Test Method","Name","Description"
"passed","Wed Jun 19 01:30:44 UTC 2024","Wed Jun 19 01:30:51 UTC 2024","7246","tests.integration.high_availability","test_upgrade_rollback_incompat","","","","test_pre_upgrade_check","Test that the pre-upgrade-check action runs successfully."
"passed","Wed Jun 19 01:33:39 UTC 2024","Wed Jun 19 01:36:31 UTC 2024","172390","tests.integration.high_availability","test_replication","","","","test_scaling_without_data_loss","Test to ensure that data is preserved when a unit is scaled up and then down.

    Ensures that there are no running continuous writes as the extra data in the
    database makes scaling up slower.
    "
"passed","Wed Jun 19 01:28:42 UTC 2024","Wed Jun 19 01:31:40 UTC 2024","178585","tests.integration.high_availability","test_replication","","","","test_build_and_deploy","Simple test to ensure that the mysql and application charms get deployed."
"passed","Wed Jun 19 01:28:42 UTC 2024","Wed Jun 19 01:31:20 UTC 2024","158536","tests.integration.high_availability","test_async_replication","","","","test_build_and_deploy","Simple test to ensure that the mysql and application charms get deployed."
"passed","Wed Jun 19 01:33:42 UTC 2024","Wed Jun 19 01:38:39 UTC 2024","297332","tests.integration","test_backups","","","","test_restore_on_same_cluster","Test to restore a backup to the same mysql cluster."
"passed","Wed Jun 19 01:30:50 UTC 2024","Wed Jun 19 01:34:39 UTC 2024","229358","tests.integration","test_charm","","","","test_scale_up_and_down","Confirm that a new primary is elected when the current primary is torn down."
"passed","Wed Jun 19 01:38:00 UTC 2024","Wed Jun 19 01:39:54 UTC 2024","113361","tests.integration.high_availability","test_self_healing","","","","test_graceful_crash_of_primary","Test to send SIGTERM to primary instance and then verify recovery."
"passed","Wed Jun 19 01:37:17 UTC 2024","Wed Jun 19 01:37:25 UTC 2024","7705","tests.integration","test_charm","","","","test_log_rotation","Test the log rotation of text files."
"passed","Wed Jun 19 01:28:24 UTC 2024","Wed Jun 19 01:31:27 UTC 2024","183734","tests.integration.high_availability","test_self_healing","","","","test_build_and_deploy","Simple test to ensure that the mysql and application charms get deployed."
"passed","Wed Jun 19 01:31:55 UTC 2024","Wed Jun 19 01:32:35 UTC 2024","39926","tests.integration","test_tls","","","","test_rotate_tls_key","Verify rotating tls private keys restarts cluster with new certificates.

    This test rotates tls private keys to randomly generated keys.
    "
"passed","Wed Jun 19 01:44:46 UTC 2024","Wed Jun 19 01:50:54 UTC 2024","367899","tests.integration.high_availability","test_self_healing","","","","test_graceful_full_cluster_crash_test","Test to send SIGTERM to all units and then ensure that the cluster recovers."
"passed","Wed Jun 19 01:28:33 UTC 2024","Wed Jun 19 01:30:50 UTC 2024","137539","tests.integration.relations","test_database","","","","test_build_and_deploy","Build the charm and deploy 3 units to ensure a cluster is formed."
"passed","Wed Jun 19 01:36:19 UTC 2024","Wed Jun 19 01:36:30 UTC 2024","11167","tests.integration","test_charm","","","","test_password_rotation","Rotate password and confirm changes."
"passed","Wed Jun 19 01:36:57 UTC 2024","Wed Jun 19 01:37:17 UTC 2024","20563","tests.integration","test_charm","","","","test_custom_variables","Query database for custom variables."
"passed","Wed Jun 19 01:30:45 UTC 2024","Wed Jun 19 01:30:50 UTC 2024","4143","tests.integration","test_charm","","","","test_consistent_data_replication_across_cluster","Confirm that data is replicated from the primary node to all the replicas."
"passed","Wed Jun 19 01:30:53 UTC 2024","Wed Jun 19 01:30:55 UTC 2024","2107","tests.integration","test_tls","","","","test_connection_before_tls","Ensure connections (with and without ssl) are possible before relating with TLS operator."
"passed","Wed Jun 19 01:36:53 UTC 2024","Wed Jun 19 01:36:57 UTC 2024","3973","tests.integration","test_charm","","","","test_exporter_endpoints","Test that endpoints are running."
"passed","Wed Jun 19 01:28:26 UTC 2024","Wed Jun 19 01:30:50 UTC 2024","144381","tests.integration.high_availability","test_upgrade_from_stable","","","","test_deploy_stable","Simple test to ensure that the mysql and application charms get deployed."
"passed","Wed Jun 19 01:40:45 UTC 2024","Wed Jun 19 01:44:09 UTC 2024","204353","tests.integration.high_availability","test_async_replication","","","","test_remove_relation_and_relate","Test removing and re-relating the two mysql clusters."
"passed","Wed Jun 19 01:31:20 UTC 2024","Wed Jun 19 01:31:23 UTC 2024","3151","tests.integration.high_availability","test_async_replication","","","","test_async_relate","Relate the two mysql clusters."
"passed","Wed Jun 19 01:36:30 UTC 2024","Wed Jun 19 01:36:40 UTC 2024","10169","tests.integration","test_charm","","","","test_password_rotation_silent","Rotate password and confirm changes."
"passed","Wed Jun 19 01:40:26 UTC 2024","Wed Jun 19 01:40:42 UTC 2024","16438","tests.integration.high_availability","test_async_replication","","","","test_rejoin_invalidated_cluster","Test rejoin invalidated cluster with."
"passed","Wed Jun 19 01:36:40 UTC 2024","Wed Jun 19 01:36:53 UTC 2024","12177","tests.integration","test_charm","","","","test_password_rotation_root_user_implicit","Rotate password and confirm changes."
"passed","Wed Jun 19 01:35:38 UTC 2024","Wed Jun 19 01:35:47 UTC 2024","8215","tests.integration.high_availability","test_async_replication","","","","test_data_replication","Test to write to primary, and read the same data back from replicas."
"passed","Wed Jun 19 01:31:48 UTC 2024","Wed Jun 19 01:32:23 UTC 2024","34252","tests.integration.relations","test_mysql_root","","","","test_osm_pol_operations","Test the existence of databases and tables created by osm-pol's migrations."
"passed","Wed Jun 19 01:29:15 UTC 2024","Wed Jun 19 01:31:48 UTC 2024","153735","tests.integration.relations","test_mysql_root","","","","test_deploy_and_relate_osm_bundle","Test the deployment and relation with osm bundle with mysql replacing mariadb."
"passed","Wed Jun 19 01:30:51 UTC 2024","Wed Jun 19 01:31:30 UTC 2024","39322","tests.integration.high_availability","test_upgrade_rollback_incompat","","","","test_upgrade_to_failling",""
"passed","Wed Jun 19 01:28:48 UTC 2024","Wed Jun 19 01:30:45 UTC 2024","117452","tests.integration","test_charm","","","","test_build_and_deploy","Build the mysql charm and deploy it."
"passed","Wed Jun 19 01:38:39 UTC 2024","Wed Jun 19 01:44:56 UTC 2024","376637","tests.integration","test_backups","","","","test_restore_on_new_cluster","Test to restore a backup on a new mysql cluster."
"passed","Wed Jun 19 01:34:24 UTC 2024","Wed Jun 19 01:37:48 UTC 2024","203478","tests.integration.high_availability","test_upgrade","","","","test_fail_and_rollback",""
"passed","Wed Jun 19 01:35:50 UTC 2024","Wed Jun 19 01:36:05 UTC 2024","15349","tests.integration.high_availability","test_async_replication","","","","test_standby_promotion","Test graceful promotion of a standby cluster to primary."
"passed","Wed Jun 19 01:29:57 UTC 2024","Wed Jun 19 01:31:54 UTC 2024","116189","tests.integration","test_backups","","","","test_build_and_deploy","Simple test to ensure that the mysql charm gets deployed."
"passed","Wed Jun 19 01:50:55 UTC 2024","Wed Jun 19 01:54:07 UTC 2024","191247","tests.integration.high_availability","test_self_healing","","","","test_single_unit_pod_delete","Delete the pod in a single unit deployment and write data to new pod."
"passed","Wed Jun 19 01:33:18 UTC 2024","Wed Jun 19 01:34:36 UTC 2024","78504","tests.integration.high_availability","test_async_replication","","","","test_deploy_router_and_app","Deploy the router and the test application."
"passed","Wed Jun 19 01:36:06 UTC 2024","Wed Jun 19 01:40:24 UTC 2024","257552","tests.integration.high_availability","test_async_replication","","","","test_failover","Test switchover on primary cluster fail."
"passed","Wed Jun 19 01:30:55 UTC 2024","Wed Jun 19 01:31:55 UTC 2024","59722","tests.integration","test_tls","","","","test_enable_tls","Test for encryption enablement when relation to TLS charm."
"passed","Wed Jun 19 01:31:22 UTC 2024","Wed Jun 19 01:31:43 UTC 2024","21559","tests.integration.relations","test_database","","","","test_relation_broken","Remove relation and wait for the expected changes in status."
"passed","Wed Jun 19 01:31:34 UTC 2024","Wed Jun 19 01:34:21 UTC 2024","167608","tests.integration.high_availability","test_upgrade","","","","test_upgrade_from_edge",""
"passed","Wed Jun 19 01:31:42 UTC 2024","Wed Jun 19 01:32:03 UTC 2024","20847","tests.integration.high_availability","test_replication","","","","test_check_consistency","Test to write to primary, and read the same data back from replicas."
"passed","Wed Jun 19 01:32:06 UTC 2024","Wed Jun 19 01:33:38 UTC 2024","91396","tests.integration.high_availability","test_replication","","","","test_no_replication_across_clusters","Test to ensure that writes to one cluster do not replicate to another cluster."
"passed","Wed Jun 19 01:28:37 UTC 2024","Wed Jun 19 01:30:44 UTC 2024","127017","tests.integration.high_availability","test_upgrade_rollback_incompat","","","","test_build_and_deploy","Simple test to ensure that the mysql and application charms get deployed."
"passed","Wed Jun 19 01:30:50 UTC 2024","Wed Jun 19 01:31:05 UTC 2024","14411","tests.integration.high_availability","test_upgrade_from_stable","","","","test_pre_upgrade_check","Test that the pre-upgrade-check action runs successfully."
"passed","Wed Jun 19 01:34:39 UTC 2024","Wed Jun 19 01:36:19 UTC 2024","100127","tests.integration","test_charm","","","","test_scale_up_after_scale_down","Confirm storage reuse works."
"passed","Wed Jun 19 01:31:54 UTC 2024","Wed Jun 19 01:33:42 UTC 2024","108242","tests.integration","test_backups","","","","test_backup","Test to create a backup and list backups."
"passed","Wed Jun 19 01:32:35 UTC 2024","Wed Jun 19 01:33:05 UTC 2024","30124","tests.integration","test_tls","","","","test_disable_tls",""
"passed","Wed Jun 19 01:28:53 UTC 2024","Wed Jun 19 01:30:53 UTC 2024","120106","tests.integration","test_tls","","","","test_build_and_deploy","Build the charm and deploy 3 units to ensure a cluster is formed."
"skipped","Wed Jun 19 01:30:50 UTC 2024","Wed Jun 19 01:30:50 UTC 2024","0","tests.integration.relations","test_database","","","","test_relation_creation_databag","Relate charms and wait for the expected changes in status."
"passed","Wed Jun 19 01:40:32 UTC 2024","Wed Jun 19 01:44:34 UTC 2024","241890","tests.integration.high_availability","test_self_healing","","","","test_network_cut_affecting_an_instance","Test for a network cut affecting an instance."
"passed","Wed Jun 19 01:31:29 UTC 2024","Wed Jun 19 01:33:00 UTC 2024","90626","tests.integration.high_availability","test_self_healing","","","","test_kill_db_process","Test to send a SIGKILL to the primary db process and ensure that the cluster self heals."
"passed","Wed Jun 19 01:31:05 UTC 2024","Wed Jun 19 01:34:23 UTC 2024","198293","tests.integration.high_availability","test_upgrade_from_stable","","","","test_upgrade_from_stable","Test updating from stable channel."
"passed","Wed Jun 19 01:36:33 UTC 2024","Wed Jun 19 01:40:00 UTC 2024","207236","tests.integration.high_availability","test_replication","","","","test_kill_primary_check_reelection","Test to kill the primary under load and ensure re-election of primary."
"passed","Wed Jun 19 01:31:30 UTC 2024","Wed Jun 19 01:34:05 UTC 2024","154403","tests.integration.high_availability","test_upgrade_rollback_incompat","","","","test_rollback",""
"passed","Wed Jun 19 01:28:35 UTC 2024","Wed Jun 19 01:31:17 UTC 2024","162208","tests.integration.high_availability","test_upgrade","","","","test_deploy_latest","Simple test to ensure that the mysql and application charms get deployed."
"passed","Wed Jun 19 01:33:03 UTC 2024","Wed Jun 19 01:37:56 UTC 2024","292983","tests.integration.high_availability","test_self_healing","","","","test_freeze_db_process","Test to send a SIGSTOP to the primary db process and ensure that the cluster self heals."
"passed","Wed Jun 19 01:30:50 UTC 2024","Wed Jun 19 01:31:22 UTC 2024","31521","tests.integration.relations","test_database","","","","test_relation_creation","Relate charms and wait for the expected changes in status."
"passed","Wed Jun 19 01:31:23 UTC 2024","Wed Jun 19 01:33:18 UTC 2024","114054","tests.integration.high_availability","test_async_replication","","","","test_create_replication","Run the create replication and wait for the applications to settle."
"passed","Wed Jun 19 01:31:17 UTC 2024","Wed Jun 19 01:31:32 UTC 2024","14393","tests.integration.high_availability","test_upgrade","","","","test_pre_upgrade_check","Test that the pre-upgrade-check action runs successfully."
