"Status","Start Time","Stop Time","Duration in ms","Parent Suite","Suite","Sub Suite","Test Class","Test Method","Name","Description"
"passed","Sat May 11 01:33:47 UTC 2024","Sat May 11 01:35:00 UTC 2024","73087","tests.integration","test_charm","","","","test_scale_up_after_scale_down","Confirm storage reuse works."
"passed","Sat May 11 01:28:08 UTC 2024","Sat May 11 01:31:21 UTC 2024","193010","tests.integration.relations","test_mysql_root","","","","test_deploy_and_relate_osm_bundle","Test the deployment and relation with osm bundle with mysql replacing mariadb."
"broken","Sat May 11 01:28:10 UTC 2024","Sat May 11 01:44:59 UTC 2024","1008998","tests.integration.relations","test_database","","","","test_build_and_deploy","Build the charm and deploy 3 units to ensure a cluster is formed."
"passed","Sat May 11 01:28:34 UTC 2024","Sat May 11 01:30:34 UTC 2024","120717","tests.integration.high_availability","test_upgrade_rollback_incompat","","","","test_build_and_deploy","Simple test to ensure that the mysql and application charms get deployed."
"passed","Sat May 11 01:38:11 UTC 2024","Sat May 11 01:40:01 UTC 2024","110400","tests.integration.high_availability","test_self_healing","","","","test_graceful_crash_of_primary","Test to send SIGTERM to primary instance and then verify recovery."
"passed","Sat May 11 01:33:10 UTC 2024","Sat May 11 01:35:47 UTC 2024","156212","tests.integration.high_availability","test_replication","","","","test_scaling_without_data_loss","Test to ensure that data is preserved when a unit is scaled up and then down.

    Ensures that there are no running continuous writes as the extra data in the
    database makes scaling up slower.
    "
"passed","Sat May 11 01:28:19 UTC 2024","Sat May 11 01:30:44 UTC 2024","145406","tests.integration.high_availability","test_upgrade_from_stable","","","","test_deploy_stable","Simple test to ensure that the mysql and application charms get deployed."
"passed","Sat May 11 01:35:20 UTC 2024","Sat May 11 01:35:29 UTC 2024","9144","tests.integration","test_charm","","","","test_password_rotation_root_user_implicit","Rotate password and confirm changes."
"passed","Sat May 11 01:35:46 UTC 2024","Sat May 11 01:35:55 UTC 2024","9082","tests.integration","test_charm","","","","test_log_rotation","Test the log rotation of text files."
"broken","Sat May 11 01:45:20 UTC 2024","Sat May 11 01:52:42 UTC 2024","441627","tests.integration.high_availability","test_self_healing","","","","test_graceful_full_cluster_crash_test","Test to send SIGTERM to all units and then ensure that the cluster recovers."
"passed","Sat May 11 01:39:21 UTC 2024","Sat May 11 01:42:26 UTC 2024","185268","tests.integration.high_availability","test_async_replication","","","","test_remove_relation_and_relate","Test removing and re-relating the two mysql clusters."
"passed","Sat May 11 01:35:33 UTC 2024","Sat May 11 01:35:46 UTC 2024","13478","tests.integration","test_charm","","","","test_custom_variables","Query database for custom variables."
"passed","Sat May 11 01:39:07 UTC 2024","Sat May 11 01:39:18 UTC 2024","11354","tests.integration.high_availability","test_async_replication","","","","test_rejoin_invalidated_cluster","Test rejoin invalidated cluster with."
"passed","Sat May 11 01:31:14 UTC 2024","Sat May 11 01:32:59 UTC 2024","104305","tests.integration","test_backups","","","","test_backup","Test to create a backup and list backups."
"passed","Sat May 11 01:35:10 UTC 2024","Sat May 11 01:35:20 UTC 2024","9142","tests.integration","test_charm","","","","test_password_rotation_silent","Rotate password and confirm changes."
"passed","Sat May 11 01:30:44 UTC 2024","Sat May 11 01:30:58 UTC 2024","13392","tests.integration.high_availability","test_upgrade_from_stable","","","","test_pre_upgrade_check","Test that the pre-upgrade-check action runs successfully."
"passed","Sat May 11 01:30:58 UTC 2024","Sat May 11 01:33:41 UTC 2024","163573","tests.integration.high_availability","test_upgrade_from_stable","","","","test_upgrade_from_stable","Test updating from stable channel."
"passed","Sat May 11 01:28:15 UTC 2024","Sat May 11 01:30:17 UTC 2024","121769","tests.integration","test_tls","","","","test_build_and_deploy","Build the charm and deploy 3 units to ensure a cluster is formed."
"passed","Sat May 11 01:34:30 UTC 2024","Sat May 11 01:34:46 UTC 2024","15624","tests.integration.high_availability","test_async_replication","","","","test_standby_promotion","Test graceful promotion of a standby cluster to primary."
"passed","Sat May 11 01:31:17 UTC 2024","Sat May 11 01:33:53 UTC 2024","155494","tests.integration.high_availability","test_upgrade_rollback_incompat","","","","test_rollback",""
"passed","Sat May 11 01:30:34 UTC 2024","Sat May 11 01:30:38 UTC 2024","3085","tests.integration.high_availability","test_upgrade_rollback_incompat","","","","test_pre_upgrade_check","Test that the pre-upgrade-check action runs successfully."
"passed","Sat May 11 01:34:19 UTC 2024","Sat May 11 01:34:27 UTC 2024","8221","tests.integration.high_availability","test_async_replication","","","","test_data_replication","Test to write to primary, and read the same data back from replicas."
"passed","Sat May 11 01:30:17 UTC 2024","Sat May 11 01:30:18 UTC 2024","1110","tests.integration","test_tls","","","","test_connection_before_tls","Ensure connections (with and without ssl) are possible before relating with TLS operator."
"passed","Sat May 11 01:34:47 UTC 2024","Sat May 11 01:39:05 UTC 2024","257690","tests.integration.high_availability","test_async_replication","","","","test_failover","Test switchover on primary cluster fail."
"passed","Sat May 11 01:30:22 UTC 2024","Sat May 11 01:33:47 UTC 2024","204943","tests.integration","test_charm","","","","test_scale_up_and_down","Confirm that a new primary is elected when the current primary is torn down."
"passed","Sat May 11 01:31:59 UTC 2024","Sat May 11 01:33:17 UTC 2024","78131","tests.integration.high_availability","test_async_replication","","","","test_deploy_router_and_app","Deploy the router and the test application."
"passed","Sat May 11 01:33:35 UTC 2024","Sat May 11 01:37:46 UTC 2024","251229","tests.integration.high_availability","test_upgrade","","","","test_fail_and_rollback",""
"passed","Sat May 11 01:30:22 UTC 2024","Sat May 11 01:31:59 UTC 2024","96689","tests.integration.high_availability","test_async_replication","","","","test_async_relate","Relate the two mysql clusters."
"passed","Sat May 11 01:31:21 UTC 2024","Sat May 11 01:32:25 UTC 2024","64416","tests.integration.relations","test_mysql_root","","","","test_osm_pol_operations","Test the existence of databases and tables created by osm-pol's migrations."
"passed","Sat May 11 01:27:52 UTC 2024","Sat May 11 01:30:22 UTC 2024","149508","tests.integration.high_availability","test_async_replication","","","","test_build_and_deploy","Simple test to ensure that the mysql and application charms get deployed."
"skipped","Sat May 11 01:44:59 UTC 2024","Sat May 11 01:44:59 UTC 2024","0","tests.integration.relations","test_database","","","","test_relation_broken","Remove relation and wait for the expected changes in status."
"passed","Sat May 11 01:31:58 UTC 2024","Sat May 11 01:32:28 UTC 2024","30128","tests.integration","test_tls","","","","test_disable_tls",""
"passed","Sat May 11 01:35:00 UTC 2024","Sat May 11 01:35:10 UTC 2024","10178","tests.integration","test_charm","","","","test_password_rotation","Rotate password and confirm changes."
"passed","Sat May 11 01:30:32 UTC 2024","Sat May 11 01:30:46 UTC 2024","14397","tests.integration.high_availability","test_upgrade","","","","test_pre_upgrade_check","Test that the pre-upgrade-check action runs successfully."
"passed","Sat May 11 01:30:48 UTC 2024","Sat May 11 01:33:32 UTC 2024","163732","tests.integration.high_availability","test_upgrade","","","","test_upgrade_from_edge",""
"passed","Sat May 11 01:32:59 UTC 2024","Sat May 11 01:37:35 UTC 2024","276578","tests.integration","test_backups","","","","test_restore_on_same_cluster","Test to restore a backup to the same mysql cluster."
"skipped","Sat May 11 01:44:59 UTC 2024","Sat May 11 01:44:59 UTC 2024","0","tests.integration.relations","test_database","","","","test_relation_creation_databag","Relate charms and wait for the expected changes in status."
"passed","Sat May 11 01:30:19 UTC 2024","Sat May 11 01:30:22 UTC 2024","3156","tests.integration","test_charm","","","","test_consistent_data_replication_across_cluster","Confirm that data is replicated from the primary node to all the replicas."
"passed","Sat May 11 01:30:18 UTC 2024","Sat May 11 01:31:19 UTC 2024","61285","tests.integration","test_tls","","","","test_enable_tls","Test for encryption enablement when relation to TLS charm."
"passed","Sat May 11 01:35:49 UTC 2024","Sat May 11 01:39:20 UTC 2024","211862","tests.integration.high_availability","test_replication","","","","test_kill_primary_check_reelection","Test to kill the primary under load and ensure re-election of primary."
"passed","Sat May 11 01:31:19 UTC 2024","Sat May 11 01:32:49 UTC 2024","89532","tests.integration.high_availability","test_self_healing","","","","test_kill_db_process","Test to send a SIGKILL to the primary db process and ensure that the cluster self heals."
"passed","Sat May 11 01:35:29 UTC 2024","Sat May 11 01:35:33 UTC 2024","3918","tests.integration","test_charm","","","","test_exporter_endpoints","Test that endpoints are running."
"skipped","Sat May 11 01:44:59 UTC 2024","Sat May 11 01:44:59 UTC 2024","0","tests.integration.relations","test_database","","","","test_relation_creation","Relate charms and wait for the expected changes in status."
"passed","Sat May 11 01:28:04 UTC 2024","Sat May 11 01:31:16 UTC 2024","191727","tests.integration.high_availability","test_replication","","","","test_build_and_deploy","Simple test to ensure that the mysql and application charms get deployed."
"passed","Sat May 11 01:31:18 UTC 2024","Sat May 11 01:31:39 UTC 2024","20837","tests.integration.high_availability","test_replication","","","","test_check_consistency","Test to write to primary, and read the same data back from replicas."
"passed","Sat May 11 01:28:20 UTC 2024","Sat May 11 01:30:19 UTC 2024","119271","tests.integration","test_charm","","","","test_build_and_deploy","Build the mysql charm and deploy it."
"passed","Sat May 11 01:28:03 UTC 2024","Sat May 11 01:30:32 UTC 2024","148521","tests.integration.high_availability","test_upgrade","","","","test_deploy_latest","Simple test to ensure that the mysql and application charms get deployed."
"passed","Sat May 11 01:37:35 UTC 2024","Sat May 11 01:43:39 UTC 2024","363202","tests.integration","test_backups","","","","test_restore_on_new_cluster","Test to restore a backup on a new mysql cluster."
"passed","Sat May 11 01:31:42 UTC 2024","Sat May 11 01:33:09 UTC 2024","87076","tests.integration.high_availability","test_replication","","","","test_no_replication_across_clusters","Test to ensure that writes to one cluster do not replicate to another cluster."
"passed","Sat May 11 01:40:36 UTC 2024","Sat May 11 01:45:06 UTC 2024","269905","tests.integration.high_availability","test_self_healing","","","","test_network_cut_affecting_an_instance","Test for a network cut affecting an instance."
"passed","Sat May 11 01:30:38 UTC 2024","Sat May 11 01:31:17 UTC 2024","39594","tests.integration.high_availability","test_upgrade_rollback_incompat","","","","test_upgrade_to_failling",""
"passed","Sat May 11 01:32:52 UTC 2024","Sat May 11 01:38:07 UTC 2024","315446","tests.integration.high_availability","test_self_healing","","","","test_freeze_db_process","Test to send a SIGSTOP to the primary db process and ensure that the cluster self heals."
"passed","Sat May 11 01:28:13 UTC 2024","Sat May 11 01:31:17 UTC 2024","184178","tests.integration.high_availability","test_self_healing","","","","test_build_and_deploy","Simple test to ensure that the mysql and application charms get deployed."
"passed","Sat May 11 01:31:19 UTC 2024","Sat May 11 01:31:58 UTC 2024","38721","tests.integration","test_tls","","","","test_rotate_tls_key","Verify rotating tls private keys restarts cluster with new certificates.

    This test rotates tls private keys to randomly generated keys.
    "
"passed","Sat May 11 01:29:32 UTC 2024","Sat May 11 01:31:14 UTC 2024","102831","tests.integration","test_backups","","","","test_build_and_deploy","Simple test to ensure that the mysql charm gets deployed."
"skipped","Sat May 11 01:52:43 UTC 2024","Sat May 11 01:52:43 UTC 2024","0","tests.integration.high_availability","test_self_healing","","","","test_single_unit_pod_delete","Delete the pod in a single unit deployment and write data to new pod."
