"DESCRIPTION","DURATION IN MS","NAME","PARENT SUITE","START TIME","STATUS","STOP TIME","SUB SUITE","SUITE","TEST CLASS","TEST METHOD"
"Deploy the router and the test application.","76388","test_deploy_router_and_app","tests.integration.high_availability","Thu May 08 01:32:31 UTC 2025","passed","Thu May 08 01:33:47 UTC 2025","","test_async_replication","",""
"Test behavior when node drains - pod is evicted and pvs are rotated.","149974","test_pod_eviction_and_pvc_deletion","tests.integration.high_availability","Thu May 08 01:33:29 UTC 2025","passed","Thu May 08 01:35:59 UTC 2025","","test_node_drain","",""
"Pitr tests.","339478","test_pitr_aws","tests.integration","Thu May 08 01:33:46 UTC 2025","passed","Thu May 08 01:39:26 UTC 2025","","test_backup_pitr_aws","",""
"Build and deploy for AWS.","211373","test_build_and_deploy_gcp","tests.integration","Thu May 08 01:29:26 UTC 2025","passed","Thu May 08 01:32:57 UTC 2025","","test_backup_pitr_gcp","",""
"Test to restore a backup on a new mysql cluster.","525257","test_restore_on_new_cluster","tests.integration","Thu May 08 01:35:40 UTC 2025","passed","Thu May 08 01:44:25 UTC 2025","","test_backup_ceph","",""
"Rotate password and confirm changes.","11153","test_password_rotation","tests.integration","Thu May 08 01:41:19 UTC 2025","passed","Thu May 08 01:41:30 UTC 2025","","test_charm","",""
"Test the existence of databases and tables created by osm-pol's migrations.","34407","test_osm_pol_operations","tests.integration.relations","Thu May 08 01:32:16 UTC 2025","passed","Thu May 08 01:32:51 UTC 2025","","test_mysql_root","",""
"Test graceful promotion of a standby cluster to primary.","21678","test_standby_promotion","tests.integration.high_availability","Thu May 08 01:36:33 UTC 2025","passed","Thu May 08 01:36:55 UTC 2025","","test_async_replication","",""
"Simple test to ensure that the mysql and application charms get deployed.","200223","test_deploy_latest","tests.integration.high_availability","Thu May 08 01:29:36 UTC 2025","passed","Thu May 08 01:32:57 UTC 2025","","test_upgrade","",""
"Relate the two mysql clusters.","4919","test_async_relate","tests.integration.high_availability","Thu May 08 01:32:26 UTC 2025","passed","Thu May 08 01:32:31 UTC 2025","","test_async_replication","",""
"","4750","test_saturate_max_connections","tests.integration","Thu May 08 01:31:09 UTC 2025","passed","Thu May 08 01:31:14 UTC 2025","","test_saturate_max_connections","",""
"","43128","test_upgrade_to_failling","tests.integration.high_availability","Thu May 08 01:31:52 UTC 2025","passed","Thu May 08 01:32:36 UTC 2025","","test_upgrade_rollback_incompat","",""
"Simple test to ensure that the mysql and application charms get deployed.","195976","test_deploy_stable","tests.integration.high_availability","Thu May 08 01:29:39 UTC 2025","passed","Thu May 08 01:32:55 UTC 2025","","test_upgrade_from_stable","",""
"Test that the pre-upgrade-check action runs successfully.","14616","test_pre_upgrade_check","tests.integration.high_availability","Thu May 08 01:32:57 UTC 2025","passed","Thu May 08 01:33:11 UTC 2025","","test_upgrade","",""
"Confirm that a new primary is elected when the current primary is torn down.","289269","test_scale_up_and_down","tests.integration","Thu May 08 01:31:50 UTC 2025","passed","Thu May 08 01:36:40 UTC 2025","","test_charm","",""
"Simple test to ensure that the mysql and application charms get deployed.","127835","test_build_and_deploy","tests.integration.high_availability","Thu May 08 01:29:40 UTC 2025","passed","Thu May 08 01:31:47 UTC 2025","","test_upgrade_rollback_incompat","",""
"Test for a network cut affecting an instance.","363657","test_network_cut_affecting_an_instance","tests.integration.high_availability","Thu May 08 01:33:22 UTC 2025","passed","Thu May 08 01:39:26 UTC 2025","","test_self_healing_network_cut","",""
"Query database for custom variables.","25202","test_custom_variables","tests.integration","Thu May 08 01:41:59 UTC 2025","passed","Thu May 08 01:42:24 UTC 2025","","test_charm","",""
"Run the create replication and wait for the applications to settle.","151970","test_create_replication","tests.integration.high_availability","Thu May 08 01:33:47 UTC 2025","passed","Thu May 08 01:36:19 UTC 2025","","test_async_replication","",""
"Test to send SIGTERM to all units and then ensure that the cluster recovers.","314350","test_graceful_full_cluster_crash_test","tests.integration.high_availability","Thu May 08 01:33:34 UTC 2025","passed","Thu May 08 01:38:49 UTC 2025","","test_self_healing_stop_all","",""
"Simple test to ensure that the mysql charm gets deployed.","112535","test_build_and_deploy","tests.integration","Thu May 08 01:29:44 UTC 2025","passed","Thu May 08 01:31:37 UTC 2025","","test_backup_aws","",""
"Confirm storage reuse works.","99036","test_scale_up_after_scale_down","tests.integration","Thu May 08 01:36:40 UTC 2025","passed","Thu May 08 01:38:19 UTC 2025","","test_charm","",""
"Test to restore a backup to the same mysql cluster.","182277","test_restore_on_same_cluster","tests.integration","Thu May 08 01:32:45 UTC 2025","passed","Thu May 08 01:35:47 UTC 2025","","test_backup_gcp","",""
"Build the charm and deploy 1 units to ensure a cluster is formed.","28266","test_build_and_deploy","tests.integration","Thu May 08 01:29:39 UTC 2025","passed","Thu May 08 01:30:07 UTC 2025","","test_multi_relations","",""
"Test COS integrations formed before mysql is allocated and deployed.","95008","test_deploy_bundle_with_cos_integrations","tests.integration","Thu May 08 01:29:41 UTC 2025","passed","Thu May 08 01:31:16 UTC 2025","","test_cos_integration_bundle","",""
"Test the deployment and relation with osm bundle with mysql replacing mariadb.","162076","test_deploy_and_relate_osm_bundle","tests.integration.relations","Thu May 08 01:29:34 UTC 2025","passed","Thu May 08 01:32:16 UTC 2025","","test_mysql_root","",""
"Test to create a backup and list backups.","39951","test_backup","tests.integration","Thu May 08 01:32:03 UTC 2025","passed","Thu May 08 01:32:43 UTC 2025","","test_backup_gcp","",""
"Test to send a SIGKILL to the primary db process and ensure that the cluster self heals.","112779","test_kill_db_process","tests.integration.high_availability","Thu May 08 01:32:48 UTC 2025","passed","Thu May 08 01:34:41 UTC 2025","","test_self_healing_process_killed","",""
"Build the mysql charm and deploy it.","135973","test_build_and_deploy","tests.integration","Thu May 08 01:29:30 UTC 2025","passed","Thu May 08 01:31:46 UTC 2025","","test_charm","",""
"Test removing and re-relating the two mysql clusters.","266412","test_remove_relation_and_relate","tests.integration.high_availability","Thu May 08 01:42:28 UTC 2025","passed","Thu May 08 01:46:55 UTC 2025","","test_async_replication","",""
"","243828","test_fail_and_rollback","tests.integration.high_availability","Thu May 08 01:36:35 UTC 2025","passed","Thu May 08 01:40:39 UTC 2025","","test_upgrade","",""
"Build the charm and deploy 3 units to ensure a cluster is formed.","131094","test_build_and_deploy","tests.integration","Thu May 08 01:29:39 UTC 2025","passed","Thu May 08 01:31:50 UTC 2025","","test_tls","",""
"Rotate password and confirm changes.","11165","test_password_rotation_silent","tests.integration","Thu May 08 01:41:30 UTC 2025","passed","Thu May 08 01:41:41 UTC 2025","","test_charm","",""
"Ensure connections (with and without ssl) are possible before relating with TLS operator.","2269","test_connection_before_tls","tests.integration","Thu May 08 01:31:50 UTC 2025","passed","Thu May 08 01:31:52 UTC 2025","","test_tls","",""
"Test updating from stable channel.","204915","test_upgrade_from_stable","tests.integration.high_availability","Thu May 08 01:33:14 UTC 2025","passed","Thu May 08 01:36:39 UTC 2025","","test_upgrade_from_stable","",""
"Test for encryption enablement when relation to TLS charm.","63991","test_enable_tls","tests.integration","Thu May 08 01:31:52 UTC 2025","passed","Thu May 08 01:32:56 UTC 2025","","test_tls","",""
"Simple test to ensure that the mysql and application charms get deployed.","167539","test_build_and_deploy","tests.integration.high_availability","Thu May 08 01:29:39 UTC 2025","passed","Thu May 08 01:32:26 UTC 2025","","test_async_replication","",""
"Test switchover on primary cluster fail.","290637","test_failover","tests.integration.high_availability","Thu May 08 01:36:56 UTC 2025","passed","Thu May 08 01:41:46 UTC 2025","","test_async_replication","",""
"Build the charm and deploy 3 units to ensure a cluster is formed.","132690","test_build_and_deploy","tests.integration.relations","Thu May 08 01:29:43 UTC 2025","passed","Thu May 08 01:31:56 UTC 2025","","test_database","",""
"Test the log rotation of text files.

    Run continuous writes to ensure that audit log plugin is loaded and active
    when mysql-test-app runs start-continuous-writes (by logging into mysql).
    ","5709","test_log_rotation","tests.integration.high_availability","Thu May 08 01:33:21 UTC 2025","passed","Thu May 08 01:33:27 UTC 2025","","test_log_rotation","",""
"Test to create a backup and list backups.","42782","test_backup","tests.integration","Thu May 08 01:32:07 UTC 2025","passed","Thu May 08 01:32:50 UTC 2025","","test_backup_ceph","",""
"Ensure scaling down to zero and back up works.","180493","test_scale_up_from_zero","tests.integration","Thu May 08 01:38:19 UTC 2025","passed","Thu May 08 01:41:19 UTC 2025","","test_charm","",""
"Scale database and routers.","480261","test_scale_out","tests.integration","Thu May 08 01:32:48 UTC 2025","passed","Thu May 08 01:40:48 UTC 2025","","test_multi_relations","",""
"Test to send SIGTERM to primary instance and then verify recovery.","78281","test_graceful_crash_of_primary","tests.integration.high_availability","Thu May 08 01:33:21 UTC 2025","passed","Thu May 08 01:34:40 UTC 2025","","test_self_healing_stop_primary","",""
"Confirm that data is replicated from the primary node to all the replicas.","4352","test_consistent_data_replication_across_cluster","tests.integration","Thu May 08 01:31:46 UTC 2025","passed","Thu May 08 01:31:50 UTC 2025","","test_charm","",""
"Test to restore a backup to the same mysql cluster.","168198","test_restore_on_same_cluster","tests.integration","Thu May 08 01:32:52 UTC 2025","passed","Thu May 08 01:35:40 UTC 2025","","test_backup_ceph","",""
"Remove relation and wait for the expected changes in status.","22484","test_relation_broken","tests.integration.relations","Thu May 08 01:32:30 UTC 2025","passed","Thu May 08 01:32:53 UTC 2025","","test_database","",""
"Test to create a backup and list backups.","52961","test_backup","tests.integration","Thu May 08 01:31:39 UTC 2025","passed","Thu May 08 01:32:32 UTC 2025","","test_backup_aws","",""
"Test to ensure that writes to one cluster do not replicate to another cluster.","72474","test_no_replication_across_clusters","tests.integration.high_availability","Thu May 08 01:32:29 UTC 2025","passed","Thu May 08 01:33:41 UTC 2025","","test_replication_data_isolation","",""
"Relate charms and wait for the expected changes in status.","0","test_relation_creation_databag","tests.integration.relations","Thu May 08 01:31:56 UTC 2025","skipped","Thu May 08 01:31:56 UTC 2025","","test_database","",""
"The cluster manual re-join test.

    A graceful restart is performed in one of the instances (choosing Primary to make it painful).
    In order to verify that the instance can come back ONLINE, after disabling automatic re-join
    ","93471","test_cluster_manual_rejoin","tests.integration.high_availability","Thu May 08 01:33:21 UTC 2025","passed","Thu May 08 01:34:54 UTC 2025","","test_self_healing_restart_graceful","",""
"Test to kill the primary under load and ensure re-election of primary.","283553","test_kill_primary_check_reelection","tests.integration.high_availability","Thu May 08 01:33:21 UTC 2025","passed","Thu May 08 01:38:04 UTC 2025","","test_replication_reelection","",""
"Test that the pre-upgrade-check action runs successfully.","5095","test_pre_upgrade_check","tests.integration.high_availability","Thu May 08 01:31:47 UTC 2025","passed","Thu May 08 01:31:52 UTC 2025","","test_upgrade_rollback_incompat","",""
"Simple test to ensure that the mysql charm gets deployed.","108487","test_build_and_deploy","tests.integration","Thu May 08 01:30:12 UTC 2025","passed","Thu May 08 01:32:01 UTC 2025","","test_backup_gcp","",""
"Verify rotating tls private keys restarts cluster with new certificates.

    This test rotates tls private keys to randomly generated keys.
    ","41985","test_rotate_tls_key","tests.integration","Thu May 08 01:32:56 UTC 2025","passed","Thu May 08 01:33:38 UTC 2025","","test_tls","",""
"Test to restore a backup on a new mysql cluster.","455238","test_restore_on_new_cluster","tests.integration","Thu May 08 01:35:47 UTC 2025","passed","Thu May 08 01:43:22 UTC 2025","","test_backup_gcp","",""
"Test to write to primary, and read the same data back from replicas.","8549","test_data_replication","tests.integration.high_availability","Thu May 08 01:36:21 UTC 2025","passed","Thu May 08 01:36:30 UTC 2025","","test_async_replication","",""
"Tries deploying an arm64 charm on amd64 host.","60192","test_arm_charm_on_amd_host","tests.integration","Thu May 08 01:29:56 UTC 2025","passed","Thu May 08 01:30:56 UTC 2025","","test_architecture","",""
"","57774","test_deploy_and_relate_test_app","tests.integration","Thu May 08 01:30:11 UTC 2025","passed","Thu May 08 01:31:09 UTC 2025","","test_saturate_max_connections","",""
"Test primary crash during startup.

    It must recover/end setup when the primary got offline.
    ","170858","test_crash_during_cluster_setup","tests.integration.high_availability","Thu May 08 01:29:26 UTC 2025","passed","Thu May 08 01:32:17 UTC 2025","","test_crash_during_setup","",""
"Test to restore a backup on a new mysql cluster.","485002","test_restore_on_new_cluster","tests.integration","Thu May 08 01:35:17 UTC 2025","passed","Thu May 08 01:43:22 UTC 2025","","test_backup_aws","",""
"Simple test to ensure that the mysql charm gets deployed.","107188","test_build_and_deploy","tests.integration","Thu May 08 01:30:18 UTC 2025","passed","Thu May 08 01:32:05 UTC 2025","","test_backup_ceph","",""
"Test to send a SIGSTOP to the primary db process and ensure that the cluster self heals.","313241","test_freeze_db_process","tests.integration.high_availability","Thu May 08 01:32:42 UTC 2025","passed","Thu May 08 01:37:55 UTC 2025","","test_self_healing_process_frozen","",""
"Scale database and routers.","215338","test_scale_in","tests.integration","Thu May 08 01:40:48 UTC 2025","passed","Thu May 08 01:44:23 UTC 2025","","test_multi_relations","",""
"Relate all the applications to the database.","160370","test_relate_all","tests.integration","Thu May 08 01:30:07 UTC 2025","passed","Thu May 08 01:32:48 UTC 2025","","test_multi_relations","",""
"Test to ensure that data is preserved when a unit is scaled up and then down.

    Ensures that there are no running continuous writes as the extra data in the
    database makes scaling up slower.
    ","171631","test_scaling_without_data_loss","tests.integration.high_availability","Thu May 08 01:33:30 UTC 2025","passed","Thu May 08 01:36:22 UTC 2025","","test_replication_scaling","",""
"","305848","test_rollback","tests.integration.high_availability","Thu May 08 01:32:36 UTC 2025","passed","Thu May 08 01:37:41 UTC 2025","","test_upgrade_rollback_incompat","",""
"Test that the pre-upgrade-check action runs successfully.","16608","test_pre_upgrade_check","tests.integration.high_availability","Thu May 08 01:32:55 UTC 2025","passed","Thu May 08 01:33:12 UTC 2025","","test_upgrade_from_stable","",""
"Test the labeling of k8s endpoints when apps with same cluster-name deployed.","378113","test_labeling_of_k8s_endpoints","tests.integration.high_availability","Thu May 08 01:29:33 UTC 2025","passed","Thu May 08 01:35:51 UTC 2025","","test_k8s_endpoints","",""
"Build and deploy for AWS.","205081","test_build_and_deploy_aws","tests.integration","Thu May 08 01:30:21 UTC 2025","passed","Thu May 08 01:33:46 UTC 2025","","test_backup_pitr_aws","",""
"","194693","test_upgrade_from_edge","tests.integration.high_availability","Thu May 08 01:33:15 UTC 2025","passed","Thu May 08 01:36:30 UTC 2025","","test_upgrade","",""
"Rotate password and confirm changes.","13163","test_password_rotation_root_user_implicit","tests.integration","Thu May 08 01:41:41 UTC 2025","passed","Thu May 08 01:41:55 UTC 2025","","test_charm","",""
"Test that endpoints are running.","3999","test_exporter_endpoints","tests.integration","Thu May 08 01:41:55 UTC 2025","passed","Thu May 08 01:41:59 UTC 2025","","test_charm","",""
"Delete the pod in a single unit deployment and write data to new pod.","235318","test_single_unit_pod_delete","tests.integration.high_availability","Thu May 08 01:33:35 UTC 2025","passed","Thu May 08 01:37:30 UTC 2025","","test_self_healing_pod","",""
"Test to write to primary, and read the same data back from replicas.","37241","test_check_consistency","tests.integration.high_availability","Thu May 08 01:32:44 UTC 2025","passed","Thu May 08 01:33:21 UTC 2025","","test_replication_data_consistency","",""
"Tries deploying an amd64 charm on arm64 host.","0","test_amd_charm_on_arm_host","tests.integration","Thu May 08 01:30:56 UTC 2025","skipped","Thu May 08 01:30:56 UTC 2025","","test_architecture","",""
"","30241","test_disable_tls","tests.integration","Thu May 08 01:33:38 UTC 2025","passed","Thu May 08 01:34:09 UTC 2025","","test_tls","",""
"Build the charm and deploy 1 units to ensure a cluster is formed.","7146","test_build_and_deploy","tests.integration","Thu May 08 01:30:04 UTC 2025","passed","Thu May 08 01:30:11 UTC 2025","","test_saturate_max_connections","",""
"Pitr tests.","275515","test_pitr_aws","tests.integration","Thu May 08 01:32:57 UTC 2025","passed","Thu May 08 01:37:32 UTC 2025","","test_backup_pitr_gcp","",""
"Test to restore a backup to the same mysql cluster.","163324","test_restore_on_same_cluster","tests.integration","Thu May 08 01:32:34 UTC 2025","passed","Thu May 08 01:35:17 UTC 2025","","test_backup_aws","",""
"Test rejoin invalidated cluster with.","36807","test_rejoin_invalidated_cluster","tests.integration.high_availability","Thu May 08 01:41:48 UTC 2025","passed","Thu May 08 01:42:25 UTC 2025","","test_async_replication","",""
"Relate charms and wait for the expected changes in status.","34642","test_relation_creation","tests.integration.relations","Thu May 08 01:31:56 UTC 2025","passed","Thu May 08 01:32:30 UTC 2025","","test_database","",""
