"DESCRIPTION","DURATION IN MS","NAME","PARENT SUITE","START TIME","STATUS","STOP TIME","SUB SUITE","SUITE","TEST CLASS","TEST METHOD"
"Test to ensure that writes to one cluster do not replicate to another cluster.","76391","test_no_replication_across_clusters","tests.integration.high_availability","2025-10-11","passed","2025-10-11","","test_replication_data_isolation","",""
"","30178","test_disable_tls","tests.integration","2025-10-11","passed","2025-10-11","","test_tls","",""
"Relate charms and wait for the expected changes in status.","0","test_relation_creation_databag","tests.integration.relations","2025-10-11","skipped","2025-10-11","","test_database","",""
"Rotate password and confirm changes.","11172","test_password_rotation_silent","tests.integration","2025-10-11","passed","2025-10-11","","test_charm","",""
"Tries deploying an amd64 charm on arm64 host.","0","test_amd_charm_on_arm_host","tests.integration","2025-10-11","skipped","2025-10-11","","test_architecture","",""
"Ensure connections (with and without ssl) are possible before relating with TLS operator.","2201","test_connection_before_tls","tests.integration","2025-10-11","passed","2025-10-11","","test_tls","",""
"Test COS integrations formed before mysql is allocated and deployed.","91097","test_deploy_bundle_with_cos_integrations","tests.integration","2025-10-11","passed","2025-10-11","","test_cos_integration_bundle","",""
"Test to create a backup and list backups.","55550","test_backup","tests.integration","2025-10-11","passed","2025-10-11","","test_backup_ceph","",""
"Tries deploying an arm64 charm on amd64 host.","58187","test_arm_charm_on_amd_host","tests.integration","2025-10-11","passed","2025-10-11","","test_architecture","",""
"Remove relation and wait for the expected changes in status.","22616","test_relation_broken","tests.integration.relations","2025-10-11","passed","2025-10-11","","test_database","",""
"Test the promote-to-primary command after losing the majority of nodes, with force flag.","319241","test_cluster_failover_after_majority_loss","tests.integration.high_availability","2025-10-11","passed","2025-10-11","","test_primary_switchover","",""
"Rotate password and confirm changes.","12171","test_password_rotation","tests.integration","2025-10-11","passed","2025-10-11","","test_charm","",""
"Delete the pod in a single unit deployment and write data to new pod.","254907","test_single_unit_pod_delete","tests.integration.high_availability","2025-10-11","passed","2025-10-11","","test_self_healing_pod","",""
"","4869","test_saturate_max_connections","tests.integration","2025-10-11","passed","2025-10-11","","test_saturate_max_connections","",""
"Test to send SIGTERM to primary instance and then verify recovery.","127276","test_graceful_crash_of_primary","tests.integration.high_availability","2025-10-11","passed","2025-10-11","","test_self_healing_stop_primary","",""
"Test to ensure that data is preserved when a unit is scaled up and then down.

    Ensures that there are no running continuous writes as the extra data in the
    database makes scaling up slower.
    ","239418","test_scaling_without_data_loss","tests.integration.high_availability","2025-10-11","passed","2025-10-11","","test_replication_scaling","",""
"Build the charm and deploy 3 units to ensure a cluster is formed.","8700","test_build_and_deploy","tests.integration.relations","2025-10-11","passed","2025-10-11","","test_database","",""
"Simple test to ensure that the mysql and data-integrator charms get deployed.","156109","test_build_and_deploy","tests.integration.roles","2025-10-11","passed","2025-10-11","","test_database_dba_role","",""
"Test to restore a backup to the same mysql cluster.","212840","test_restore_on_same_cluster","tests.integration","2025-10-11","passed","2025-10-11","","test_backup_ceph","",""
"Confirm storage reuse works.","83783","test_scale_up_after_scale_down","tests.integration","2025-10-11","passed","2025-10-11","","test_charm","",""
"Deploy the router and the test application.","57808","test_deploy_router_and_app","tests.integration.high_availability","2025-10-11","passed","2025-10-11","","test_async_replication","",""
"","62406","test_deploy_and_relate_test_app","tests.integration","2025-10-11","passed","2025-10-11","","test_saturate_max_connections","",""
"Test to restore a backup on a new mysql cluster.","486119","test_restore_on_new_cluster","tests.integration","2025-10-11","passed","2025-10-11","","test_backup_ceph","",""
"Relate the two MySQL clusters.","33724","test_async_relate","tests.integration.high_availability","2025-10-11","passed","2025-10-11","","test_async_replication_upgrade","",""
"Rotate password and confirm changes.","13169","test_password_rotation_root_user_implicit","tests.integration","2025-10-11","passed","2025-10-11","","test_charm","",""
"Query database for custom variables.","24866","test_custom_variables","tests.integration","2025-10-11","passed","2025-10-11","","test_charm","",""
"Test the labeling of k8s endpoints when apps with same cluster-name deployed.","404403","test_labeling_of_k8s_endpoints","tests.integration.high_availability","2025-10-11","passed","2025-10-11","","test_k8s_endpoints","",""
"Test to send a SIGSTOP to the primary db process and ensure that the cluster self heals.","358521","test_freeze_db_process","tests.integration.high_availability","2025-10-11","passed","2025-10-11","","test_self_healing_process_frozen","",""
"Test that the pre-upgrade-check action runs successfully.","19305","test_pre_upgrade_check","tests.integration.high_availability","2025-10-11","passed","2025-10-11","","test_upgrade","",""
"Test to write to primary, and read the same data back from replicas.","29502","test_data_replication","tests.integration.high_availability","2025-10-11","failed","2025-10-11","","test_async_replication_upgrade","",""
"Relate charms before they have time to properly start.

    It simulates a Terraform-like deployment strategy
    ","165781","test_relation_creation_eager","tests.integration.relations","2025-10-11","passed","2025-10-11","","test_mysql_root","",""
"Upgrade the two MySQL clusters.","301421","test_upgrade_from_edge","tests.integration.high_availability","2025-10-11","broken","2025-10-11","","test_async_replication_upgrade","",""
"Update the second cluster.","300242","test_upgrade_from_edge","tests.integration.high_availability","2025-10-11","passed","2025-10-11","","test_upgrade","",""
"Build the charm and deploy 3 units to ensure a cluster is formed.","6874","test_build_and_deploy","tests.integration.relations","2025-10-11","passed","2025-10-11","","test_mysql_root","",""
"Build the mysql charm and deploy it.","129235","test_build_and_deploy","tests.integration","2025-10-11","passed","2025-10-11","","test_charm","",""
"Test for encryption enablement when relation to TLS charm.","62906","test_enable_tls","tests.integration","2025-10-11","passed","2025-10-11","","test_tls","",""
"Scale database and routers.","921343","test_scale_out","tests.integration","2025-10-11","passed","2025-10-11","","test_multi_relations","",""
"Verify rotating tls private keys restarts cluster with new certificates.

    This test rotates tls private keys to randomly generated keys.
    ","41094","test_rotate_tls_key","tests.integration","2025-10-11","passed","2025-10-11","","test_tls","",""
"Test the deployment and relation with osm bundle with mysql replacing mariadb.","148379","test_deploy_and_relate_osm_bundle","tests.integration","2025-10-11","passed","2025-10-11","","test_osm_integration_bundle","",""
"Simple test to ensure that the mysql and data-integrator charms get deployed.","162765","test_build_and_deploy","tests.integration.roles","2025-10-11","passed","2025-10-11","","test_instance_roles","",""
"Simple test to ensure that the mysql charm gets deployed.","170638","test_build_and_deploy","tests.integration","2025-10-11","passed","2025-10-11","","test_backup_gcp","",""
"Test to restore a backup to the same mysql cluster.","223925","test_restore_on_same_cluster","tests.integration","2025-10-11","passed","2025-10-11","","test_backup_aws","",""
"Run the create-replication action and wait for the applications to settle.","193574","test_create_replication","tests.integration.high_availability","2025-10-11","passed","2025-10-11","","test_async_replication","",""
"Test upgrade rollback to a healthy revision.","325249","test_rollback","tests.integration.high_availability","2025-10-11","passed","2025-10-11","","test_upgrade_rollback_incompat","",""
"Run the create-replication action and wait for the applications to settle.","194606","test_create_replication","tests.integration.high_availability","2025-10-11","passed","2025-10-11","","test_async_replication_upgrade","",""
"Build and deploy for AWS.","214847","test_build_and_deploy_gcp","tests.integration","2025-10-11","passed","2025-10-11","","test_backup_pitr_gcp","",""
"Build the charm and deploy 1 units to ensure a cluster is formed.","6191","test_build_and_deploy","tests.integration","2025-10-11","passed","2025-10-11","","test_saturate_max_connections","",""
"Simple test to ensure that the MySQL application charms get deployed.","162685","test_build_and_deploy","tests.integration.high_availability","2025-10-11","passed","2025-10-11","","test_async_replication","",""
"Test primary crash during startup.

    It must recover/end setup when the primary got offline.
    ","190296","test_crash_during_cluster_setup","tests.integration.high_availability","2025-10-11","passed","2025-10-11","","test_crash_during_setup","",""
"Build the charm and deploy 1 units to ensure a cluster is formed.","36495","test_build_and_deploy","tests.integration","2025-10-11","passed","2025-10-11","","test_multi_relations","",""
"Test to send a SIGKILL to the primary db process and ensure that the cluster self heals.","125826","test_kill_db_process","tests.integration.high_availability","2025-10-11","passed","2025-10-11","","test_self_healing_process_killed","",""
"Simple test to ensure that the MySQL application charms get deployed.","160425","test_build_and_deploy","tests.integration.high_availability","2025-10-11","passed","2025-10-11","","test_async_replication_upgrade","",""
"Test that the pre-upgrade-check action runs successfully.","23620","test_pre_upgrade_check","tests.integration.high_availability","2025-10-11","passed","2025-10-11","","test_upgrade_from_stable","",""
"Test removing and re-relating the two mysql clusters.","314618","test_unrelate_and_relate","tests.integration.high_availability","2025-10-11","passed","2025-10-11","","test_async_replication","",""
"","38369","test_upgrade_to_failing","tests.integration.high_availability","2025-10-11","passed","2025-10-11","","test_upgrade_rollback_incompat","",""
"Test for a network cut affecting an instance.","224563","test_network_cut_affecting_an_instance","tests.integration.high_availability","2025-10-11","passed","2025-10-11","","test_self_healing_network_cut","",""
"Simple test to ensure that the mysql charm gets deployed.","164440","test_build_and_deploy","tests.integration","2025-10-11","passed","2025-10-11","","test_backup_ceph","",""
"Simple test to ensure that the MySQL and application charms get deployed.","107080","test_build_and_deploy","tests.integration.high_availability","2025-10-11","passed","2025-10-11","","test_upgrade_rollback_incompat","",""
"Test to restore a backup on a new mysql cluster.","567006","test_restore_on_new_cluster","tests.integration","2025-10-11","passed","2025-10-11","","test_backup_gcp","",""
"Test to send SIGTERM to all units and then ensure that the cluster recovers.","298169","test_graceful_full_cluster_crash_test","tests.integration.high_availability","2025-10-11","passed","2025-10-11","","test_self_healing_stop_all","",""
"Ensure scaling down to zero and back up works.","154495","test_scale_up_from_zero","tests.integration","2025-10-11","passed","2025-10-11","","test_charm","",""
"Simple test to ensure that the MySQL and application charms get deployed.","129301","test_deploy_stable","tests.integration.high_availability","2025-10-11","passed","2025-10-11","","test_upgrade_from_stable","",""
"Scale database and routers.","287041","test_scale_in","tests.integration","2025-10-11","passed","2025-10-11","","test_multi_relations","",""
"Test rejoin invalidated cluster with.","25577","test_rejoin_invalidated_cluster","tests.integration.high_availability","2025-10-11","passed","2025-10-11","","test_async_replication","",""
"Relate all the applications to the database.","170592","test_relate_all","tests.integration","2025-10-11","passed","2025-10-11","","test_multi_relations","",""
"Test to write to primary, and read the same data back from replicas.","19339","test_data_replication","tests.integration.high_availability","2025-10-11","passed","2025-10-11","","test_async_replication","",""
"Test behavior when node drains - pod is evicted and pvs are rotated.","142933","test_pod_eviction_and_pvc_deletion","tests.integration.high_availability","2025-10-11","passed","2025-10-11","","test_node_drain","",""
"Test the charmed_read predefined role.","62963","test_charmed_read_role","tests.integration.roles","2025-10-11","passed","2025-10-11","","test_instance_roles","",""
"Test that endpoints are running.","4061","test_exporter_endpoints","tests.integration","2025-10-11","passed","2025-10-11","","test_charm","",""
"Test to create a backup and list backups.","62690","test_backup","tests.integration","2025-10-11","passed","2025-10-11","","test_backup_aws","",""
"Test to restore a backup to the same mysql cluster.","217208","test_restore_on_same_cluster","tests.integration","2025-10-11","passed","2025-10-11","","test_backup_gcp","",""
"The cluster manual re-join test.

    A graceful restart is performed in one of the instances (choosing Primary to make it painful).
    In order to verify that the instance can come back ONLINE, after disabling automatic re-join
    ","93569","test_cluster_manual_rejoin","tests.integration.high_availability","2025-10-11","passed","2025-10-11","","test_self_healing_restart_graceful","",""
"Pitr tests.","287955","test_pitr_aws","tests.integration","2025-10-11","passed","2025-10-11","","test_backup_pitr_aws","",""
"Test the database-level DBA role.","66845","test_charmed_dba_role","tests.integration.roles","2025-10-11","passed","2025-10-11","","test_database_dba_role","",""
"Pitr tests.","217961","test_pitr_aws","tests.integration","2025-10-11","passed","2025-10-11","","test_backup_pitr_gcp","",""
"Test to restore a backup on a new mysql cluster.","534267","test_restore_on_new_cluster","tests.integration","2025-10-11","passed","2025-10-11","","test_backup_aws","",""
"Build the charm and deploy 3 units to ensure a cluster is formed.","129891","test_build_and_deploy","tests.integration","2025-10-11","passed","2025-10-11","","test_tls","",""
"Confirm that data is replicated from the primary node to all the replicas.","4271","test_consistent_data_replication_across_cluster","tests.integration","2025-10-11","passed","2025-10-11","","test_charm","",""
"Relate the two MySQL clusters.","39836","test_async_relate","tests.integration.high_availability","2025-10-11","passed","2025-10-11","","test_async_replication","",""
"Test to create a backup and list backups.","49679","test_backup","tests.integration","2025-10-11","passed","2025-10-11","","test_backup_gcp","",""
"Simple test to ensure that the MySQL and application charms get deployed.","130693","test_deploy_latest","tests.integration.high_availability","2025-10-11","passed","2025-10-11","","test_upgrade","",""
"Test an upgrade failure and its rollback.","354067","test_fail_and_rollback","tests.integration.high_availability","2025-10-11","passed","2025-10-11","","test_upgrade","",""
"Relate charms and wait for the expected changes in status.","16034","test_relation_creation","tests.integration.relations","2025-10-11","passed","2025-10-11","","test_database","",""
"Test that the primary node can be switched over.","11898","test_cluster_switchover","tests.integration.high_availability","2025-10-11","passed","2025-10-11","","test_primary_switchover","",""
"Simple test to ensure that the mysql and data-integrator charms get deployed.","170173","test_build_and_deploy","tests.integration.roles","2025-10-11","passed","2025-10-11","","test_instance_dba_role","",""
"Test graceful promotion of a standby cluster to primary.","38633","test_standby_promotion","tests.integration.high_availability","2025-10-11","passed","2025-10-11","","test_async_replication","",""
"Update the second cluster.","257969","test_upgrade_from_stable","tests.integration.high_availability","2025-10-11","passed","2025-10-11","","test_upgrade_from_stable","",""
"Confirm that a new primary is elected when the current primary is torn down.","242178","test_scale_up_and_down","tests.integration","2025-10-11","passed","2025-10-11","","test_charm","",""
"Test to write to primary, and read the same data back from replicas.","26694","test_check_consistency","tests.integration.high_availability","2025-10-11","passed","2025-10-11","","test_replication_data_consistency","",""
"Simple test to ensure that the mysql charm gets deployed.","193087","test_build_and_deploy","tests.integration","2025-10-11","passed","2025-10-11","","test_backup_aws","",""
"Test to kill the primary under load and ensure re-election of primary.","221185","test_kill_primary_check_reelection","tests.integration.high_availability","2025-10-11","passed","2025-10-11","","test_replication_reelection","",""
"Test switchover on primary cluster fail.","438250","test_failover","tests.integration.high_availability","2025-10-11","passed","2025-10-11","","test_async_replication","",""
"Relate charms before they have time to properly start.

    It simulates a Terraform-like deployment strategy
    ","164122","test_relation_creation_eager","tests.integration.relations","2025-10-11","passed","2025-10-11","","test_database","",""
"Deploy the test application.","25695","test_deploy_test_app","tests.integration.high_availability","2025-10-11","passed","2025-10-11","","test_async_replication_upgrade","",""
"Test the DBA predefined role.","30796","test_charmed_dba_role","tests.integration.roles","2025-10-11","passed","2025-10-11","","test_instance_dba_role","",""
"Test the charmed_dml role.","84575","test_charmed_dml_role","tests.integration.roles","2025-10-11","passed","2025-10-11","","test_instance_roles","",""
"Test that the pre-upgrade-check action runs successfully.","5521","test_pre_upgrade_check","tests.integration.high_availability","2025-10-11","passed","2025-10-11","","test_upgrade_rollback_incompat","",""
"Test the existence of databases and tables created by osm-pol's migrations.","34342","test_osm_pol_operations","tests.integration","2025-10-11","passed","2025-10-11","","test_osm_integration_bundle","",""
"Test the log rotation of text files.

    Run continuous writes to ensure that audit log plugin is loaded and active
    when mysql-test-app runs start-continuous-writes (by logging into mysql).
    ","6362","test_log_rotation","tests.integration.high_availability","2025-10-11","passed","2025-10-11","","test_log_rotation","",""
"Build and deploy for AWS.","231017","test_build_and_deploy_aws","tests.integration","2025-10-11","passed","2025-10-11","","test_backup_pitr_aws","",""
