"DESCRIPTION","DURATION IN MS","NAME","PARENT SUITE","START TIME","STATUS","STOP TIME","SUB SUITE","SUITE","TEST CLASS","TEST METHOD"
"Run the create replication and wait for the applications to settle.","157561","test_create_replication","tests.integration.high_availability","Tue Aug 05 01:46:42 UTC 2025","passed","Tue Aug 05 01:49:20 UTC 2025","","test_async_replication","",""
"Test the log rotation of text files.

    Run continuous writes to ensure that audit log plugin is loaded and active
    when mysql-test-app runs start-continuous-writes (by logging into mysql).
    ","5579","test_log_rotation","tests.integration.high_availability","Tue Aug 05 01:47:19 UTC 2025","passed","Tue Aug 05 01:47:24 UTC 2025","","test_log_rotation","",""
"Test to kill the primary under load and ensure re-election of primary.","246653","test_kill_primary_check_reelection","tests.integration.high_availability","Tue Aug 05 01:50:21 UTC 2025","passed","Tue Aug 05 01:54:28 UTC 2025","","test_replication_reelection","",""
"Test to send SIGTERM to all units and then ensure that the cluster recovers.","297096","test_graceful_full_cluster_crash_test","tests.integration.high_availability","Tue Aug 05 01:47:21 UTC 2025","passed","Tue Aug 05 01:52:18 UTC 2025","","test_self_healing_stop_all","",""
"Tries deploying an amd64 charm on arm64 host.","0","test_amd_charm_on_arm_host","tests.integration","Tue Aug 05 01:41:25 UTC 2025","skipped","Tue Aug 05 01:41:25 UTC 2025","","test_architecture","",""
"Remove relation and wait for the expected changes in status.","24761","test_relation_broken","tests.integration.relations","Tue Aug 05 01:46:55 UTC 2025","passed","Tue Aug 05 01:47:20 UTC 2025","","test_database","",""
"","55212","test_upgrade_to_failling","tests.integration.high_availability","Tue Aug 05 01:49:37 UTC 2025","passed","Tue Aug 05 01:50:32 UTC 2025","","test_upgrade_rollback_incompat","",""
"Test to create a backup and list backups.","43197","test_backup","tests.integration","Tue Aug 05 01:45:58 UTC 2025","passed","Tue Aug 05 01:46:41 UTC 2025","","test_backup_gcp","",""
"Test that the pre-upgrade-check action runs successfully.","22537","test_pre_upgrade_check","tests.integration.high_availability","Tue Aug 05 01:47:17 UTC 2025","passed","Tue Aug 05 01:47:40 UTC 2025","","test_upgrade_from_stable","",""
"Rotate password and confirm changes.","11148","test_password_rotation_silent","tests.integration","Tue Aug 05 01:53:31 UTC 2025","passed","Tue Aug 05 01:53:42 UTC 2025","","test_charm","",""
"Rotate password and confirm changes.","11159","test_password_rotation","tests.integration","Tue Aug 05 01:53:20 UTC 2025","passed","Tue Aug 05 01:53:31 UTC 2025","","test_charm","",""
"Test primary crash during startup.

    It must recover/end setup when the primary got offline.
    ","155932","test_crash_during_cluster_setup","tests.integration.high_availability","Tue Aug 05 01:46:18 UTC 2025","passed","Tue Aug 05 01:48:54 UTC 2025","","test_crash_during_setup","",""
"Verify rotating tls private keys restarts cluster with new certificates.

    This test rotates tls private keys to randomly generated keys.
    ","41018","test_rotate_tls_key","tests.integration","Tue Aug 05 01:51:21 UTC 2025","passed","Tue Aug 05 01:52:02 UTC 2025","","test_tls","",""
"Test to send a SIGSTOP to the primary db process and ensure that the cluster self heals.","433484","test_freeze_db_process","tests.integration.high_availability","Tue Aug 05 01:49:41 UTC 2025","passed","Tue Aug 05 01:56:54 UTC 2025","","test_self_healing_process_frozen","",""
"Test that the pre-upgrade-check action runs successfully.","0","test_pre_upgrade_check","tests.integration.high_availability","Tue Aug 05 01:48:14 UTC 2025","skipped","Tue Aug 05 01:48:14 UTC 2025","","test_upgrade","",""
"Relate all the applications to the database.","160392","test_relate_all","tests.integration","Tue Aug 05 01:47:41 UTC 2025","passed","Tue Aug 05 01:50:21 UTC 2025","","test_multi_relations","",""
"Test to restore a backup on a new mysql cluster.","509961","test_restore_on_new_cluster","tests.integration","Tue Aug 05 01:49:27 UTC 2025","passed","Tue Aug 05 01:57:57 UTC 2025","","test_backup_gcp","",""
"Relate the two mysql clusters.","4945","test_async_relate","tests.integration.high_availability","Tue Aug 05 01:45:18 UTC 2025","passed","Tue Aug 05 01:45:23 UTC 2025","","test_async_replication","",""
"Scale database and routers.","465264","test_scale_out","tests.integration","Tue Aug 05 01:50:21 UTC 2025","passed","Tue Aug 05 01:58:06 UTC 2025","","test_multi_relations","",""
"Test to send SIGTERM to primary instance and then verify recovery.","92811","test_graceful_crash_of_primary","tests.integration.high_availability","Tue Aug 05 01:47:21 UTC 2025","passed","Tue Aug 05 01:48:54 UTC 2025","","test_self_healing_stop_primary","",""
"","0","test_fail_and_rollback","tests.integration.high_availability","Tue Aug 05 01:48:14 UTC 2025","skipped","Tue Aug 05 01:48:14 UTC 2025","","test_upgrade","",""
"Test to restore a backup to the same mysql cluster.","164455","test_restore_on_same_cluster","tests.integration","Tue Aug 05 01:46:43 UTC 2025","passed","Tue Aug 05 01:49:27 UTC 2025","","test_backup_gcp","",""
"Test to write to primary, and read the same data back from replicas.","26809","test_check_consistency","tests.integration.high_availability","Tue Aug 05 01:49:36 UTC 2025","passed","Tue Aug 05 01:50:03 UTC 2025","","test_replication_data_consistency","",""
"Test the existence of databases and tables created by osm-pol's migrations.","34326","test_osm_pol_operations","tests.integration.relations","Tue Aug 05 01:49:46 UTC 2025","passed","Tue Aug 05 01:50:21 UTC 2025","","test_mysql_root","",""
"Build the charm and deploy 3 units to ensure a cluster is formed.","150108","test_build_and_deploy","tests.integration","Tue Aug 05 01:47:46 UTC 2025","passed","Tue Aug 05 01:50:16 UTC 2025","","test_tls","",""
"Test removing and re-relating the two mysql clusters.","627494","test_remove_relation_and_relate","tests.integration.high_availability","Tue Aug 05 01:55:22 UTC 2025","broken","Tue Aug 05 02:05:50 UTC 2025","","test_async_replication","",""
"Test graceful promotion of a standby cluster to primary.","22560","test_standby_promotion","tests.integration.high_availability","Tue Aug 05 01:49:33 UTC 2025","passed","Tue Aug 05 01:49:56 UTC 2025","","test_async_replication","",""
"Ensure scaling down to zero and back up works.","159450","test_scale_up_from_zero","tests.integration","Tue Aug 05 01:50:41 UTC 2025","passed","Tue Aug 05 01:53:20 UTC 2025","","test_charm","",""
"Test to ensure that data is preserved when a unit is scaled up and then down.

    Ensures that there are no running continuous writes as the extra data in the
    database makes scaling up slower.
    ","237983","test_scaling_without_data_loss","tests.integration.high_availability","Tue Aug 05 01:49:26 UTC 2025","passed","Tue Aug 05 01:53:24 UTC 2025","","test_replication_scaling","",""
"Test to send a SIGKILL to the primary db process and ensure that the cluster self heals.","137161","test_kill_db_process","tests.integration.high_availability","Tue Aug 05 01:51:41 UTC 2025","passed","Tue Aug 05 01:53:58 UTC 2025","","test_self_healing_process_killed","",""
"","14687","test_saturate_max_connections","tests.integration","Tue Aug 05 01:45:20 UTC 2025","passed","Tue Aug 05 01:45:34 UTC 2025","","test_saturate_max_connections","",""
"Test the labeling of k8s endpoints when apps with same cluster-name deployed.","401150","test_labeling_of_k8s_endpoints","tests.integration.high_availability","Tue Aug 05 01:47:05 UTC 2025","passed","Tue Aug 05 01:53:46 UTC 2025","","test_k8s_endpoints","",""
"Test to restore a backup to the same mysql cluster.","157737","test_restore_on_same_cluster","tests.integration","Tue Aug 05 01:46:12 UTC 2025","passed","Tue Aug 05 01:48:49 UTC 2025","","test_backup_aws","",""
"Tries deploying an arm64 charm on amd64 host.","55382","test_arm_charm_on_amd_host","tests.integration","Tue Aug 05 01:40:30 UTC 2025","passed","Tue Aug 05 01:41:25 UTC 2025","","test_architecture","",""
"Test for a network cut affecting an instance.","221785","test_network_cut_affecting_an_instance","tests.integration.high_availability","Tue Aug 05 01:47:47 UTC 2025","passed","Tue Aug 05 01:51:29 UTC 2025","","test_self_healing_network_cut","",""
"","30183","test_disable_tls","tests.integration","Tue Aug 05 01:52:02 UTC 2025","passed","Tue Aug 05 01:52:32 UTC 2025","","test_tls","",""
"Build the charm and deploy 3 units to ensure a cluster is formed.","126982","test_build_and_deploy","tests.integration.relations","Tue Aug 05 01:44:17 UTC 2025","passed","Tue Aug 05 01:46:24 UTC 2025","","test_database","",""
"Scale database and routers.","210242","test_scale_in","tests.integration","Tue Aug 05 01:58:06 UTC 2025","passed","Tue Aug 05 02:01:37 UTC 2025","","test_multi_relations","",""
"Confirm storage reuse works.","76741","test_scale_up_after_scale_down","tests.integration","Tue Aug 05 01:49:24 UTC 2025","passed","Tue Aug 05 01:50:41 UTC 2025","","test_charm","",""
"Test the deployment and relation with osm bundle with mysql replacing mariadb.","148141","test_deploy_and_relate_osm_bundle","tests.integration.relations","Tue Aug 05 01:47:18 UTC 2025","passed","Tue Aug 05 01:49:46 UTC 2025","","test_mysql_root","",""
"Build the mysql charm and deploy it.","124747","test_build_and_deploy","tests.integration","Tue Aug 05 01:42:44 UTC 2025","passed","Tue Aug 05 01:44:49 UTC 2025","","test_charm","",""
"Relate charms and wait for the expected changes in status.","0","test_relation_creation_databag","tests.integration.relations","Tue Aug 05 01:46:24 UTC 2025","skipped","Tue Aug 05 01:46:24 UTC 2025","","test_database","",""
"Test to ensure that writes to one cluster do not replicate to another cluster.","76086","test_no_replication_across_clusters","tests.integration.high_availability","Tue Aug 05 01:49:52 UTC 2025","passed","Tue Aug 05 01:51:08 UTC 2025","","test_replication_data_isolation","",""
"Relate charms and wait for the expected changes in status.","31816","test_relation_creation","tests.integration.relations","Tue Aug 05 01:46:24 UTC 2025","passed","Tue Aug 05 01:46:55 UTC 2025","","test_database","",""
"","51988","test_deploy_and_relate_test_app","tests.integration","Tue Aug 05 01:44:28 UTC 2025","passed","Tue Aug 05 01:45:20 UTC 2025","","test_saturate_max_connections","",""
"Test to restore a backup on a new mysql cluster.","509482","test_restore_on_new_cluster","tests.integration","Tue Aug 05 01:48:49 UTC 2025","passed","Tue Aug 05 01:57:19 UTC 2025","","test_backup_aws","",""
"Test COS integrations formed before mysql is allocated and deployed.","","test_deploy_bundle_with_cos_integrations","tests.integration","","unknown","","","test_cos_integration_bundle","",""
"Simple test to ensure that the mysql and application charms get deployed.","90004","test_deploy_latest","tests.integration.high_availability","Tue Aug 05 01:46:44 UTC 2025","broken","Tue Aug 05 01:48:14 UTC 2025","","test_upgrade","",""
"Test behavior when node drains - pod is evicted and pvs are rotated.","195612","test_pod_eviction_and_pvc_deletion","tests.integration.high_availability","Tue Aug 05 01:49:21 UTC 2025","passed","Tue Aug 05 01:52:37 UTC 2025","","test_node_drain","",""
"Test that endpoints are running.","4025","test_exporter_endpoints","tests.integration","Tue Aug 05 01:53:55 UTC 2025","passed","Tue Aug 05 01:54:00 UTC 2025","","test_charm","",""
"Test that the pre-upgrade-check action runs successfully.","14138","test_pre_upgrade_check","tests.integration.high_availability","Tue Aug 05 01:49:23 UTC 2025","passed","Tue Aug 05 01:49:37 UTC 2025","","test_upgrade_rollback_incompat","",""
"Test to write to primary, and read the same data back from replicas.","8408","test_data_replication","tests.integration.high_availability","Tue Aug 05 01:49:22 UTC 2025","passed","Tue Aug 05 01:49:30 UTC 2025","","test_async_replication","",""
"Simple test to ensure that the mysql and application charms get deployed.","124616","test_build_and_deploy","tests.integration.high_availability","Tue Aug 05 01:47:18 UTC 2025","passed","Tue Aug 05 01:49:23 UTC 2025","","test_upgrade_rollback_incompat","",""
"Test to restore a backup to the same mysql cluster.","149768","test_restore_on_same_cluster","tests.integration","Tue Aug 05 01:46:04 UTC 2025","passed","Tue Aug 05 01:48:34 UTC 2025","","test_backup_ceph","",""
"Simple test to ensure that the mysql and application charms get deployed.","189374","test_build_and_deploy","tests.integration.high_availability","Tue Aug 05 01:42:09 UTC 2025","passed","Tue Aug 05 01:45:18 UTC 2025","","test_async_replication","",""
"Simple test to ensure that the mysql charm gets deployed.","113318","test_build_and_deploy","tests.integration","Tue Aug 05 01:43:29 UTC 2025","passed","Tue Aug 05 01:45:22 UTC 2025","","test_backup_aws","",""
"Pitr tests.","298153","test_pitr_aws","tests.integration","Tue Aug 05 01:46:44 UTC 2025","passed","Tue Aug 05 01:51:42 UTC 2025","","test_backup_pitr_aws","",""
"Confirm that a new primary is elected when the current primary is torn down.","271005","test_scale_up_and_down","tests.integration","Tue Aug 05 01:44:53 UTC 2025","passed","Tue Aug 05 01:49:24 UTC 2025","","test_charm","",""
"Build the charm and deploy 1 units to ensure a cluster is formed.","28953","test_build_and_deploy","tests.integration","Tue Aug 05 01:47:12 UTC 2025","passed","Tue Aug 05 01:47:41 UTC 2025","","test_multi_relations","",""
"Pitr tests.","215723","test_pitr_aws","tests.integration","Tue Aug 05 01:44:44 UTC 2025","passed","Tue Aug 05 01:48:20 UTC 2025","","test_backup_pitr_gcp","",""
"Build and deploy for AWS.","223435","test_build_and_deploy_aws","tests.integration","Tue Aug 05 01:43:00 UTC 2025","passed","Tue Aug 05 01:46:44 UTC 2025","","test_backup_pitr_aws","",""
"Ensure connections (with and without ssl) are possible before relating with TLS operator.","2218","test_connection_before_tls","tests.integration","Tue Aug 05 01:50:16 UTC 2025","passed","Tue Aug 05 01:50:19 UTC 2025","","test_tls","",""
"","0","test_upgrade_from_edge","tests.integration.high_availability","Tue Aug 05 01:48:14 UTC 2025","skipped","Tue Aug 05 01:48:14 UTC 2025","","test_upgrade","",""
"Test to create a backup and list backups.","45656","test_backup","tests.integration","Tue Aug 05 01:45:24 UTC 2025","passed","Tue Aug 05 01:46:10 UTC 2025","","test_backup_aws","",""
"Rotate password and confirm changes.","13171","test_password_rotation_root_user_implicit","tests.integration","Tue Aug 05 01:53:42 UTC 2025","passed","Tue Aug 05 01:53:55 UTC 2025","","test_charm","",""
"Build the charm and deploy 1 units to ensure a cluster is formed.","7273","test_build_and_deploy","tests.integration","Tue Aug 05 01:44:20 UTC 2025","passed","Tue Aug 05 01:44:28 UTC 2025","","test_saturate_max_connections","",""
"Simple test to ensure that the mysql charm gets deployed.","126936","test_build_and_deploy","tests.integration","Tue Aug 05 01:43:49 UTC 2025","passed","Tue Aug 05 01:45:56 UTC 2025","","test_backup_gcp","",""
"Test to create a backup and list backups.","42678","test_backup","tests.integration","Tue Aug 05 01:45:20 UTC 2025","passed","Tue Aug 05 01:46:02 UTC 2025","","test_backup_ceph","",""
"Query database for custom variables.","24841","test_custom_variables","tests.integration","Tue Aug 05 01:54:00 UTC 2025","passed","Tue Aug 05 01:54:24 UTC 2025","","test_charm","",""
"The cluster manual re-join test.

    A graceful restart is performed in one of the instances (choosing Primary to make it painful).
    In order to verify that the instance can come back ONLINE, after disabling automatic re-join
    ","94506","test_cluster_manual_rejoin","tests.integration.high_availability","Tue Aug 05 01:50:37 UTC 2025","passed","Tue Aug 05 01:52:11 UTC 2025","","test_self_healing_restart_graceful","",""
"Simple test to ensure that the mysql and application charms get deployed.","188682","test_deploy_stable","tests.integration.high_availability","Tue Aug 05 01:44:09 UTC 2025","passed","Tue Aug 05 01:47:17 UTC 2025","","test_upgrade_from_stable","",""
"Confirm that data is replicated from the primary node to all the replicas.","4248","test_consistent_data_replication_across_cluster","tests.integration","Tue Aug 05 01:44:49 UTC 2025","passed","Tue Aug 05 01:44:53 UTC 2025","","test_charm","",""
"Test for encryption enablement when relation to TLS charm.","62488","test_enable_tls","tests.integration","Tue Aug 05 01:50:19 UTC 2025","passed","Tue Aug 05 01:51:21 UTC 2025","","test_tls","",""
"Test switchover on primary cluster fail.","294736","test_failover","tests.integration.high_availability","Tue Aug 05 01:49:57 UTC 2025","passed","Tue Aug 05 01:54:51 UTC 2025","","test_async_replication","",""
"Test rejoin invalidated cluster with.","23603","test_rejoin_invalidated_cluster","tests.integration.high_availability","Tue Aug 05 01:54:56 UTC 2025","passed","Tue Aug 05 01:55:19 UTC 2025","","test_async_replication","",""
"Test updating from stable channel.","206118","test_upgrade_from_stable","tests.integration.high_availability","Tue Aug 05 01:47:42 UTC 2025","passed","Tue Aug 05 01:51:08 UTC 2025","","test_upgrade_from_stable","",""
"Build and deploy for AWS.","191689","test_build_and_deploy_gcp","tests.integration","Tue Aug 05 01:41:32 UTC 2025","passed","Tue Aug 05 01:44:44 UTC 2025","","test_backup_pitr_gcp","",""
"Test to restore a backup on a new mysql cluster.","547182","test_restore_on_new_cluster","tests.integration","Tue Aug 05 01:48:34 UTC 2025","passed","Tue Aug 05 01:57:41 UTC 2025","","test_backup_ceph","",""
"Deploy the router and the test application.","79045","test_deploy_router_and_app","tests.integration.high_availability","Tue Aug 05 01:45:23 UTC 2025","passed","Tue Aug 05 01:46:42 UTC 2025","","test_async_replication","",""
"Delete the pod in a single unit deployment and write data to new pod.","231375","test_single_unit_pod_delete","tests.integration.high_availability","Tue Aug 05 01:46:54 UTC 2025","passed","Tue Aug 05 01:50:46 UTC 2025","","test_self_healing_pod","",""
"Simple test to ensure that the mysql charm gets deployed.","105572","test_build_and_deploy","tests.integration","Tue Aug 05 01:43:32 UTC 2025","passed","Tue Aug 05 01:45:18 UTC 2025","","test_backup_ceph","",""
"","296565","test_rollback","tests.integration.high_availability","Tue Aug 05 01:50:32 UTC 2025","passed","Tue Aug 05 01:55:29 UTC 2025","","test_upgrade_rollback_incompat","",""
