"DESCRIPTION","DURATION IN MS","NAME","PARENT SUITE","START TIME","STATUS","STOP TIME","SUB SUITE","SUITE","TEST CLASS","TEST METHOD"
"Relate charms and wait for the expected changes in status.","0","test_relation_creation_databag","tests.integration.relations","Wed Jun 18 01:30:35 UTC 2025","skipped","Wed Jun 18 01:30:35 UTC 2025","","test_database","",""
"Simple test to ensure that the mysql and application charms get deployed.","128084","test_build_and_deploy","tests.integration.high_availability","Wed Jun 18 01:28:09 UTC 2025","passed","Wed Jun 18 01:30:17 UTC 2025","","test_upgrade_rollback_incompat","",""
"Ensure connections (with and without ssl) are possible before relating with TLS operator.","2271","test_connection_before_tls","tests.integration","Wed Jun 18 01:30:26 UTC 2025","passed","Wed Jun 18 01:30:29 UTC 2025","","test_tls","",""
"Test to kill the primary under load and ensure re-election of primary.","285343","test_kill_primary_check_reelection","tests.integration.high_availability","Wed Jun 18 01:31:21 UTC 2025","passed","Wed Jun 18 01:36:06 UTC 2025","","test_replication_reelection","",""
"Scale database and routers.","475266","test_scale_out","tests.integration","Wed Jun 18 01:31:48 UTC 2025","passed","Wed Jun 18 01:39:44 UTC 2025","","test_multi_relations","",""
"Scale database and routers.","215238","test_scale_in","tests.integration","Wed Jun 18 01:39:44 UTC 2025","passed","Wed Jun 18 01:43:19 UTC 2025","","test_multi_relations","",""
"Test behavior when node drains - pod is evicted and pvs are rotated.","150202","test_pod_eviction_and_pvc_deletion","tests.integration.high_availability","Wed Jun 18 01:31:21 UTC 2025","passed","Wed Jun 18 01:33:51 UTC 2025","","test_node_drain","",""
"Test removing and re-relating the two mysql clusters.","608492","test_remove_relation_and_relate","tests.integration.high_availability","Wed Jun 18 01:41:28 UTC 2025","passed","Wed Jun 18 01:51:36 UTC 2025","","test_async_replication","",""
"Test to create a backup and list backups.","43299","test_backup","tests.integration","Wed Jun 18 01:30:47 UTC 2025","passed","Wed Jun 18 01:31:30 UTC 2025","","test_backup_ceph","",""
"Test that the pre-upgrade-check action runs successfully.","18711","test_pre_upgrade_check","tests.integration.high_availability","Wed Jun 18 01:30:55 UTC 2025","passed","Wed Jun 18 01:31:13 UTC 2025","","test_upgrade_from_stable","",""
"Relate charms and wait for the expected changes in status.","43108","test_relation_creation","tests.integration.relations","Wed Jun 18 01:30:35 UTC 2025","passed","Wed Jun 18 01:31:18 UTC 2025","","test_database","",""
"Test primary crash during startup.

    It must recover/end setup when the primary got offline.
    ","167569","test_crash_during_cluster_setup","tests.integration.high_availability","Wed Jun 18 01:28:10 UTC 2025","passed","Wed Jun 18 01:30:58 UTC 2025","","test_crash_during_setup","",""
"","30254","test_disable_tls","tests.integration","Wed Jun 18 01:32:13 UTC 2025","passed","Wed Jun 18 01:32:43 UTC 2025","","test_tls","",""
"","43114","test_upgrade_to_failling","tests.integration.high_availability","Wed Jun 18 01:30:21 UTC 2025","passed","Wed Jun 18 01:31:04 UTC 2025","","test_upgrade_rollback_incompat","",""
"Simple test to ensure that the mysql charm gets deployed.","113008","test_build_and_deploy","tests.integration","Wed Jun 18 01:28:37 UTC 2025","passed","Wed Jun 18 01:30:30 UTC 2025","","test_backup_aws","",""
"Test graceful promotion of a standby cluster to primary.","21668","test_standby_promotion","tests.integration.high_availability","Wed Jun 18 01:35:33 UTC 2025","passed","Wed Jun 18 01:35:54 UTC 2025","","test_async_replication","",""
"Rotate password and confirm changes.","13174","test_password_rotation_root_user_implicit","tests.integration","Wed Jun 18 01:40:21 UTC 2025","passed","Wed Jun 18 01:40:34 UTC 2025","","test_charm","",""
"Simple test to ensure that the mysql and application charms get deployed.","173549","test_build_and_deploy","tests.integration.high_availability","Wed Jun 18 01:28:36 UTC 2025","passed","Wed Jun 18 01:31:29 UTC 2025","","test_async_replication","",""
"","167594","test_upgrade_from_edge","tests.integration.high_availability","Wed Jun 18 01:31:42 UTC 2025","passed","Wed Jun 18 01:34:30 UTC 2025","","test_upgrade","",""
"Test to send a SIGSTOP to the primary db process and ensure that the cluster self heals.","365540","test_freeze_db_process","tests.integration.high_availability","Wed Jun 18 01:31:36 UTC 2025","passed","Wed Jun 18 01:37:41 UTC 2025","","test_self_healing_process_frozen","",""
"Test to send SIGTERM to primary instance and then verify recovery.","98343","test_graceful_crash_of_primary","tests.integration.high_availability","Wed Jun 18 01:31:54 UTC 2025","passed","Wed Jun 18 01:33:33 UTC 2025","","test_self_healing_stop_primary","",""
"Test to restore a backup on a new mysql cluster.","544629","test_restore_on_new_cluster","tests.integration","Wed Jun 18 01:34:17 UTC 2025","passed","Wed Jun 18 01:43:22 UTC 2025","","test_backup_ceph","",""
"The cluster manual re-join test.

    A graceful restart is performed in one of the instances (choosing Primary to make it painful).
    In order to verify that the instance can come back ONLINE, after disabling automatic re-join
    ","90841","test_cluster_manual_rejoin","tests.integration.high_availability","Wed Jun 18 01:31:41 UTC 2025","passed","Wed Jun 18 01:33:12 UTC 2025","","test_self_healing_restart_graceful","",""
"Test to restore a backup on a new mysql cluster.","515187","test_restore_on_new_cluster","tests.integration","Wed Jun 18 01:34:17 UTC 2025","passed","Wed Jun 18 01:42:52 UTC 2025","","test_backup_aws","",""
"Query database for custom variables.","25171","test_custom_variables","tests.integration","Wed Jun 18 01:40:38 UTC 2025","passed","Wed Jun 18 01:41:03 UTC 2025","","test_charm","",""
"Simple test to ensure that the mysql charm gets deployed.","112317","test_build_and_deploy","tests.integration","Wed Jun 18 01:28:40 UTC 2025","passed","Wed Jun 18 01:30:33 UTC 2025","","test_backup_gcp","",""
"Rotate password and confirm changes.","12179","test_password_rotation","tests.integration","Wed Jun 18 01:39:58 UTC 2025","passed","Wed Jun 18 01:40:10 UTC 2025","","test_charm","",""
"Build the mysql charm and deploy it.","152112","test_build_and_deploy","tests.integration","Wed Jun 18 01:28:50 UTC 2025","passed","Wed Jun 18 01:31:22 UTC 2025","","test_charm","",""
"Test to ensure that writes to one cluster do not replicate to another cluster.","81832","test_no_replication_across_clusters","tests.integration.high_availability","Wed Jun 18 01:31:21 UTC 2025","passed","Wed Jun 18 01:32:43 UTC 2025","","test_replication_data_isolation","",""
"Test the existence of databases and tables created by osm-pol's migrations.","34392","test_osm_pol_operations","tests.integration.relations","Wed Jun 18 01:31:43 UTC 2025","passed","Wed Jun 18 01:32:17 UTC 2025","","test_mysql_root","",""
"Simple test to ensure that the mysql charm gets deployed.","110785","test_build_and_deploy","tests.integration","Wed Jun 18 01:28:54 UTC 2025","passed","Wed Jun 18 01:30:45 UTC 2025","","test_backup_ceph","",""
"Test to ensure that data is preserved when a unit is scaled up and then down.

    Ensures that there are no running continuous writes as the extra data in the
    database makes scaling up slower.
    ","224318","test_scaling_without_data_loss","tests.integration.high_availability","Wed Jun 18 01:31:54 UTC 2025","passed","Wed Jun 18 01:35:38 UTC 2025","","test_replication_scaling","",""
"Delete the pod in a single unit deployment and write data to new pod.","245272","test_single_unit_pod_delete","tests.integration.high_availability","Wed Jun 18 01:31:29 UTC 2025","passed","Wed Jun 18 01:35:34 UTC 2025","","test_self_healing_pod","",""
"Confirm that a new primary is elected when the current primary is torn down.","257532","test_scale_up_and_down","tests.integration","Wed Jun 18 01:31:26 UTC 2025","passed","Wed Jun 18 01:35:44 UTC 2025","","test_charm","",""
"Test to write to primary, and read the same data back from replicas.","8544","test_data_replication","tests.integration.high_availability","Wed Jun 18 01:35:21 UTC 2025","passed","Wed Jun 18 01:35:30 UTC 2025","","test_async_replication","",""
"Test for encryption enablement when relation to TLS charm.","63303","test_enable_tls","tests.integration","Wed Jun 18 01:30:29 UTC 2025","passed","Wed Jun 18 01:31:32 UTC 2025","","test_tls","",""
"Build and deploy for AWS.","204889","test_build_and_deploy_aws","tests.integration","Wed Jun 18 01:28:25 UTC 2025","passed","Wed Jun 18 01:31:50 UTC 2025","","test_backup_pitr_aws","",""
"Test to create a backup and list backups.","56699","test_backup","tests.integration","Wed Jun 18 01:30:35 UTC 2025","passed","Wed Jun 18 01:31:31 UTC 2025","","test_backup_gcp","",""
"Test that the pre-upgrade-check action runs successfully.","20607","test_pre_upgrade_check","tests.integration.high_availability","Wed Jun 18 01:31:18 UTC 2025","passed","Wed Jun 18 01:31:38 UTC 2025","","test_upgrade","",""
"Test to restore a backup on a new mysql cluster.","537115","test_restore_on_new_cluster","tests.integration","Wed Jun 18 01:34:21 UTC 2025","passed","Wed Jun 18 01:43:18 UTC 2025","","test_backup_gcp","",""
"Test updating from stable channel.","179638","test_upgrade_from_stable","tests.integration.high_availability","Wed Jun 18 01:31:15 UTC 2025","passed","Wed Jun 18 01:34:15 UTC 2025","","test_upgrade_from_stable","",""
"Test the log rotation of text files.

    Run continuous writes to ensure that audit log plugin is loaded and active
    when mysql-test-app runs start-continuous-writes (by logging into mysql).
    ","5778","test_log_rotation","tests.integration.high_availability","Wed Jun 18 01:31:26 UTC 2025","passed","Wed Jun 18 01:31:32 UTC 2025","","test_log_rotation","",""
"Rotate password and confirm changes.","11172","test_password_rotation_silent","tests.integration","Wed Jun 18 01:40:10 UTC 2025","passed","Wed Jun 18 01:40:21 UTC 2025","","test_charm","",""
"Build the charm and deploy 3 units to ensure a cluster is formed.","133796","test_build_and_deploy","tests.integration","Wed Jun 18 01:28:12 UTC 2025","passed","Wed Jun 18 01:30:26 UTC 2025","","test_tls","",""
"Build the charm and deploy 1 units to ensure a cluster is formed.","6908","test_build_and_deploy","tests.integration","Wed Jun 18 01:28:28 UTC 2025","passed","Wed Jun 18 01:28:35 UTC 2025","","test_saturate_max_connections","",""
"Confirm that data is replicated from the primary node to all the replicas.","4344","test_consistent_data_replication_across_cluster","tests.integration","Wed Jun 18 01:31:22 UTC 2025","passed","Wed Jun 18 01:31:26 UTC 2025","","test_charm","",""
"Deploy the router and the test application.","79376","test_deploy_router_and_app","tests.integration.high_availability","Wed Jun 18 01:31:34 UTC 2025","passed","Wed Jun 18 01:32:54 UTC 2025","","test_async_replication","",""
"Pitr tests.","277364","test_pitr_aws","tests.integration","Wed Jun 18 01:31:50 UTC 2025","passed","Wed Jun 18 01:36:27 UTC 2025","","test_backup_pitr_aws","",""
"Tries deploying an amd64 charm on arm64 host.","0","test_amd_charm_on_arm_host","tests.integration","Wed Jun 18 01:29:45 UTC 2025","skipped","Wed Jun 18 01:29:45 UTC 2025","","test_architecture","",""
"Remove relation and wait for the expected changes in status.","22482","test_relation_broken","tests.integration.relations","Wed Jun 18 01:31:18 UTC 2025","passed","Wed Jun 18 01:31:41 UTC 2025","","test_database","",""
"Test to send a SIGKILL to the primary db process and ensure that the cluster self heals.","95693","test_kill_db_process","tests.integration.high_availability","Wed Jun 18 01:32:21 UTC 2025","passed","Wed Jun 18 01:33:56 UTC 2025","","test_self_healing_process_killed","",""
"Test to restore a backup to the same mysql cluster.","164986","test_restore_on_same_cluster","tests.integration","Wed Jun 18 01:31:32 UTC 2025","passed","Wed Jun 18 01:34:17 UTC 2025","","test_backup_ceph","",""
"Verify rotating tls private keys restarts cluster with new certificates.

    This test rotates tls private keys to randomly generated keys.
    ","40971","test_rotate_tls_key","tests.integration","Wed Jun 18 01:31:32 UTC 2025","passed","Wed Jun 18 01:32:13 UTC 2025","","test_tls","",""
"Build and deploy for AWS.","240044","test_build_and_deploy_gcp","tests.integration","Wed Jun 18 01:28:44 UTC 2025","passed","Wed Jun 18 01:32:44 UTC 2025","","test_backup_pitr_gcp","",""
"Test to write to primary, and read the same data back from replicas.","37090","test_check_consistency","tests.integration.high_availability","Wed Jun 18 01:31:49 UTC 2025","passed","Wed Jun 18 01:32:26 UTC 2025","","test_replication_data_consistency","",""
"Run the create replication and wait for the applications to settle.","145258","test_create_replication","tests.integration.high_availability","Wed Jun 18 01:32:54 UTC 2025","passed","Wed Jun 18 01:35:19 UTC 2025","","test_async_replication","",""
"Test that endpoints are running.","3981","test_exporter_endpoints","tests.integration","Wed Jun 18 01:40:34 UTC 2025","passed","Wed Jun 18 01:40:38 UTC 2025","","test_charm","",""
"Test to send SIGTERM to all units and then ensure that the cluster recovers.","277903","test_graceful_full_cluster_crash_test","tests.integration.high_availability","Wed Jun 18 01:31:38 UTC 2025","passed","Wed Jun 18 01:36:16 UTC 2025","","test_self_healing_stop_all","",""
"Confirm storage reuse works.","95941","test_scale_up_after_scale_down","tests.integration","Wed Jun 18 01:35:44 UTC 2025","passed","Wed Jun 18 01:37:20 UTC 2025","","test_charm","",""
"","248608","test_fail_and_rollback","tests.integration.high_availability","Wed Jun 18 01:34:35 UTC 2025","passed","Wed Jun 18 01:38:44 UTC 2025","","test_upgrade","",""
"Relate the two mysql clusters.","4908","test_async_relate","tests.integration.high_availability","Wed Jun 18 01:31:29 UTC 2025","passed","Wed Jun 18 01:31:34 UTC 2025","","test_async_replication","",""
"Test switchover on primary cluster fail.","296590","test_failover","tests.integration.high_availability","Wed Jun 18 01:35:55 UTC 2025","passed","Wed Jun 18 01:40:52 UTC 2025","","test_async_replication","",""
"Build the charm and deploy 1 units to ensure a cluster is formed.","38653","test_build_and_deploy","tests.integration","Wed Jun 18 01:28:43 UTC 2025","passed","Wed Jun 18 01:29:22 UTC 2025","","test_multi_relations","",""
"Test to create a backup and list backups.","63407","test_backup","tests.integration","Wed Jun 18 01:30:32 UTC 2025","passed","Wed Jun 18 01:31:35 UTC 2025","","test_backup_aws","",""
"Relate all the applications to the database.","146483","test_relate_all","tests.integration","Wed Jun 18 01:29:22 UTC 2025","passed","Wed Jun 18 01:31:48 UTC 2025","","test_multi_relations","",""
"Test the labeling of k8s endpoints when apps with same cluster-name deployed.","404298","test_labeling_of_k8s_endpoints","tests.integration.high_availability","Wed Jun 18 01:28:11 UTC 2025","passed","Wed Jun 18 01:34:56 UTC 2025","","test_k8s_endpoints","",""
"Test to restore a backup to the same mysql cluster.","160132","test_restore_on_same_cluster","tests.integration","Wed Jun 18 01:31:37 UTC 2025","passed","Wed Jun 18 01:34:17 UTC 2025","","test_backup_aws","",""
"Test COS integrations formed before mysql is allocated and deployed.","83809","test_deploy_bundle_with_cos_integrations","tests.integration","Wed Jun 18 01:28:10 UTC 2025","passed","Wed Jun 18 01:29:34 UTC 2025","","test_cos_integration_bundle","",""
"Simple test to ensure that the mysql and application charms get deployed.","183446","test_deploy_latest","tests.integration.high_availability","Wed Jun 18 01:28:14 UTC 2025","passed","Wed Jun 18 01:31:18 UTC 2025","","test_upgrade","",""
"Pitr tests.","219033","test_pitr_aws","tests.integration","Wed Jun 18 01:32:44 UTC 2025","passed","Wed Jun 18 01:36:23 UTC 2025","","test_backup_pitr_gcp","",""
"Test that the pre-upgrade-check action runs successfully.","4068","test_pre_upgrade_check","tests.integration.high_availability","Wed Jun 18 01:30:17 UTC 2025","passed","Wed Jun 18 01:30:21 UTC 2025","","test_upgrade_rollback_incompat","",""
"","52494","test_deploy_and_relate_test_app","tests.integration","Wed Jun 18 01:28:35 UTC 2025","passed","Wed Jun 18 01:29:27 UTC 2025","","test_saturate_max_connections","",""
"Ensure scaling down to zero and back up works.","157895","test_scale_up_from_zero","tests.integration","Wed Jun 18 01:37:20 UTC 2025","passed","Wed Jun 18 01:39:58 UTC 2025","","test_charm","",""
"Tries deploying an arm64 charm on amd64 host.","59958","test_arm_charm_on_amd_host","tests.integration","Wed Jun 18 01:28:45 UTC 2025","passed","Wed Jun 18 01:29:45 UTC 2025","","test_architecture","",""
"Test the deployment and relation with osm bundle with mysql replacing mariadb.","206242","test_deploy_and_relate_osm_bundle","tests.integration.relations","Wed Jun 18 01:28:17 UTC 2025","passed","Wed Jun 18 01:31:43 UTC 2025","","test_mysql_root","",""
"Test rejoin invalidated cluster with.","30727","test_rejoin_invalidated_cluster","tests.integration.high_availability","Wed Jun 18 01:40:54 UTC 2025","passed","Wed Jun 18 01:41:25 UTC 2025","","test_async_replication","",""
"Build the charm and deploy 3 units to ensure a cluster is formed.","131996","test_build_and_deploy","tests.integration.relations","Wed Jun 18 01:28:23 UTC 2025","passed","Wed Jun 18 01:30:35 UTC 2025","","test_database","",""
"Test to restore a backup to the same mysql cluster.","168036","test_restore_on_same_cluster","tests.integration","Wed Jun 18 01:31:33 UTC 2025","passed","Wed Jun 18 01:34:21 UTC 2025","","test_backup_gcp","",""
"","310164","test_rollback","tests.integration.high_availability","Wed Jun 18 01:31:04 UTC 2025","passed","Wed Jun 18 01:36:15 UTC 2025","","test_upgrade_rollback_incompat","",""
"","14747","test_saturate_max_connections","tests.integration","Wed Jun 18 01:29:27 UTC 2025","passed","Wed Jun 18 01:29:42 UTC 2025","","test_saturate_max_connections","",""
"Test for a network cut affecting an instance.","220318","test_network_cut_affecting_an_instance","tests.integration.high_availability","Wed Jun 18 01:31:59 UTC 2025","passed","Wed Jun 18 01:35:39 UTC 2025","","test_self_healing_network_cut","",""
"Simple test to ensure that the mysql and application charms get deployed.","158905","test_deploy_stable","tests.integration.high_availability","Wed Jun 18 01:28:16 UTC 2025","passed","Wed Jun 18 01:30:55 UTC 2025","","test_upgrade_from_stable","",""
