"DESCRIPTION","DURATION IN MS","NAME","PARENT SUITE","START TIME","STATUS","STOP TIME","SUB SUITE","SUITE","TEST CLASS","TEST METHOD"
"Test that the pre-upgrade-check action runs successfully.","3831","test_pre_upgrade_check","tests.integration.integration.high_availability","2026-01-06","passed","2026-01-06","","test_upgrade_rollback_incompat","",""
"Confirm that a new primary is elected when the current primary is torn down.","269767","test_scale_up_and_down","tests.integration.integration","2026-01-06","passed","2026-01-06","","test_charm","",""
"Simple test to ensure that the MySQL and application charms get deployed.","150522","test_deploy_latest","tests.integration.integration.high_availability","2026-01-06","passed","2026-01-06","","test_upgrade","",""
"The cluster manual re-join test.

    A graceful restart is performed in one of the instances (choosing Primary to make it painful).
    In order to verify that the instance can come back ONLINE, after disabling automatic re-join
    ","209878","test_cluster_manual_rejoin","tests.integration.integration.high_availability","2026-01-06","passed","2026-01-06","","test_self_healing_restart_graceful","",""
"Run the create-replication action and wait for the applications to settle.","314167","test_create_replication","tests.integration.integration.high_availability","2026-01-06","broken","2026-01-06","","test_async_replication","",""
"Test to send a SIGSTOP to the primary db process and ensure that the cluster self heals.","167292","test_freeze_db_process","tests.integration.integration.high_availability","2026-01-06","passed","2026-01-06","","test_self_healing_process_frozen","",""
"Test for cluster data isolation.

    This test creates a new cluster, create a new table on both cluster, write a single record with
    the application name for each cluster, retrieve and compare these records, asserting they are
    not the same.
    ","80944","test_cluster_data_isolation","tests.integration.integration.high_availability","2026-01-06","passed","2026-01-06","","test_replication_data_isolation","",""
"Scale database and routers.","260247","test_scale_in","tests.integration.integration","2026-01-06","passed","2026-01-06","","test_multi_relations","",""
"Test behavior when node drains - pod is evicted and pvs are rotated.","103291","test_pod_eviction_and_pvc_deletion","tests.integration.integration.high_availability","2026-01-06","passed","2026-01-06","","test_self_healing_node_drain","",""
"Test that the pre-upgrade-check action runs successfully.","","test_pre_upgrade_check","tests.integration.integration.high_availability","","unknown","","","test_upgrade_from_stable","",""
"Test that endpoints are running.","4053","test_exporter_endpoints","tests.integration.integration","2026-01-06","passed","2026-01-06","","test_charm","",""
"Simple test to ensure that the MySQL application charms get deployed.","751023","test_build_and_deploy","tests.integration.integration.high_availability","2026-01-06","broken","2026-01-06","","test_async_replication_upgrade","",""
"Relate the two MySQL clusters.","27458","test_async_relate","tests.integration.integration.high_availability","2026-01-06","passed","2026-01-06","","test_async_replication_upgrade","",""
"Test to write to primary, and read the same data back from replicas.","16557","test_data_replication","tests.integration.integration.high_availability","2026-01-06","broken","2026-01-06","","test_async_replication_upgrade","",""
"Test to create a backup and list backups.","46736","test_backup","tests.integration.integration","2026-01-06","passed","2026-01-06","","test_backup_aws","",""
"Build the charm and deploy 3 units to ensure a cluster is formed.","7329","test_build_and_deploy","tests.integration.integration.relations","2026-01-06","passed","2026-01-06","","test_database","",""
"Test switchover on primary cluster fail.","304322","test_failover","tests.integration.integration.high_availability","2026-01-06","broken","2026-01-06","","test_async_replication","",""
"Test to send a SIGKILL to the primary db process and ensure that the cluster self heals.","106978","test_kill_db_process","tests.integration.integration.high_availability","2026-01-06","passed","2026-01-06","","test_self_healing_process_killed","",""
"Deploy the test application.","38067","test_deploy_test_app","tests.integration.integration.high_availability","2026-01-06","passed","2026-01-06","","test_async_replication_upgrade","",""
"Test to write to primary, and read the same data back from replicas.","71933","test_data_replication","tests.integration.integration.high_availability","2026-01-06","broken","2026-01-06","","test_async_replication","",""
"Test to restore a backup on a new mysql cluster.","510280","test_restore_on_new_cluster","tests.integration.integration","2026-01-06","passed","2026-01-06","","test_backup_gcp","",""
"Simple test to ensure that the MySQL and application charms get deployed.","113728","test_build_and_deploy","tests.integration.integration.high_availability","2026-01-06","passed","2026-01-06","","test_upgrade_rollback_incompat","",""
"Test primary crash during startup.

    It must recover/end setup when the primary got offline.
    ","115966","test_crash_during_cluster_setup","tests.integration.integration.high_availability","2026-01-06","passed","2026-01-06","","test_self_healing_setup_crash","",""
"Verify rotating tls private keys restarts cluster with new certificates.

    This test rotates tls private keys to randomly generated keys.
    ","40039","test_rotate_tls_key","tests.integration.integration","2026-01-06","passed","2026-01-06","","test_tls","",""
"Test to restore a backup to the same mysql cluster.","238464","test_restore_on_same_cluster","tests.integration.integration","2026-01-06","passed","2026-01-06","","test_backup_aws","",""
"Deploy the router and the test application.","57953","test_deploy_router_and_app","tests.integration.integration.high_availability","2026-01-06","passed","2026-01-06","","test_async_replication","",""
"Simple test to ensure that the MySQL and application charms get deployed.","1215656","test_deploy_highly_available_cluster_2","tests.integration.integration.high_availability","2026-01-06","broken","2026-01-06","","test_replication_unit_endpoints","",""
"Simple test to ensure that the mysql charm gets deployed.","225644","test_build_and_deploy","tests.integration.integration","2026-01-06","passed","2026-01-06","","test_backup_ceph","",""
"Test to send SIGTERM to primary instance and then verify recovery.","195414","test_graceful_crash_of_primary","tests.integration.integration.high_availability","2026-01-06","passed","2026-01-06","","test_self_healing_stop_primary","",""
"Simple test to ensure that the MySQL and application charms get deployed.","127477","test_deploy_highly_available_cluster","tests.integration.integration.high_availability","2026-01-06","passed","2026-01-06","","test_self_healing_stop_primary","",""
"Test for a network cut affecting an instance.","125624","test_network_cut_affecting_an_instance","tests.integration.integration.high_availability","2026-01-06","passed","2026-01-06","","test_self_healing_network_cut","",""
"Rotate password and confirm changes.","12186","test_password_rotation_silent","tests.integration.integration","2026-01-06","passed","2026-01-06","","test_charm","",""
"Delete the pod in a single unit deployment and write data to new pod.","749886","test_single_unit_pod_delete","tests.integration.integration.high_availability","2026-01-06","passed","2026-01-06","","test_self_healing_pod","",""
"Test the DBA predefined role.","28144","test_charmed_dba_role","tests.integration.integration.roles","2026-01-06","passed","2026-01-06","","test_instance_dba_role","",""
"Test that the primary node can be switched over.","13764","test_cluster_switchover","tests.integration.integration.high_availability","2026-01-06","passed","2026-01-06","","test_primary_switchover","",""
"Test for encryption enablement when relation to TLS charm.","65626","test_enable_tls","tests.integration.integration","2026-01-06","passed","2026-01-06","","test_tls","",""
"Build the charm and deploy 3 units to ensure a cluster is formed.","7553","test_build_and_deploy","tests.integration.integration.relations","2026-01-06","passed","2026-01-06","","test_mysql_root","",""
"Test to create a backup and list backups.","44081","test_backup","tests.integration.integration","2026-01-06","passed","2026-01-06","","test_backup_ceph","",""
"Test COS integrations formed before mysql is allocated and deployed.","93042","test_deploy_bundle_with_cos_integrations","tests.integration.integration","2026-01-06","passed","2026-01-06","","test_cos_integration_bundle","",""
"Confirm that data is replicated from the primary node to all the replicas.","20741","test_consistent_data_replication_across_cluster","tests.integration.integration.high_availability","2026-01-06","passed","2026-01-06","","test_replication_data_consistency","",""
"Pitr tests.","281919","test_pitr_aws","tests.integration.integration","2026-01-06","passed","2026-01-06","","test_backup_pitr_aws","",""
"Test that the pre-upgrade-check action runs successfully.","21881","test_pre_upgrade_check","tests.integration.integration.high_availability","2026-01-06","passed","2026-01-06","","test_upgrade","",""
"","3647","test_saturate_max_connections","tests.integration.integration","2026-01-06","passed","2026-01-06","","test_saturate_max_connections","",""
"Test the promote-to-primary command after losing the majority of nodes, with force flag.","255069","test_cluster_failover_after_majority_loss","tests.integration.integration.high_availability","2026-01-06","passed","2026-01-06","","test_primary_switchover","",""
"Query database for custom variables.","24833","test_custom_variables","tests.integration.integration","2026-01-06","passed","2026-01-06","","test_charm","",""
"Simple test to ensure that the MySQL and application charms get deployed.","","test_deploy_stable","tests.integration.integration.high_availability","","unknown","","","test_upgrade_from_stable","",""
"Test to restore a backup to the same mysql cluster.","225436","test_restore_on_same_cluster","tests.integration.integration","2026-01-06","passed","2026-01-06","","test_backup_ceph","",""
"Test the charmed_dml role.","57453","test_charmed_dml_role","tests.integration.integration.roles","2026-01-06","passed","2026-01-06","","test_instance_roles","",""
"Simple test to ensure that the MySQL and application charms get deployed.","138000","test_deploy_highly_available_cluster","tests.integration.integration.high_availability","2026-01-06","passed","2026-01-06","","test_replication_data_consistency","",""
"Test the charmed_read predefined role.","36913","test_charmed_read_role","tests.integration.integration.roles","2026-01-06","passed","2026-01-06","","test_instance_roles","",""
"Test removing and re-relating the two mysql clusters.","601905","test_unrelate_and_relate","tests.integration.integration.high_availability","2026-01-06","broken","2026-01-06","","test_async_replication","",""
"Simple test to ensure that the MySQL and application charms get deployed.","140612","test_deploy_highly_available_cluster","tests.integration.integration.high_availability","2026-01-06","passed","2026-01-06","","test_self_healing_process_killed","",""
"Build the charm and deploy 3 units to ensure a cluster is formed.","131818","test_build_and_deploy","tests.integration.integration","2026-01-06","passed","2026-01-06","","test_tls","",""
"","30178","test_disable_tls","tests.integration.integration","2026-01-06","passed","2026-01-06","","test_tls","",""
"Test the labeling of k8s endpoints when apps with same cluster-name deployed.","4518","test_labeling_of_k8s_endpoints","tests.integration.integration.high_availability","2026-01-06","failed","2026-01-06","","test_replication_unit_endpoints","",""
"Test to restore a backup on a new mysql cluster.","544822","test_restore_on_new_cluster","tests.integration.integration","2026-01-06","passed","2026-01-06","","test_backup_aws","",""
"Test graceful promotion of a standby cluster to primary.","89859","test_standby_promotion","tests.integration.integration.high_availability","2026-01-06","broken","2026-01-06","","test_async_replication","",""
"Simple test to ensure that the MySQL and application charms get deployed.","131294","test_deploy_highly_available_cluster","tests.integration.integration.high_availability","2026-01-06","passed","2026-01-06","","test_self_healing_pod","",""
"Run the create-replication action and wait for the applications to settle.","309845","test_create_replication","tests.integration.integration.high_availability","2026-01-06","broken","2026-01-06","","test_async_replication_upgrade","",""
"Simple test to ensure that the MySQL and application charms get deployed.","134394","test_deploy_highly_available_cluster","tests.integration.integration.high_availability","2026-01-06","passed","2026-01-06","","test_replication_reelection","",""
"Simple test to ensure that the MySQL and application charms get deployed.","123111","test_deploy_highly_available_cluster","tests.integration.integration.high_availability","2026-01-06","passed","2026-01-06","","test_replication_scaling","",""
"Ensure scaling down to zero and back up works.","128906","test_scale_up_from_zero","tests.integration.integration","2026-01-06","passed","2026-01-06","","test_charm","",""
"Test upgrade rollback to a healthy revision.","338079","test_rollback","tests.integration.integration.high_availability","2026-01-06","passed","2026-01-06","","test_upgrade_rollback_incompat","",""
"Simple test to ensure that the MySQL and application charms get deployed.","130190","test_deploy_highly_available_cluster","tests.integration.integration.high_availability","2026-01-06","passed","2026-01-06","","test_self_healing_network_cut","",""
"Confirm that data is replicated from the primary node to all the replicas.","4251","test_consistent_data_replication_across_cluster","tests.integration.integration","2026-01-06","passed","2026-01-06","","test_charm","",""
"Test to create a backup and list backups.","52699","test_backup","tests.integration.integration","2026-01-06","passed","2026-01-06","","test_backup_gcp","",""
"Relate charms and wait for the expected changes in status.","0","test_relation_creation_databag","tests.integration.integration.relations","2026-01-06","skipped","2026-01-06","","test_database","",""
"Tries deploying an arm64 charm on amd64 host.","60602","test_arm_charm_on_amd_host","tests.integration.integration","2026-01-06","passed","2026-01-06","","test_architecture","",""
"Build the mysql charm and deploy it.","132085","test_build_and_deploy","tests.integration.integration","2026-01-06","passed","2026-01-06","","test_charm","",""
"Relate charms before they have time to properly start.

    It simulates a Terraform-like deployment strategy
    ","137808","test_relation_creation_eager","tests.integration.integration.relations","2026-01-06","passed","2026-01-06","","test_database","",""
"Test the existence of databases and tables created by osm-pol's migrations.","34262","test_osm_pol_operations","tests.integration.integration","2026-01-06","passed","2026-01-06","","test_osm_integration_bundle","",""
"Simple test to ensure that the MySQL application charms get deployed.","614866","test_build_and_deploy","tests.integration.integration.high_availability","2026-01-06","broken","2026-01-06","","test_async_replication","",""
"Confirm that a new primary is elected when the current primary is tear down.","365804","test_kill_primary_check_reelection","tests.integration.integration.high_availability","2026-01-06","passed","2026-01-06","","test_replication_reelection","",""
"Test to restore a backup to the same mysql cluster.","212576","test_restore_on_same_cluster","tests.integration.integration","2026-01-06","passed","2026-01-06","","test_backup_gcp","",""
"Relate charms before they have time to properly start.

    It simulates a Terraform-like deployment strategy
    ","153827","test_relation_creation_eager","tests.integration.integration.relations","2026-01-06","passed","2026-01-06","","test_mysql_root","",""
"","72749","test_deploy_and_relate_test_app","tests.integration.integration","2026-01-06","passed","2026-01-06","","test_saturate_max_connections","",""
"Tries deploying an amd64 charm on arm64 host.","0","test_amd_charm_on_arm_host","tests.integration.integration","2026-01-06","skipped","2026-01-06","","test_architecture","",""
"Test an upgrade failure and its rollback.","388875","test_fail_and_rollback","tests.integration.integration.high_availability","2026-01-06","passed","2026-01-06","","test_upgrade","",""
"Build and deploy for AWS.","224397","test_build_and_deploy_gcp","tests.integration.integration","2026-01-06","passed","2026-01-06","","test_backup_pitr_gcp","",""
"Pause test.

    A graceful simultaneous restart of all instances,
    check primary election after the start, write and read data
    ","136747","test_graceful_full_cluster_crash","tests.integration.integration.high_availability","2026-01-06","passed","2026-01-06","","test_self_healing_stop_all","",""
"Confirm storage reuse works.","80232","test_scale_up_after_scale_down","tests.integration.integration","2026-01-06","passed","2026-01-06","","test_charm","",""
"Simple test to ensure that the mysql charm gets deployed.","185386","test_build_and_deploy","tests.integration.integration","2026-01-06","passed","2026-01-06","","test_backup_gcp","",""
"Remove relation and wait for the expected changes in status.","13836","test_relation_broken","tests.integration.integration.relations","2026-01-06","passed","2026-01-06","","test_database","",""
"Relate charms and wait for the expected changes in status.","3531","test_relation_creation","tests.integration.integration.relations","2026-01-06","passed","2026-01-06","","test_database","",""
"Simple test to ensure that the mysql and data-integrator charms get deployed.","129557","test_build_and_deploy","tests.integration.integration.roles","2026-01-06","passed","2026-01-06","","test_instance_dba_role","",""
"Simple test to ensure that the MySQL and application charms get deployed.","133936","test_deploy_highly_available_cluster","tests.integration.integration.high_availability","2026-01-06","passed","2026-01-06","","test_self_healing_process_frozen","",""
"Test the deployment and relation with osm bundle with mysql replacing mariadb.","165822","test_deploy_and_relate_osm_bundle","tests.integration.integration","2026-01-06","passed","2026-01-06","","test_osm_integration_bundle","",""
"Test rejoin invalidated cluster with.","158029","test_rejoin_invalidated_cluster","tests.integration.integration.high_availability","2026-01-06","broken","2026-01-06","","test_async_replication","",""
"Simple test to ensure that the MySQL and application charms get deployed.","137245","test_deploy_highly_available_cluster","tests.integration.integration.high_availability","2026-01-06","passed","2026-01-06","","test_self_healing_restart_graceful","",""
"Upgrade the two MySQL clusters.","86460","test_upgrade_from_edge","tests.integration.integration.high_availability","2026-01-06","broken","2026-01-06","","test_async_replication_upgrade","",""
"Rotate password and confirm changes.","11163","test_password_rotation","tests.integration.integration","2026-01-06","passed","2026-01-06","","test_charm","",""
"Ensure connections (with and without ssl) are possible before relating with TLS operator.","2200","test_connection_before_tls","tests.integration.integration","2026-01-06","passed","2026-01-06","","test_tls","",""
"Relate all the applications to the database.","210368","test_relate_all","tests.integration.integration","2026-01-06","passed","2026-01-06","","test_multi_relations","",""
"Simple test to ensure that the mysql and data-integrator charms get deployed.","133021","test_build_and_deploy","tests.integration.integration.roles","2026-01-06","passed","2026-01-06","","test_database_dba_role","",""
"Pitr tests.","257310","test_pitr_aws","tests.integration.integration","2026-01-06","passed","2026-01-06","","test_backup_pitr_gcp","",""
"Scale database and routers.","720486","test_scale_out","tests.integration.integration","2026-01-06","passed","2026-01-06","","test_multi_relations","",""
"Simple test to ensure that the MySQL and application charms get deployed.","132378","test_deploy_highly_available_cluster","tests.integration.integration.high_availability","2026-01-06","passed","2026-01-06","","test_replication_logs_rotation","",""
"Test the database-level DBA role.","55814","test_charmed_dba_role","tests.integration.integration.roles","2026-01-06","passed","2026-01-06","","test_database_dba_role","",""
"Relate the two MySQL clusters.","305558","test_async_relate","tests.integration.integration.high_availability","2026-01-06","broken","2026-01-06","","test_async_replication","",""
"Simple test to ensure that the mysql charm gets deployed.","160471","test_build_and_deploy","tests.integration.integration","2026-01-06","passed","2026-01-06","","test_backup_aws","",""
"Test the log rotation of text files.","5333","test_log_rotation","tests.integration.integration.high_availability","2026-01-06","passed","2026-01-06","","test_replication_logs_rotation","",""
"Build the charm and deploy 1 units to ensure a cluster is formed.","35925","test_build_and_deploy","tests.integration.integration","2026-01-06","passed","2026-01-06","","test_multi_relations","",""
"Simple test to ensure that the MySQL and application charms get deployed.","61648","test_deploy_single_unit_cluster","tests.integration.integration.high_availability","2026-01-06","passed","2026-01-06","","test_self_healing_setup_crash","",""
"Simple test to ensure that the MySQL and application charms get deployed.","142264","test_deploy_highly_available_cluster","tests.integration.integration.high_availability","2026-01-06","passed","2026-01-06","","test_self_healing_node_drain","",""
"","47609","test_upgrade_to_failing","tests.integration.integration.high_availability","2026-01-06","passed","2026-01-06","","test_upgrade_rollback_incompat","",""
"Update the second cluster.","349334","test_upgrade_from_edge","tests.integration.integration.high_availability","2026-01-06","passed","2026-01-06","","test_upgrade","",""
"Update the second cluster.","","test_upgrade_from_stable","tests.integration.integration.high_availability","","unknown","","","test_upgrade_from_stable","",""
"Test to restore a backup on a new mysql cluster.","538478","test_restore_on_new_cluster","tests.integration.integration","2026-01-06","passed","2026-01-06","","test_backup_ceph","",""
"Test that data is preserved during scale up and scale down.","200158","test_scaling_without_data_loss","tests.integration.integration.high_availability","2026-01-06","passed","2026-01-06","","test_replication_scaling","",""
"Build and deploy for AWS.","232699","test_build_and_deploy_aws","tests.integration.integration","2026-01-06","passed","2026-01-06","","test_backup_pitr_aws","",""
"Simple test to ensure that the MySQL and application charms get deployed.","136068","test_deploy_highly_available_cluster","tests.integration.integration.high_availability","2026-01-06","passed","2026-01-06","","test_replication_data_isolation","",""
"Simple test to ensure that the mysql and data-integrator charms get deployed.","131228","test_build_and_deploy","tests.integration.integration.roles","2026-01-06","passed","2026-01-06","","test_instance_roles","",""
"Rotate password and confirm changes.","13210","test_password_rotation_root_user_implicit","tests.integration.integration","2026-01-06","passed","2026-01-06","","test_charm","",""
"Build the charm and deploy 1 units to ensure a cluster is formed.","7261","test_build_and_deploy","tests.integration.integration","2026-01-06","passed","2026-01-06","","test_saturate_max_connections","",""
"Simple test to ensure that the MySQL and application charms get deployed.","37901","test_deploy_highly_available_cluster_1","tests.integration.integration.high_availability","2026-01-06","broken","2026-01-06","","test_replication_unit_endpoints","",""
"Simple test to ensure that the MySQL and application charms get deployed.","131880","test_deploy_highly_available_cluster","tests.integration.integration.high_availability","2026-01-06","passed","2026-01-06","","test_self_healing_stop_all","",""
