"DESCRIPTION","DURATION IN MS","NAME","PARENT SUITE","START TIME","STATUS","STOP TIME","SUB SUITE","SUITE","TEST CLASS","TEST METHOD"
"Test to create a backup and list backups.","43107","test_backup","tests.integration.integration","2025-12-01","passed","2025-12-01","","test_backup_aws","",""
"Relate charms and wait for the expected changes in status.","0","test_relation_creation_databag","tests.integration.integration.relations","2025-12-01","skipped","2025-12-01","","test_database","",""
"Test the database-level DBA role.","53198","test_charmed_dba_role","tests.integration.integration.roles","2025-12-01","passed","2025-12-01","","test_database_dba_role","",""
"Build the charm and deploy 1 units to ensure a cluster is formed.","36388","test_build_and_deploy","tests.integration.integration","2025-12-01","passed","2025-12-01","","test_multi_relations","",""
"Confirm storage reuse works.","77536","test_scale_up_after_scale_down","tests.integration.integration","2025-12-01","passed","2025-12-01","","test_charm","",""
"Update the second cluster.","","test_upgrade_from_stable","tests.integration.integration.high_availability","","unknown","","","test_upgrade_from_stable","",""
"Simple test to ensure that the MySQL and application charms get deployed.","125405","test_deploy_highly_available_cluster","tests.integration.integration.high_availability","2025-12-01","passed","2025-12-01","","test_replication_data_consistency","",""
"Test for cluster data isolation.

    This test creates a new cluster, create a new table on both cluster, write a single record with
    the application name for each cluster, retrieve and compare these records, asserting they are
    not the same.
    ","80164","test_cluster_data_isolation","tests.integration.integration.high_availability","2025-12-01","passed","2025-12-01","","test_replication_data_isolation","",""
"Confirm that a new primary is elected when the current primary is torn down.","263713","test_scale_up_and_down","tests.integration.integration","2025-12-01","passed","2025-12-01","","test_charm","",""
"Simple test to ensure that the MySQL and application charms get deployed.","134546","test_deploy_highly_available_cluster","tests.integration.integration.high_availability","2025-12-01","passed","2025-12-01","","test_self_healing_network_cut","",""
"Test the charmed_dml role.","52127","test_charmed_dml_role","tests.integration.integration.roles","2025-12-01","passed","2025-12-01","","test_instance_roles","",""
"Pitr tests.","280868","test_pitr_aws","tests.integration.integration","2025-12-01","passed","2025-12-01","","test_backup_pitr_aws","",""
"Rotate password and confirm changes.","11182","test_password_rotation","tests.integration.integration","2025-12-01","passed","2025-12-01","","test_charm","",""
"Build the charm and deploy 3 units to ensure a cluster is formed.","8028","test_build_and_deploy","tests.integration.integration.relations","2025-12-01","passed","2025-12-01","","test_database","",""
"Relate the two MySQL clusters.","39340","test_async_relate","tests.integration.integration.high_availability","2025-12-01","passed","2025-12-01","","test_async_replication","",""
"Build the charm and deploy 1 units to ensure a cluster is formed.","5851","test_build_and_deploy","tests.integration.integration","2025-12-01","passed","2025-12-01","","test_saturate_max_connections","",""
"Simple test to ensure that the MySQL and application charms get deployed.","130545","test_deploy_highly_available_cluster","tests.integration.integration.high_availability","2025-12-01","passed","2025-12-01","","test_replication_logs_rotation","",""
"Tries deploying an arm64 charm on amd64 host.","59583","test_arm_charm_on_amd_host","tests.integration.integration","2025-12-01","passed","2025-12-01","","test_architecture","",""
"Rotate password and confirm changes.","12184","test_password_rotation_silent","tests.integration.integration","2025-12-01","passed","2025-12-01","","test_charm","",""
"Simple test to ensure that the mysql and data-integrator charms get deployed.","128632","test_build_and_deploy","tests.integration.integration.roles","2025-12-01","passed","2025-12-01","","test_instance_dba_role","",""
"Test to create a backup and list backups.","46594","test_backup","tests.integration.integration","2025-12-01","passed","2025-12-01","","test_backup_gcp","",""
"Simple test to ensure that the MySQL and application charms get deployed.","145878","test_deploy_highly_available_cluster","tests.integration.integration.high_availability","2025-12-01","passed","2025-12-01","","test_self_healing_pod","",""
"Test the DBA predefined role.","28589","test_charmed_dba_role","tests.integration.integration.roles","2025-12-01","passed","2025-12-01","","test_instance_dba_role","",""
"Test an upgrade failure and its rollback.","455782","test_fail_and_rollback","tests.integration.integration.high_availability","2025-12-01","passed","2025-12-01","","test_upgrade","",""
"Deploy the test application.","36478","test_deploy_test_app","tests.integration.integration.high_availability","2025-12-01","passed","2025-12-01","","test_async_replication_upgrade","",""
"Deploy the router and the test application.","63070","test_deploy_router_and_app","tests.integration.integration.high_availability","2025-12-01","passed","2025-12-01","","test_async_replication","",""
"Simple test to ensure that the MySQL and application charms get deployed.","164698","test_deploy_latest","tests.integration.integration.high_availability","2025-12-01","passed","2025-12-01","","test_upgrade","",""
"Test COS integrations formed before mysql is allocated and deployed.","93036","test_deploy_bundle_with_cos_integrations","tests.integration.integration","2025-12-01","passed","2025-12-01","","test_cos_integration_bundle","",""
"Confirm that a new primary is elected when the current primary is tear down.","424962","test_kill_primary_check_reelection","tests.integration.integration.high_availability","2025-12-01","passed","2025-12-01","","test_replication_reelection","",""
"","30178","test_disable_tls","tests.integration.integration","2025-12-01","passed","2025-12-01","","test_tls","",""
"Confirm that data is replicated from the primary node to all the replicas.","5320","test_consistent_data_replication_across_cluster","tests.integration.integration","2025-12-01","passed","2025-12-01","","test_charm","",""
"Test to restore a backup on a new mysql cluster.","502082","test_restore_on_new_cluster","tests.integration.integration","2025-12-01","passed","2025-12-01","","test_backup_gcp","",""
"","46569","test_upgrade_to_failing","tests.integration.integration.high_availability","2025-12-01","passed","2025-12-01","","test_upgrade_rollback_incompat","",""
"Relate all the applications to the database.","185372","test_relate_all","tests.integration.integration","2025-12-01","passed","2025-12-01","","test_multi_relations","",""
"Pause test.

    A graceful simultaneous restart of all instances,
    check primary election after the start, write and read data
    ","137313","test_graceful_full_cluster_crash","tests.integration.integration.high_availability","2025-12-01","passed","2025-12-01","","test_self_healing_stop_all","",""
"Simple test to ensure that the MySQL and application charms get deployed.","124034","test_build_and_deploy","tests.integration.integration.high_availability","2025-12-01","passed","2025-12-01","","test_upgrade_rollback_incompat","",""
"Remove relation and wait for the expected changes in status.","12918","test_relation_broken","tests.integration.integration.relations","2025-12-01","passed","2025-12-01","","test_database","",""
"Rotate password and confirm changes.","13194","test_password_rotation_root_user_implicit","tests.integration.integration","2025-12-01","passed","2025-12-01","","test_charm","",""
"Test to restore a backup on a new mysql cluster.","581058","test_restore_on_new_cluster","tests.integration.integration","2025-12-01","passed","2025-12-01","","test_backup_ceph","",""
"Relate charms before they have time to properly start.

    It simulates a Terraform-like deployment strategy
    ","151650","test_relation_creation_eager","tests.integration.integration.relations","2025-12-01","passed","2025-12-01","","test_database","",""
"","3636","test_saturate_max_connections","tests.integration.integration","2025-12-01","passed","2025-12-01","","test_saturate_max_connections","",""
"Test the deployment and relation with osm bundle with mysql replacing mariadb.","163555","test_deploy_and_relate_osm_bundle","tests.integration.integration","2025-12-01","passed","2025-12-01","","test_osm_integration_bundle","",""
"Test to send a SIGSTOP to the primary db process and ensure that the cluster self heals.","263213","test_freeze_db_process","tests.integration.integration.high_availability","2025-12-01","passed","2025-12-01","","test_self_healing_process_frozen","",""
"Test primary crash during startup.

    It must recover/end setup when the primary got offline.
    ","1202594","test_crash_during_cluster_setup","tests.integration.integration.high_availability","2025-12-01","broken","2025-12-01","","test_self_healing_setup_crash","",""
"Scale database and routers.","288265","test_scale_in","tests.integration.integration","2025-12-01","passed","2025-12-01","","test_multi_relations","",""
"Build the charm and deploy 3 units to ensure a cluster is formed.","137394","test_build_and_deploy","tests.integration.integration","2025-12-01","passed","2025-12-01","","test_tls","",""
"Test to restore a backup to the same mysql cluster.","205653","test_restore_on_same_cluster","tests.integration.integration","2025-12-01","passed","2025-12-01","","test_backup_aws","",""
"Simple test to ensure that the mysql charm gets deployed.","174602","test_build_and_deploy","tests.integration.integration","2025-12-01","passed","2025-12-01","","test_backup_aws","",""
"Simple test to ensure that the mysql and data-integrator charms get deployed.","126512","test_build_and_deploy","tests.integration.integration.roles","2025-12-01","passed","2025-12-01","","test_instance_roles","",""
"Test the labeling of k8s endpoints when apps with same cluster-name deployed.","4421","test_labeling_of_k8s_endpoints","tests.integration.integration.high_availability","2025-12-01","passed","2025-12-01","","test_replication_unit_endpoints","",""
"Tries deploying an amd64 charm on arm64 host.","0","test_amd_charm_on_arm_host","tests.integration.integration","2025-12-01","skipped","2025-12-01","","test_architecture","",""
"Test that endpoints are running.","4053","test_exporter_endpoints","tests.integration.integration","2025-12-01","passed","2025-12-01","","test_charm","",""
"Simple test to ensure that the MySQL and application charms get deployed.","123390","test_deploy_highly_available_cluster","tests.integration.integration.high_availability","2025-12-01","passed","2025-12-01","","test_self_healing_process_killed","",""
"Simple test to ensure that the MySQL and application charms get deployed.","131636","test_deploy_highly_available_cluster","tests.integration.integration.high_availability","2025-12-01","passed","2025-12-01","","test_replication_reelection","",""
"Build the charm and deploy 3 units to ensure a cluster is formed.","8342","test_build_and_deploy","tests.integration.integration.relations","2025-12-01","passed","2025-12-01","","test_mysql_root","",""
"Build and deploy for AWS.","231169","test_build_and_deploy_gcp","tests.integration.integration","2025-12-01","passed","2025-12-01","","test_backup_pitr_gcp","",""
"Relate the two MySQL clusters.","94406","test_async_relate","tests.integration.integration.high_availability","2025-12-01","passed","2025-12-01","","test_async_replication_upgrade","",""
"Test the log rotation of text files.","5109","test_log_rotation","tests.integration.integration.high_availability","2025-12-01","passed","2025-12-01","","test_replication_logs_rotation","",""
"Test the existence of databases and tables created by osm-pol's migrations.","34325","test_osm_pol_operations","tests.integration.integration","2025-12-01","passed","2025-12-01","","test_osm_integration_bundle","",""
"Simple test to ensure that the mysql and data-integrator charms get deployed.","135729","test_build_and_deploy","tests.integration.integration.roles","2025-12-01","passed","2025-12-01","","test_database_dba_role","",""
"The cluster manual re-join test.

    A graceful restart is performed in one of the instances (choosing Primary to make it painful).
    In order to verify that the instance can come back ONLINE, after disabling automatic re-join
    ","181533","test_cluster_manual_rejoin","tests.integration.integration.high_availability","2025-12-01","passed","2025-12-01","","test_self_healing_restart_graceful","",""
"Test rejoin invalidated cluster with.","49400","test_rejoin_invalidated_cluster","tests.integration.integration.high_availability","2025-12-01","passed","2025-12-01","","test_async_replication","",""
"Test that the primary node can be switched over.","20664","test_cluster_switchover","tests.integration.integration.high_availability","2025-12-01","passed","2025-12-01","","test_primary_switchover","",""
"Run the create-replication action and wait for the applications to settle.","127214","test_create_replication","tests.integration.integration.high_availability","2025-12-01","passed","2025-12-01","","test_async_replication","",""
"Pitr tests.","239002","test_pitr_aws","tests.integration.integration","2025-12-01","passed","2025-12-01","","test_backup_pitr_gcp","",""
"Simple test to ensure that the MySQL and application charms get deployed.","152266","test_deploy_highly_available_cluster_1","tests.integration.integration.high_availability","2025-12-01","passed","2025-12-01","","test_replication_unit_endpoints","",""
"Query database for custom variables.","24869","test_custom_variables","tests.integration.integration","2025-12-01","passed","2025-12-01","","test_charm","",""
"Simple test to ensure that the MySQL and application charms get deployed.","124923","test_deploy_highly_available_cluster","tests.integration.integration.high_availability","2025-12-01","passed","2025-12-01","","test_replication_data_isolation","",""
"Test the charmed_read predefined role.","27832","test_charmed_read_role","tests.integration.integration.roles","2025-12-01","passed","2025-12-01","","test_instance_roles","",""
"Simple test to ensure that the MySQL application charms get deployed.","163013","test_build_and_deploy","tests.integration.integration.high_availability","2025-12-01","passed","2025-12-01","","test_async_replication","",""
"Simple test to ensure that the MySQL and application charms get deployed.","","test_deploy_stable","tests.integration.integration.high_availability","","unknown","","","test_upgrade_from_stable","",""
"Test switchover on primary cluster fail.","444316","test_failover","tests.integration.integration.high_availability","2025-12-01","passed","2025-12-01","","test_async_replication","",""
"Simple test to ensure that the mysql charm gets deployed.","170083","test_build_and_deploy","tests.integration.integration","2025-12-01","passed","2025-12-01","","test_backup_gcp","",""
"Verify rotating tls private keys restarts cluster with new certificates.

    This test rotates tls private keys to randomly generated keys.
    ","42222","test_rotate_tls_key","tests.integration.integration","2025-12-01","passed","2025-12-01","","test_tls","",""
"Ensure scaling down to zero and back up works.","180545","test_scale_up_from_zero","tests.integration.integration","2025-12-01","passed","2025-12-01","","test_charm","",""
"Test graceful promotion of a standby cluster to primary.","32572","test_standby_promotion","tests.integration.integration.high_availability","2025-12-01","passed","2025-12-01","","test_async_replication","",""
"Test to write to primary, and read the same data back from replicas.","21972","test_data_replication","tests.integration.integration.high_availability","2025-12-01","passed","2025-12-01","","test_async_replication","",""
"Test to restore a backup to the same mysql cluster.","216848","test_restore_on_same_cluster","tests.integration.integration","2025-12-01","passed","2025-12-01","","test_backup_ceph","",""
"Simple test to ensure that the MySQL and application charms get deployed.","128757","test_deploy_highly_available_cluster","tests.integration.integration.high_availability","2025-12-01","passed","2025-12-01","","test_self_healing_stop_primary","",""
"Test to create a backup and list backups.","77045","test_backup","tests.integration.integration","2025-12-01","passed","2025-12-01","","test_backup_ceph","",""
"Test that data is preserved during scale up and scale down.","181026","test_scaling_without_data_loss","tests.integration.integration.high_availability","2025-12-01","passed","2025-12-01","","test_replication_scaling","",""
"Test to send a SIGKILL to the primary db process and ensure that the cluster self heals.","100432","test_kill_db_process","tests.integration.integration.high_availability","2025-12-01","passed","2025-12-01","","test_self_healing_process_killed","",""
"Simple test to ensure that the MySQL and application charms get deployed.","128524","test_deploy_highly_available_cluster","tests.integration.integration.high_availability","2025-12-01","passed","2025-12-01","","test_self_healing_restart_graceful","",""
"Test that the pre-upgrade-check action runs successfully.","18739","test_pre_upgrade_check","tests.integration.integration.high_availability","2025-12-01","passed","2025-12-01","","test_upgrade","",""
"Run the create-replication action and wait for the applications to settle.","325089","test_create_replication","tests.integration.integration.high_availability","2025-12-01","broken","2025-12-01","","test_async_replication_upgrade","",""
"Confirm that data is replicated from the primary node to all the replicas.","20177","test_consistent_data_replication_across_cluster","tests.integration.integration.high_availability","2025-12-01","passed","2025-12-01","","test_replication_data_consistency","",""
"Simple test to ensure that the MySQL and application charms get deployed.","127850","test_deploy_highly_available_cluster","tests.integration.integration.high_availability","2025-12-01","passed","2025-12-01","","test_self_healing_stop_all","",""
"","68039","test_deploy_and_relate_test_app","tests.integration.integration","2025-12-01","passed","2025-12-01","","test_saturate_max_connections","",""
"Test to restore a backup on a new mysql cluster.","538671","test_restore_on_new_cluster","tests.integration.integration","2025-12-01","passed","2025-12-01","","test_backup_aws","",""
"Delete the pod in a single unit deployment and write data to new pod.","809711","test_single_unit_pod_delete","tests.integration.integration.high_availability","2025-12-01","passed","2025-12-01","","test_self_healing_pod","",""
"Build the mysql charm and deploy it.","129267","test_build_and_deploy","tests.integration.integration","2025-12-01","passed","2025-12-01","","test_charm","",""
"Simple test to ensure that the MySQL and application charms get deployed.","64794","test_deploy_single_unit_cluster","tests.integration.integration.high_availability","2025-12-01","passed","2025-12-01","","test_self_healing_setup_crash","",""
"Relate charms before they have time to properly start.

    It simulates a Terraform-like deployment strategy
    ","142673","test_relation_creation_eager","tests.integration.integration.relations","2025-12-01","passed","2025-12-01","","test_mysql_root","",""
"Test the promote-to-primary command after losing the majority of nodes, with force flag.","269931","test_cluster_failover_after_majority_loss","tests.integration.integration.high_availability","2025-12-01","passed","2025-12-01","","test_primary_switchover","",""
"Test for encryption enablement when relation to TLS charm.","63307","test_enable_tls","tests.integration.integration","2025-12-01","passed","2025-12-01","","test_tls","",""
"Simple test to ensure that the mysql charm gets deployed.","212127","test_build_and_deploy","tests.integration.integration","2025-12-01","passed","2025-12-01","","test_backup_ceph","",""
"Test that the pre-upgrade-check action runs successfully.","","test_pre_upgrade_check","tests.integration.integration.high_availability","","unknown","","","test_upgrade_from_stable","",""
"Simple test to ensure that the MySQL and application charms get deployed.","120782","test_deploy_highly_available_cluster","tests.integration.integration.high_availability","2025-12-01","passed","2025-12-01","","test_replication_scaling","",""
"Test behavior when node drains - pod is evicted and pvs are rotated.","91624","test_pod_eviction_and_pvc_deletion","tests.integration.integration.high_availability","2025-12-01","passed","2025-12-01","","test_self_healing_node_drain","",""
"Build and deploy for AWS.","186628","test_build_and_deploy_aws","tests.integration.integration","2025-12-01","passed","2025-12-01","","test_backup_pitr_aws","",""
"Simple test to ensure that the MySQL and application charms get deployed.","211052","test_deploy_highly_available_cluster_2","tests.integration.integration.high_availability","2025-12-01","passed","2025-12-01","","test_replication_unit_endpoints","",""
"Test removing and re-relating the two mysql clusters.","326824","test_unrelate_and_relate","tests.integration.integration.high_availability","2025-12-01","passed","2025-12-01","","test_async_replication","",""
"Update the second cluster.","314197","test_upgrade_from_edge","tests.integration.integration.high_availability","2025-12-01","passed","2025-12-01","","test_upgrade","",""
"Test to restore a backup to the same mysql cluster.","224574","test_restore_on_same_cluster","tests.integration.integration","2025-12-01","passed","2025-12-01","","test_backup_gcp","",""
"Simple test to ensure that the MySQL application charms get deployed.","733026","test_build_and_deploy","tests.integration.integration.high_availability","2025-12-01","broken","2025-12-01","","test_async_replication_upgrade","",""
"Test upgrade rollback to a healthy revision.","351067","test_rollback","tests.integration.integration.high_availability","2025-12-01","passed","2025-12-01","","test_upgrade_rollback_incompat","",""
"Test to send SIGTERM to primary instance and then verify recovery.","240418","test_graceful_crash_of_primary","tests.integration.integration.high_availability","2025-12-01","passed","2025-12-01","","test_self_healing_stop_primary","",""
"Upgrade the two MySQL clusters.","1298799","test_upgrade_from_edge","tests.integration.integration.high_availability","2025-12-01","broken","2025-12-01","","test_async_replication_upgrade","",""
"Scale database and routers.","850738","test_scale_out","tests.integration.integration","2025-12-01","passed","2025-12-01","","test_multi_relations","",""
"Simple test to ensure that the MySQL and application charms get deployed.","125968","test_deploy_highly_available_cluster","tests.integration.integration.high_availability","2025-12-01","passed","2025-12-01","","test_self_healing_process_frozen","",""
"Test to write to primary, and read the same data back from replicas.","73092","test_data_replication","tests.integration.integration.high_availability","2025-12-01","broken","2025-12-01","","test_async_replication_upgrade","",""
"Test for a network cut affecting an instance.","118839","test_network_cut_affecting_an_instance","tests.integration.integration.high_availability","2025-12-01","passed","2025-12-01","","test_self_healing_network_cut","",""
"Simple test to ensure that the MySQL and application charms get deployed.","125358","test_deploy_highly_available_cluster","tests.integration.integration.high_availability","2025-12-01","passed","2025-12-01","","test_self_healing_node_drain","",""
"Relate charms and wait for the expected changes in status.","3800","test_relation_creation","tests.integration.integration.relations","2025-12-01","passed","2025-12-01","","test_database","",""
"Test that the pre-upgrade-check action runs successfully.","3843","test_pre_upgrade_check","tests.integration.integration.high_availability","2025-12-01","passed","2025-12-01","","test_upgrade_rollback_incompat","",""
"Ensure connections (with and without ssl) are possible before relating with TLS operator.","2199","test_connection_before_tls","tests.integration.integration","2025-12-01","passed","2025-12-01","","test_tls","",""
