"DESCRIPTION","DURATION IN MS","NAME","PARENT SUITE","START TIME","STATUS","STOP TIME","SUB SUITE","SUITE","TEST CLASS","TEST METHOD"
"Build the charm and deploy 3 units to ensure a cluster is formed.","137632","test_build_and_deploy","tests.integration.relations","Wed Jan 15 01:28:31 UTC 2025","passed","Wed Jan 15 01:30:49 UTC 2025","","test_database","",""
"Test that the pre-upgrade-check action runs successfully.","18676","test_pre_upgrade_check","tests.integration.high_availability","Wed Jan 15 01:31:18 UTC 2025","passed","Wed Jan 15 01:31:37 UTC 2025","","test_upgrade","",""
"","150797","test_rollback","tests.integration.high_availability","Wed Jan 15 01:31:13 UTC 2025","passed","Wed Jan 15 01:33:44 UTC 2025","","test_upgrade_rollback_incompat","",""
"Relate charms and wait for the expected changes in status.","0","test_relation_creation_databag","tests.integration.relations","Wed Jan 15 01:30:49 UTC 2025","skipped","Wed Jan 15 01:30:49 UTC 2025","","test_database","",""
"Relate the two mysql clusters.","4","test_async_relate","tests.integration.high_availability","Wed Jan 15 01:31:36 UTC 2025","broken","Wed Jan 15 01:31:36 UTC 2025","","test_async_replication","",""
"Test switchover on primary cluster fail.","0","test_failover","tests.integration.high_availability","Wed Jan 15 01:31:36 UTC 2025","skipped","Wed Jan 15 01:31:36 UTC 2025","","test_async_replication","",""
"","239099","test_fail_and_rollback","tests.integration.high_availability","Wed Jan 15 01:34:56 UTC 2025","passed","Wed Jan 15 01:38:55 UTC 2025","","test_upgrade","",""
"Tries deploying an arm64 charm on amd64 host.","58792","test_arm_charm_on_amd_host","tests.integration","Wed Jan 15 01:29:06 UTC 2025","passed","Wed Jan 15 01:30:04 UTC 2025","","test_architecture","",""
"Tries deploying an amd64 charm on arm64 host.","0","test_amd_charm_on_arm_host","tests.integration","Wed Jan 15 01:30:04 UTC 2025","skipped","Wed Jan 15 01:30:04 UTC 2025","","test_architecture","",""
"Simple test to ensure that the mysql and application charms get deployed.","131234","test_build_and_deploy","tests.integration.high_availability","Wed Jan 15 01:28:11 UTC 2025","passed","Wed Jan 15 01:30:22 UTC 2025","","test_upgrade_rollback_incompat","",""
"Delete the pod in a single unit deployment and write data to new pod.","198369","test_single_unit_pod_delete","tests.integration.high_availability","Wed Jan 15 01:31:24 UTC 2025","passed","Wed Jan 15 01:34:42 UTC 2025","","test_self_healing","",""
"Test that the pre-upgrade-check action runs successfully.","8143","test_pre_upgrade_check","tests.integration.high_availability","Wed Jan 15 01:30:23 UTC 2025","passed","Wed Jan 15 01:30:31 UTC 2025","","test_upgrade_rollback_incompat","",""
"","188538","test_upgrade_from_edge","tests.integration.high_availability","Wed Jan 15 01:31:41 UTC 2025","passed","Wed Jan 15 01:34:50 UTC 2025","","test_upgrade","",""
"Test to restore a backup to the same mysql cluster.","168309","test_restore_on_same_cluster","tests.integration","Wed Jan 15 01:32:03 UTC 2025","passed","Wed Jan 15 01:34:51 UTC 2025","","test_backup_ceph","",""
"","4688","test_saturate_max_connections","tests.integration","Wed Jan 15 01:29:22 UTC 2025","passed","Wed Jan 15 01:29:27 UTC 2025","","test_saturate_max_connections","",""
"Run the create replication and wait for the applications to settle.","0","test_create_replication","tests.integration.high_availability","Wed Jan 15 01:31:36 UTC 2025","skipped","Wed Jan 15 01:31:36 UTC 2025","","test_async_replication","",""
"Test the labeling of k8s endpoints when apps with same cluster-name deployed.","435394","test_labeling_of_k8s_endpoints","tests.integration.high_availability","Wed Jan 15 01:28:16 UTC 2025","passed","Wed Jan 15 01:35:31 UTC 2025","","test_k8s_endpoints","",""
"Confirm that data is replicated from the primary node to all the replicas.","4350","test_consistent_data_replication_across_cluster","tests.integration","Wed Jan 15 01:31:19 UTC 2025","passed","Wed Jan 15 01:31:24 UTC 2025","","test_charm","",""
"Test to restore a backup to the same mysql cluster.","192153","test_restore_on_same_cluster","tests.integration","Wed Jan 15 01:31:05 UTC 2025","passed","Wed Jan 15 01:34:17 UTC 2025","","test_backup_gcp","",""
"Build the mysql charm and deploy it.","144222","test_build_and_deploy","tests.integration","Wed Jan 15 01:28:55 UTC 2025","passed","Wed Jan 15 01:31:19 UTC 2025","","test_charm","",""
"Test to send SIGTERM to all units and then ensure that the cluster recovers.","338869","test_graceful_full_cluster_crash_test","tests.integration.high_availability","Wed Jan 15 01:32:02 UTC 2025","passed","Wed Jan 15 01:37:41 UTC 2025","","test_self_healing","",""
"Test for a network cut affecting an instance.","258854","test_network_cut_affecting_an_instance","tests.integration.high_availability","Wed Jan 15 01:32:00 UTC 2025","passed","Wed Jan 15 01:36:19 UTC 2025","","test_self_healing","",""
"Test to send SIGTERM to primary instance and then verify recovery.","123874","test_graceful_crash_of_primary","tests.integration.high_availability","Wed Jan 15 01:32:28 UTC 2025","passed","Wed Jan 15 01:34:32 UTC 2025","","test_self_healing","",""
"Test the existence of databases and tables created by osm-pol's migrations.","34418","test_osm_pol_operations","tests.integration.relations","Wed Jan 15 01:31:45 UTC 2025","passed","Wed Jan 15 01:32:20 UTC 2025","","test_mysql_root","",""
"Build the charm and deploy 3 units to ensure a cluster is formed.","127265","test_build_and_deploy","tests.integration","Wed Jan 15 01:29:45 UTC 2025","passed","Wed Jan 15 01:31:53 UTC 2025","","test_tls","",""
"Test for encryption enablement when relation to TLS charm.","62469","test_enable_tls","tests.integration","Wed Jan 15 01:31:55 UTC 2025","passed","Wed Jan 15 01:32:57 UTC 2025","","test_tls","",""
"","927910","test_crash_during_cluster_setup","tests.integration.high_availability","Wed Jan 15 01:28:14 UTC 2025","broken","Wed Jan 15 01:43:42 UTC 2025","","test_crash_during_setup","",""
"Build the charm and deploy 1 units to ensure a cluster is formed.","7896","test_build_and_deploy","tests.integration","Wed Jan 15 01:28:12 UTC 2025","passed","Wed Jan 15 01:28:20 UTC 2025","","test_saturate_max_connections","",""
"Simple test to ensure that the mysql charm gets deployed.","112944","test_build_and_deploy","tests.integration","Wed Jan 15 01:28:17 UTC 2025","passed","Wed Jan 15 01:30:10 UTC 2025","","test_backup_gcp","",""
"Ensure connections (with and without ssl) are possible before relating with TLS operator.","2275","test_connection_before_tls","tests.integration","Wed Jan 15 01:31:53 UTC 2025","passed","Wed Jan 15 01:31:55 UTC 2025","","test_tls","",""
"Test to create a backup and list backups.","53403","test_backup","tests.integration","Wed Jan 15 01:31:39 UTC 2025","passed","Wed Jan 15 01:32:32 UTC 2025","","test_backup_aws","",""
"Test rejoin invalidated cluster with.","0","test_rejoin_invalidated_cluster","tests.integration.high_availability","Wed Jan 15 01:31:36 UTC 2025","skipped","Wed Jan 15 01:31:36 UTC 2025","","test_async_replication","",""
"Test to ensure that writes to one cluster do not replicate to another cluster.","90479","test_no_replication_across_clusters","tests.integration.high_availability","Wed Jan 15 01:31:40 UTC 2025","passed","Wed Jan 15 01:33:10 UTC 2025","","test_replication","",""
"Test to create a backup and list backups.","44307","test_backup","tests.integration","Wed Jan 15 01:31:17 UTC 2025","passed","Wed Jan 15 01:32:01 UTC 2025","","test_backup_ceph","",""
"Test to write to primary, and read the same data back from replicas.","0","test_data_replication","tests.integration.high_availability","Wed Jan 15 01:31:36 UTC 2025","skipped","Wed Jan 15 01:31:36 UTC 2025","","test_async_replication","",""
"Test to restore a backup on a new mysql cluster.","307789","test_restore_on_new_cluster","tests.integration","Wed Jan 15 01:34:17 UTC 2025","passed","Wed Jan 15 01:39:25 UTC 2025","","test_backup_gcp","",""
"Build the charm and deploy 1 units to ensure a cluster is formed.","38610","test_build_and_deploy","tests.integration","Wed Jan 15 01:28:55 UTC 2025","passed","Wed Jan 15 01:29:34 UTC 2025","","test_multi_relations","",""
"Deploy the router and the test application.","0","test_deploy_router_and_app","tests.integration.high_availability","Wed Jan 15 01:31:36 UTC 2025","skipped","Wed Jan 15 01:31:36 UTC 2025","","test_async_replication","",""
"Simple test to ensure that the mysql charm gets deployed.","113340","test_build_and_deploy","tests.integration","Wed Jan 15 01:29:44 UTC 2025","passed","Wed Jan 15 01:31:37 UTC 2025","","test_backup_aws","",""
"Scale database and routers.","230276","test_scale_in","tests.integration","Wed Jan 15 01:40:20 UTC 2025","passed","Wed Jan 15 01:44:10 UTC 2025","","test_multi_relations","",""
"Query database for custom variables.","25135","test_custom_variables","tests.integration","Wed Jan 15 01:38:02 UTC 2025","passed","Wed Jan 15 01:38:28 UTC 2025","","test_charm","",""
"Scale database and routers.","495304","test_scale_out","tests.integration","Wed Jan 15 01:32:04 UTC 2025","passed","Wed Jan 15 01:40:20 UTC 2025","","test_multi_relations","",""
"Test to create a backup and list backups.","51679","test_backup","tests.integration","Wed Jan 15 01:30:12 UTC 2025","passed","Wed Jan 15 01:31:03 UTC 2025","","test_backup_gcp","",""
"Relate charms and wait for the expected changes in status.","36361","test_relation_creation","tests.integration.relations","Wed Jan 15 01:30:49 UTC 2025","passed","Wed Jan 15 01:31:25 UTC 2025","","test_database","",""
"Test removing and re-relating the two mysql clusters.","0","test_remove_relation_and_relate","tests.integration.high_availability","Wed Jan 15 01:31:36 UTC 2025","skipped","Wed Jan 15 01:31:36 UTC 2025","","test_async_replication","",""
"Simple test to ensure that the mysql and application charms get deployed.","179199","test_build_and_deploy","tests.integration.high_availability","Wed Jan 15 01:28:36 UTC 2025","passed","Wed Jan 15 01:31:36 UTC 2025","","test_async_replication","",""
"Test to restore a backup to the same mysql cluster.","166707","test_restore_on_same_cluster","tests.integration","Wed Jan 15 01:32:34 UTC 2025","passed","Wed Jan 15 01:35:21 UTC 2025","","test_backup_aws","",""
"Test to kill the primary under load and ensure re-election of primary.","199883","test_kill_primary_check_reelection","tests.integration.high_availability","Wed Jan 15 01:31:42 UTC 2025","passed","Wed Jan 15 01:35:02 UTC 2025","","test_replication","",""
"","62337","test_deploy_and_relate_test_app","tests.integration","Wed Jan 15 01:28:20 UTC 2025","passed","Wed Jan 15 01:29:22 UTC 2025","","test_saturate_max_connections","",""
"Test to restore a backup on a new mysql cluster.","269424","test_restore_on_new_cluster","tests.integration","Wed Jan 15 01:35:21 UTC 2025","passed","Wed Jan 15 01:39:51 UTC 2025","","test_backup_aws","",""
"Simple test to ensure that the mysql and application charms get deployed.","179131","test_deploy_latest","tests.integration.high_availability","Wed Jan 15 01:28:19 UTC 2025","passed","Wed Jan 15 01:31:18 UTC 2025","","test_upgrade","",""
"Test updating from stable channel.","160011","test_upgrade_from_stable","tests.integration.high_availability","Wed Jan 15 01:31:53 UTC 2025","passed","Wed Jan 15 01:34:33 UTC 2025","","test_upgrade_from_stable","",""
"Test that the pre-upgrade-check action runs successfully.","17597","test_pre_upgrade_check","tests.integration.high_availability","Wed Jan 15 01:31:34 UTC 2025","passed","Wed Jan 15 01:31:51 UTC 2025","","test_upgrade_from_stable","",""
"Simple test to ensure that the mysql and application charms get deployed.","175405","test_deploy_stable","tests.integration.high_availability","Wed Jan 15 01:28:38 UTC 2025","passed","Wed Jan 15 01:31:34 UTC 2025","","test_upgrade_from_stable","",""
"Test to send a SIGSTOP to the primary db process and ensure that the cluster self heals.","238763","test_freeze_db_process","tests.integration.high_availability","Wed Jan 15 01:31:53 UTC 2025","passed","Wed Jan 15 01:35:52 UTC 2025","","test_self_healing","",""
"Rotate password and confirm changes.","14169","test_password_rotation_root_user_implicit","tests.integration","Wed Jan 15 01:37:44 UTC 2025","passed","Wed Jan 15 01:37:58 UTC 2025","","test_charm","",""
"Confirm that a new primary is elected when the current primary is torn down.","263318","test_scale_up_and_down","tests.integration","Wed Jan 15 01:31:24 UTC 2025","passed","Wed Jan 15 01:35:47 UTC 2025","","test_charm","",""
"Test COS integrations formed before mysql is allocated and deployed.","82389","test_deploy_bundle_with_cos_integrations","tests.integration","Wed Jan 15 01:28:16 UTC 2025","passed","Wed Jan 15 01:29:39 UTC 2025","","test_cos_integration_bundle","",""
"Test that endpoints are running.","4373","test_exporter_endpoints","tests.integration","Wed Jan 15 01:37:58 UTC 2025","passed","Wed Jan 15 01:38:02 UTC 2025","","test_charm","",""
"Test the deployment and relation with osm bundle with mysql replacing mariadb.","174571","test_deploy_and_relate_osm_bundle","tests.integration.relations","Wed Jan 15 01:28:51 UTC 2025","passed","Wed Jan 15 01:31:45 UTC 2025","","test_mysql_root","",""
"","30247","test_disable_tls","tests.integration","Wed Jan 15 01:33:39 UTC 2025","passed","Wed Jan 15 01:34:10 UTC 2025","","test_tls","",""
"Remove relation and wait for the expected changes in status.","23547","test_relation_broken","tests.integration.relations","Wed Jan 15 01:31:25 UTC 2025","passed","Wed Jan 15 01:31:49 UTC 2025","","test_database","",""
"Test graceful promotion of a standby cluster to primary.","0","test_standby_promotion","tests.integration.high_availability","Wed Jan 15 01:31:36 UTC 2025","skipped","Wed Jan 15 01:31:36 UTC 2025","","test_async_replication","",""
"Verify rotating tls private keys restarts cluster with new certificates.

    This test rotates tls private keys to randomly generated keys.
    ","41911","test_rotate_tls_key","tests.integration","Wed Jan 15 01:32:57 UTC 2025","passed","Wed Jan 15 01:33:39 UTC 2025","","test_tls","",""
"Rotate password and confirm changes.","12167","test_password_rotation","tests.integration","Wed Jan 15 01:37:20 UTC 2025","passed","Wed Jan 15 01:37:32 UTC 2025","","test_charm","",""
"Test to send a SIGKILL to the primary db process and ensure that the cluster self heals.","82125","test_kill_db_process","tests.integration.high_availability","Wed Jan 15 01:31:22 UTC 2025","passed","Wed Jan 15 01:32:44 UTC 2025","","test_self_healing","",""
"Test to ensure that data is preserved when a unit is scaled up and then down.

    Ensures that there are no running continuous writes as the extra data in the
    database makes scaling up slower.
    ","257794","test_scaling_without_data_loss","tests.integration.high_availability","Wed Jan 15 01:32:22 UTC 2025","passed","Wed Jan 15 01:36:40 UTC 2025","","test_replication","",""
"Test to restore a backup on a new mysql cluster.","300771","test_restore_on_new_cluster","tests.integration","Wed Jan 15 01:34:51 UTC 2025","passed","Wed Jan 15 01:39:52 UTC 2025","","test_backup_ceph","",""
"","42800","test_upgrade_to_failling","tests.integration.high_availability","Wed Jan 15 01:30:31 UTC 2025","passed","Wed Jan 15 01:31:13 UTC 2025","","test_upgrade_rollback_incompat","",""
"Test the log rotation of text files.

    Run continuous writes to ensure that audit log plugin is loaded and active
    when mysql-test-app runs start-continuous-writes (by logging into mysql).
    ","10061","test_log_rotation","tests.integration.high_availability","Wed Jan 15 01:31:25 UTC 2025","passed","Wed Jan 15 01:31:35 UTC 2025","","test_log_rotation","",""
"Simple test to ensure that the mysql charm gets deployed.","117639","test_build_and_deploy","tests.integration","Wed Jan 15 01:29:17 UTC 2025","passed","Wed Jan 15 01:31:15 UTC 2025","","test_backup_ceph","",""
"Relate all the applications to the database.","150309","test_relate_all","tests.integration","Wed Jan 15 01:29:34 UTC 2025","passed","Wed Jan 15 01:32:04 UTC 2025","","test_multi_relations","",""
"Confirm storage reuse works.","92530","test_scale_up_after_scale_down","tests.integration","Wed Jan 15 01:35:47 UTC 2025","passed","Wed Jan 15 01:37:20 UTC 2025","","test_charm","",""
"Rotate password and confirm changes.","12158","test_password_rotation_silent","tests.integration","Wed Jan 15 01:37:32 UTC 2025","passed","Wed Jan 15 01:37:44 UTC 2025","","test_charm","",""
"Test behavior when node drains - pod is evicted and pvs are rotated.","133762","test_pod_eviction_and_pvc_deletion","tests.integration.high_availability","Wed Jan 15 01:31:27 UTC 2025","passed","Wed Jan 15 01:33:40 UTC 2025","","test_node_drain","",""
"Test to write to primary, and read the same data back from replicas.","10188","test_check_consistency","tests.integration.high_availability","Wed Jan 15 01:31:46 UTC 2025","passed","Wed Jan 15 01:31:56 UTC 2025","","test_replication","",""
