"DESCRIPTION","DURATION IN MS","NAME","PARENT SUITE","START TIME","STATUS","STOP TIME","SUB SUITE","SUITE","TEST CLASS","TEST METHOD"
"Test that the pre-upgrade-check action runs successfully.","18473","test_pre_upgrade_check","tests.integration.high_availability","Thu Nov 28 01:32:52 UTC 2024","passed","Thu Nov 28 01:33:11 UTC 2024","","test_upgrade","",""
"Ensure connections (with and without ssl) are possible before relating with TLS operator.","2137","test_connection_before_tls","tests.integration","Thu Nov 28 01:30:57 UTC 2024","passed","Thu Nov 28 01:31:00 UTC 2024","","test_tls","",""
"Build the charm and deploy 1 units to ensure a cluster is formed.","37435","test_build_and_deploy","tests.integration","Thu Nov 28 01:28:40 UTC 2024","passed","Thu Nov 28 01:29:17 UTC 2024","","test_multi_relations","",""
"Relate charms and wait for the expected changes in status.","0","test_relation_creation_databag","tests.integration.relations","Thu Nov 28 01:30:39 UTC 2024","skipped","Thu Nov 28 01:30:39 UTC 2024","","test_database","",""
"Scale database and routers.","525309","test_scale_out","tests.integration","Thu Nov 28 01:31:48 UTC 2024","passed","Thu Nov 28 01:40:33 UTC 2024","","test_multi_relations","",""
"Test to restore a backup on a new mysql cluster.","275391","test_restore_on_new_cluster","tests.integration","Thu Nov 28 01:34:47 UTC 2024","passed","Thu Nov 28 01:39:22 UTC 2024","","test_backup_ceph","",""
"","228614","test_crash_during_cluster_setup","tests.integration.high_availability","Thu Nov 28 01:28:33 UTC 2024","passed","Thu Nov 28 01:32:22 UTC 2024","","test_crash_during_setup","",""
"Simple test to ensure that the mysql and application charms get deployed.","155736","test_build_and_deploy","tests.integration.high_availability","Thu Nov 28 01:28:42 UTC 2024","passed","Thu Nov 28 01:31:18 UTC 2024","","test_upgrade_rollback_incompat","",""
"","57624","test_deploy_and_relate_test_app","tests.integration","Thu Nov 28 01:28:45 UTC 2024","passed","Thu Nov 28 01:29:42 UTC 2024","","test_saturate_max_connections","",""
"Deploy the router and the test application.","72836","test_deploy_router_and_app","tests.integration.high_availability","Thu Nov 28 01:34:37 UTC 2024","passed","Thu Nov 28 01:35:50 UTC 2024","","test_async_replication","",""
"Simple test to ensure that the mysql and application charms get deployed.","173099","test_build_and_deploy","tests.integration.high_availability","Thu Nov 28 01:28:32 UTC 2024","passed","Thu Nov 28 01:31:25 UTC 2024","","test_async_replication","",""
"Simple test to ensure that the mysql charm gets deployed.","109782","test_build_and_deploy","tests.integration","Thu Nov 28 01:28:14 UTC 2024","passed","Thu Nov 28 01:30:03 UTC 2024","","test_backup_aws","",""
"Build the charm and deploy 1 units to ensure a cluster is formed.","9848","test_build_and_deploy","tests.integration","Thu Nov 28 01:28:35 UTC 2024","passed","Thu Nov 28 01:28:45 UTC 2024","","test_saturate_max_connections","",""
"Relate charms and wait for the expected changes in status.","39175","test_relation_creation","tests.integration.relations","Thu Nov 28 01:30:39 UTC 2024","passed","Thu Nov 28 01:31:18 UTC 2024","","test_database","",""
"","30102","test_disable_tls","tests.integration","Thu Nov 28 01:32:46 UTC 2024","passed","Thu Nov 28 01:33:17 UTC 2024","","test_tls","",""
"Relate the two mysql clusters.","4682","test_async_relate","tests.integration.high_availability","Thu Nov 28 01:31:25 UTC 2024","passed","Thu Nov 28 01:31:30 UTC 2024","","test_async_replication","",""
"Simple test to ensure that the mysql and application charms get deployed.","243319","test_deploy_latest","tests.integration.high_availability","Thu Nov 28 01:28:49 UTC 2024","passed","Thu Nov 28 01:32:52 UTC 2024","","test_upgrade","",""
"Test to restore a backup to the same mysql cluster.","178865","test_restore_on_same_cluster","tests.integration","Thu Nov 28 01:30:48 UTC 2024","passed","Thu Nov 28 01:33:47 UTC 2024","","test_backup_aws","",""
"Rotate password and confirm changes.","14173","test_password_rotation_root_user_implicit","tests.integration","Thu Nov 28 01:37:24 UTC 2024","passed","Thu Nov 28 01:37:38 UTC 2024","","test_charm","",""
"Test to restore a backup to the same mysql cluster.","174725","test_restore_on_same_cluster","tests.integration","Thu Nov 28 01:31:52 UTC 2024","passed","Thu Nov 28 01:34:47 UTC 2024","","test_backup_ceph","",""
"Query database for custom variables.","25553","test_custom_variables","tests.integration","Thu Nov 28 01:37:42 UTC 2024","passed","Thu Nov 28 01:38:08 UTC 2024","","test_charm","",""
"Test for a network cut affecting an instance.","240958","test_network_cut_affecting_an_instance","tests.integration.high_availability","Thu Nov 28 01:32:01 UTC 2024","passed","Thu Nov 28 01:36:02 UTC 2024","","test_self_healing","",""
"","3141","test_saturate_max_connections","tests.integration","Thu Nov 28 01:29:42 UTC 2024","passed","Thu Nov 28 01:29:45 UTC 2024","","test_saturate_max_connections","",""
"","217695","test_upgrade_from_edge","tests.integration.high_availability","Thu Nov 28 01:33:15 UTC 2024","passed","Thu Nov 28 01:36:53 UTC 2024","","test_upgrade","",""
"Test to send SIGTERM to primary instance and then verify recovery.","62658","test_graceful_crash_of_primary","tests.integration.high_availability","Thu Nov 28 01:31:28 UTC 2024","passed","Thu Nov 28 01:32:31 UTC 2024","","test_self_healing","",""
"Scale database and routers.","265541","test_scale_in","tests.integration","Thu Nov 28 01:40:33 UTC 2024","passed","Thu Nov 28 01:44:59 UTC 2024","","test_multi_relations","",""
"Test to write to primary, and read the same data back from replicas.","8729","test_data_replication","tests.integration.high_availability","Thu Nov 28 01:36:52 UTC 2024","passed","Thu Nov 28 01:37:01 UTC 2024","","test_async_replication","",""
"Test the log rotation of text files.

    Run continuous writes to ensure that audit log plugin is loaded and active
    when mysql-test-app runs start-continuous-writes (by logging into mysql).
    ","10000","test_log_rotation","tests.integration.high_availability","Thu Nov 28 01:31:51 UTC 2024","passed","Thu Nov 28 01:32:01 UTC 2024","","test_log_rotation","",""
"Test to ensure that data is preserved when a unit is scaled up and then down.

    Ensures that there are no running continuous writes as the extra data in the
    database makes scaling up slower.
    ","249409","test_scaling_without_data_loss","tests.integration.high_availability","Thu Nov 28 01:31:24 UTC 2024","passed","Thu Nov 28 01:35:33 UTC 2024","","test_replication","",""
"Build the charm and deploy 3 units to ensure a cluster is formed.","133548","test_build_and_deploy","tests.integration.relations","Thu Nov 28 01:28:25 UTC 2024","passed","Thu Nov 28 01:30:39 UTC 2024","","test_database","",""
"","47668","test_upgrade_to_failling","tests.integration.high_availability","Thu Nov 28 01:31:26 UTC 2024","passed","Thu Nov 28 01:32:14 UTC 2024","","test_upgrade_rollback_incompat","",""
"Delete the pod in a single unit deployment and write data to new pod.","198997","test_single_unit_pod_delete","tests.integration.high_availability","Thu Nov 28 01:31:21 UTC 2024","passed","Thu Nov 28 01:34:40 UTC 2024","","test_self_healing","",""
"Simple test to ensure that the mysql and application charms get deployed.","53008","test_deploy_stable","tests.integration.high_availability","Thu Nov 28 01:28:32 UTC 2024","broken","Thu Nov 28 01:29:25 UTC 2024","","test_upgrade_from_stable","",""
"Test to write to primary, and read the same data back from replicas.","9476","test_check_consistency","tests.integration.high_availability","Thu Nov 28 01:31:41 UTC 2024","passed","Thu Nov 28 01:31:51 UTC 2024","","test_replication","",""
"Test switchover on primary cluster fail.","258607","test_failover","tests.integration.high_availability","Thu Nov 28 01:37:29 UTC 2024","passed","Thu Nov 28 01:41:47 UTC 2024","","test_async_replication","",""
"Test the existence of databases and tables created by osm-pol's migrations.","34202","test_osm_pol_operations","tests.integration.relations","Thu Nov 28 01:32:46 UTC 2024","passed","Thu Nov 28 01:33:20 UTC 2024","","test_mysql_root","",""
"Test to ensure that writes to one cluster do not replicate to another cluster.","92130","test_no_replication_across_clusters","tests.integration.high_availability","Thu Nov 28 01:31:24 UTC 2024","passed","Thu Nov 28 01:32:56 UTC 2024","","test_replication","",""
"Test the labeling of k8s endpoints when apps with same cluster-name deployed.","428231","test_labeling_of_k8s_endpoints","tests.integration.high_availability","Thu Nov 28 01:28:13 UTC 2024","passed","Thu Nov 28 01:35:21 UTC 2024","","test_k8s_endpoints","",""
"Test to restore a backup on a new mysql cluster.","299888","test_restore_on_new_cluster","tests.integration","Thu Nov 28 01:33:47 UTC 2024","passed","Thu Nov 28 01:38:47 UTC 2024","","test_backup_aws","",""
"Test removing and re-relating the two mysql clusters.","629819","test_remove_relation_and_relate","tests.integration.high_availability","Thu Nov 28 01:42:19 UTC 2024","broken","Thu Nov 28 01:52:49 UTC 2024","","test_async_replication","",""
"Test to restore a backup on a new mysql cluster.","299277","test_restore_on_new_cluster","tests.integration","Thu Nov 28 01:34:20 UTC 2024","passed","Thu Nov 28 01:39:19 UTC 2024","","test_backup_gcp","",""
"Test behavior when node drains - pod is evicted and pvs are rotated.","136764","test_pod_eviction_and_pvc_deletion","tests.integration.high_availability","Thu Nov 28 01:31:22 UTC 2024","passed","Thu Nov 28 01:33:39 UTC 2024","","test_node_drain","",""
"Test to send a SIGSTOP to the primary db process and ensure that the cluster self heals.","247444","test_freeze_db_process","tests.integration.high_availability","Thu Nov 28 01:31:23 UTC 2024","passed","Thu Nov 28 01:35:31 UTC 2024","","test_self_healing","",""
"Confirm that data is replicated from the primary node to all the replicas.","4157","test_consistent_data_replication_across_cluster","tests.integration","Thu Nov 28 01:30:20 UTC 2024","passed","Thu Nov 28 01:30:24 UTC 2024","","test_charm","",""
"Test to create a backup and list backups.","44000","test_backup","tests.integration","Thu Nov 28 01:31:06 UTC 2024","passed","Thu Nov 28 01:31:50 UTC 2024","","test_backup_ceph","",""
"Test that the pre-upgrade-check action runs successfully.","0","test_pre_upgrade_check","tests.integration.high_availability","Thu Nov 28 01:29:25 UTC 2024","skipped","Thu Nov 28 01:29:25 UTC 2024","","test_upgrade_from_stable","",""
"Test COS integrations formed before mysql is allocated and deployed.","99852","test_deploy_bundle_with_cos_integrations","tests.integration","Thu Nov 28 01:28:37 UTC 2024","passed","Thu Nov 28 01:30:16 UTC 2024","","test_cos_integration_bundle","",""
"Simple test to ensure that the mysql charm gets deployed.","111604","test_build_and_deploy","tests.integration","Thu Nov 28 01:28:10 UTC 2024","passed","Thu Nov 28 01:30:01 UTC 2024","","test_backup_gcp","",""
"Test to send a SIGKILL to the primary db process and ensure that the cluster self heals.","97181","test_kill_db_process","tests.integration.high_availability","Thu Nov 28 01:31:39 UTC 2024","passed","Thu Nov 28 01:33:16 UTC 2024","","test_self_healing","",""
"Test to send SIGTERM to all units and then ensure that the cluster recovers.","324248","test_graceful_full_cluster_crash_test","tests.integration.high_availability","Thu Nov 28 01:31:41 UTC 2024","passed","Thu Nov 28 01:37:05 UTC 2024","","test_self_healing","",""
"Build the charm and deploy 3 units to ensure a cluster is formed.","164121","test_build_and_deploy","tests.integration","Thu Nov 28 01:28:13 UTC 2024","passed","Thu Nov 28 01:30:57 UTC 2024","","test_tls","",""
"Confirm storage reuse works.","95186","test_scale_up_after_scale_down","tests.integration","Thu Nov 28 01:35:23 UTC 2024","passed","Thu Nov 28 01:36:59 UTC 2024","","test_charm","",""
"Test for encryption enablement when relation to TLS charm.","62807","test_enable_tls","tests.integration","Thu Nov 28 01:31:00 UTC 2024","passed","Thu Nov 28 01:32:02 UTC 2024","","test_tls","",""
"Test graceful promotion of a standby cluster to primary.","21384","test_standby_promotion","tests.integration.high_availability","Thu Nov 28 01:37:06 UTC 2024","passed","Thu Nov 28 01:37:27 UTC 2024","","test_async_replication","",""
"Rotate password and confirm changes.","12166","test_password_rotation_silent","tests.integration","Thu Nov 28 01:37:12 UTC 2024","passed","Thu Nov 28 01:37:24 UTC 2024","","test_charm","",""
"","178252","test_rollback","tests.integration.high_availability","Thu Nov 28 01:32:14 UTC 2024","passed","Thu Nov 28 01:35:12 UTC 2024","","test_upgrade_rollback_incompat","",""
"Test to restore a backup to the same mysql cluster.","205166","test_restore_on_same_cluster","tests.integration","Thu Nov 28 01:30:55 UTC 2024","passed","Thu Nov 28 01:34:20 UTC 2024","","test_backup_gcp","",""
"Test that the pre-upgrade-check action runs successfully.","8284","test_pre_upgrade_check","tests.integration.high_availability","Thu Nov 28 01:31:18 UTC 2024","passed","Thu Nov 28 01:31:26 UTC 2024","","test_upgrade_rollback_incompat","",""
"Verify rotating tls private keys restarts cluster with new certificates.

    This test rotates tls private keys to randomly generated keys.
    ","44011","test_rotate_tls_key","tests.integration","Thu Nov 28 01:32:02 UTC 2024","passed","Thu Nov 28 01:32:46 UTC 2024","","test_tls","",""
"Test the deployment and relation with osm bundle with mysql replacing mariadb.","272331","test_deploy_and_relate_osm_bundle","tests.integration.relations","Thu Nov 28 01:28:13 UTC 2024","passed","Thu Nov 28 01:32:46 UTC 2024","","test_mysql_root","",""
"Confirm that a new primary is elected when the current primary is torn down.","299603","test_scale_up_and_down","tests.integration","Thu Nov 28 01:30:24 UTC 2024","passed","Thu Nov 28 01:35:23 UTC 2024","","test_charm","",""
"Test to create a backup and list backups.","49396","test_backup","tests.integration","Thu Nov 28 01:30:03 UTC 2024","passed","Thu Nov 28 01:30:53 UTC 2024","","test_backup_gcp","",""
"Test to kill the primary under load and ensure re-election of primary.","139788","test_kill_primary_check_reelection","tests.integration.high_availability","Thu Nov 28 01:31:28 UTC 2024","passed","Thu Nov 28 01:33:48 UTC 2024","","test_replication","",""
"Test that endpoints are running.","4011","test_exporter_endpoints","tests.integration","Thu Nov 28 01:37:38 UTC 2024","passed","Thu Nov 28 01:37:42 UTC 2024","","test_charm","",""
"","254226","test_fail_and_rollback","tests.integration.high_availability","Thu Nov 28 01:37:02 UTC 2024","passed","Thu Nov 28 01:41:16 UTC 2024","","test_upgrade","",""
"Test updating from stable channel.","0","test_upgrade_from_stable","tests.integration.high_availability","Thu Nov 28 01:29:25 UTC 2024","skipped","Thu Nov 28 01:29:25 UTC 2024","","test_upgrade_from_stable","",""
"Build the mysql charm and deploy it.","133908","test_build_and_deploy","tests.integration","Thu Nov 28 01:28:06 UTC 2024","passed","Thu Nov 28 01:30:20 UTC 2024","","test_charm","",""
"Test to create a backup and list backups.","40849","test_backup","tests.integration","Thu Nov 28 01:30:05 UTC 2024","passed","Thu Nov 28 01:30:46 UTC 2024","","test_backup_aws","",""
"Simple test to ensure that the mysql charm gets deployed.","108121","test_build_and_deploy","tests.integration","Thu Nov 28 01:29:16 UTC 2024","passed","Thu Nov 28 01:31:04 UTC 2024","","test_backup_ceph","",""
"Run the create replication and wait for the applications to settle.","187083","test_create_replication","tests.integration.high_availability","Thu Nov 28 01:31:30 UTC 2024","passed","Thu Nov 28 01:34:37 UTC 2024","","test_async_replication","",""
"Test rejoin invalidated cluster with.","24613","test_rejoin_invalidated_cluster","tests.integration.high_availability","Thu Nov 28 01:41:51 UTC 2024","passed","Thu Nov 28 01:42:16 UTC 2024","","test_async_replication","",""
"Relate all the applications to the database.","150401","test_relate_all","tests.integration","Thu Nov 28 01:29:17 UTC 2024","passed","Thu Nov 28 01:31:48 UTC 2024","","test_multi_relations","",""
"Rotate password and confirm changes.","13212","test_password_rotation","tests.integration","Thu Nov 28 01:36:59 UTC 2024","passed","Thu Nov 28 01:37:12 UTC 2024","","test_charm","",""
"Remove relation and wait for the expected changes in status.","22634","test_relation_broken","tests.integration.relations","Thu Nov 28 01:31:18 UTC 2024","passed","Thu Nov 28 01:31:41 UTC 2024","","test_database","",""
