"DESCRIPTION","DURATION IN MS","NAME","PARENT SUITE","START TIME","STATUS","STOP TIME","SUB SUITE","SUITE","TEST CLASS","TEST METHOD"
"Simple test to ensure that the MySQL and application charms get deployed.","117680","test_build_and_deploy","tests.integration.high_availability","2025-10-29","passed","2025-10-29","","test_upgrade_rollback_incompat","",""
"Pitr tests.","252096","test_pitr_aws","tests.integration","2025-10-29","passed","2025-10-29","","test_backup_pitr_gcp","",""
"Confirm that data is replicated from the primary node to all the replicas.","23216","test_consistent_data_replication_across_cluster","tests.integration.high_availability","2025-10-29","passed","2025-10-29","","test_replication_data_consistency","",""
"Test rejoin invalidated cluster with.","42999","test_rejoin_invalidated_cluster","tests.integration.high_availability","2025-10-29","passed","2025-10-29","","test_async_replication","",""
"Simple test to ensure that the mysql and data-integrator charms get deployed.","161580","test_build_and_deploy","tests.integration.roles","2025-10-29","passed","2025-10-29","","test_database_dba_role","",""
"Relate all the applications to the database.","195352","test_relate_all","tests.integration","2025-10-29","passed","2025-10-29","","test_multi_relations","",""
"Test to write to primary, and read the same data back from replicas.","21789","test_data_replication","tests.integration.high_availability","2025-10-29","passed","2025-10-29","","test_async_replication","",""
"Simple test to ensure that the MySQL and application charms get deployed.","177943","test_deploy_highly_available_cluster_2","tests.integration.high_availability","2025-10-29","passed","2025-10-29","","test_replication_unit_endpoints","",""
"Build and deploy for AWS.","207347","test_build_and_deploy_aws","tests.integration","2025-10-29","passed","2025-10-29","","test_backup_pitr_aws","",""
"Test to create a backup and list backups.","51592","test_backup","tests.integration","2025-10-29","passed","2025-10-29","","test_backup_gcp","",""
"Test the charmed_dml role.","77364","test_charmed_dml_role","tests.integration.roles","2025-10-29","passed","2025-10-29","","test_instance_roles","",""
"Test upgrade rollback to a healthy revision.","341255","test_rollback","tests.integration.high_availability","2025-10-29","passed","2025-10-29","","test_upgrade_rollback_incompat","",""
"Test for cluster data isolation.

    This test creates a new cluster, create a new table on both cluster, write a single record with
    the application name for each cluster, retrieve and compare these records, asserting they are
    not the same.
    ","83425","test_cluster_data_isolation","tests.integration.high_availability","2025-10-29","passed","2025-10-29","","test_replication_data_isolation","",""
"Simple test to ensure that the mysql charm gets deployed.","185581","test_build_and_deploy","tests.integration","2025-10-29","passed","2025-10-29","","test_backup_gcp","",""
"Relate charms before they have time to properly start.

    It simulates a Terraform-like deployment strategy
    ","156548","test_relation_creation_eager","tests.integration.relations","2025-10-29","passed","2025-10-29","","test_database","",""
"Test that the pre-upgrade-check action runs successfully.","21986","test_pre_upgrade_check","tests.integration.high_availability","2025-10-29","passed","2025-10-29","","test_upgrade_from_stable","",""
"Tries deploying an amd64 charm on arm64 host.","0","test_amd_charm_on_arm_host","tests.integration","2025-10-29","skipped","2025-10-29","","test_architecture","",""
"Simple test to ensure that the MySQL and application charms get deployed.","136178","test_deploy_highly_available_cluster_1","tests.integration.high_availability","2025-10-29","passed","2025-10-29","","test_replication_unit_endpoints","",""
"Test for a network cut affecting an instance.","306277","test_network_cut_affecting_an_instance","tests.integration.high_availability","2025-10-29","passed","2025-10-29","","test_self_healing_network_cut","",""
"Build the charm and deploy 3 units to ensure a cluster is formed.","5481","test_build_and_deploy","tests.integration.relations","2025-10-29","passed","2025-10-29","","test_database","",""
"Confirm that a new primary is elected when the current primary is torn down.","256901","test_scale_up_and_down","tests.integration","2025-10-29","passed","2025-10-29","","test_charm","",""
"Deploy the test application.","29633","test_deploy_test_app","tests.integration.high_availability","2025-10-29","passed","2025-10-29","","test_async_replication_upgrade","",""
"Test graceful promotion of a standby cluster to primary.","32759","test_standby_promotion","tests.integration.high_availability","2025-10-29","passed","2025-10-29","","test_async_replication","",""
"Test to create a backup and list backups.","45985","test_backup","tests.integration","2025-10-29","passed","2025-10-29","","test_backup_ceph","",""
"Build the mysql charm and deploy it.","145694","test_build_and_deploy","tests.integration","2025-10-29","passed","2025-10-29","","test_charm","",""
"Tries deploying an arm64 charm on amd64 host.","59097","test_arm_charm_on_amd_host","tests.integration","2025-10-29","passed","2025-10-29","","test_architecture","",""
"Test to restore a backup to the same mysql cluster.","228147","test_restore_on_same_cluster","tests.integration","2025-10-29","passed","2025-10-29","","test_backup_aws","",""
"Test that endpoints are running.","4078","test_exporter_endpoints","tests.integration","2025-10-29","passed","2025-10-29","","test_charm","",""
"Test the labeling of k8s endpoints when apps with same cluster-name deployed.","3486","test_labeling_of_k8s_endpoints","tests.integration.high_availability","2025-10-29","passed","2025-10-29","","test_replication_unit_endpoints","",""
"","67190","test_deploy_and_relate_test_app","tests.integration","2025-10-29","passed","2025-10-29","","test_saturate_max_connections","",""
"Test the existence of databases and tables created by osm-pol's migrations.","34349","test_osm_pol_operations","tests.integration","2025-10-29","passed","2025-10-29","","test_osm_integration_bundle","",""
"Build the charm and deploy 3 units to ensure a cluster is formed.","6383","test_build_and_deploy","tests.integration.relations","2025-10-29","passed","2025-10-29","","test_mysql_root","",""
"Deploy the router and the test application.","59419","test_deploy_router_and_app","tests.integration.high_availability","2025-10-29","passed","2025-10-29","","test_async_replication","",""
"Simple test to ensure that the MySQL and application charms get deployed.","129770","test_deploy_highly_available_cluster","tests.integration.high_availability","2025-10-29","passed","2025-10-29","","test_replication_data_consistency","",""
"Simple test to ensure that the mysql and data-integrator charms get deployed.","148805","test_build_and_deploy","tests.integration.roles","2025-10-29","passed","2025-10-29","","test_instance_dba_role","",""
"Update the second cluster.","395358","test_upgrade_from_stable","tests.integration.high_availability","2025-10-29","passed","2025-10-29","","test_upgrade_from_stable","",""
"Confirm storage reuse works.","88982","test_scale_up_after_scale_down","tests.integration","2025-10-29","passed","2025-10-29","","test_charm","",""
"Test an upgrade failure and its rollback.","354202","test_fail_and_rollback","tests.integration.high_availability","2025-10-29","passed","2025-10-29","","test_upgrade","",""
"Run the create-replication action and wait for the applications to settle.","123641","test_create_replication","tests.integration.high_availability","2025-10-29","passed","2025-10-29","","test_async_replication","",""
"Build the charm and deploy 3 units to ensure a cluster is formed.","148968","test_build_and_deploy","tests.integration","2025-10-29","passed","2025-10-29","","test_tls","",""
"Test to restore a backup on a new mysql cluster.","472993","test_restore_on_new_cluster","tests.integration","2025-10-29","passed","2025-10-29","","test_backup_gcp","",""
"Simple test to ensure that the MySQL and application charms get deployed.","132423","test_deploy_latest","tests.integration.high_availability","2025-10-29","passed","2025-10-29","","test_upgrade","",""
"","47142","test_upgrade_to_failing","tests.integration.high_availability","2025-10-29","passed","2025-10-29","","test_upgrade_rollback_incompat","",""
"","30189","test_disable_tls","tests.integration","2025-10-29","passed","2025-10-29","","test_tls","",""
"Test that the pre-upgrade-check action runs successfully.","23253","test_pre_upgrade_check","tests.integration.high_availability","2025-10-29","passed","2025-10-29","","test_upgrade","",""
"Simple test to ensure that the mysql and data-integrator charms get deployed.","163031","test_build_and_deploy","tests.integration.roles","2025-10-29","passed","2025-10-29","","test_instance_roles","",""
"Confirm that data is replicated from the primary node to all the replicas.","4256","test_consistent_data_replication_across_cluster","tests.integration","2025-10-29","passed","2025-10-29","","test_charm","",""
"Relate charms and wait for the expected changes in status.","0","test_relation_creation_databag","tests.integration.relations","2025-10-29","skipped","2025-10-29","","test_database","",""
"Test the database-level DBA role.","56822","test_charmed_dba_role","tests.integration.roles","2025-10-29","passed","2025-10-29","","test_database_dba_role","",""
"Delete the pod in a single unit deployment and write data to new pod.","250558","test_single_unit_pod_delete","tests.integration.high_availability","2025-10-29","passed","2025-10-29","","test_self_healing_pod","",""
"Scale database and routers.","855964","test_scale_out","tests.integration","2025-10-29","passed","2025-10-29","","test_multi_relations","",""
"Simple test to ensure that the MySQL application charms get deployed.","171352","test_build_and_deploy","tests.integration.high_availability","2025-10-29","passed","2025-10-29","","test_async_replication","",""
"Test to write to primary, and read the same data back from replicas.","19442","test_data_replication","tests.integration.high_availability","2025-10-29","passed","2025-10-29","","test_async_replication_upgrade","",""
"Query database for custom variables.","24850","test_custom_variables","tests.integration","2025-10-29","passed","2025-10-29","","test_charm","",""
"Rotate password and confirm changes.","11156","test_password_rotation_silent","tests.integration","2025-10-29","passed","2025-10-29","","test_charm","",""
"Test the deployment and relation with osm bundle with mysql replacing mariadb.","164960","test_deploy_and_relate_osm_bundle","tests.integration","2025-10-29","passed","2025-10-29","","test_osm_integration_bundle","",""
"Test to create a backup and list backups.","56182","test_backup","tests.integration","2025-10-29","passed","2025-10-29","","test_backup_aws","",""
"Simple test to ensure that the MySQL and application charms get deployed.","145218","test_deploy_highly_available_cluster","tests.integration.high_availability","2025-10-29","passed","2025-10-29","","test_replication_data_isolation","",""
"Test to restore a backup on a new mysql cluster.","586217","test_restore_on_new_cluster","tests.integration","2025-10-29","passed","2025-10-29","","test_backup_aws","",""
"The cluster manual re-join test.

    A graceful restart is performed in one of the instances (choosing Primary to make it painful).
    In order to verify that the instance can come back ONLINE, after disabling automatic re-join
    ","66042","test_cluster_manual_rejoin","tests.integration.high_availability","2025-10-29","passed","2025-10-29","","test_self_healing_restart_graceful","",""
"Test to send SIGTERM to all units and then ensure that the cluster recovers.","377934","test_graceful_full_cluster_crash_test","tests.integration.high_availability","2025-10-29","passed","2025-10-29","","test_self_healing_stop_all","",""
"Test primary crash during startup.

    It must recover/end setup when the primary got offline.
    ","173063","test_crash_during_cluster_setup","tests.integration.high_availability","2025-10-29","passed","2025-10-29","","test_crash_during_setup","",""
"Test behavior when node drains - pod is evicted and pvs are rotated.","132372","test_pod_eviction_and_pvc_deletion","tests.integration.high_availability","2025-10-29","passed","2025-10-29","","test_node_drain","",""
"Test the charmed_read predefined role.","49934","test_charmed_read_role","tests.integration.roles","2025-10-29","passed","2025-10-29","","test_instance_roles","",""
"Pitr tests.","286673","test_pitr_aws","tests.integration","2025-10-29","passed","2025-10-29","","test_backup_pitr_aws","",""
"Simple test to ensure that the MySQL and application charms get deployed.","138063","test_deploy_stable","tests.integration.high_availability","2025-10-29","passed","2025-10-29","","test_upgrade_from_stable","",""
"Relate the two MySQL clusters.","38801","test_async_relate","tests.integration.high_availability","2025-10-29","passed","2025-10-29","","test_async_replication","",""
"Test switchover on primary cluster fail.","296179","test_failover","tests.integration.high_availability","2025-10-29","passed","2025-10-29","","test_async_replication","",""
"Test the DBA predefined role.","32612","test_charmed_dba_role","tests.integration.roles","2025-10-29","passed","2025-10-29","","test_instance_dba_role","",""
"Relate charms before they have time to properly start.

    It simulates a Terraform-like deployment strategy
    ","153401","test_relation_creation_eager","tests.integration.relations","2025-10-29","passed","2025-10-29","","test_mysql_root","",""
"Run the create-replication action and wait for the applications to settle.","183682","test_create_replication","tests.integration.high_availability","2025-10-29","passed","2025-10-29","","test_async_replication_upgrade","",""
"Simple test to ensure that the MySQL and application charms get deployed.","141324","test_deploy_highly_available_cluster","tests.integration.high_availability","2025-10-29","passed","2025-10-29","","test_replication_scaling","",""
"Rotate password and confirm changes.","11161","test_password_rotation","tests.integration","2025-10-29","passed","2025-10-29","","test_charm","",""
"Ensure scaling down to zero and back up works.","176369","test_scale_up_from_zero","tests.integration","2025-10-29","passed","2025-10-29","","test_charm","",""
"Verify rotating tls private keys restarts cluster with new certificates.

    This test rotates tls private keys to randomly generated keys.
    ","44323","test_rotate_tls_key","tests.integration","2025-10-29","passed","2025-10-29","","test_tls","",""
"Build the charm and deploy 1 units to ensure a cluster is formed.","29448","test_build_and_deploy","tests.integration","2025-10-29","passed","2025-10-29","","test_multi_relations","",""
"Ensure connections (with and without ssl) are possible before relating with TLS operator.","2206","test_connection_before_tls","tests.integration","2025-10-29","passed","2025-10-29","","test_tls","",""
"Simple test to ensure that the MySQL application charms get deployed.","174270","test_build_and_deploy","tests.integration.high_availability","2025-10-29","passed","2025-10-29","","test_async_replication_upgrade","",""
"Simple test to ensure that the mysql charm gets deployed.","204551","test_build_and_deploy","tests.integration","2025-10-29","passed","2025-10-29","","test_backup_ceph","",""
"Update the second cluster.","231452","test_upgrade_from_edge","tests.integration.high_availability","2025-10-29","passed","2025-10-29","","test_upgrade","",""
"Build the charm and deploy 1 units to ensure a cluster is formed.","6267","test_build_and_deploy","tests.integration","2025-10-29","passed","2025-10-29","","test_saturate_max_connections","",""
"Confirm that a new primary is elected when the current primary is tear down.","315852","test_kill_primary_check_reelection","tests.integration.high_availability","2025-10-29","passed","2025-10-29","","test_replication_reelection","",""
"Test COS integrations formed before mysql is allocated and deployed.","96762","test_deploy_bundle_with_cos_integrations","tests.integration","2025-10-29","passed","2025-10-29","","test_cos_integration_bundle","",""
"Test the promote-to-primary command after losing the majority of nodes, with force flag.","271058","test_cluster_failover_after_majority_loss","tests.integration.high_availability","2025-10-29","passed","2025-10-29","","test_primary_switchover","",""
"Test to restore a backup to the same mysql cluster.","200549","test_restore_on_same_cluster","tests.integration","2025-10-29","passed","2025-10-29","","test_backup_ceph","",""
"Relate charms and wait for the expected changes in status.","15747","test_relation_creation","tests.integration.relations","2025-10-29","passed","2025-10-29","","test_database","",""
"Remove relation and wait for the expected changes in status.","37164","test_relation_broken","tests.integration.relations","2025-10-29","passed","2025-10-29","","test_database","",""
"Test the log rotation of text files.","4889","test_log_rotation","tests.integration.high_availability","2025-10-29","passed","2025-10-29","","test_replication_logs_rotation","",""
"Relate the two MySQL clusters.","37685","test_async_relate","tests.integration.high_availability","2025-10-29","passed","2025-10-29","","test_async_replication_upgrade","",""
"Upgrade the two MySQL clusters.","659171","test_upgrade_from_edge","tests.integration.high_availability","2025-10-29","passed","2025-10-29","","test_async_replication_upgrade","",""
"Scale database and routers.","288696","test_scale_in","tests.integration","2025-10-29","passed","2025-10-29","","test_multi_relations","",""
"Test for encryption enablement when relation to TLS charm.","64308","test_enable_tls","tests.integration","2025-10-29","passed","2025-10-29","","test_tls","",""
"Test that the pre-upgrade-check action runs successfully.","5563","test_pre_upgrade_check","tests.integration.high_availability","2025-10-29","passed","2025-10-29","","test_upgrade_rollback_incompat","",""
"Simple test to ensure that the MySQL and application charms get deployed.","127800","test_deploy_highly_available_cluster","tests.integration.high_availability","2025-10-29","passed","2025-10-29","","test_replication_logs_rotation","",""
"Test to restore a backup to the same mysql cluster.","222725","test_restore_on_same_cluster","tests.integration","2025-10-29","passed","2025-10-29","","test_backup_gcp","",""
"Simple test to ensure that the MySQL and application charms get deployed.","138365","test_deploy_highly_available_cluster","tests.integration.high_availability","2025-10-29","passed","2025-10-29","","test_replication_reelection","",""
"Test to send a SIGKILL to the primary db process and ensure that the cluster self heals.","124495","test_kill_db_process","tests.integration.high_availability","2025-10-29","passed","2025-10-29","","test_self_healing_process_killed","",""
"","3771","test_saturate_max_connections","tests.integration","2025-10-29","passed","2025-10-29","","test_saturate_max_connections","",""
"Rotate password and confirm changes.","13164","test_password_rotation_root_user_implicit","tests.integration","2025-10-29","passed","2025-10-29","","test_charm","",""
"Test to send SIGTERM to primary instance and then verify recovery.","111078","test_graceful_crash_of_primary","tests.integration.high_availability","2025-10-29","passed","2025-10-29","","test_self_healing_stop_primary","",""
"Test removing and re-relating the two mysql clusters.","304286","test_unrelate_and_relate","tests.integration.high_availability","2025-10-29","passed","2025-10-29","","test_async_replication","",""
"Test that the primary node can be switched over.","14617","test_cluster_switchover","tests.integration.high_availability","2025-10-29","passed","2025-10-29","","test_primary_switchover","",""
"Simple test to ensure that the mysql charm gets deployed.","172393","test_build_and_deploy","tests.integration","2025-10-29","passed","2025-10-29","","test_backup_aws","",""
"Test to send a SIGSTOP to the primary db process and ensure that the cluster self heals.","300245","test_freeze_db_process","tests.integration.high_availability","2025-10-29","passed","2025-10-29","","test_self_healing_process_frozen","",""
"Test to restore a backup on a new mysql cluster.","505366","test_restore_on_new_cluster","tests.integration","2025-10-29","passed","2025-10-29","","test_backup_ceph","",""
"Test that data is preserved during scale up and scale down.","181993","test_scaling_without_data_loss","tests.integration.high_availability","2025-10-29","passed","2025-10-29","","test_replication_scaling","",""
"Build and deploy for AWS.","196271","test_build_and_deploy_gcp","tests.integration","2025-10-29","passed","2025-10-29","","test_backup_pitr_gcp","",""
