"DESCRIPTION","DURATION IN MS","NAME","PARENT SUITE","START TIME","STATUS","STOP TIME","SUB SUITE","SUITE","TEST CLASS","TEST METHOD"
"Test to write to primary, and read the same data back from replicas.","20872","test_check_consistency","tests.integration.high_availability","Wed Jul 17 01:40:21 UTC 2024","passed","Wed Jul 17 01:40:42 UTC 2024","","test_replication","",""
"Simple test to ensure that the mysql and application charms get deployed.","133556","test_build_and_deploy","tests.integration.high_availability","Wed Jul 17 01:37:04 UTC 2024","passed","Wed Jul 17 01:39:17 UTC 2024","","test_upgrade_rollback_incompat","",""
"Relate the two mysql clusters.","4149","test_async_relate","tests.integration.high_availability","Wed Jul 17 01:39:30 UTC 2024","passed","Wed Jul 17 01:39:35 UTC 2024","","test_async_replication","",""
"Build the mysql charm and deploy it.","118686","test_build_and_deploy","tests.integration","Wed Jul 17 01:36:45 UTC 2024","passed","Wed Jul 17 01:38:44 UTC 2024","","test_charm","",""
"Test updating from stable channel.","194449","test_upgrade_from_stable","tests.integration.high_availability","Wed Jul 17 01:39:47 UTC 2024","passed","Wed Jul 17 01:43:01 UTC 2024","","test_upgrade_from_stable","",""
"Test to kill the primary under load and ensure re-election of primary.","225249","test_kill_primary_check_reelection","tests.integration.high_availability","Wed Jul 17 01:46:25 UTC 2024","passed","Wed Jul 17 01:50:10 UTC 2024","","test_replication","",""
"Test that the pre-upgrade-check action runs successfully.","14363","test_pre_upgrade_check","tests.integration.high_availability","Wed Jul 17 01:39:33 UTC 2024","passed","Wed Jul 17 01:39:47 UTC 2024","","test_upgrade_from_stable","",""
"Rotate password and confirm changes.","14195","test_password_rotation_root_user_implicit","tests.integration","Wed Jul 17 01:44:11 UTC 2024","passed","Wed Jul 17 01:44:25 UTC 2024","","test_charm","",""
"Simple test to ensure that the mysql and application charms get deployed.","192840","test_build_and_deploy","tests.integration.high_availability","Wed Jul 17 01:37:05 UTC 2024","passed","Wed Jul 17 01:40:18 UTC 2024","","test_self_healing","",""
"Test that the pre-upgrade-check action runs successfully.","5101","test_pre_upgrade_check","tests.integration.high_availability","Wed Jul 17 01:39:17 UTC 2024","passed","Wed Jul 17 01:39:22 UTC 2024","","test_upgrade_rollback_incompat","",""
"","145883","test_rollback","tests.integration.high_availability","Wed Jul 17 01:40:02 UTC 2024","passed","Wed Jul 17 01:42:28 UTC 2024","","test_upgrade_rollback_incompat","",""
"Rotate password and confirm changes.","12162","test_password_rotation_silent","tests.integration","Wed Jul 17 01:43:59 UTC 2024","passed","Wed Jul 17 01:44:11 UTC 2024","","test_charm","",""
"Test switchover on primary cluster fail.","258580","test_failover","tests.integration.high_availability","Wed Jul 17 01:44:10 UTC 2024","passed","Wed Jul 17 01:48:29 UTC 2024","","test_async_replication","",""
"Simple test to ensure that the mysql charm gets deployed.","116547","test_build_and_deploy","tests.integration","Wed Jul 17 01:38:01 UTC 2024","passed","Wed Jul 17 01:39:58 UTC 2024","","test_backup_ceph","",""
"Confirm that data is replicated from the primary node to all the replicas.","4137","test_consistent_data_replication_across_cluster","tests.integration","Wed Jul 17 01:38:44 UTC 2024","passed","Wed Jul 17 01:38:48 UTC 2024","","test_charm","",""
"Rotate password and confirm changes.","11161","test_password_rotation","tests.integration","Wed Jul 17 01:43:48 UTC 2024","passed","Wed Jul 17 01:43:59 UTC 2024","","test_charm","",""
"Test the deployment and relation with osm bundle with mysql replacing mariadb.","146995","test_deploy_and_relate_osm_bundle","tests.integration.relations","Wed Jul 17 01:36:50 UTC 2024","passed","Wed Jul 17 01:39:17 UTC 2024","","test_mysql_root","",""
"Test to restore a backup on a new mysql cluster.","290399","test_restore_on_new_cluster","tests.integration","Wed Jul 17 01:43:54 UTC 2024","passed","Wed Jul 17 01:48:44 UTC 2024","","test_backup_ceph","",""
"Test that the pre-upgrade-check action runs successfully.","13402","test_pre_upgrade_check","tests.integration.high_availability","Wed Jul 17 01:39:17 UTC 2024","passed","Wed Jul 17 01:39:31 UTC 2024","","test_upgrade","",""
"Build the charm and deploy 3 units to ensure a cluster is formed.","147586","test_build_and_deploy","tests.integration.relations","Wed Jul 17 01:36:49 UTC 2024","passed","Wed Jul 17 01:39:17 UTC 2024","","test_database","",""
"Test removing and re-relating the two mysql clusters.","229046","test_remove_relation_and_relate","tests.integration.high_availability","Wed Jul 17 01:48:54 UTC 2024","passed","Wed Jul 17 01:52:43 UTC 2024","","test_async_replication","",""
"Remove relation and wait for the expected changes in status.","27743","test_relation_broken","tests.integration.relations","Wed Jul 17 01:39:49 UTC 2024","passed","Wed Jul 17 01:40:17 UTC 2024","","test_database","",""
"","196060","test_upgrade_from_edge","tests.integration.high_availability","Wed Jul 17 01:39:33 UTC 2024","passed","Wed Jul 17 01:42:49 UTC 2024","","test_upgrade","",""
"Test to ensure that writes to one cluster do not replicate to another cluster.","107002","test_no_replication_across_clusters","tests.integration.high_availability","Wed Jul 17 01:40:45 UTC 2024","passed","Wed Jul 17 01:42:32 UTC 2024","","test_replication","",""
"Test rejoin invalidated cluster with.","18453","test_rejoin_invalidated_cluster","tests.integration.high_availability","Wed Jul 17 01:48:32 UTC 2024","passed","Wed Jul 17 01:48:51 UTC 2024","","test_async_replication","",""
"Build the charm and deploy 3 units to ensure a cluster is formed.","127829","test_build_and_deploy","tests.integration","Wed Jul 17 01:37:15 UTC 2024","passed","Wed Jul 17 01:39:23 UTC 2024","","test_tls","",""
"Test to restore a backup on a new mysql cluster.","293455","test_restore_on_new_cluster","tests.integration","Wed Jul 17 01:42:37 UTC 2024","passed","Wed Jul 17 01:47:30 UTC 2024","","test_backup_aws","",""
"Simple test to ensure that the mysql and application charms get deployed.","150118","test_deploy_latest","tests.integration.high_availability","Wed Jul 17 01:36:47 UTC 2024","passed","Wed Jul 17 01:39:17 UTC 2024","","test_upgrade","",""
"Test for encryption enablement when relation to TLS charm.","68586","test_enable_tls","tests.integration","Wed Jul 17 01:39:25 UTC 2024","passed","Wed Jul 17 01:40:34 UTC 2024","","test_tls","",""
"Test the log rotation of text files.","6692","test_log_rotation","tests.integration","Wed Jul 17 01:44:54 UTC 2024","passed","Wed Jul 17 01:45:00 UTC 2024","","test_charm","",""
"Test to create a backup and list backups.","50931","test_backup","tests.integration","Wed Jul 17 01:39:00 UTC 2024","passed","Wed Jul 17 01:39:50 UTC 2024","","test_backup_gcp","",""
"Test to send SIGTERM to all units and then ensure that the cluster recovers.","0","test_graceful_full_cluster_crash_test","tests.integration.high_availability","Wed Jul 17 02:02:25 UTC 2024","skipped","Wed Jul 17 02:02:25 UTC 2024","","test_self_healing","",""
"Simple test to ensure that the mysql and application charms get deployed.","161973","test_build_and_deploy","tests.integration.high_availability","Wed Jul 17 01:36:48 UTC 2024","passed","Wed Jul 17 01:39:30 UTC 2024","","test_async_replication","",""
"Test that endpoints are running.","3972","test_exporter_endpoints","tests.integration","Wed Jul 17 01:44:25 UTC 2024","passed","Wed Jul 17 01:44:29 UTC 2024","","test_charm","",""
"Test for a network cut affecting an instance.","0","test_network_cut_affecting_an_instance","tests.integration.high_availability","Wed Jul 17 02:02:25 UTC 2024","skipped","Wed Jul 17 02:02:25 UTC 2024","","test_self_healing","",""
"Test to restore a backup to the same mysql cluster.","166572","test_restore_on_same_cluster","tests.integration","Wed Jul 17 01:39:50 UTC 2024","passed","Wed Jul 17 01:42:37 UTC 2024","","test_backup_gcp","",""
"Relate charms and wait for the expected changes in status.","0","test_relation_creation_databag","tests.integration.relations","Wed Jul 17 01:39:17 UTC 2024","skipped","Wed Jul 17 01:39:17 UTC 2024","","test_database","",""
"Ensure connections (with and without ssl) are possible before relating with TLS operator.","2113","test_connection_before_tls","tests.integration","Wed Jul 17 01:39:23 UTC 2024","passed","Wed Jul 17 01:39:25 UTC 2024","","test_tls","",""
"","39884","test_upgrade_to_failling","tests.integration.high_availability","Wed Jul 17 01:39:22 UTC 2024","passed","Wed Jul 17 01:40:02 UTC 2024","","test_upgrade_rollback_incompat","",""
"","227018","test_fail_and_rollback","tests.integration.high_availability","Wed Jul 17 01:42:52 UTC 2024","passed","Wed Jul 17 01:46:39 UTC 2024","","test_upgrade","",""
"Simple test to ensure that the mysql and application charms get deployed.","156410","test_deploy_stable","tests.integration.high_availability","Wed Jul 17 01:36:56 UTC 2024","passed","Wed Jul 17 01:39:33 UTC 2024","","test_upgrade_from_stable","",""
"Simple test to ensure that the mysql charm gets deployed.","121071","test_build_and_deploy","tests.integration","Wed Jul 17 01:36:55 UTC 2024","passed","Wed Jul 17 01:38:57 UTC 2024","","test_backup_aws","",""
"Simple test to ensure that the mysql and application charms get deployed.","187864","test_build_and_deploy","tests.integration.high_availability","Wed Jul 17 01:37:11 UTC 2024","passed","Wed Jul 17 01:40:19 UTC 2024","","test_replication","",""
"Verify rotating tls private keys restarts cluster with new certificates.

    This test rotates tls private keys to randomly generated keys.
    ","43030","test_rotate_tls_key","tests.integration","Wed Jul 17 01:40:34 UTC 2024","passed","Wed Jul 17 01:41:17 UTC 2024","","test_tls","",""
"Delete the pod in a single unit deployment and write data to new pod.","0","test_single_unit_pod_delete","tests.integration.high_availability","Wed Jul 17 02:02:25 UTC 2024","skipped","Wed Jul 17 02:02:25 UTC 2024","","test_self_healing","",""
"Run the create replication and wait for the applications to settle.","111595","test_create_replication","tests.integration.high_availability","Wed Jul 17 01:39:35 UTC 2024","passed","Wed Jul 17 01:41:26 UTC 2024","","test_async_replication","",""
"Confirm storage reuse works.","72035","test_scale_up_after_scale_down","tests.integration","Wed Jul 17 01:42:36 UTC 2024","passed","Wed Jul 17 01:43:48 UTC 2024","","test_charm","",""
"Test graceful promotion of a standby cluster to primary.","20484","test_standby_promotion","tests.integration.high_availability","Wed Jul 17 01:43:49 UTC 2024","passed","Wed Jul 17 01:44:09 UTC 2024","","test_async_replication","",""
"Confirm that a new primary is elected when the current primary is torn down.","227940","test_scale_up_and_down","tests.integration","Wed Jul 17 01:38:48 UTC 2024","passed","Wed Jul 17 01:42:36 UTC 2024","","test_charm","",""
"Test to send SIGTERM to primary instance and then verify recovery.","0","test_graceful_crash_of_primary","tests.integration.high_availability","Wed Jul 17 02:02:25 UTC 2024","skipped","Wed Jul 17 02:02:25 UTC 2024","","test_self_healing","",""
"Deploy the router and the test application.","69149","test_deploy_router_and_app","tests.integration.high_availability","Wed Jul 17 01:41:26 UTC 2024","passed","Wed Jul 17 01:42:35 UTC 2024","","test_async_replication","",""
"Test to create a backup and list backups.","47088","test_backup","tests.integration","Wed Jul 17 01:38:57 UTC 2024","passed","Wed Jul 17 01:39:44 UTC 2024","","test_backup_aws","",""
"Test the existence of databases and tables created by osm-pol's migrations.","34203","test_osm_pol_operations","tests.integration.relations","Wed Jul 17 01:39:17 UTC 2024","passed","Wed Jul 17 01:39:52 UTC 2024","","test_mysql_root","",""
"Query database for custom variables.","24512","test_custom_variables","tests.integration","Wed Jul 17 01:44:29 UTC 2024","passed","Wed Jul 17 01:44:54 UTC 2024","","test_charm","",""
"Simple test to ensure that the mysql charm gets deployed.","107978","test_build_and_deploy","tests.integration","Wed Jul 17 01:37:12 UTC 2024","passed","Wed Jul 17 01:39:00 UTC 2024","","test_backup_gcp","",""
"","30143","test_disable_tls","tests.integration","Wed Jul 17 01:41:17 UTC 2024","passed","Wed Jul 17 01:41:47 UTC 2024","","test_tls","",""
"Test to ensure that data is preserved when a unit is scaled up and then down.

    Ensures that there are no running continuous writes as the extra data in the
    database makes scaling up slower.
    ","220059","test_scaling_without_data_loss","tests.integration.high_availability","Wed Jul 17 01:42:43 UTC 2024","passed","Wed Jul 17 01:46:23 UTC 2024","","test_replication","",""
"Test to send a SIGKILL to the primary db process and ensure that the cluster self heals.","99750","test_kill_db_process","tests.integration.high_availability","Wed Jul 17 01:40:20 UTC 2024","passed","Wed Jul 17 01:42:00 UTC 2024","","test_self_healing","",""
"Test to create a backup and list backups.","46987","test_backup","tests.integration","Wed Jul 17 01:39:58 UTC 2024","passed","Wed Jul 17 01:40:45 UTC 2024","","test_backup_ceph","",""
"Test to restore a backup on a new mysql cluster.","296652","test_restore_on_new_cluster","tests.integration","Wed Jul 17 01:42:37 UTC 2024","passed","Wed Jul 17 01:47:34 UTC 2024","","test_backup_gcp","",""
"Test to write to primary, and read the same data back from replicas.","8242","test_data_replication","tests.integration.high_availability","Wed Jul 17 01:43:38 UTC 2024","passed","Wed Jul 17 01:43:46 UTC 2024","","test_async_replication","",""
"Test to restore a backup to the same mysql cluster.","172923","test_restore_on_same_cluster","tests.integration","Wed Jul 17 01:39:44 UTC 2024","passed","Wed Jul 17 01:42:37 UTC 2024","","test_backup_aws","",""
"Test to restore a backup to the same mysql cluster.","188979","test_restore_on_same_cluster","tests.integration","Wed Jul 17 01:40:45 UTC 2024","passed","Wed Jul 17 01:43:54 UTC 2024","","test_backup_ceph","",""
"Test to send a SIGSTOP to the primary db process and ensure that the cluster self heals.","950597","test_freeze_db_process","tests.integration.high_availability","Wed Jul 17 01:42:03 UTC 2024","broken","Wed Jul 17 01:57:54 UTC 2024","","test_self_healing","",""
"Relate charms and wait for the expected changes in status.","32144","test_relation_creation","tests.integration.relations","Wed Jul 17 01:39:17 UTC 2024","passed","Wed Jul 17 01:39:49 UTC 2024","","test_database","",""
