"DESCRIPTION","DURATION IN MS","NAME","PARENT SUITE","START TIME","STATUS","STOP TIME","SUB SUITE","SUITE","TEST CLASS","TEST METHOD"
"Test removing and re-relating the two mysql clusters.","593410","test_remove_relation_and_relate","tests.integration.high_availability","Tue Jan 21 01:40:18 UTC 2025","passed","Tue Jan 21 01:50:11 UTC 2025","","test_async_replication","",""
"Test graceful promotion of a standby cluster to primary.","21722","test_standby_promotion","tests.integration.high_availability","Tue Jan 21 01:35:04 UTC 2025","passed","Tue Jan 21 01:35:26 UTC 2025","","test_async_replication","",""
"","156043","test_rollback","tests.integration.high_availability","Tue Jan 21 01:31:22 UTC 2025","passed","Tue Jan 21 01:33:58 UTC 2025","","test_upgrade_rollback_incompat","",""
"Test to restore a backup on a new mysql cluster.","308870","test_restore_on_new_cluster","tests.integration","Tue Jan 21 01:32:50 UTC 2025","passed","Tue Jan 21 01:37:59 UTC 2025","","test_backup_gcp","",""
"Test to restore a backup on a new mysql cluster.","298394","test_restore_on_new_cluster","tests.integration","Tue Jan 21 01:33:53 UTC 2025","passed","Tue Jan 21 01:38:52 UTC 2025","","test_backup_ceph","",""
"Relate the two mysql clusters.","5442","test_async_relate","tests.integration.high_availability","Tue Jan 21 01:30:38 UTC 2025","passed","Tue Jan 21 01:30:44 UTC 2025","","test_async_replication","",""
"Test for a network cut affecting an instance.","218769","test_network_cut_affecting_an_instance","tests.integration.high_availability","Tue Jan 21 01:30:54 UTC 2025","passed","Tue Jan 21 01:34:33 UTC 2025","","test_self_healing","",""
"Test COS integrations formed before mysql is allocated and deployed.","87865","test_deploy_bundle_with_cos_integrations","tests.integration","Tue Jan 21 01:27:15 UTC 2025","passed","Tue Jan 21 01:28:43 UTC 2025","","test_cos_integration_bundle","",""
"Test that the pre-upgrade-check action runs successfully.","17653","test_pre_upgrade_check","tests.integration.high_availability","Tue Jan 21 01:30:18 UTC 2025","passed","Tue Jan 21 01:30:36 UTC 2025","","test_upgrade","",""
"Simple test to ensure that the mysql charm gets deployed.","114756","test_build_and_deploy","tests.integration","Tue Jan 21 01:28:21 UTC 2025","passed","Tue Jan 21 01:30:16 UTC 2025","","test_backup_ceph","",""
"Test to write to primary, and read the same data back from replicas.","8512","test_data_replication","tests.integration.high_availability","Tue Jan 21 01:34:51 UTC 2025","passed","Tue Jan 21 01:34:59 UTC 2025","","test_async_replication","",""
"Test for encryption enablement when relation to TLS charm.","70485","test_enable_tls","tests.integration","Tue Jan 21 01:30:36 UTC 2025","passed","Tue Jan 21 01:31:46 UTC 2025","","test_tls","",""
"Test to restore a backup to the same mysql cluster.","185882","test_restore_on_same_cluster","tests.integration","Tue Jan 21 01:30:11 UTC 2025","passed","Tue Jan 21 01:33:17 UTC 2025","","test_backup_aws","",""
"Test to kill the primary under load and ensure re-election of primary.","206172","test_kill_primary_check_reelection","tests.integration.high_availability","Tue Jan 21 01:30:22 UTC 2025","passed","Tue Jan 21 01:33:49 UTC 2025","","test_replication","",""
"","175481","test_upgrade_from_edge","tests.integration.high_availability","Tue Jan 21 01:30:40 UTC 2025","passed","Tue Jan 21 01:33:36 UTC 2025","","test_upgrade","",""
"Simple test to ensure that the mysql and application charms get deployed.","167555","test_deploy_stable","tests.integration.high_availability","Tue Jan 21 01:26:55 UTC 2025","passed","Tue Jan 21 01:29:43 UTC 2025","","test_upgrade_from_stable","",""
"Test behavior when node drains - pod is evicted and pvs are rotated.","146169","test_pod_eviction_and_pvc_deletion","tests.integration.high_availability","Tue Jan 21 01:30:22 UTC 2025","passed","Tue Jan 21 01:32:48 UTC 2025","","test_node_drain","",""
"Build the charm and deploy 3 units to ensure a cluster is formed.","174109","test_build_and_deploy","tests.integration.relations","Tue Jan 21 01:27:23 UTC 2025","passed","Tue Jan 21 01:30:17 UTC 2025","","test_database","",""
"Test to send a SIGKILL to the primary db process and ensure that the cluster self heals.","97376","test_kill_db_process","tests.integration.high_availability","Tue Jan 21 01:30:59 UTC 2025","passed","Tue Jan 21 01:32:36 UTC 2025","","test_self_healing","",""
"","30237","test_disable_tls","tests.integration","Tue Jan 21 01:32:28 UTC 2025","passed","Tue Jan 21 01:32:58 UTC 2025","","test_tls","",""
"Simple test to ensure that the mysql and application charms get deployed.","122489","test_build_and_deploy","tests.integration.high_availability","Tue Jan 21 01:28:20 UTC 2025","passed","Tue Jan 21 01:30:22 UTC 2025","","test_upgrade_rollback_incompat","",""
"Confirm storage reuse works.","92947","test_scale_up_after_scale_down","tests.integration","Tue Jan 21 01:33:49 UTC 2025","passed","Tue Jan 21 01:35:22 UTC 2025","","test_charm","",""
"Test to create a backup and list backups.","43838","test_backup","tests.integration","Tue Jan 21 01:30:18 UTC 2025","passed","Tue Jan 21 01:31:02 UTC 2025","","test_backup_ceph","",""
"Simple test to ensure that the mysql charm gets deployed.","116323","test_build_and_deploy","tests.integration","Tue Jan 21 01:27:25 UTC 2025","passed","Tue Jan 21 01:29:21 UTC 2025","","test_backup_aws","",""
"Test the existence of databases and tables created by osm-pol's migrations.","34394","test_osm_pol_operations","tests.integration.relations","Tue Jan 21 01:29:45 UTC 2025","passed","Tue Jan 21 01:30:19 UTC 2025","","test_mysql_root","",""
"Tries deploying an amd64 charm on arm64 host.","0","test_amd_charm_on_arm_host","tests.integration","Tue Jan 21 01:27:36 UTC 2025","skipped","Tue Jan 21 01:27:36 UTC 2025","","test_architecture","",""
"Tries deploying an arm64 charm on amd64 host.","48799","test_arm_charm_on_amd_host","tests.integration","Tue Jan 21 01:26:48 UTC 2025","passed","Tue Jan 21 01:27:36 UTC 2025","","test_architecture","",""
"","239092","test_fail_and_rollback","tests.integration.high_availability","Tue Jan 21 01:33:43 UTC 2025","passed","Tue Jan 21 01:37:42 UTC 2025","","test_upgrade","",""
"Rotate password and confirm changes.","14194","test_password_rotation_root_user_implicit","tests.integration","Tue Jan 21 01:37:59 UTC 2025","passed","Tue Jan 21 01:38:14 UTC 2025","","test_charm","",""
"Rotate password and confirm changes.","11162","test_password_rotation_silent","tests.integration","Tue Jan 21 01:37:48 UTC 2025","passed","Tue Jan 21 01:37:59 UTC 2025","","test_charm","",""
"Delete the pod in a single unit deployment and write data to new pod.","275728","test_single_unit_pod_delete","tests.integration.high_availability","Tue Jan 21 01:30:29 UTC 2025","passed","Tue Jan 21 01:35:05 UTC 2025","","test_self_healing","",""
"Test that the pre-upgrade-check action runs successfully.","15553","test_pre_upgrade_check","tests.integration.high_availability","Tue Jan 21 01:29:43 UTC 2025","passed","Tue Jan 21 01:29:58 UTC 2025","","test_upgrade_from_stable","",""
"Confirm that data is replicated from the primary node to all the replicas.","5364","test_consistent_data_replication_across_cluster","tests.integration","Tue Jan 21 01:29:01 UTC 2025","passed","Tue Jan 21 01:29:06 UTC 2025","","test_charm","",""
"Remove relation and wait for the expected changes in status.","27269","test_relation_broken","tests.integration.relations","Tue Jan 21 01:30:50 UTC 2025","passed","Tue Jan 21 01:31:17 UTC 2025","","test_database","",""
"","4794","test_saturate_max_connections","tests.integration","Tue Jan 21 01:28:53 UTC 2025","passed","Tue Jan 21 01:28:58 UTC 2025","","test_saturate_max_connections","",""
"Test to create a backup and list backups.","48255","test_backup","tests.integration","Tue Jan 21 01:29:04 UTC 2025","passed","Tue Jan 21 01:29:52 UTC 2025","","test_backup_gcp","",""
"Simple test to ensure that the mysql charm gets deployed.","115071","test_build_and_deploy","tests.integration","Tue Jan 21 01:27:07 UTC 2025","passed","Tue Jan 21 01:29:02 UTC 2025","","test_backup_gcp","",""
"Test to restore a backup to the same mysql cluster.","175763","test_restore_on_same_cluster","tests.integration","Tue Jan 21 01:29:54 UTC 2025","passed","Tue Jan 21 01:32:50 UTC 2025","","test_backup_gcp","",""
"Test switchover on primary cluster fail.","257458","test_failover","tests.integration.high_availability","Tue Jan 21 01:35:27 UTC 2025","passed","Tue Jan 21 01:39:45 UTC 2025","","test_async_replication","",""
"Test to restore a backup on a new mysql cluster.","302240","test_restore_on_new_cluster","tests.integration","Tue Jan 21 01:33:17 UTC 2025","passed","Tue Jan 21 01:38:20 UTC 2025","","test_backup_aws","",""
"Test to write to primary, and read the same data back from replicas.","10127","test_check_consistency","tests.integration.high_availability","Tue Jan 21 01:30:26 UTC 2025","passed","Tue Jan 21 01:30:37 UTC 2025","","test_replication","",""
"Test to create a backup and list backups.","46129","test_backup","tests.integration","Tue Jan 21 01:29:23 UTC 2025","passed","Tue Jan 21 01:30:09 UTC 2025","","test_backup_aws","",""
"Test the deployment and relation with osm bundle with mysql replacing mariadb.","167901","test_deploy_and_relate_osm_bundle","tests.integration.relations","Tue Jan 21 01:26:57 UTC 2025","passed","Tue Jan 21 01:29:45 UTC 2025","","test_mysql_root","",""
"Ensure connections (with and without ssl) are possible before relating with TLS operator.","2297","test_connection_before_tls","tests.integration","Tue Jan 21 01:30:34 UTC 2025","passed","Tue Jan 21 01:30:36 UTC 2025","","test_tls","",""
"Simple test to ensure that the mysql and application charms get deployed.","187683","test_deploy_latest","tests.integration.high_availability","Tue Jan 21 01:27:11 UTC 2025","passed","Tue Jan 21 01:30:18 UTC 2025","","test_upgrade","",""
"Test to ensure that writes to one cluster do not replicate to another cluster.","93134","test_no_replication_across_clusters","tests.integration.high_availability","Tue Jan 21 01:30:35 UTC 2025","passed","Tue Jan 21 01:32:08 UTC 2025","","test_replication","",""
"Test to send SIGTERM to all units and then ensure that the cluster recovers.","280873","test_graceful_full_cluster_crash_test","tests.integration.high_availability","Tue Jan 21 01:30:00 UTC 2025","passed","Tue Jan 21 01:34:41 UTC 2025","","test_self_healing","",""
"Test that endpoints are running.","3979","test_exporter_endpoints","tests.integration","Tue Jan 21 01:38:14 UTC 2025","passed","Tue Jan 21 01:38:18 UTC 2025","","test_charm","",""
"Test that the pre-upgrade-check action runs successfully.","9128","test_pre_upgrade_check","tests.integration.high_availability","Tue Jan 21 01:30:22 UTC 2025","passed","Tue Jan 21 01:30:32 UTC 2025","","test_upgrade_rollback_incompat","",""
"Scale database and routers.","230361","test_scale_in","tests.integration","Tue Jan 21 01:38:34 UTC 2025","passed","Tue Jan 21 01:42:24 UTC 2025","","test_multi_relations","",""
"Confirm that a new primary is elected when the current primary is torn down.","283565","test_scale_up_and_down","tests.integration","Tue Jan 21 01:29:06 UTC 2025","passed","Tue Jan 21 01:33:49 UTC 2025","","test_charm","",""
"Verify rotating tls private keys restarts cluster with new certificates.

    This test rotates tls private keys to randomly generated keys.
    ","41852","test_rotate_tls_key","tests.integration","Tue Jan 21 01:31:46 UTC 2025","passed","Tue Jan 21 01:32:28 UTC 2025","","test_tls","",""
"Test to send a SIGSTOP to the primary db process and ensure that the cluster self heals.","253785","test_freeze_db_process","tests.integration.high_availability","Tue Jan 21 01:30:52 UTC 2025","passed","Tue Jan 21 01:35:06 UTC 2025","","test_self_healing","",""
"Rotate password and confirm changes.","12159","test_password_rotation","tests.integration","Tue Jan 21 01:37:36 UTC 2025","passed","Tue Jan 21 01:37:48 UTC 2025","","test_charm","",""
"Query database for custom variables.","25127","test_custom_variables","tests.integration","Tue Jan 21 01:38:18 UTC 2025","passed","Tue Jan 21 01:38:43 UTC 2025","","test_charm","",""
"Test rejoin invalidated cluster with.","25767","test_rejoin_invalidated_cluster","tests.integration.high_availability","Tue Jan 21 01:39:49 UTC 2025","passed","Tue Jan 21 01:40:14 UTC 2025","","test_async_replication","",""
"Scale database and routers.","490294","test_scale_out","tests.integration","Tue Jan 21 01:30:23 UTC 2025","passed","Tue Jan 21 01:38:34 UTC 2025","","test_multi_relations","",""
"Ensure scaling down to zero and back up works.","133656","test_scale_up_from_zero","tests.integration","Tue Jan 21 01:35:22 UTC 2025","passed","Tue Jan 21 01:37:36 UTC 2025","","test_charm","",""
"Relate charms and wait for the expected changes in status.","33109","test_relation_creation","tests.integration.relations","Tue Jan 21 01:30:17 UTC 2025","passed","Tue Jan 21 01:30:50 UTC 2025","","test_database","",""
"Build the charm and deploy 3 units to ensure a cluster is formed.","133205","test_build_and_deploy","tests.integration","Tue Jan 21 01:28:20 UTC 2025","passed","Tue Jan 21 01:30:34 UTC 2025","","test_tls","",""
"Test to send SIGTERM to primary instance and then verify recovery.","64443","test_graceful_crash_of_primary","tests.integration.high_availability","Tue Jan 21 01:30:32 UTC 2025","passed","Tue Jan 21 01:31:37 UTC 2025","","test_self_healing","",""
"Run the create replication and wait for the applications to settle.","169377","test_create_replication","tests.integration.high_availability","Tue Jan 21 01:30:44 UTC 2025","passed","Tue Jan 21 01:33:33 UTC 2025","","test_async_replication","",""
"Build the charm and deploy 1 units to ensure a cluster is formed.","7634","test_build_and_deploy","tests.integration","Tue Jan 21 01:27:43 UTC 2025","passed","Tue Jan 21 01:27:50 UTC 2025","","test_saturate_max_connections","",""
"Test primary crash during startup.

    It must recover/end setup when the primary got offline.
    ","166601","test_crash_during_cluster_setup","tests.integration.high_availability","Tue Jan 21 01:28:10 UTC 2025","passed","Tue Jan 21 01:30:56 UTC 2025","","test_crash_during_setup","",""
"Build the charm and deploy 1 units to ensure a cluster is formed.","37050","test_build_and_deploy","tests.integration","Tue Jan 21 01:27:11 UTC 2025","passed","Tue Jan 21 01:27:48 UTC 2025","","test_multi_relations","",""
"Test the labeling of k8s endpoints when apps with same cluster-name deployed.","459484","test_labeling_of_k8s_endpoints","tests.integration.high_availability","Tue Jan 21 01:28:03 UTC 2025","passed","Tue Jan 21 01:35:43 UTC 2025","","test_k8s_endpoints","",""
"","62419","test_deploy_and_relate_test_app","tests.integration","Tue Jan 21 01:27:50 UTC 2025","passed","Tue Jan 21 01:28:53 UTC 2025","","test_saturate_max_connections","",""
"Relate charms and wait for the expected changes in status.","0","test_relation_creation_databag","tests.integration.relations","Tue Jan 21 01:30:17 UTC 2025","skipped","Tue Jan 21 01:30:17 UTC 2025","","test_database","",""
"Simple test to ensure that the mysql and application charms get deployed.","176794","test_build_and_deploy","tests.integration.high_availability","Tue Jan 21 01:27:42 UTC 2025","passed","Tue Jan 21 01:30:38 UTC 2025","","test_async_replication","",""
"","50362","test_upgrade_to_failling","tests.integration.high_availability","Tue Jan 21 01:30:32 UTC 2025","passed","Tue Jan 21 01:31:22 UTC 2025","","test_upgrade_rollback_incompat","",""
"Relate all the applications to the database.","155421","test_relate_all","tests.integration","Tue Jan 21 01:27:48 UTC 2025","passed","Tue Jan 21 01:30:23 UTC 2025","","test_multi_relations","",""
"Test to ensure that data is preserved when a unit is scaled up and then down.

    Ensures that there are no running continuous writes as the extra data in the
    database makes scaling up slower.
    ","245510","test_scaling_without_data_loss","tests.integration.high_availability","Tue Jan 21 01:30:42 UTC 2025","passed","Tue Jan 21 01:34:48 UTC 2025","","test_replication","",""
"Test updating from stable channel.","180487","test_upgrade_from_stable","tests.integration.high_availability","Tue Jan 21 01:30:00 UTC 2025","passed","Tue Jan 21 01:33:01 UTC 2025","","test_upgrade_from_stable","",""
"Test the log rotation of text files.

    Run continuous writes to ensure that audit log plugin is loaded and active
    when mysql-test-app runs start-continuous-writes (by logging into mysql).
    ","10106","test_log_rotation","tests.integration.high_availability","Tue Jan 21 01:30:37 UTC 2025","passed","Tue Jan 21 01:30:47 UTC 2025","","test_log_rotation","",""
"Deploy the router and the test application.","75517","test_deploy_router_and_app","tests.integration.high_availability","Tue Jan 21 01:33:33 UTC 2025","passed","Tue Jan 21 01:34:49 UTC 2025","","test_async_replication","",""
"Test to restore a backup to the same mysql cluster.","168489","test_restore_on_same_cluster","tests.integration","Tue Jan 21 01:31:05 UTC 2025","passed","Tue Jan 21 01:33:53 UTC 2025","","test_backup_ceph","",""
"Build the mysql charm and deploy it.","132091","test_build_and_deploy","tests.integration","Tue Jan 21 01:26:48 UTC 2025","passed","Tue Jan 21 01:29:01 UTC 2025","","test_charm","",""
