"DESCRIPTION","DURATION IN MS","NAME","PARENT SUITE","START TIME","STATUS","STOP TIME","SUB SUITE","SUITE","TEST CLASS","TEST METHOD"
"Scale database and routers.","235387","test_scale_in","tests.integration","Tue Sep 24 01:42:48 UTC 2024","passed","Tue Sep 24 01:46:43 UTC 2024","","test_multi_relations","",""
"Test switchover on primary cluster fail.","261566","test_failover","tests.integration.high_availability","Tue Sep 24 01:42:38 UTC 2024","passed","Tue Sep 24 01:46:59 UTC 2024","","test_async_replication","",""
"Test for encryption enablement when relation to TLS charm.","62079","test_enable_tls","tests.integration","Tue Sep 24 01:33:37 UTC 2024","passed","Tue Sep 24 01:34:39 UTC 2024","","test_tls","",""
"","167576","test_upgrade_from_edge","tests.integration.high_availability","Tue Sep 24 01:34:16 UTC 2024","passed","Tue Sep 24 01:37:04 UTC 2024","","test_upgrade","",""
"Test that the pre-upgrade-check action runs successfully.","16350","test_pre_upgrade_check","tests.integration.high_availability","Tue Sep 24 01:33:56 UTC 2024","passed","Tue Sep 24 01:34:12 UTC 2024","","test_upgrade","",""
"Test that endpoints are running.","3942","test_exporter_endpoints","tests.integration","Tue Sep 24 01:40:23 UTC 2024","passed","Tue Sep 24 01:40:27 UTC 2024","","test_charm","",""
"Test to send a SIGSTOP to the primary db process and ensure that the cluster self heals.","","test_freeze_db_process","tests.integration.high_availability","","unknown","","","test_self_healing","",""
"","30134","test_disable_tls","tests.integration","Tue Sep 24 01:35:21 UTC 2024","passed","Tue Sep 24 01:35:51 UTC 2024","","test_tls","",""
"Simple test to ensure that the mysql charm gets deployed.","125643","test_build_and_deploy","tests.integration","Tue Sep 24 01:32:52 UTC 2024","passed","Tue Sep 24 01:34:58 UTC 2024","","test_backup_ceph","",""
"Delete the pod in a single unit deployment and write data to new pod.","178683","test_single_unit_pod_delete","tests.integration.high_availability","Tue Sep 24 01:34:32 UTC 2024","passed","Tue Sep 24 01:37:31 UTC 2024","","test_self_healing","",""
"","163247","test_rollback","tests.integration.high_availability","Tue Sep 24 01:34:25 UTC 2024","passed","Tue Sep 24 01:37:09 UTC 2024","","test_upgrade_rollback_incompat","",""
"Remove relation and wait for the expected changes in status.","23574","test_relation_broken","tests.integration.relations","Tue Sep 24 01:34:19 UTC 2024","passed","Tue Sep 24 01:34:43 UTC 2024","","test_database","",""
"Confirm that data is replicated from the primary node to all the replicas.","5170","test_consistent_data_replication_across_cluster","tests.integration","Tue Sep 24 01:34:03 UTC 2024","passed","Tue Sep 24 01:34:08 UTC 2024","","test_charm","",""
"Test to restore a backup on a new mysql cluster.","286267","test_restore_on_new_cluster","tests.integration","Tue Sep 24 01:36:42 UTC 2024","passed","Tue Sep 24 01:41:29 UTC 2024","","test_backup_gcp","",""
"Test to write to primary, and read the same data back from replicas.","9524","test_check_consistency","tests.integration.high_availability","Tue Sep 24 01:34:30 UTC 2024","passed","Tue Sep 24 01:34:39 UTC 2024","","test_replication","",""
"Test to kill the primary under load and ensure re-election of primary.","122303","test_kill_primary_check_reelection","tests.integration.high_availability","Tue Sep 24 01:34:46 UTC 2024","passed","Tue Sep 24 01:36:48 UTC 2024","","test_replication","",""
"Test to send SIGTERM to primary instance and then verify recovery.","124906","test_graceful_crash_of_primary","tests.integration.high_availability","Tue Sep 24 01:35:37 UTC 2024","passed","Tue Sep 24 01:37:42 UTC 2024","","test_self_healing","",""
"Test to send SIGTERM to all units and then ensure that the cluster recovers.","327387","test_graceful_full_cluster_crash_test","tests.integration.high_availability","Tue Sep 24 01:34:30 UTC 2024","passed","Tue Sep 24 01:39:57 UTC 2024","","test_self_healing","",""
"Test to ensure that writes to one cluster do not replicate to another cluster.","101051","test_no_replication_across_clusters","tests.integration.high_availability","Tue Sep 24 01:34:30 UTC 2024","passed","Tue Sep 24 01:36:11 UTC 2024","","test_replication","",""
"Test to send a SIGKILL to the primary db process and ensure that the cluster self heals.","91940","test_kill_db_process","tests.integration.high_availability","Tue Sep 24 01:35:36 UTC 2024","passed","Tue Sep 24 01:37:08 UTC 2024","","test_self_healing","",""
"","56965","test_deploy_and_relate_test_app","tests.integration","Tue Sep 24 01:31:39 UTC 2024","passed","Tue Sep 24 01:32:36 UTC 2024","","test_saturate_max_connections","",""
"Test graceful promotion of a standby cluster to primary.","39558","test_standby_promotion","tests.integration.high_availability","Tue Sep 24 01:41:57 UTC 2024","passed","Tue Sep 24 01:42:37 UTC 2024","","test_async_replication","",""
"Build the charm and deploy 1 units to ensure a cluster is formed.","39457","test_build_and_deploy","tests.integration","Tue Sep 24 01:31:48 UTC 2024","passed","Tue Sep 24 01:32:27 UTC 2024","","test_multi_relations","",""
"","221028","test_fail_and_rollback","tests.integration.high_availability","Tue Sep 24 01:37:11 UTC 2024","passed","Tue Sep 24 01:40:52 UTC 2024","","test_upgrade","",""
"Test to restore a backup on a new mysql cluster.","297122","test_restore_on_new_cluster","tests.integration","Tue Sep 24 01:38:22 UTC 2024","passed","Tue Sep 24 01:43:19 UTC 2024","","test_backup_ceph","",""
"Test to restore a backup to the same mysql cluster.","161007","test_restore_on_same_cluster","tests.integration","Tue Sep 24 01:35:41 UTC 2024","passed","Tue Sep 24 01:38:22 UTC 2024","","test_backup_ceph","",""
"Deploy the router and the test application.","84150","test_deploy_router_and_app","tests.integration.high_availability","Tue Sep 24 01:39:19 UTC 2024","passed","Tue Sep 24 01:40:43 UTC 2024","","test_async_replication","",""
"Test updating from stable channel.","144603","test_upgrade_from_stable","tests.integration.high_availability","Tue Sep 24 01:37:51 UTC 2024","passed","Tue Sep 24 01:40:15 UTC 2024","","test_upgrade_from_stable","",""
"Verify rotating tls private keys restarts cluster with new certificates.

    This test rotates tls private keys to randomly generated keys.
    ","41822","test_rotate_tls_key","tests.integration","Tue Sep 24 01:34:39 UTC 2024","passed","Tue Sep 24 01:35:21 UTC 2024","","test_tls","",""
"Simple test to ensure that the mysql and application charms get deployed.","168141","test_deploy_stable","tests.integration.high_availability","Tue Sep 24 01:34:45 UTC 2024","passed","Tue Sep 24 01:37:33 UTC 2024","","test_upgrade_from_stable","",""
"Test the log rotation of text files.

    Run continuous writes to ensure that audit log plugin is loaded and active
    when mysql-test-app runs start-continuous-writes (by logging into mysql).
    ","9686","test_log_rotation","tests.integration.high_availability","Tue Sep 24 01:34:24 UTC 2024","passed","Tue Sep 24 01:34:34 UTC 2024","","test_log_rotation","",""
"Test the labeling of k8s endpoints when apps with same cluster-name deployed.","438324","test_labeling_of_k8s_endpoints","tests.integration.high_availability","Tue Sep 24 01:31:24 UTC 2024","passed","Tue Sep 24 01:38:42 UTC 2024","","test_k8s_endpoints","",""
"Test that the pre-upgrade-check action runs successfully.","9166","test_pre_upgrade_check","tests.integration.high_availability","Tue Sep 24 01:33:32 UTC 2024","passed","Tue Sep 24 01:33:41 UTC 2024","","test_upgrade_rollback_incompat","",""
"Test the deployment and relation with osm bundle with mysql replacing mariadb.","150994","test_deploy_and_relate_osm_bundle","tests.integration.relations","Tue Sep 24 01:31:46 UTC 2024","passed","Tue Sep 24 01:34:17 UTC 2024","","test_mysql_root","",""
"Test to ensure that data is preserved when a unit is scaled up and then down.

    Ensures that there are no running continuous writes as the extra data in the
    database makes scaling up slower.
    ","246017","test_scaling_without_data_loss","tests.integration.high_availability","Tue Sep 24 01:34:36 UTC 2024","passed","Tue Sep 24 01:38:42 UTC 2024","","test_replication","",""
"Test to restore a backup to the same mysql cluster.","161866","test_restore_on_same_cluster","tests.integration","Tue Sep 24 01:33:58 UTC 2024","passed","Tue Sep 24 01:36:40 UTC 2024","","test_backup_aws","",""
"Build the charm and deploy 3 units to ensure a cluster is formed.","134084","test_build_and_deploy","tests.integration.relations","Tue Sep 24 01:31:20 UTC 2024","passed","Tue Sep 24 01:33:34 UTC 2024","","test_database","",""
"Simple test to ensure that the mysql and application charms get deployed.","123008","test_build_and_deploy","tests.integration.high_availability","Tue Sep 24 01:31:29 UTC 2024","passed","Tue Sep 24 01:33:32 UTC 2024","","test_upgrade_rollback_incompat","",""
"","44197","test_upgrade_to_failling","tests.integration.high_availability","Tue Sep 24 01:33:41 UTC 2024","passed","Tue Sep 24 01:34:25 UTC 2024","","test_upgrade_rollback_incompat","",""
"Test rejoin invalidated cluster with.","27472","test_rejoin_invalidated_cluster","tests.integration.high_availability","Tue Sep 24 01:47:03 UTC 2024","passed","Tue Sep 24 01:47:31 UTC 2024","","test_async_replication","",""
"Test behavior when node drains - pod is evicted and pvs are rotated.","1809752","test_pod_eviction_and_pvc_deletion","tests.integration.high_availability","Tue Sep 24 01:34:46 UTC 2024","broken","Tue Sep 24 02:04:56 UTC 2024","","test_node_drain","",""
"Test to create a backup and list backups.","40348","test_backup","tests.integration","Tue Sep 24 01:33:15 UTC 2024","passed","Tue Sep 24 01:33:56 UTC 2024","","test_backup_aws","",""
"Scale database and routers.","460335","test_scale_out","tests.integration","Tue Sep 24 01:35:08 UTC 2024","passed","Tue Sep 24 01:42:48 UTC 2024","","test_multi_relations","",""
"Relate all the applications to the database.","160396","test_relate_all","tests.integration","Tue Sep 24 01:32:27 UTC 2024","passed","Tue Sep 24 01:35:08 UTC 2024","","test_multi_relations","",""
"Test to restore a backup on a new mysql cluster.","287560","test_restore_on_new_cluster","tests.integration","Tue Sep 24 01:36:40 UTC 2024","passed","Tue Sep 24 01:41:27 UTC 2024","","test_backup_aws","",""
"Confirm that a new primary is elected when the current primary is torn down.","255207","test_scale_up_and_down","tests.integration","Tue Sep 24 01:34:08 UTC 2024","passed","Tue Sep 24 01:38:23 UTC 2024","","test_charm","",""
"Test that the pre-upgrade-check action runs successfully.","15380","test_pre_upgrade_check","tests.integration.high_availability","Tue Sep 24 01:37:33 UTC 2024","passed","Tue Sep 24 01:37:49 UTC 2024","","test_upgrade_from_stable","",""
"Test removing and re-relating the two mysql clusters.","242091","test_remove_relation_and_relate","tests.integration.high_availability","Tue Sep 24 01:47:34 UTC 2024","passed","Tue Sep 24 01:51:36 UTC 2024","","test_async_replication","",""
"Build the mysql charm and deploy it.","159618","test_build_and_deploy","tests.integration","Tue Sep 24 01:31:23 UTC 2024","passed","Tue Sep 24 01:34:03 UTC 2024","","test_charm","",""
"Test the existence of databases and tables created by osm-pol's migrations.","34209","test_osm_pol_operations","tests.integration.relations","Tue Sep 24 01:34:17 UTC 2024","passed","Tue Sep 24 01:34:51 UTC 2024","","test_mysql_root","",""
"Rotate password and confirm changes.","12192","test_password_rotation","tests.integration","Tue Sep 24 01:39:45 UTC 2024","passed","Tue Sep 24 01:39:57 UTC 2024","","test_charm","",""
"Rotate password and confirm changes.","14190","test_password_rotation_root_user_implicit","tests.integration","Tue Sep 24 01:40:09 UTC 2024","passed","Tue Sep 24 01:40:23 UTC 2024","","test_charm","",""
"Query database for custom variables.","24530","test_custom_variables","tests.integration","Tue Sep 24 01:40:27 UTC 2024","passed","Tue Sep 24 01:40:52 UTC 2024","","test_charm","",""
"Test to create a backup and list backups.","43687","test_backup","tests.integration","Tue Sep 24 01:33:13 UTC 2024","passed","Tue Sep 24 01:33:57 UTC 2024","","test_backup_gcp","",""
"Relate the two mysql clusters.","6197","test_async_relate","tests.integration.high_availability","Tue Sep 24 01:34:59 UTC 2024","passed","Tue Sep 24 01:35:05 UTC 2024","","test_async_replication","",""
"Rotate password and confirm changes.","12195","test_password_rotation_silent","tests.integration","Tue Sep 24 01:39:57 UTC 2024","passed","Tue Sep 24 01:40:09 UTC 2024","","test_charm","",""
"Build the charm and deploy 3 units to ensure a cluster is formed.","125148","test_build_and_deploy","tests.integration","Tue Sep 24 01:31:30 UTC 2024","passed","Tue Sep 24 01:33:35 UTC 2024","","test_tls","",""
"Test for a network cut affecting an instance.","244963","test_network_cut_affecting_an_instance","tests.integration.high_availability","Tue Sep 24 01:35:12 UTC 2024","passed","Tue Sep 24 01:39:17 UTC 2024","","test_self_healing","",""
"Test to write to primary, and read the same data back from replicas.","8358","test_data_replication","tests.integration.high_availability","Tue Sep 24 01:41:46 UTC 2024","passed","Tue Sep 24 01:41:54 UTC 2024","","test_async_replication","",""
"Run the create replication and wait for the applications to settle.","254296","test_create_replication","tests.integration.high_availability","Tue Sep 24 01:35:05 UTC 2024","passed","Tue Sep 24 01:39:19 UTC 2024","","test_async_replication","",""
"Relate charms and wait for the expected changes in status.","0","test_relation_creation_databag","tests.integration.relations","Tue Sep 24 01:33:34 UTC 2024","skipped","Tue Sep 24 01:33:34 UTC 2024","","test_database","",""
"Simple test to ensure that the mysql charm gets deployed.","112994","test_build_and_deploy","tests.integration","Tue Sep 24 01:31:20 UTC 2024","passed","Tue Sep 24 01:33:13 UTC 2024","","test_backup_aws","",""
"Test to create a backup and list backups.","39621","test_backup","tests.integration","Tue Sep 24 01:35:00 UTC 2024","passed","Tue Sep 24 01:35:39 UTC 2024","","test_backup_ceph","",""
"Simple test to ensure that the mysql charm gets deployed.","107651","test_build_and_deploy","tests.integration","Tue Sep 24 01:31:24 UTC 2024","passed","Tue Sep 24 01:33:11 UTC 2024","","test_backup_gcp","",""
"Confirm storage reuse works.","81363","test_scale_up_after_scale_down","tests.integration","Tue Sep 24 01:38:23 UTC 2024","passed","Tue Sep 24 01:39:45 UTC 2024","","test_charm","",""
"Ensure connections (with and without ssl) are possible before relating with TLS operator.","2122","test_connection_before_tls","tests.integration","Tue Sep 24 01:33:35 UTC 2024","passed","Tue Sep 24 01:33:37 UTC 2024","","test_tls","",""
"Simple test to ensure that the mysql and application charms get deployed.","186989","test_build_and_deploy","tests.integration.high_availability","Tue Sep 24 01:31:52 UTC 2024","passed","Tue Sep 24 01:34:59 UTC 2024","","test_async_replication","",""
"","196678","test_crash_during_cluster_setup","tests.integration.high_availability","Tue Sep 24 01:31:18 UTC 2024","passed","Tue Sep 24 01:34:34 UTC 2024","","test_crash_during_setup","",""
"Test COS integrations formed before mysql is allocated and deployed.","83004","test_deploy_bundle_with_cos_integrations","tests.integration","Tue Sep 24 01:31:22 UTC 2024","passed","Tue Sep 24 01:32:45 UTC 2024","","test_cos_integration_bundle","",""
"","4169","test_saturate_max_connections","tests.integration","Tue Sep 24 01:32:36 UTC 2024","passed","Tue Sep 24 01:32:40 UTC 2024","","test_saturate_max_connections","",""
"Relate charms and wait for the expected changes in status.","45043","test_relation_creation","tests.integration.relations","Tue Sep 24 01:33:34 UTC 2024","passed","Tue Sep 24 01:34:19 UTC 2024","","test_database","",""
"Build the charm and deploy 1 units to ensure a cluster is formed.","10106","test_build_and_deploy","tests.integration","Tue Sep 24 01:31:29 UTC 2024","passed","Tue Sep 24 01:31:39 UTC 2024","","test_saturate_max_connections","",""
"Test to restore a backup to the same mysql cluster.","163220","test_restore_on_same_cluster","tests.integration","Tue Sep 24 01:33:59 UTC 2024","passed","Tue Sep 24 01:36:42 UTC 2024","","test_backup_gcp","",""
"Simple test to ensure that the mysql and application charms get deployed.","161857","test_deploy_latest","tests.integration.high_availability","Tue Sep 24 01:31:14 UTC 2024","passed","Tue Sep 24 01:33:56 UTC 2024","","test_upgrade","",""
