"DESCRIPTION","DURATION IN MS","NAME","PARENT SUITE","START TIME","STATUS","STOP TIME","SUB SUITE","SUITE","TEST CLASS","TEST METHOD"
"Test to send SIGTERM to all units and then ensure that the cluster recovers.","310872","test_graceful_full_cluster_crash_test","tests.integration.high_availability","Sun Aug 31 01:34:46 UTC 2025","passed","Sun Aug 31 01:39:57 UTC 2025","","test_self_healing_stop_all","",""
"Relate charms before they have time to properly start.

    It simulates a Terraform-like deployment strategy
    ","","test_relation_creation_eager","tests.integration.relations","","unknown","","","test_database","",""
"Pitr tests.","310923","test_pitr_aws","tests.integration","Sun Aug 31 01:34:51 UTC 2025","passed","Sun Aug 31 01:40:02 UTC 2025","","test_backup_pitr_aws","",""
"Test the existence of databases and tables created by osm-pol's migrations.","34334","test_osm_pol_operations","tests.integration","Sun Aug 31 01:33:48 UTC 2025","passed","Sun Aug 31 01:34:23 UTC 2025","","test_osm_integration_bundle","",""
"Rotate password and confirm changes.","12168","test_password_rotation_silent","tests.integration","Sun Aug 31 01:41:55 UTC 2025","passed","Sun Aug 31 01:42:07 UTC 2025","","test_charm","",""
"Ensure connections (with and without ssl) are possible before relating with TLS operator.","2185","test_connection_before_tls","tests.integration","Sun Aug 31 01:32:55 UTC 2025","passed","Sun Aug 31 01:32:57 UTC 2025","","test_tls","",""
"Run the create replication and wait for the applications to settle.","180427","test_create_replication","tests.integration.high_availability","Sun Aug 31 01:35:36 UTC 2025","passed","Sun Aug 31 01:38:36 UTC 2025","","test_async_replication","",""
"Pitr tests.","253479","test_pitr_aws","tests.integration","Sun Aug 31 01:34:44 UTC 2025","passed","Sun Aug 31 01:38:57 UTC 2025","","test_backup_pitr_gcp","",""
"Relate charms and wait for the expected changes in status.","","test_relation_creation","tests.integration.relations","","unknown","","","test_database","",""
"Delete the pod in a single unit deployment and write data to new pod.","","test_single_unit_pod_delete","tests.integration.high_availability","","unknown","","","test_self_healing_pod","",""
"Test to write to primary, and read the same data back from replicas.","8399","test_data_replication","tests.integration.high_availability","Sun Aug 31 01:38:38 UTC 2025","passed","Sun Aug 31 01:38:47 UTC 2025","","test_async_replication","",""
"Test the labeling of k8s endpoints when apps with same cluster-name deployed.","375443","test_labeling_of_k8s_endpoints","tests.integration.high_availability","Sun Aug 31 01:30:44 UTC 2025","passed","Sun Aug 31 01:36:59 UTC 2025","","test_k8s_endpoints","",""
"Build the charm and deploy 3 units to ensure a cluster is formed.","6420","test_build_and_deploy","tests.integration.relations","Sun Aug 31 01:31:23 UTC 2025","passed","Sun Aug 31 01:31:30 UTC 2025","","test_mysql_root","",""
"Test primary crash during startup.

    It must recover/end setup when the primary got offline.
    ","163358","test_crash_during_cluster_setup","tests.integration.high_availability","Sun Aug 31 01:30:49 UTC 2025","passed","Sun Aug 31 01:33:33 UTC 2025","","test_crash_during_setup","",""
"Test removing and re-relating the two mysql clusters.","312636","test_remove_relation_and_relate","tests.integration.high_availability","Sun Aug 31 01:44:38 UTC 2025","passed","Sun Aug 31 01:49:51 UTC 2025","","test_async_replication","",""
"Build the charm and deploy 1 units to ensure a cluster is formed.","6839","test_build_and_deploy","tests.integration","Sun Aug 31 01:31:23 UTC 2025","passed","Sun Aug 31 01:31:30 UTC 2025","","test_saturate_max_connections","",""
"Confirm storage reuse works.","89398","test_scale_up_after_scale_down","tests.integration","Sun Aug 31 01:37:49 UTC 2025","passed","Sun Aug 31 01:39:19 UTC 2025","","test_charm","",""
"Build the charm and deploy 3 units to ensure a cluster is formed.","","test_build_and_deploy","tests.integration.relations","","unknown","","","test_database","",""
"Test to write to primary, and read the same data back from replicas.","38024","test_check_consistency","tests.integration.high_availability","Sun Aug 31 01:33:58 UTC 2025","passed","Sun Aug 31 01:34:36 UTC 2025","","test_replication_data_consistency","",""
"Relate the two mysql clusters.","10979","test_async_relate","tests.integration.high_availability","Sun Aug 31 01:33:43 UTC 2025","passed","Sun Aug 31 01:33:54 UTC 2025","","test_async_replication","",""
"Test switchover on primary cluster fail.","291635","test_failover","tests.integration.high_availability","Sun Aug 31 01:39:16 UTC 2025","passed","Sun Aug 31 01:44:08 UTC 2025","","test_async_replication","",""
"Test to ensure that writes to one cluster do not replicate to another cluster.","90988","test_no_replication_across_clusters","tests.integration.high_availability","Sun Aug 31 01:33:55 UTC 2025","passed","Sun Aug 31 01:35:25 UTC 2025","","test_replication_data_isolation","",""
"","195315","test_upgrade_from_edge","tests.integration.high_availability","Sun Aug 31 01:34:51 UTC 2025","passed","Sun Aug 31 01:38:06 UTC 2025","","test_upgrade","",""
"Test for a network cut affecting an instance.","255637","test_network_cut_affecting_an_instance","tests.integration.high_availability","Sun Aug 31 01:34:41 UTC 2025","passed","Sun Aug 31 01:38:56 UTC 2025","","test_self_healing_network_cut","",""
"","3824","test_saturate_max_connections","tests.integration","Sun Aug 31 01:32:28 UTC 2025","passed","Sun Aug 31 01:32:31 UTC 2025","","test_saturate_max_connections","",""
"Confirm that a new primary is elected when the current primary is torn down.","296986","test_scale_up_and_down","tests.integration","Sun Aug 31 01:32:52 UTC 2025","passed","Sun Aug 31 01:37:49 UTC 2025","","test_charm","",""
"Test that endpoints are running.","4027","test_exporter_endpoints","tests.integration","Sun Aug 31 01:42:21 UTC 2025","passed","Sun Aug 31 01:42:25 UTC 2025","","test_charm","",""
"The cluster manual re-join test.

    A graceful restart is performed in one of the instances (choosing Primary to make it painful).
    In order to verify that the instance can come back ONLINE, after disabling automatic re-join
    ","94464","test_cluster_manual_rejoin","tests.integration.high_availability","Sun Aug 31 01:33:42 UTC 2025","passed","Sun Aug 31 01:35:17 UTC 2025","","test_self_healing_restart_graceful","",""
"Test to create a backup and list backups.","41108","test_backup","tests.integration","Sun Aug 31 01:32:57 UTC 2025","passed","Sun Aug 31 01:33:38 UTC 2025","","test_backup_aws","",""
"Test the deployment and relation with osm bundle with mysql replacing mariadb.","141950","test_deploy_and_relate_osm_bundle","tests.integration","Sun Aug 31 01:31:26 UTC 2025","passed","Sun Aug 31 01:33:48 UTC 2025","","test_osm_integration_bundle","",""
"Relate charms and wait for the expected changes in status.","","test_relation_creation_databag","tests.integration.relations","","unknown","","","test_database","",""
"Test graceful promotion of a standby cluster to primary.","25713","test_standby_promotion","tests.integration.high_availability","Sun Aug 31 01:38:50 UTC 2025","passed","Sun Aug 31 01:39:15 UTC 2025","","test_async_replication","",""
"Test behavior when node drains - pod is evicted and pvs are rotated.","","test_pod_eviction_and_pvc_deletion","tests.integration.high_availability","","unknown","","","test_node_drain","",""
"Test to restore a backup to the same mysql cluster.","159660","test_restore_on_same_cluster","tests.integration","Sun Aug 31 01:33:40 UTC 2025","passed","Sun Aug 31 01:36:19 UTC 2025","","test_backup_aws","",""
"Test that the pre-upgrade-check action runs successfully.","14490","test_pre_upgrade_check","tests.integration.high_availability","Sun Aug 31 01:34:32 UTC 2025","passed","Sun Aug 31 01:34:47 UTC 2025","","test_upgrade","",""
"Simple test to ensure that the mysql and application charms get deployed.","177050","test_build_and_deploy","tests.integration.high_availability","Sun Aug 31 01:30:46 UTC 2025","passed","Sun Aug 31 01:33:43 UTC 2025","","test_async_replication","",""
"Remove relation and wait for the expected changes in status.","","test_relation_broken","tests.integration.relations","","unknown","","","test_database","",""
"Test to create a backup and list backups.","59542","test_backup","tests.integration","Sun Aug 31 01:32:39 UTC 2025","passed","Sun Aug 31 01:33:38 UTC 2025","","test_backup_gcp","",""
"Test that the pre-upgrade-check action runs successfully.","23190","test_pre_upgrade_check","tests.integration.high_availability","Sun Aug 31 01:33:31 UTC 2025","passed","Sun Aug 31 01:33:54 UTC 2025","","test_upgrade_rollback_incompat","",""
"Test to restore a backup to the same mysql cluster.","189163","test_restore_on_same_cluster","tests.integration","Sun Aug 31 01:33:40 UTC 2025","passed","Sun Aug 31 01:36:50 UTC 2025","","test_backup_gcp","",""
"Test to restore a backup on a new mysql cluster.","519130","test_restore_on_new_cluster","tests.integration","Sun Aug 31 01:36:48 UTC 2025","passed","Sun Aug 31 01:45:27 UTC 2025","","test_backup_ceph","",""
"Test rejoin invalidated cluster with.","24785","test_rejoin_invalidated_cluster","tests.integration.high_availability","Sun Aug 31 01:44:10 UTC 2025","passed","Sun Aug 31 01:44:35 UTC 2025","","test_async_replication","",""
"Verify rotating tls private keys restarts cluster with new certificates.

    This test rotates tls private keys to randomly generated keys.
    ","41618","test_rotate_tls_key","tests.integration","Sun Aug 31 01:34:00 UTC 2025","passed","Sun Aug 31 01:34:42 UTC 2025","","test_tls","",""
"Test to create a backup and list backups.","40089","test_backup","tests.integration","Sun Aug 31 01:33:26 UTC 2025","passed","Sun Aug 31 01:34:07 UTC 2025","","test_backup_ceph","",""
"Simple test to ensure that the mysql charm gets deployed.","114286","test_build_and_deploy","tests.integration","Sun Aug 31 01:31:00 UTC 2025","passed","Sun Aug 31 01:32:55 UTC 2025","","test_backup_aws","",""
"Simple test to ensure that the mysql and application charms get deployed.","131295","test_build_and_deploy","tests.integration.high_availability","Sun Aug 31 01:31:20 UTC 2025","passed","Sun Aug 31 01:33:31 UTC 2025","","test_upgrade_rollback_incompat","",""
"Build and deploy for AWS.","217755","test_build_and_deploy_gcp","tests.integration","Sun Aug 31 01:31:06 UTC 2025","passed","Sun Aug 31 01:34:44 UTC 2025","","test_backup_pitr_gcp","",""
"Test COS integrations formed before mysql is allocated and deployed.","","test_deploy_bundle_with_cos_integrations","tests.integration","","unknown","","","test_cos_integration_bundle","",""
"","247708","test_fail_and_rollback","tests.integration.high_availability","Sun Aug 31 01:38:19 UTC 2025","passed","Sun Aug 31 01:42:27 UTC 2025","","test_upgrade","",""
"Relate charms before they have time to properly start.

    It simulates a Terraform-like deployment strategy
    ","168419","test_relation_creation_eager","tests.integration.relations","Sun Aug 31 01:31:30 UTC 2025","passed","Sun Aug 31 01:34:18 UTC 2025","","test_mysql_root","",""
"Build the charm and deploy 1 units to ensure a cluster is formed.","29312","test_build_and_deploy","tests.integration","Sun Aug 31 01:30:55 UTC 2025","passed","Sun Aug 31 01:31:25 UTC 2025","","test_multi_relations","",""
"Relate all the applications to the database.","195435","test_relate_all","tests.integration","Sun Aug 31 01:31:25 UTC 2025","passed","Sun Aug 31 01:34:40 UTC 2025","","test_multi_relations","",""
"Ensure scaling down to zero and back up works.","145067","test_scale_up_from_zero","tests.integration","Sun Aug 31 01:39:19 UTC 2025","passed","Sun Aug 31 01:41:44 UTC 2025","","test_charm","",""
"Test to kill the primary under load and ensure re-election of primary.","","test_kill_primary_check_reelection","tests.integration.high_availability","","unknown","","","test_replication_reelection","",""
"Deploy the router and the test application.","101696","test_deploy_router_and_app","tests.integration.high_availability","Sun Aug 31 01:33:54 UTC 2025","passed","Sun Aug 31 01:35:36 UTC 2025","","test_async_replication","",""
"Test to restore a backup on a new mysql cluster.","509624","test_restore_on_new_cluster","tests.integration","Sun Aug 31 01:36:50 UTC 2025","passed","Sun Aug 31 01:45:19 UTC 2025","","test_backup_gcp","",""
"Build the mysql charm and deploy it.","124367","test_build_and_deploy","tests.integration","Sun Aug 31 01:30:44 UTC 2025","passed","Sun Aug 31 01:32:48 UTC 2025","","test_charm","",""
"Build and deploy for AWS.","236751","test_build_and_deploy_aws","tests.integration","Sun Aug 31 01:30:54 UTC 2025","passed","Sun Aug 31 01:34:51 UTC 2025","","test_backup_pitr_aws","",""
"Test to restore a backup to the same mysql cluster.","158955","test_restore_on_same_cluster","tests.integration","Sun Aug 31 01:34:09 UTC 2025","passed","Sun Aug 31 01:36:48 UTC 2025","","test_backup_ceph","",""
"Test that the primary node can be switched over.","18945","test_cluster_switchover","tests.integration.high_availability","Sun Aug 31 01:34:26 UTC 2025","passed","Sun Aug 31 01:34:45 UTC 2025","","test_primary_switchover","",""
"","57775","test_deploy_and_relate_test_app","tests.integration","Sun Aug 31 01:31:30 UTC 2025","passed","Sun Aug 31 01:32:28 UTC 2025","","test_saturate_max_connections","",""
"Test the log rotation of text files.

    Run continuous writes to ensure that audit log plugin is loaded and active
    when mysql-test-app runs start-continuous-writes (by logging into mysql).
    ","6930","test_log_rotation","tests.integration.high_availability","Sun Aug 31 01:33:58 UTC 2025","passed","Sun Aug 31 01:34:05 UTC 2025","","test_log_rotation","",""
"Simple test to ensure that the mysql charm gets deployed.","109948","test_build_and_deploy","tests.integration","Sun Aug 31 01:30:47 UTC 2025","passed","Sun Aug 31 01:32:37 UTC 2025","","test_backup_gcp","",""
"Scale database and routers.","705827","test_scale_out","tests.integration","Sun Aug 31 01:34:40 UTC 2025","passed","Sun Aug 31 01:46:26 UTC 2025","","test_multi_relations","",""
"Rotate password and confirm changes.","11170","test_password_rotation","tests.integration","Sun Aug 31 01:41:44 UTC 2025","passed","Sun Aug 31 01:41:55 UTC 2025","","test_charm","",""
"Query database for custom variables.","24828","test_custom_variables","tests.integration","Sun Aug 31 01:42:25 UTC 2025","passed","Sun Aug 31 01:42:50 UTC 2025","","test_charm","",""
"","43523","test_upgrade_to_failling","tests.integration.high_availability","Sun Aug 31 01:33:54 UTC 2025","passed","Sun Aug 31 01:34:38 UTC 2025","","test_upgrade_rollback_incompat","",""
"Test the promote-to-primary command after losing the majority of nodes, with force flag.","271373","test_cluster_failover_after_majority_loss","tests.integration.high_availability","Sun Aug 31 01:34:45 UTC 2025","passed","Sun Aug 31 01:39:17 UTC 2025","","test_primary_switchover","",""
"Simple test to ensure that the mysql charm gets deployed.","106791","test_build_and_deploy","tests.integration","Sun Aug 31 01:31:38 UTC 2025","passed","Sun Aug 31 01:33:24 UTC 2025","","test_backup_ceph","",""
"Test to send a SIGKILL to the primary db process and ensure that the cluster self heals.","114497","test_kill_db_process","tests.integration.high_availability","Sun Aug 31 01:33:56 UTC 2025","passed","Sun Aug 31 01:35:50 UTC 2025","","test_self_healing_process_killed","",""
"Test to restore a backup on a new mysql cluster.","552248","test_restore_on_new_cluster","tests.integration","Sun Aug 31 01:36:19 UTC 2025","passed","Sun Aug 31 01:45:32 UTC 2025","","test_backup_aws","",""
"Test updating from stable channel.","","test_upgrade_from_stable","tests.integration.high_availability","","unknown","","","test_upgrade_from_stable","",""
"Simple test to ensure that the mysql and application charms get deployed.","","test_deploy_stable","tests.integration.high_availability","","unknown","","","test_upgrade_from_stable","",""
"Build the charm and deploy 3 units to ensure a cluster is formed.","126377","test_build_and_deploy","tests.integration","Sun Aug 31 01:30:49 UTC 2025","passed","Sun Aug 31 01:32:55 UTC 2025","","test_tls","",""
"","30173","test_disable_tls","tests.integration","Sun Aug 31 01:34:42 UTC 2025","passed","Sun Aug 31 01:35:12 UTC 2025","","test_tls","",""
"","306044","test_rollback","tests.integration.high_availability","Sun Aug 31 01:34:38 UTC 2025","passed","Sun Aug 31 01:39:44 UTC 2025","","test_upgrade_rollback_incompat","",""
"Tries deploying an amd64 charm on arm64 host.","","test_amd_charm_on_arm_host","tests.integration","","unknown","","","test_architecture","",""
"Confirm that data is replicated from the primary node to all the replicas.","4267","test_consistent_data_replication_across_cluster","tests.integration","Sun Aug 31 01:32:48 UTC 2025","passed","Sun Aug 31 01:32:52 UTC 2025","","test_charm","",""
"Rotate password and confirm changes.","14185","test_password_rotation_root_user_implicit","tests.integration","Sun Aug 31 01:42:07 UTC 2025","passed","Sun Aug 31 01:42:21 UTC 2025","","test_charm","",""
"Test to ensure that data is preserved when a unit is scaled up and then down.

    Ensures that there are no running continuous writes as the extra data in the
    database makes scaling up slower.
    ","181954","test_scaling_without_data_loss","tests.integration.high_availability","Sun Aug 31 01:33:53 UTC 2025","passed","Sun Aug 31 01:36:55 UTC 2025","","test_replication_scaling","",""
"Simple test to ensure that the mysql and application charms get deployed.","190681","test_deploy_latest","tests.integration.high_availability","Sun Aug 31 01:31:22 UTC 2025","passed","Sun Aug 31 01:34:32 UTC 2025","","test_upgrade","",""
"Scale database and routers.","259859","test_scale_in","tests.integration","Sun Aug 31 01:46:26 UTC 2025","passed","Sun Aug 31 01:50:46 UTC 2025","","test_multi_relations","",""
"Test for encryption enablement when relation to TLS charm.","63139","test_enable_tls","tests.integration","Sun Aug 31 01:32:57 UTC 2025","passed","Sun Aug 31 01:34:00 UTC 2025","","test_tls","",""
"Test to send SIGTERM to primary instance and then verify recovery.","92775","test_graceful_crash_of_primary","tests.integration.high_availability","Sun Aug 31 01:33:41 UTC 2025","passed","Sun Aug 31 01:35:14 UTC 2025","","test_self_healing_stop_primary","",""
"Tries deploying an arm64 charm on amd64 host.","","test_arm_charm_on_amd_host","tests.integration","","unknown","","","test_architecture","",""
"Test to send a SIGSTOP to the primary db process and ensure that the cluster self heals.","365439","test_freeze_db_process","tests.integration.high_availability","Sun Aug 31 01:33:45 UTC 2025","passed","Sun Aug 31 01:39:51 UTC 2025","","test_self_healing_process_frozen","",""
"Test that the pre-upgrade-check action runs successfully.","","test_pre_upgrade_check","tests.integration.high_availability","","unknown","","","test_upgrade_from_stable","",""
