"DESCRIPTION","DURATION IN MS","NAME","PARENT SUITE","START TIME","STATUS","STOP TIME","SUB SUITE","SUITE","TEST CLASS","TEST METHOD"
"Rotate password and confirm changes.","14179","test_password_rotation_root_user_implicit","tests.integration","Fri Sep 27 01:40:16 UTC 2024","passed","Fri Sep 27 01:40:30 UTC 2024","","test_charm","",""
"Relate charms and wait for the expected changes in status.","32396","test_relation_creation","tests.integration.relations","Fri Sep 27 01:33:17 UTC 2024","passed","Fri Sep 27 01:33:49 UTC 2024","","test_database","",""
"Scale database and routers.","480341","test_scale_out","tests.integration","Fri Sep 27 01:34:42 UTC 2024","passed","Fri Sep 27 01:42:42 UTC 2024","","test_multi_relations","",""
"Rotate password and confirm changes.","12158","test_password_rotation_silent","tests.integration","Fri Sep 27 01:40:04 UTC 2024","passed","Fri Sep 27 01:40:16 UTC 2024","","test_charm","",""
"Deploy the router and the test application.","69001","test_deploy_router_and_app","tests.integration.high_availability","Fri Sep 27 01:37:44 UTC 2024","passed","Fri Sep 27 01:38:53 UTC 2024","","test_async_replication","",""
"Test to restore a backup to the same mysql cluster.","177238","test_restore_on_same_cluster","tests.integration","Fri Sep 27 01:35:44 UTC 2024","passed","Fri Sep 27 01:38:41 UTC 2024","","test_backup_ceph","",""
"","43492","test_upgrade_to_failling","tests.integration.high_availability","Fri Sep 27 01:33:47 UTC 2024","passed","Fri Sep 27 01:34:30 UTC 2024","","test_upgrade_rollback_incompat","",""
"Simple test to ensure that the mysql and application charms get deployed.","172188","test_build_and_deploy","tests.integration.high_availability","Fri Sep 27 01:31:06 UTC 2024","passed","Fri Sep 27 01:33:58 UTC 2024","","test_async_replication","",""
"Test the labeling of k8s endpoints when apps with same cluster-name deployed.","441401","test_labeling_of_k8s_endpoints","tests.integration.high_availability","Fri Sep 27 01:31:01 UTC 2024","passed","Fri Sep 27 01:38:22 UTC 2024","","test_k8s_endpoints","",""
"Test that the pre-upgrade-check action runs successfully.","15373","test_pre_upgrade_check","tests.integration.high_availability","Fri Sep 27 01:34:18 UTC 2024","passed","Fri Sep 27 01:34:33 UTC 2024","","test_upgrade","",""
"Test that the pre-upgrade-check action runs successfully.","0","test_pre_upgrade_check","tests.integration.high_availability","Fri Sep 27 01:32:40 UTC 2024","skipped","Fri Sep 27 01:32:40 UTC 2024","","test_upgrade_from_stable","",""
"Test to send a SIGKILL to the primary db process and ensure that the cluster self heals.","88033","test_kill_db_process","tests.integration.high_availability","Fri Sep 27 01:34:37 UTC 2024","passed","Fri Sep 27 01:36:05 UTC 2024","","test_self_healing","",""
"Test to ensure that data is preserved when a unit is scaled up and then down.

    Ensures that there are no running continuous writes as the extra data in the
    database makes scaling up slower.
    ","253570","test_scaling_without_data_loss","tests.integration.high_availability","Fri Sep 27 01:34:44 UTC 2024","passed","Fri Sep 27 01:38:57 UTC 2024","","test_replication","",""
"Rotate password and confirm changes.","14214","test_password_rotation","tests.integration","Fri Sep 27 01:39:49 UTC 2024","passed","Fri Sep 27 01:40:04 UTC 2024","","test_charm","",""
"Test to restore a backup to the same mysql cluster.","214829","test_restore_on_same_cluster","tests.integration","Fri Sep 27 01:33:49 UTC 2024","passed","Fri Sep 27 01:37:24 UTC 2024","","test_backup_aws","",""
"Test to send SIGTERM to primary instance and then verify recovery.","50404","test_graceful_crash_of_primary","tests.integration.high_availability","Fri Sep 27 01:34:22 UTC 2024","passed","Fri Sep 27 01:35:13 UTC 2024","","test_self_healing","",""
"Build the mysql charm and deploy it.","126935","test_build_and_deploy","tests.integration","Fri Sep 27 01:31:25 UTC 2024","passed","Fri Sep 27 01:33:32 UTC 2024","","test_charm","",""
"Simple test to ensure that the mysql and application charms get deployed.","90618","test_deploy_stable","tests.integration.high_availability","Fri Sep 27 01:31:09 UTC 2024","broken","Fri Sep 27 01:32:40 UTC 2024","","test_upgrade_from_stable","",""
"Test the existence of databases and tables created by osm-pol's migrations.","36222","test_osm_pol_operations","tests.integration.relations","Fri Sep 27 01:33:45 UTC 2024","passed","Fri Sep 27 01:34:22 UTC 2024","","test_mysql_root","",""
"Test switchover on primary cluster fail.","262447","test_failover","tests.integration.high_availability","Fri Sep 27 01:40:35 UTC 2024","passed","Fri Sep 27 01:44:57 UTC 2024","","test_async_replication","",""
"Test updating from stable channel.","0","test_upgrade_from_stable","tests.integration.high_availability","Fri Sep 27 01:32:40 UTC 2024","skipped","Fri Sep 27 01:32:40 UTC 2024","","test_upgrade_from_stable","",""
"Build the charm and deploy 1 units to ensure a cluster is formed.","8546","test_build_and_deploy","tests.integration","Fri Sep 27 01:31:42 UTC 2024","passed","Fri Sep 27 01:31:51 UTC 2024","","test_saturate_max_connections","",""
"Test that the pre-upgrade-check action runs successfully.","9134","test_pre_upgrade_check","tests.integration.high_availability","Fri Sep 27 01:33:37 UTC 2024","passed","Fri Sep 27 01:33:47 UTC 2024","","test_upgrade_rollback_incompat","",""
"Simple test to ensure that the mysql charm gets deployed.","115931","test_build_and_deploy","tests.integration","Fri Sep 27 01:31:05 UTC 2024","passed","Fri Sep 27 01:33:01 UTC 2024","","test_backup_aws","",""
"Test to restore a backup on a new mysql cluster.","295750","test_restore_on_new_cluster","tests.integration","Fri Sep 27 01:37:24 UTC 2024","passed","Fri Sep 27 01:42:20 UTC 2024","","test_backup_aws","",""
"Test to create a backup and list backups.","49000","test_backup","tests.integration","Fri Sep 27 01:33:01 UTC 2024","passed","Fri Sep 27 01:33:50 UTC 2024","","test_backup_gcp","",""
"Scale database and routers.","245317","test_scale_in","tests.integration","Fri Sep 27 01:42:42 UTC 2024","passed","Fri Sep 27 01:46:47 UTC 2024","","test_multi_relations","",""
"Test that endpoints are running.","3980","test_exporter_endpoints","tests.integration","Fri Sep 27 01:40:30 UTC 2024","passed","Fri Sep 27 01:40:34 UTC 2024","","test_charm","",""
"Test to send a SIGSTOP to the primary db process and ensure that the cluster self heals.","","test_freeze_db_process","tests.integration.high_availability","","unknown","","","test_self_healing","",""
"Simple test to ensure that the mysql and application charms get deployed.","172389","test_deploy_latest","tests.integration.high_availability","Fri Sep 27 01:31:25 UTC 2024","passed","Fri Sep 27 01:34:18 UTC 2024","","test_upgrade","",""
"Simple test to ensure that the mysql charm gets deployed.","117045","test_build_and_deploy","tests.integration","Fri Sep 27 01:32:59 UTC 2024","passed","Fri Sep 27 01:34:57 UTC 2024","","test_backup_ceph","",""
"","224183","test_fail_and_rollback","tests.integration.high_availability","Fri Sep 27 01:37:35 UTC 2024","passed","Fri Sep 27 01:41:19 UTC 2024","","test_upgrade","",""
"Test graceful promotion of a standby cluster to primary.","27414","test_standby_promotion","tests.integration.high_availability","Fri Sep 27 01:40:06 UTC 2024","passed","Fri Sep 27 01:40:34 UTC 2024","","test_async_replication","",""
"Test behavior when node drains - pod is evicted and pvs are rotated.","155312","test_pod_eviction_and_pvc_deletion","tests.integration.high_availability","Fri Sep 27 01:34:38 UTC 2024","passed","Fri Sep 27 01:37:14 UTC 2024","","test_node_drain","",""
"Test to send SIGTERM to all units and then ensure that the cluster recovers.","327886","test_graceful_full_cluster_crash_test","tests.integration.high_availability","Fri Sep 27 01:34:34 UTC 2024","passed","Fri Sep 27 01:40:02 UTC 2024","","test_self_healing","",""
"Build the charm and deploy 1 units to ensure a cluster is formed.","64216","test_build_and_deploy","tests.integration","Fri Sep 27 01:31:07 UTC 2024","passed","Fri Sep 27 01:32:11 UTC 2024","","test_multi_relations","",""
"Test COS integrations formed before mysql is allocated and deployed.","79110","test_deploy_bundle_with_cos_integrations","tests.integration","Fri Sep 27 01:31:08 UTC 2024","passed","Fri Sep 27 01:32:27 UTC 2024","","test_cos_integration_bundle","",""
"Test to write to primary, and read the same data back from replicas.","9508","test_check_consistency","tests.integration.high_availability","Fri Sep 27 01:34:25 UTC 2024","passed","Fri Sep 27 01:34:34 UTC 2024","","test_replication","",""
"Test to create a backup and list backups.","44161","test_backup","tests.integration","Fri Sep 27 01:33:03 UTC 2024","passed","Fri Sep 27 01:33:47 UTC 2024","","test_backup_aws","",""
"Confirm that data is replicated from the primary node to all the replicas.","4147","test_consistent_data_replication_across_cluster","tests.integration","Fri Sep 27 01:33:32 UTC 2024","passed","Fri Sep 27 01:33:36 UTC 2024","","test_charm","",""
"Simple test to ensure that the mysql and application charms get deployed.","127456","test_build_and_deploy","tests.integration.high_availability","Fri Sep 27 01:31:30 UTC 2024","passed","Fri Sep 27 01:33:37 UTC 2024","","test_upgrade_rollback_incompat","",""
"Test to kill the primary under load and ensure re-election of primary.","209979","test_kill_primary_check_reelection","tests.integration.high_availability","Fri Sep 27 01:34:24 UTC 2024","passed","Fri Sep 27 01:37:54 UTC 2024","","test_replication","",""
"","159726","test_rollback","tests.integration.high_availability","Fri Sep 27 01:34:30 UTC 2024","passed","Fri Sep 27 01:37:10 UTC 2024","","test_upgrade_rollback_incompat","",""
"Relate the two mysql clusters.","4660","test_async_relate","tests.integration.high_availability","Fri Sep 27 01:33:58 UTC 2024","passed","Fri Sep 27 01:34:03 UTC 2024","","test_async_replication","",""
"Test the log rotation of text files.

    Run continuous writes to ensure that audit log plugin is loaded and active
    when mysql-test-app runs start-continuous-writes (by logging into mysql).
    ","9478","test_log_rotation","tests.integration.high_availability","Fri Sep 27 01:34:45 UTC 2024","passed","Fri Sep 27 01:34:54 UTC 2024","","test_log_rotation","",""
"Test to restore a backup on a new mysql cluster.","286363","test_restore_on_new_cluster","tests.integration","Fri Sep 27 01:38:41 UTC 2024","passed","Fri Sep 27 01:43:28 UTC 2024","","test_backup_ceph","",""
"","170814","test_upgrade_from_edge","tests.integration.high_availability","Fri Sep 27 01:34:37 UTC 2024","passed","Fri Sep 27 01:37:28 UTC 2024","","test_upgrade","",""
"Relate all the applications to the database.","150624","test_relate_all","tests.integration","Fri Sep 27 01:32:11 UTC 2024","passed","Fri Sep 27 01:34:42 UTC 2024","","test_multi_relations","",""
"Simple test to ensure that the mysql charm gets deployed.","114623","test_build_and_deploy","tests.integration","Fri Sep 27 01:31:04 UTC 2024","passed","Fri Sep 27 01:32:59 UTC 2024","","test_backup_gcp","",""
"Test to restore a backup on a new mysql cluster.","339909","test_restore_on_new_cluster","tests.integration","Fri Sep 27 01:36:51 UTC 2024","passed","Fri Sep 27 01:42:31 UTC 2024","","test_backup_gcp","",""
"","30121","test_disable_tls","tests.integration","Fri Sep 27 01:35:13 UTC 2024","passed","Fri Sep 27 01:35:43 UTC 2024","","test_tls","",""
"Delete the pod in a single unit deployment and write data to new pod.","187896","test_single_unit_pod_delete","tests.integration.high_availability","Fri Sep 27 01:34:34 UTC 2024","passed","Fri Sep 27 01:37:42 UTC 2024","","test_self_healing","",""
"Build the charm and deploy 3 units to ensure a cluster is formed.","126509","test_build_and_deploy","tests.integration","Fri Sep 27 01:31:13 UTC 2024","passed","Fri Sep 27 01:33:20 UTC 2024","","test_tls","",""
"Confirm that a new primary is elected when the current primary is torn down.","282331","test_scale_up_and_down","tests.integration","Fri Sep 27 01:33:36 UTC 2024","passed","Fri Sep 27 01:38:18 UTC 2024","","test_charm","",""
"","4143","test_saturate_max_connections","tests.integration","Fri Sep 27 01:32:49 UTC 2024","passed","Fri Sep 27 01:32:53 UTC 2024","","test_saturate_max_connections","",""
"Verify rotating tls private keys restarts cluster with new certificates.

    This test rotates tls private keys to randomly generated keys.
    ","41812","test_rotate_tls_key","tests.integration","Fri Sep 27 01:34:31 UTC 2024","passed","Fri Sep 27 01:35:13 UTC 2024","","test_tls","",""
"Confirm storage reuse works.","91366","test_scale_up_after_scale_down","tests.integration","Fri Sep 27 01:38:18 UTC 2024","passed","Fri Sep 27 01:39:49 UTC 2024","","test_charm","",""
"Test rejoin invalidated cluster with.","22376","test_rejoin_invalidated_cluster","tests.integration.high_availability","Fri Sep 27 01:44:59 UTC 2024","passed","Fri Sep 27 01:45:22 UTC 2024","","test_async_replication","",""
"Query database for custom variables.","24554","test_custom_variables","tests.integration","Fri Sep 27 01:40:34 UTC 2024","passed","Fri Sep 27 01:40:58 UTC 2024","","test_charm","",""
"Test to restore a backup to the same mysql cluster.","179517","test_restore_on_same_cluster","tests.integration","Fri Sep 27 01:33:52 UTC 2024","passed","Fri Sep 27 01:36:51 UTC 2024","","test_backup_gcp","",""
"Test to create a backup and list backups.","43517","test_backup","tests.integration","Fri Sep 27 01:34:59 UTC 2024","passed","Fri Sep 27 01:35:42 UTC 2024","","test_backup_ceph","",""
"Test to ensure that writes to one cluster do not replicate to another cluster.","111563","test_no_replication_across_clusters","tests.integration.high_availability","Fri Sep 27 01:34:38 UTC 2024","passed","Fri Sep 27 01:36:29 UTC 2024","","test_replication","",""
"Run the create replication and wait for the applications to settle.","220929","test_create_replication","tests.integration.high_availability","Fri Sep 27 01:34:03 UTC 2024","passed","Fri Sep 27 01:37:44 UTC 2024","","test_async_replication","",""
"Relate charms and wait for the expected changes in status.","0","test_relation_creation_databag","tests.integration.relations","Fri Sep 27 01:33:17 UTC 2024","skipped","Fri Sep 27 01:33:17 UTC 2024","","test_database","",""
"","184191","test_crash_during_cluster_setup","tests.integration.high_availability","Fri Sep 27 01:31:29 UTC 2024","passed","Fri Sep 27 01:34:33 UTC 2024","","test_crash_during_setup","",""
"Test removing and re-relating the two mysql clusters.","243858","test_remove_relation_and_relate","tests.integration.high_availability","Fri Sep 27 01:45:25 UTC 2024","passed","Fri Sep 27 01:49:29 UTC 2024","","test_async_replication","",""
"Test the deployment and relation with osm bundle with mysql replacing mariadb.","159848","test_deploy_and_relate_osm_bundle","tests.integration.relations","Fri Sep 27 01:31:06 UTC 2024","passed","Fri Sep 27 01:33:45 UTC 2024","","test_mysql_root","",""
"Build the charm and deploy 3 units to ensure a cluster is formed.","137305","test_build_and_deploy","tests.integration.relations","Fri Sep 27 01:31:00 UTC 2024","passed","Fri Sep 27 01:33:17 UTC 2024","","test_database","",""
"","57964","test_deploy_and_relate_test_app","tests.integration","Fri Sep 27 01:31:51 UTC 2024","passed","Fri Sep 27 01:32:49 UTC 2024","","test_saturate_max_connections","",""
"Test for encryption enablement when relation to TLS charm.","69563","test_enable_tls","tests.integration","Fri Sep 27 01:33:22 UTC 2024","passed","Fri Sep 27 01:34:31 UTC 2024","","test_tls","",""
"Test for a network cut affecting an instance.","1203400","test_network_cut_affecting_an_instance","tests.integration.high_availability","Fri Sep 27 01:34:30 UTC 2024","passed","Fri Sep 27 01:54:33 UTC 2024","","test_self_healing","",""
"Test to write to primary, and read the same data back from replicas.","8391","test_data_replication","tests.integration.high_availability","Fri Sep 27 01:39:55 UTC 2024","passed","Fri Sep 27 01:40:03 UTC 2024","","test_async_replication","",""
"Ensure connections (with and without ssl) are possible before relating with TLS operator.","2113","test_connection_before_tls","tests.integration","Fri Sep 27 01:33:20 UTC 2024","passed","Fri Sep 27 01:33:22 UTC 2024","","test_tls","",""
"Remove relation and wait for the expected changes in status.","27580","test_relation_broken","tests.integration.relations","Fri Sep 27 01:33:49 UTC 2024","passed","Fri Sep 27 01:34:17 UTC 2024","","test_database","",""
