"DESCRIPTION","DURATION IN MS","NAME","PARENT SUITE","START TIME","STATUS","STOP TIME","SUB SUITE","SUITE","TEST CLASS","TEST METHOD"
"Confirm that a new primary is elected when the current primary is torn down.","295021","test_scale_up_and_down","tests.integration","Wed Dec 25 01:30:24 UTC 2024","passed","Wed Dec 25 01:35:19 UTC 2024","","test_charm","",""
"Relate charms and wait for the expected changes in status.","31622","test_relation_creation","tests.integration.relations","Wed Dec 25 01:30:17 UTC 2024","passed","Wed Dec 25 01:30:49 UTC 2024","","test_database","",""
"Test to restore a backup to the same mysql cluster.","167820","test_restore_on_same_cluster","tests.integration","Wed Dec 25 01:32:08 UTC 2024","passed","Wed Dec 25 01:34:55 UTC 2024","","test_backup_ceph","",""
"Deploy the router and the test application.","0","test_deploy_router_and_app","tests.integration.high_availability","Wed Dec 25 01:30:59 UTC 2024","skipped","Wed Dec 25 01:30:59 UTC 2024","","test_async_replication","",""
"Test for a network cut affecting an instance.","216246","test_network_cut_affecting_an_instance","tests.integration.high_availability","Wed Dec 25 01:32:00 UTC 2024","passed","Wed Dec 25 01:35:36 UTC 2024","","test_self_healing","",""
"Run the create replication and wait for the applications to settle.","0","test_create_replication","tests.integration.high_availability","Wed Dec 25 01:30:59 UTC 2024","skipped","Wed Dec 25 01:30:59 UTC 2024","","test_async_replication","",""
"","47876","test_upgrade_to_failling","tests.integration.high_availability","Wed Dec 25 01:30:37 UTC 2024","passed","Wed Dec 25 01:31:24 UTC 2024","","test_upgrade_rollback_incompat","",""
"Query database for custom variables.","24521","test_custom_variables","tests.integration","Wed Dec 25 01:37:27 UTC 2024","passed","Wed Dec 25 01:37:52 UTC 2024","","test_charm","",""
"Test graceful promotion of a standby cluster to primary.","0","test_standby_promotion","tests.integration.high_availability","Wed Dec 25 01:30:59 UTC 2024","skipped","Wed Dec 25 01:30:59 UTC 2024","","test_async_replication","",""
"","240940","test_fail_and_rollback","tests.integration.high_availability","Wed Dec 25 01:35:24 UTC 2024","passed","Wed Dec 25 01:39:25 UTC 2024","","test_upgrade","",""
"","199871","test_upgrade_from_edge","tests.integration.high_availability","Wed Dec 25 01:31:58 UTC 2024","passed","Wed Dec 25 01:35:17 UTC 2024","","test_upgrade","",""
"Verify rotating tls private keys restarts cluster with new certificates.

    This test rotates tls private keys to randomly generated keys.
    ","40881","test_rotate_tls_key","tests.integration","Wed Dec 25 01:31:34 UTC 2024","passed","Wed Dec 25 01:32:15 UTC 2024","","test_tls","",""
"","62020","test_deploy_and_relate_test_app","tests.integration","Wed Dec 25 01:27:53 UTC 2024","passed","Wed Dec 25 01:28:55 UTC 2024","","test_saturate_max_connections","",""
"Test to write to primary, and read the same data back from replicas.","9502","test_check_consistency","tests.integration.high_availability","Wed Dec 25 01:31:00 UTC 2024","passed","Wed Dec 25 01:31:10 UTC 2024","","test_replication","",""
"Test to restore a backup on a new mysql cluster.","297405","test_restore_on_new_cluster","tests.integration","Wed Dec 25 01:33:25 UTC 2024","passed","Wed Dec 25 01:38:22 UTC 2024","","test_backup_aws","",""
"","5144","test_saturate_max_connections","tests.integration","Wed Dec 25 01:28:55 UTC 2024","passed","Wed Dec 25 01:29:00 UTC 2024","","test_saturate_max_connections","",""
"Test the log rotation of text files.

    Run continuous writes to ensure that audit log plugin is loaded and active
    when mysql-test-app runs start-continuous-writes (by logging into mysql).
    ","9494","test_log_rotation","tests.integration.high_availability","Wed Dec 25 01:31:45 UTC 2024","passed","Wed Dec 25 01:31:55 UTC 2024","","test_log_rotation","",""
"Tries deploying an arm64 charm on amd64 host.","60691","test_arm_charm_on_amd_host","tests.integration","Wed Dec 25 01:27:48 UTC 2024","passed","Wed Dec 25 01:28:48 UTC 2024","","test_architecture","",""
"Simple test to ensure that the mysql charm gets deployed.","125011","test_build_and_deploy","tests.integration","Wed Dec 25 01:27:50 UTC 2024","passed","Wed Dec 25 01:29:55 UTC 2024","","test_backup_aws","",""
"Relate all the applications to the database.","155360","test_relate_all","tests.integration","Wed Dec 25 01:28:48 UTC 2024","passed","Wed Dec 25 01:31:23 UTC 2024","","test_multi_relations","",""
"Build the mysql charm and deploy it.","144815","test_build_and_deploy","tests.integration","Wed Dec 25 01:27:55 UTC 2024","passed","Wed Dec 25 01:30:20 UTC 2024","","test_charm","",""
"Test for encryption enablement when relation to TLS charm.","61773","test_enable_tls","tests.integration","Wed Dec 25 01:30:32 UTC 2024","passed","Wed Dec 25 01:31:34 UTC 2024","","test_tls","",""
"Rotate password and confirm changes.","14195","test_password_rotation_root_user_implicit","tests.integration","Wed Dec 25 01:37:09 UTC 2024","passed","Wed Dec 25 01:37:23 UTC 2024","","test_charm","",""
"Tries deploying an amd64 charm on arm64 host.","0","test_amd_charm_on_arm_host","tests.integration","Wed Dec 25 01:28:48 UTC 2024","skipped","Wed Dec 25 01:28:48 UTC 2024","","test_architecture","",""
"Test to create a backup and list backups.","48444","test_backup","tests.integration","Wed Dec 25 01:29:58 UTC 2024","passed","Wed Dec 25 01:30:46 UTC 2024","","test_backup_gcp","",""
"Build the charm and deploy 1 units to ensure a cluster is formed.","37467","test_build_and_deploy","tests.integration","Wed Dec 25 01:28:10 UTC 2024","passed","Wed Dec 25 01:28:48 UTC 2024","","test_multi_relations","",""
"Build the charm and deploy 1 units to ensure a cluster is formed.","7724","test_build_and_deploy","tests.integration","Wed Dec 25 01:27:45 UTC 2024","passed","Wed Dec 25 01:27:53 UTC 2024","","test_saturate_max_connections","",""
"Test to send SIGTERM to all units and then ensure that the cluster recovers.","318174","test_graceful_full_cluster_crash_test","tests.integration.high_availability","Wed Dec 25 01:31:22 UTC 2024","passed","Wed Dec 25 01:36:40 UTC 2024","","test_self_healing","",""
"Rotate password and confirm changes.","11188","test_password_rotation","tests.integration","Wed Dec 25 01:36:46 UTC 2024","passed","Wed Dec 25 01:36:57 UTC 2024","","test_charm","",""
"Simple test to ensure that the mysql and application charms get deployed.","152196","test_build_and_deploy","tests.integration.high_availability","Wed Dec 25 01:27:54 UTC 2024","passed","Wed Dec 25 01:30:26 UTC 2024","","test_upgrade_rollback_incompat","",""
"Simple test to ensure that the mysql and application charms get deployed.","232357","test_deploy_latest","tests.integration.high_availability","Wed Dec 25 01:27:46 UTC 2024","passed","Wed Dec 25 01:31:38 UTC 2024","","test_upgrade","",""
"Ensure connections (with and without ssl) are possible before relating with TLS operator.","2138","test_connection_before_tls","tests.integration","Wed Dec 25 01:30:30 UTC 2024","passed","Wed Dec 25 01:30:32 UTC 2024","","test_tls","",""
"Test updating from stable channel.","0","test_upgrade_from_stable","tests.integration.high_availability","Wed Dec 25 01:28:49 UTC 2024","skipped","Wed Dec 25 01:28:49 UTC 2024","","test_upgrade_from_stable","",""
"Test the existence of databases and tables created by osm-pol's migrations.","34223","test_osm_pol_operations","tests.integration.relations","Wed Dec 25 01:31:17 UTC 2024","passed","Wed Dec 25 01:31:51 UTC 2024","","test_mysql_root","",""
"","930819","test_crash_during_cluster_setup","tests.integration.high_availability","Wed Dec 25 01:28:33 UTC 2024","broken","Wed Dec 25 01:44:04 UTC 2024","","test_crash_during_setup","",""
"Test the deployment and relation with osm bundle with mysql replacing mariadb.","216388","test_deploy_and_relate_osm_bundle","tests.integration.relations","Wed Dec 25 01:27:41 UTC 2024","passed","Wed Dec 25 01:31:17 UTC 2024","","test_mysql_root","",""
"Test to restore a backup to the same mysql cluster.","186002","test_restore_on_same_cluster","tests.integration","Wed Dec 25 01:30:48 UTC 2024","passed","Wed Dec 25 01:33:54 UTC 2024","","test_backup_gcp","",""
"Delete the pod in a single unit deployment and write data to new pod.","186558","test_single_unit_pod_delete","tests.integration.high_availability","Wed Dec 25 01:31:20 UTC 2024","passed","Wed Dec 25 01:34:27 UTC 2024","","test_self_healing","",""
"Scale database and routers.","225383","test_scale_in","tests.integration","Wed Dec 25 01:39:24 UTC 2024","passed","Wed Dec 25 01:43:09 UTC 2024","","test_multi_relations","",""
"Remove relation and wait for the expected changes in status.","28287","test_relation_broken","tests.integration.relations","Wed Dec 25 01:30:49 UTC 2024","passed","Wed Dec 25 01:31:17 UTC 2024","","test_database","",""
"Simple test to ensure that the mysql charm gets deployed.","122962","test_build_and_deploy","tests.integration","Wed Dec 25 01:27:53 UTC 2024","passed","Wed Dec 25 01:29:56 UTC 2024","","test_backup_gcp","",""
"Test that the pre-upgrade-check action runs successfully.","10201","test_pre_upgrade_check","tests.integration.high_availability","Wed Dec 25 01:30:26 UTC 2024","passed","Wed Dec 25 01:30:37 UTC 2024","","test_upgrade_rollback_incompat","",""
"Test to ensure that data is preserved when a unit is scaled up and then down.

    Ensures that there are no running continuous writes as the extra data in the
    database makes scaling up slower.
    ","244462","test_scaling_without_data_loss","tests.integration.high_availability","Wed Dec 25 01:31:20 UTC 2024","passed","Wed Dec 25 01:35:24 UTC 2024","","test_replication","",""
"","30118","test_disable_tls","tests.integration","Wed Dec 25 01:32:15 UTC 2024","passed","Wed Dec 25 01:32:45 UTC 2024","","test_tls","",""
"Test that endpoints are running.","3948","test_exporter_endpoints","tests.integration","Wed Dec 25 01:37:23 UTC 2024","passed","Wed Dec 25 01:37:27 UTC 2024","","test_charm","",""
"Test switchover on primary cluster fail.","0","test_failover","tests.integration.high_availability","Wed Dec 25 01:30:59 UTC 2024","skipped","Wed Dec 25 01:30:59 UTC 2024","","test_async_replication","",""
"Test to send a SIGKILL to the primary db process and ensure that the cluster self heals.","80781","test_kill_db_process","tests.integration.high_availability","Wed Dec 25 01:31:34 UTC 2024","passed","Wed Dec 25 01:32:55 UTC 2024","","test_self_healing","",""
"Test rejoin invalidated cluster with.","0","test_rejoin_invalidated_cluster","tests.integration.high_availability","Wed Dec 25 01:30:59 UTC 2024","skipped","Wed Dec 25 01:30:59 UTC 2024","","test_async_replication","",""
"Test to kill the primary under load and ensure re-election of primary.","193646","test_kill_primary_check_reelection","tests.integration.high_availability","Wed Dec 25 01:31:45 UTC 2024","passed","Wed Dec 25 01:34:59 UTC 2024","","test_replication","",""
"Test to restore a backup on a new mysql cluster.","295649","test_restore_on_new_cluster","tests.integration","Wed Dec 25 01:34:55 UTC 2024","passed","Wed Dec 25 01:39:51 UTC 2024","","test_backup_ceph","",""
"Relate the two mysql clusters.","5","test_async_relate","tests.integration.high_availability","Wed Dec 25 01:30:59 UTC 2024","broken","Wed Dec 25 01:30:59 UTC 2024","","test_async_replication","",""
"Test to create a backup and list backups.","43934","test_backup","tests.integration","Wed Dec 25 01:31:22 UTC 2024","passed","Wed Dec 25 01:32:06 UTC 2024","","test_backup_ceph","",""
"Test COS integrations formed before mysql is allocated and deployed.","91928","test_deploy_bundle_with_cos_integrations","tests.integration","Wed Dec 25 01:27:45 UTC 2024","passed","Wed Dec 25 01:29:16 UTC 2024","","test_cos_integration_bundle","",""
"Test to restore a backup to the same mysql cluster.","163835","test_restore_on_same_cluster","tests.integration","Wed Dec 25 01:30:41 UTC 2024","passed","Wed Dec 25 01:33:25 UTC 2024","","test_backup_aws","",""
"Rotate password and confirm changes.","12190","test_password_rotation_silent","tests.integration","Wed Dec 25 01:36:57 UTC 2024","passed","Wed Dec 25 01:37:09 UTC 2024","","test_charm","",""
"Test to ensure that writes to one cluster do not replicate to another cluster.","92424","test_no_replication_across_clusters","tests.integration.high_availability","Wed Dec 25 01:31:54 UTC 2024","passed","Wed Dec 25 01:33:27 UTC 2024","","test_replication","",""
"Test the labeling of k8s endpoints when apps with same cluster-name deployed.","428593","test_labeling_of_k8s_endpoints","tests.integration.high_availability","Wed Dec 25 01:28:12 UTC 2024","passed","Wed Dec 25 01:35:21 UTC 2024","","test_k8s_endpoints","",""
"Scale database and routers.","480340","test_scale_out","tests.integration","Wed Dec 25 01:31:23 UTC 2024","passed","Wed Dec 25 01:39:24 UTC 2024","","test_multi_relations","",""
"Test behavior when node drains - pod is evicted and pvs are rotated.","138619","test_pod_eviction_and_pvc_deletion","tests.integration.high_availability","Wed Dec 25 01:31:22 UTC 2024","passed","Wed Dec 25 01:33:41 UTC 2024","","test_node_drain","",""
"Relate charms and wait for the expected changes in status.","0","test_relation_creation_databag","tests.integration.relations","Wed Dec 25 01:30:17 UTC 2024","skipped","Wed Dec 25 01:30:17 UTC 2024","","test_database","",""
"Test to restore a backup on a new mysql cluster.","301812","test_restore_on_new_cluster","tests.integration","Wed Dec 25 01:33:54 UTC 2024","passed","Wed Dec 25 01:38:56 UTC 2024","","test_backup_gcp","",""
"Simple test to ensure that the mysql and application charms get deployed.","182803","test_build_and_deploy","tests.integration.high_availability","Wed Dec 25 01:27:56 UTC 2024","passed","Wed Dec 25 01:30:59 UTC 2024","","test_async_replication","",""
"Test to write to primary, and read the same data back from replicas.","0","test_data_replication","tests.integration.high_availability","Wed Dec 25 01:30:59 UTC 2024","skipped","Wed Dec 25 01:30:59 UTC 2024","","test_async_replication","",""
"Simple test to ensure that the mysql and application charms get deployed.","47683","test_deploy_stable","tests.integration.high_availability","Wed Dec 25 01:28:01 UTC 2024","broken","Wed Dec 25 01:28:49 UTC 2024","","test_upgrade_from_stable","",""
"Simple test to ensure that the mysql charm gets deployed.","121036","test_build_and_deploy","tests.integration","Wed Dec 25 01:29:19 UTC 2024","passed","Wed Dec 25 01:31:20 UTC 2024","","test_backup_ceph","",""
"Build the charm and deploy 3 units to ensure a cluster is formed.","147612","test_build_and_deploy","tests.integration.relations","Wed Dec 25 01:27:50 UTC 2024","passed","Wed Dec 25 01:30:17 UTC 2024","","test_database","",""
"Build the charm and deploy 3 units to ensure a cluster is formed.","160070","test_build_and_deploy","tests.integration","Wed Dec 25 01:27:50 UTC 2024","passed","Wed Dec 25 01:30:30 UTC 2024","","test_tls","",""
"Test that the pre-upgrade-check action runs successfully.","0","test_pre_upgrade_check","tests.integration.high_availability","Wed Dec 25 01:28:49 UTC 2024","skipped","Wed Dec 25 01:28:49 UTC 2024","","test_upgrade_from_stable","",""
"Test to create a backup and list backups.","41390","test_backup","tests.integration","Wed Dec 25 01:29:58 UTC 2024","passed","Wed Dec 25 01:30:39 UTC 2024","","test_backup_aws","",""
"Test that the pre-upgrade-check action runs successfully.","15389","test_pre_upgrade_check","tests.integration.high_availability","Wed Dec 25 01:31:38 UTC 2024","passed","Wed Dec 25 01:31:54 UTC 2024","","test_upgrade","",""
"Confirm storage reuse works.","86756","test_scale_up_after_scale_down","tests.integration","Wed Dec 25 01:35:19 UTC 2024","passed","Wed Dec 25 01:36:46 UTC 2024","","test_charm","",""
"Test to send a SIGSTOP to the primary db process and ensure that the cluster self heals.","239428","test_freeze_db_process","tests.integration.high_availability","Wed Dec 25 01:31:24 UTC 2024","passed","Wed Dec 25 01:35:23 UTC 2024","","test_self_healing","",""
"Test removing and re-relating the two mysql clusters.","0","test_remove_relation_and_relate","tests.integration.high_availability","Wed Dec 25 01:30:59 UTC 2024","skipped","Wed Dec 25 01:30:59 UTC 2024","","test_async_replication","",""
"","171250","test_rollback","tests.integration.high_availability","Wed Dec 25 01:31:24 UTC 2024","passed","Wed Dec 25 01:34:16 UTC 2024","","test_upgrade_rollback_incompat","",""
"Test to send SIGTERM to primary instance and then verify recovery.","118640","test_graceful_crash_of_primary","tests.integration.high_availability","Wed Dec 25 01:31:04 UTC 2024","passed","Wed Dec 25 01:33:02 UTC 2024","","test_self_healing","",""
"Confirm that data is replicated from the primary node to all the replicas.","4144","test_consistent_data_replication_across_cluster","tests.integration","Wed Dec 25 01:30:20 UTC 2024","passed","Wed Dec 25 01:30:24 UTC 2024","","test_charm","",""
