"DESCRIPTION","DURATION IN MS","NAME","PARENT SUITE","START TIME","STATUS","STOP TIME","SUB SUITE","SUITE","TEST CLASS","TEST METHOD"
"Ensure connections (with and without ssl) are possible before relating with TLS operator.","2264","test_connection_before_tls","tests.integration","Mon Feb 03 01:32:51 UTC 2025","passed","Mon Feb 03 01:32:54 UTC 2025","","test_tls","",""
"Rotate password and confirm changes.","14166","test_password_rotation_root_user_implicit","tests.integration","Mon Feb 03 01:38:42 UTC 2025","passed","Mon Feb 03 01:38:56 UTC 2025","","test_charm","",""
"Test for a network cut affecting an instance.","203015","test_network_cut_affecting_an_instance","tests.integration.high_availability","Mon Feb 03 01:31:04 UTC 2025","passed","Mon Feb 03 01:34:27 UTC 2025","","test_self_healing","",""
"Remove relation and wait for the expected changes in status.","25718","test_relation_broken","tests.integration.relations","Mon Feb 03 01:32:57 UTC 2025","passed","Mon Feb 03 01:33:22 UTC 2025","","test_database","",""
"Test for encryption enablement when relation to TLS charm.","63275","test_enable_tls","tests.integration","Mon Feb 03 01:32:54 UTC 2025","passed","Mon Feb 03 01:33:57 UTC 2025","","test_tls","",""
"Test to write to primary, and read the same data back from replicas.","8511","test_data_replication","tests.integration.high_availability","Mon Feb 03 01:36:40 UTC 2025","passed","Mon Feb 03 01:36:48 UTC 2025","","test_async_replication","",""
"","4735","test_saturate_max_connections","tests.integration","Mon Feb 03 01:28:54 UTC 2025","passed","Mon Feb 03 01:28:58 UTC 2025","","test_saturate_max_connections","",""
"Test to send a SIGSTOP to the primary db process and ensure that the cluster self heals.","","test_freeze_db_process","tests.integration.high_availability","","unknown","","","test_self_healing","",""
"Test switchover on primary cluster fail.","292492","test_failover","tests.integration.high_availability","Mon Feb 03 01:37:17 UTC 2025","passed","Mon Feb 03 01:42:10 UTC 2025","","test_async_replication","",""
"Test rejoin invalidated cluster with.","26671","test_rejoin_invalidated_cluster","tests.integration.high_availability","Mon Feb 03 01:42:12 UTC 2025","passed","Mon Feb 03 01:42:38 UTC 2025","","test_async_replication","",""
"Test removing and re-relating the two mysql clusters.","239461","test_remove_relation_and_relate","tests.integration.high_availability","Mon Feb 03 01:42:42 UTC 2025","passed","Mon Feb 03 01:46:41 UTC 2025","","test_async_replication","",""
"Test to create a backup and list backups.","48605","test_backup","tests.integration","Mon Feb 03 01:29:31 UTC 2025","passed","Mon Feb 03 01:30:20 UTC 2025","","test_backup_gcp","",""
"Test graceful promotion of a standby cluster to primary.","24697","test_standby_promotion","tests.integration.high_availability","Mon Feb 03 01:36:52 UTC 2025","passed","Mon Feb 03 01:37:16 UTC 2025","","test_async_replication","",""
"Simple test to ensure that the mysql and application charms get deployed.","151423","test_build_and_deploy","tests.integration.high_availability","Mon Feb 03 01:27:21 UTC 2025","passed","Mon Feb 03 01:29:52 UTC 2025","","test_upgrade_rollback_incompat","",""
"Test to send SIGTERM to primary instance and then verify recovery.","51259","test_graceful_crash_of_primary","tests.integration.high_availability","Mon Feb 03 01:31:39 UTC 2025","passed","Mon Feb 03 01:32:31 UTC 2025","","test_self_healing","",""
"Rotate password and confirm changes.","11154","test_password_rotation_silent","tests.integration","Mon Feb 03 01:38:30 UTC 2025","passed","Mon Feb 03 01:38:42 UTC 2025","","test_charm","",""
"Build the charm and deploy 3 units to ensure a cluster is formed.","131180","test_build_and_deploy","tests.integration.relations","Mon Feb 03 01:30:12 UTC 2025","passed","Mon Feb 03 01:32:23 UTC 2025","","test_database","",""
"Confirm storage reuse works.","80842","test_scale_up_after_scale_down","tests.integration","Mon Feb 03 01:34:25 UTC 2025","passed","Mon Feb 03 01:35:46 UTC 2025","","test_charm","",""
"Simple test to ensure that the mysql and application charms get deployed.","153298","test_deploy_latest","tests.integration.high_availability","Mon Feb 03 01:28:09 UTC 2025","passed","Mon Feb 03 01:30:43 UTC 2025","","test_upgrade","",""
"Simple test to ensure that the mysql charm gets deployed.","122101","test_build_and_deploy","tests.integration","Mon Feb 03 01:27:30 UTC 2025","passed","Mon Feb 03 01:29:32 UTC 2025","","test_backup_aws","",""
"","62973","test_deploy_and_relate_test_app","tests.integration","Mon Feb 03 01:27:51 UTC 2025","passed","Mon Feb 03 01:28:54 UTC 2025","","test_saturate_max_connections","",""
"Test the existence of databases and tables created by osm-pol's migrations.","34437","test_osm_pol_operations","tests.integration.relations","Mon Feb 03 01:33:17 UTC 2025","passed","Mon Feb 03 01:33:51 UTC 2025","","test_mysql_root","",""
"Test to kill the primary under load and ensure re-election of primary.","201311","test_kill_primary_check_reelection","tests.integration.high_availability","Mon Feb 03 01:32:28 UTC 2025","passed","Mon Feb 03 01:35:49 UTC 2025","","test_replication","",""
"Relate the two mysql clusters.","4964","test_async_relate","tests.integration.high_availability","Mon Feb 03 01:31:23 UTC 2025","passed","Mon Feb 03 01:31:28 UTC 2025","","test_async_replication","",""
"Scale database and routers.","230262","test_scale_in","tests.integration","Mon Feb 03 01:38:52 UTC 2025","passed","Mon Feb 03 01:42:42 UTC 2025","","test_multi_relations","",""
"Scale database and routers.","480481","test_scale_out","tests.integration","Mon Feb 03 01:30:51 UTC 2025","passed","Mon Feb 03 01:38:52 UTC 2025","","test_multi_relations","",""
"Test to restore a backup on a new mysql cluster.","274362","test_restore_on_new_cluster","tests.integration","Mon Feb 03 01:33:17 UTC 2025","passed","Mon Feb 03 01:37:52 UTC 2025","","test_backup_gcp","",""
"Tries deploying an amd64 charm on arm64 host.","0","test_amd_charm_on_arm_host","tests.integration","Mon Feb 03 01:29:19 UTC 2025","skipped","Mon Feb 03 01:29:19 UTC 2025","","test_architecture","",""
"","196253","test_fail_and_rollback","tests.integration.high_availability","Mon Feb 03 01:34:04 UTC 2025","passed","Mon Feb 03 01:37:20 UTC 2025","","test_upgrade","",""
"Run the create replication and wait for the applications to settle.","231385","test_create_replication","tests.integration.high_availability","Mon Feb 03 01:31:28 UTC 2025","passed","Mon Feb 03 01:35:19 UTC 2025","","test_async_replication","",""
"Test the labeling of k8s endpoints when apps with same cluster-name deployed.","429335","test_labeling_of_k8s_endpoints","tests.integration.high_availability","Mon Feb 03 01:28:13 UTC 2025","passed","Mon Feb 03 01:35:22 UTC 2025","","test_k8s_endpoints","",""
"Confirm that data is replicated from the primary node to all the replicas.","4334","test_consistent_data_replication_across_cluster","tests.integration","Mon Feb 03 01:29:49 UTC 2025","passed","Mon Feb 03 01:29:53 UTC 2025","","test_charm","",""
"Test that the pre-upgrade-check action runs successfully.","11154","test_pre_upgrade_check","tests.integration.high_availability","Mon Feb 03 01:29:52 UTC 2025","passed","Mon Feb 03 01:30:03 UTC 2025","","test_upgrade_rollback_incompat","",""
"Test to send a SIGKILL to the primary db process and ensure that the cluster self heals.","80112","test_kill_db_process","tests.integration.high_availability","Mon Feb 03 01:31:04 UTC 2025","passed","Mon Feb 03 01:32:24 UTC 2025","","test_self_healing","",""
"","163558","test_rollback","tests.integration.high_availability","Mon Feb 03 01:30:46 UTC 2025","passed","Mon Feb 03 01:33:29 UTC 2025","","test_upgrade_rollback_incompat","",""
"Rotate password and confirm changes.","11150","test_password_rotation","tests.integration","Mon Feb 03 01:38:19 UTC 2025","passed","Mon Feb 03 01:38:30 UTC 2025","","test_charm","",""
"Test that endpoints are running.","3968","test_exporter_endpoints","tests.integration","Mon Feb 03 01:38:56 UTC 2025","passed","Mon Feb 03 01:39:00 UTC 2025","","test_charm","",""
"Test the deployment and relation with osm bundle with mysql replacing mariadb.","195733","test_deploy_and_relate_osm_bundle","tests.integration.relations","Mon Feb 03 01:30:01 UTC 2025","passed","Mon Feb 03 01:33:17 UTC 2025","","test_mysql_root","",""
"Confirm that a new primary is elected when the current primary is torn down.","272311","test_scale_up_and_down","tests.integration","Mon Feb 03 01:29:53 UTC 2025","passed","Mon Feb 03 01:34:25 UTC 2025","","test_charm","",""
"Relate all the applications to the database.","160298","test_relate_all","tests.integration","Mon Feb 03 01:28:11 UTC 2025","passed","Mon Feb 03 01:30:51 UTC 2025","","test_multi_relations","",""
"Ensure scaling down to zero and back up works.","153157","test_scale_up_from_zero","tests.integration","Mon Feb 03 01:35:46 UTC 2025","passed","Mon Feb 03 01:38:19 UTC 2025","","test_charm","",""
"Test to write to primary, and read the same data back from replicas.","10166","test_check_consistency","tests.integration.high_availability","Mon Feb 03 01:30:30 UTC 2025","passed","Mon Feb 03 01:30:40 UTC 2025","","test_replication","",""
"","30241","test_disable_tls","tests.integration","Mon Feb 03 01:34:39 UTC 2025","passed","Mon Feb 03 01:35:09 UTC 2025","","test_tls","",""
"Simple test to ensure that the mysql charm gets deployed.","118274","test_build_and_deploy","tests.integration","Mon Feb 03 01:27:31 UTC 2025","passed","Mon Feb 03 01:29:29 UTC 2025","","test_backup_gcp","",""
"Test to restore a backup on a new mysql cluster.","282806","test_restore_on_new_cluster","tests.integration","Mon Feb 03 01:33:45 UTC 2025","passed","Mon Feb 03 01:38:28 UTC 2025","","test_backup_ceph","",""
"Test to restore a backup on a new mysql cluster.","301898","test_restore_on_new_cluster","tests.integration","Mon Feb 03 01:33:18 UTC 2025","passed","Mon Feb 03 01:38:20 UTC 2025","","test_backup_aws","",""
"Build the charm and deploy 3 units to ensure a cluster is formed.","130246","test_build_and_deploy","tests.integration","Mon Feb 03 01:30:41 UTC 2025","passed","Mon Feb 03 01:32:51 UTC 2025","","test_tls","",""
"Deploy the router and the test application.","78659","test_deploy_router_and_app","tests.integration.high_availability","Mon Feb 03 01:35:19 UTC 2025","passed","Mon Feb 03 01:36:38 UTC 2025","","test_async_replication","",""
"Verify rotating tls private keys restarts cluster with new certificates.

    This test rotates tls private keys to randomly generated keys.
    ","41970","test_rotate_tls_key","tests.integration","Mon Feb 03 01:33:57 UTC 2025","passed","Mon Feb 03 01:34:39 UTC 2025","","test_tls","",""
"Test to send SIGTERM to all units and then ensure that the cluster recovers.","374493","test_graceful_full_cluster_crash_test","tests.integration.high_availability","Mon Feb 03 01:32:26 UTC 2025","passed","Mon Feb 03 01:38:41 UTC 2025","","test_self_healing","",""
"Test that the pre-upgrade-check action runs successfully.","17638","test_pre_upgrade_check","tests.integration.high_availability","Mon Feb 03 01:30:43 UTC 2025","passed","Mon Feb 03 01:31:00 UTC 2025","","test_upgrade","",""
"Test to ensure that writes to one cluster do not replicate to another cluster.","96022","test_no_replication_across_clusters","tests.integration.high_availability","Mon Feb 03 01:31:38 UTC 2025","passed","Mon Feb 03 01:33:14 UTC 2025","","test_replication","",""
"Test updating from stable channel.","195787","test_upgrade_from_stable","tests.integration.high_availability","Mon Feb 03 01:30:36 UTC 2025","passed","Mon Feb 03 01:33:51 UTC 2025","","test_upgrade_from_stable","",""
"Tries deploying an arm64 charm on amd64 host.","57564","test_arm_charm_on_amd_host","tests.integration","Mon Feb 03 01:28:21 UTC 2025","passed","Mon Feb 03 01:29:19 UTC 2025","","test_architecture","",""
"Test COS integrations formed before mysql is allocated and deployed.","94971","test_deploy_bundle_with_cos_integrations","tests.integration","Mon Feb 03 01:28:41 UTC 2025","passed","Mon Feb 03 01:30:16 UTC 2025","","test_cos_integration_bundle","",""
"Query database for custom variables.","27101","test_custom_variables","tests.integration","Mon Feb 03 01:39:00 UTC 2025","passed","Mon Feb 03 01:39:27 UTC 2025","","test_charm","",""
"Test that the pre-upgrade-check action runs successfully.","15557","test_pre_upgrade_check","tests.integration.high_availability","Mon Feb 03 01:30:18 UTC 2025","passed","Mon Feb 03 01:30:34 UTC 2025","","test_upgrade_from_stable","",""
"Simple test to ensure that the mysql and application charms get deployed.","175758","test_deploy_stable","tests.integration.high_availability","Mon Feb 03 01:27:22 UTC 2025","passed","Mon Feb 03 01:30:18 UTC 2025","","test_upgrade_from_stable","",""
"","42308","test_upgrade_to_failling","tests.integration.high_availability","Mon Feb 03 01:30:03 UTC 2025","passed","Mon Feb 03 01:30:46 UTC 2025","","test_upgrade_rollback_incompat","",""
"Relate charms and wait for the expected changes in status.","33600","test_relation_creation","tests.integration.relations","Mon Feb 03 01:32:23 UTC 2025","passed","Mon Feb 03 01:32:57 UTC 2025","","test_database","",""
"","172584","test_upgrade_from_edge","tests.integration.high_availability","Mon Feb 03 01:31:05 UTC 2025","passed","Mon Feb 03 01:33:58 UTC 2025","","test_upgrade","",""
"Build the mysql charm and deploy it.","152136","test_build_and_deploy","tests.integration","Mon Feb 03 01:27:16 UTC 2025","passed","Mon Feb 03 01:29:49 UTC 2025","","test_charm","",""
"Test to restore a backup to the same mysql cluster.","158840","test_restore_on_same_cluster","tests.integration","Mon Feb 03 01:31:06 UTC 2025","passed","Mon Feb 03 01:33:45 UTC 2025","","test_backup_ceph","",""
"The cluster manual re-join test.

    A graceful restart is performed in one of the instances (choosing Primary to make it painful).
    In order to verify that the instance can come back ONLINE, after disabling automatic re-join
    ","89881","test_cluster_manual_rejoin","tests.integration.high_availability","Mon Feb 03 01:31:31 UTC 2025","passed","Mon Feb 03 01:33:00 UTC 2025","","test_self_healing","",""
"Test to ensure that data is preserved when a unit is scaled up and then down.

    Ensures that there are no running continuous writes as the extra data in the
    database makes scaling up slower.
    ","242231","test_scaling_without_data_loss","tests.integration.high_availability","Mon Feb 03 01:30:21 UTC 2025","passed","Mon Feb 03 01:34:24 UTC 2025","","test_replication","",""
"Build the charm and deploy 1 units to ensure a cluster is formed.","30691","test_build_and_deploy","tests.integration","Mon Feb 03 01:27:40 UTC 2025","passed","Mon Feb 03 01:28:11 UTC 2025","","test_multi_relations","",""
"Test to restore a backup to the same mysql cluster.","164372","test_restore_on_same_cluster","tests.integration","Mon Feb 03 01:30:34 UTC 2025","passed","Mon Feb 03 01:33:18 UTC 2025","","test_backup_aws","",""
"Delete the pod in a single unit deployment and write data to new pod.","271116","test_single_unit_pod_delete","tests.integration.high_availability","Mon Feb 03 01:30:33 UTC 2025","passed","Mon Feb 03 01:35:04 UTC 2025","","test_self_healing","",""
"Simple test to ensure that the mysql charm gets deployed.","118834","test_build_and_deploy","tests.integration","Mon Feb 03 01:28:18 UTC 2025","passed","Mon Feb 03 01:30:16 UTC 2025","","test_backup_ceph","",""
"Test the log rotation of text files.

    Run continuous writes to ensure that audit log plugin is loaded and active
    when mysql-test-app runs start-continuous-writes (by logging into mysql).
    ","8113","test_log_rotation","tests.integration.high_availability","Mon Feb 03 01:31:21 UTC 2025","passed","Mon Feb 03 01:31:29 UTC 2025","","test_log_rotation","",""
"Build the charm and deploy 1 units to ensure a cluster is formed.","6308","test_build_and_deploy","tests.integration","Mon Feb 03 01:27:44 UTC 2025","passed","Mon Feb 03 01:27:51 UTC 2025","","test_saturate_max_connections","",""
"Test to create a backup and list backups.","57751","test_backup","tests.integration","Mon Feb 03 01:29:34 UTC 2025","passed","Mon Feb 03 01:30:31 UTC 2025","","test_backup_aws","",""
"Simple test to ensure that the mysql and application charms get deployed.","172417","test_build_and_deploy","tests.integration.high_availability","Mon Feb 03 01:28:30 UTC 2025","passed","Mon Feb 03 01:31:23 UTC 2025","","test_async_replication","",""
"Test primary crash during startup.

    It must recover/end setup when the primary got offline.
    ","174903","test_crash_during_cluster_setup","tests.integration.high_availability","Mon Feb 03 01:28:24 UTC 2025","passed","Mon Feb 03 01:31:19 UTC 2025","","test_crash_during_setup","",""
"Test to create a backup and list backups.","45860","test_backup","tests.integration","Mon Feb 03 01:30:19 UTC 2025","passed","Mon Feb 03 01:31:04 UTC 2025","","test_backup_ceph","",""
"Test to restore a backup to the same mysql cluster.","175512","test_restore_on_same_cluster","tests.integration","Mon Feb 03 01:30:22 UTC 2025","passed","Mon Feb 03 01:33:17 UTC 2025","","test_backup_gcp","",""
"Test behavior when node drains - pod is evicted and pvs are rotated.","128623","test_pod_eviction_and_pvc_deletion","tests.integration.high_availability","Mon Feb 03 01:31:24 UTC 2025","passed","Mon Feb 03 01:33:32 UTC 2025","","test_node_drain","",""
"Relate charms and wait for the expected changes in status.","0","test_relation_creation_databag","tests.integration.relations","Mon Feb 03 01:32:23 UTC 2025","skipped","Mon Feb 03 01:32:23 UTC 2025","","test_database","",""
