"DESCRIPTION","DURATION IN MS","NAME","PARENT SUITE","START TIME","STATUS","STOP TIME","SUB SUITE","SUITE","TEST CLASS","TEST METHOD"
"Deploy the router and the test application.","77558","test_deploy_router_and_app","tests.integration.high_availability","Thu Aug 21 02:00:45 UTC 2025","passed","Thu Aug 21 02:02:02 UTC 2025","","test_async_replication","",""
"Tries deploying an amd64 charm on arm64 host.","0","test_amd_charm_on_arm_host","tests.integration","Thu Aug 21 01:59:22 UTC 2025","skipped","Thu Aug 21 01:59:22 UTC 2025","","test_architecture","",""
"","57993","test_deploy_and_relate_test_app","tests.integration","Thu Aug 21 01:58:31 UTC 2025","passed","Thu Aug 21 01:59:29 UTC 2025","","test_saturate_max_connections","",""
"","4749","test_saturate_max_connections","tests.integration","Thu Aug 21 01:59:29 UTC 2025","passed","Thu Aug 21 01:59:34 UTC 2025","","test_saturate_max_connections","",""
"Relate charms before they have time to properly start.

    It simulates a Terraform-like deployment strategy
    ","161495","test_relation_creation_eager","tests.integration.relations","Thu Aug 21 01:58:02 UTC 2025","passed","Thu Aug 21 02:00:43 UTC 2025","","test_database","",""
"Test to send SIGTERM to primary instance and then verify recovery.","136372","test_graceful_crash_of_primary","tests.integration.high_availability","Thu Aug 21 02:01:21 UTC 2025","passed","Thu Aug 21 02:03:38 UTC 2025","","test_self_healing_stop_primary","",""
"Test COS integrations formed before mysql is allocated and deployed.","88086","test_deploy_bundle_with_cos_integrations","tests.integration","Thu Aug 21 01:58:24 UTC 2025","passed","Thu Aug 21 01:59:52 UTC 2025","","test_cos_integration_bundle","",""
"Relate the two mysql clusters.","4426","test_async_relate","tests.integration.high_availability","Thu Aug 21 02:00:40 UTC 2025","passed","Thu Aug 21 02:00:45 UTC 2025","","test_async_replication","",""
"Test to kill the primary under load and ensure re-election of primary.","225879","test_kill_primary_check_reelection","tests.integration.high_availability","Thu Aug 21 02:01:21 UTC 2025","passed","Thu Aug 21 02:05:07 UTC 2025","","test_replication_reelection","",""
"Test that the pre-upgrade-check action runs successfully.","21608","test_pre_upgrade_check","tests.integration.high_availability","Thu Aug 21 02:01:17 UTC 2025","passed","Thu Aug 21 02:01:39 UTC 2025","","test_upgrade_from_stable","",""
"Test to restore a backup on a new mysql cluster.","512745","test_restore_on_new_cluster","tests.integration","Thu Aug 21 02:03:45 UTC 2025","passed","Thu Aug 21 02:12:18 UTC 2025","","test_backup_gcp","",""
"Test for encryption enablement when relation to TLS charm.","","test_enable_tls","tests.integration","","unknown","","","test_tls","",""
"Rotate password and confirm changes.","11170","test_password_rotation_silent","tests.integration","Thu Aug 21 02:08:30 UTC 2025","passed","Thu Aug 21 02:08:41 UTC 2025","","test_charm","",""
"Relate all the applications to the database.","145286","test_relate_all","tests.integration","Thu Aug 21 01:58:33 UTC 2025","passed","Thu Aug 21 02:00:59 UTC 2025","","test_multi_relations","",""
"Simple test to ensure that the mysql and application charms get deployed.","180774","test_deploy_latest","tests.integration.high_availability","Thu Aug 21 01:58:17 UTC 2025","passed","Thu Aug 21 02:01:17 UTC 2025","","test_upgrade","",""
"Build the charm and deploy 1 units to ensure a cluster is formed.","29462","test_build_and_deploy","tests.integration","Thu Aug 21 01:58:04 UTC 2025","passed","Thu Aug 21 01:58:33 UTC 2025","","test_multi_relations","",""
"Test to ensure that writes to one cluster do not replicate to another cluster.","76330","test_no_replication_across_clusters","tests.integration.high_availability","Thu Aug 21 02:01:21 UTC 2025","passed","Thu Aug 21 02:02:37 UTC 2025","","test_replication_data_isolation","",""
"Build and deploy for AWS.","232631","test_build_and_deploy_aws","tests.integration","Thu Aug 21 01:57:58 UTC 2025","passed","Thu Aug 21 02:01:50 UTC 2025","","test_backup_pitr_aws","",""
"Simple test to ensure that the mysql charm gets deployed.","111237","test_build_and_deploy","tests.integration","Thu Aug 21 01:59:10 UTC 2025","passed","Thu Aug 21 02:01:01 UTC 2025","","test_backup_ceph","",""
"","","test_disable_tls","tests.integration","","unknown","","","test_tls","",""
"","313500","test_rollback","tests.integration.high_availability","Thu Aug 21 02:00:52 UTC 2025","passed","Thu Aug 21 02:06:06 UTC 2025","","test_upgrade_rollback_incompat","",""
"Rotate password and confirm changes.","13172","test_password_rotation_root_user_implicit","tests.integration","Thu Aug 21 02:08:41 UTC 2025","passed","Thu Aug 21 02:08:54 UTC 2025","","test_charm","",""
"Test to restore a backup to the same mysql cluster.","176136","test_restore_on_same_cluster","tests.integration","Thu Aug 21 02:00:49 UTC 2025","passed","Thu Aug 21 02:03:45 UTC 2025","","test_backup_gcp","",""
"Test graceful promotion of a standby cluster to primary.","53800","test_standby_promotion","tests.integration.high_availability","Thu Aug 21 02:04:49 UTC 2025","passed","Thu Aug 21 02:05:43 UTC 2025","","test_async_replication","",""
"Test to create a backup and list backups.","50823","test_backup","tests.integration","Thu Aug 21 01:59:56 UTC 2025","passed","Thu Aug 21 02:00:47 UTC 2025","","test_backup_gcp","",""
"Test to restore a backup to the same mysql cluster.","166214","test_restore_on_same_cluster","tests.integration","Thu Aug 21 02:01:48 UTC 2025","passed","Thu Aug 21 02:04:34 UTC 2025","","test_backup_ceph","",""
"Verify rotating tls private keys restarts cluster with new certificates.

    This test rotates tls private keys to randomly generated keys.
    ","","test_rotate_tls_key","tests.integration","","unknown","","","test_tls","",""
"Simple test to ensure that the mysql and application charms get deployed.","181750","test_build_and_deploy","tests.integration.high_availability","Thu Aug 21 01:57:38 UTC 2025","passed","Thu Aug 21 02:00:40 UTC 2025","","test_async_replication","",""
"Build the mysql charm and deploy it.","127776","test_build_and_deploy","tests.integration","Thu Aug 21 01:57:40 UTC 2025","passed","Thu Aug 21 01:59:47 UTC 2025","","test_charm","",""
"Scale database and routers.","460295","test_scale_out","tests.integration","Thu Aug 21 02:00:59 UTC 2025","passed","Thu Aug 21 02:08:39 UTC 2025","","test_multi_relations","",""
"Test for a network cut affecting an instance.","235937","test_network_cut_affecting_an_instance","tests.integration.high_availability","Thu Aug 21 02:01:44 UTC 2025","passed","Thu Aug 21 02:05:40 UTC 2025","","test_self_healing_network_cut","",""
"Test behavior when node drains - pod is evicted and pvs are rotated.","167870","test_pod_eviction_and_pvc_deletion","tests.integration.high_availability","Thu Aug 21 02:01:21 UTC 2025","passed","Thu Aug 21 02:04:09 UTC 2025","","test_node_drain","",""
"Remove relation and wait for the expected changes in status.","24833","test_relation_broken","tests.integration.relations","Thu Aug 21 02:00:59 UTC 2025","passed","Thu Aug 21 02:01:24 UTC 2025","","test_database","",""
"Scale database and routers.","220194","test_scale_in","tests.integration","Thu Aug 21 02:08:39 UTC 2025","passed","Thu Aug 21 02:12:19 UTC 2025","","test_multi_relations","",""
"Build the charm and deploy 1 units to ensure a cluster is formed.","6153","test_build_and_deploy","tests.integration","Thu Aug 21 01:58:25 UTC 2025","passed","Thu Aug 21 01:58:31 UTC 2025","","test_saturate_max_connections","",""
"Confirm that a new primary is elected when the current primary is torn down.","266712","test_scale_up_and_down","tests.integration","Thu Aug 21 01:59:52 UTC 2025","passed","Thu Aug 21 02:04:18 UTC 2025","","test_charm","",""
"Test to send a SIGKILL to the primary db process and ensure that the cluster self heals.","","test_kill_db_process","tests.integration.high_availability","","unknown","","","test_self_healing_process_killed","",""
"","260781","test_fail_and_rollback","tests.integration.high_availability","Thu Aug 21 02:05:18 UTC 2025","passed","Thu Aug 21 02:09:39 UTC 2025","","test_upgrade","",""
"Test that the pre-upgrade-check action runs successfully.","16521","test_pre_upgrade_check","tests.integration.high_availability","Thu Aug 21 02:01:17 UTC 2025","passed","Thu Aug 21 02:01:34 UTC 2025","","test_upgrade","",""
"Test to create a backup and list backups.","41787","test_backup","tests.integration","Thu Aug 21 01:59:59 UTC 2025","passed","Thu Aug 21 02:00:41 UTC 2025","","test_backup_aws","",""
"The cluster manual re-join test.

    A graceful restart is performed in one of the instances (choosing Primary to make it painful).
    In order to verify that the instance can come back ONLINE, after disabling automatic re-join
    ","72738","test_cluster_manual_rejoin","tests.integration.high_availability","Thu Aug 21 02:01:21 UTC 2025","passed","Thu Aug 21 02:02:34 UTC 2025","","test_self_healing_restart_graceful","",""
"Test to write to primary, and read the same data back from replicas.","8378","test_data_replication","tests.integration.high_availability","Thu Aug 21 02:04:38 UTC 2025","passed","Thu Aug 21 02:04:46 UTC 2025","","test_async_replication","",""
"Query database for custom variables.","24980","test_custom_variables","tests.integration","Thu Aug 21 02:08:58 UTC 2025","passed","Thu Aug 21 02:09:23 UTC 2025","","test_charm","",""
"Test to restore a backup on a new mysql cluster.","549215","test_restore_on_new_cluster","tests.integration","Thu Aug 21 02:03:26 UTC 2025","passed","Thu Aug 21 02:12:36 UTC 2025","","test_backup_aws","",""
"Test the labeling of k8s endpoints when apps with same cluster-name deployed.","393086","test_labeling_of_k8s_endpoints","tests.integration.high_availability","Thu Aug 21 01:57:58 UTC 2025","passed","Thu Aug 21 02:04:31 UTC 2025","","test_k8s_endpoints","",""
"Test that endpoints are running.","3962","test_exporter_endpoints","tests.integration","Thu Aug 21 02:08:54 UTC 2025","passed","Thu Aug 21 02:08:58 UTC 2025","","test_charm","",""
"Build the charm and deploy 3 units to ensure a cluster is formed.","7400","test_build_and_deploy","tests.integration.relations","Thu Aug 21 01:58:17 UTC 2025","passed","Thu Aug 21 01:58:24 UTC 2025","","test_mysql_root","",""
"Confirm that data is replicated from the primary node to all the replicas.","4253","test_consistent_data_replication_across_cluster","tests.integration","Thu Aug 21 01:59:47 UTC 2025","passed","Thu Aug 21 01:59:52 UTC 2025","","test_charm","",""
"Confirm storage reuse works.","80477","test_scale_up_after_scale_down","tests.integration","Thu Aug 21 02:04:18 UTC 2025","passed","Thu Aug 21 02:05:39 UTC 2025","","test_charm","",""
"Relate charms before they have time to properly start.

    It simulates a Terraform-like deployment strategy
    ","144245","test_relation_creation_eager","tests.integration.relations","Thu Aug 21 01:58:24 UTC 2025","passed","Thu Aug 21 02:00:49 UTC 2025","","test_mysql_root","",""
"Relate charms and wait for the expected changes in status.","16030","test_relation_creation","tests.integration.relations","Thu Aug 21 02:00:43 UTC 2025","passed","Thu Aug 21 02:00:59 UTC 2025","","test_database","",""
"Simple test to ensure that the mysql charm gets deployed.","117396","test_build_and_deploy","tests.integration","Thu Aug 21 01:57:57 UTC 2025","passed","Thu Aug 21 01:59:54 UTC 2025","","test_backup_gcp","",""
"Test to restore a backup on a new mysql cluster.","464378","test_restore_on_new_cluster","tests.integration","Thu Aug 21 02:04:34 UTC 2025","passed","Thu Aug 21 02:12:19 UTC 2025","","test_backup_ceph","",""
"Test to create a backup and list backups.","42666","test_backup","tests.integration","Thu Aug 21 02:01:03 UTC 2025","passed","Thu Aug 21 02:01:46 UTC 2025","","test_backup_ceph","",""
"Build the charm and deploy 3 units to ensure a cluster is formed.","6801","test_build_and_deploy","tests.integration.relations","Thu Aug 21 01:57:55 UTC 2025","passed","Thu Aug 21 01:58:02 UTC 2025","","test_database","",""
"Simple test to ensure that the mysql charm gets deployed.","119560","test_build_and_deploy","tests.integration","Thu Aug 21 01:57:57 UTC 2025","passed","Thu Aug 21 01:59:57 UTC 2025","","test_backup_aws","",""
"Test updating from stable channel.","199151","test_upgrade_from_stable","tests.integration.high_availability","Thu Aug 21 02:01:41 UTC 2025","passed","Thu Aug 21 02:05:00 UTC 2025","","test_upgrade_from_stable","",""
"Pitr tests.","281635","test_pitr_aws","tests.integration","Thu Aug 21 02:01:50 UTC 2025","passed","Thu Aug 21 02:06:32 UTC 2025","","test_backup_pitr_aws","",""
"Test to send SIGTERM to all units and then ensure that the cluster recovers.","296956","test_graceful_full_cluster_crash_test","tests.integration.high_availability","Thu Aug 21 02:01:21 UTC 2025","passed","Thu Aug 21 02:06:18 UTC 2025","","test_self_healing_stop_all","",""
"Tries deploying an arm64 charm on amd64 host.","59006","test_arm_charm_on_amd_host","tests.integration","Thu Aug 21 01:58:23 UTC 2025","passed","Thu Aug 21 01:59:22 UTC 2025","","test_architecture","",""
"Test switchover on primary cluster fail.","293623","test_failover","tests.integration.high_availability","Thu Aug 21 02:05:44 UTC 2025","passed","Thu Aug 21 02:10:38 UTC 2025","","test_async_replication","",""
"Test to ensure that data is preserved when a unit is scaled up and then down.

    Ensures that there are no running continuous writes as the extra data in the
    database makes scaling up slower.
    ","","test_scaling_without_data_loss","tests.integration.high_availability","","unknown","","","test_replication_scaling","",""
"Test the log rotation of text files.

    Run continuous writes to ensure that audit log plugin is loaded and active
    when mysql-test-app runs start-continuous-writes (by logging into mysql).
    ","6307","test_log_rotation","tests.integration.high_availability","Thu Aug 21 02:01:22 UTC 2025","passed","Thu Aug 21 02:01:28 UTC 2025","","test_log_rotation","",""
"Build and deploy for AWS.","","test_build_and_deploy_gcp","tests.integration","","unknown","","","test_backup_pitr_gcp","",""
"","201645","test_upgrade_from_edge","tests.integration.high_availability","Thu Aug 21 02:01:38 UTC 2025","passed","Thu Aug 21 02:05:00 UTC 2025","","test_upgrade","",""
"Test the deployment and relation with osm bundle with mysql replacing mariadb.","157770","test_deploy_and_relate_osm_bundle","tests.integration","Thu Aug 21 01:57:39 UTC 2025","passed","Thu Aug 21 02:00:16 UTC 2025","","test_osm_integration_bundle","",""
"Build the charm and deploy 3 units to ensure a cluster is formed.","","test_build_and_deploy","tests.integration","","unknown","","","test_tls","",""
"Ensure scaling down to zero and back up works.","159810","test_scale_up_from_zero","tests.integration","Thu Aug 21 02:05:39 UTC 2025","passed","Thu Aug 21 02:08:19 UTC 2025","","test_charm","",""
"Relate charms and wait for the expected changes in status.","0","test_relation_creation_databag","tests.integration.relations","Thu Aug 21 02:00:43 UTC 2025","skipped","Thu Aug 21 02:00:43 UTC 2025","","test_database","",""
"","54175","test_upgrade_to_failling","tests.integration.high_availability","Thu Aug 21 01:59:58 UTC 2025","passed","Thu Aug 21 02:00:52 UTC 2025","","test_upgrade_rollback_incompat","",""
"Test rejoin invalidated cluster with.","21148","test_rejoin_invalidated_cluster","tests.integration.high_availability","Thu Aug 21 02:10:42 UTC 2025","passed","Thu Aug 21 02:11:03 UTC 2025","","test_async_replication","",""
"Test primary crash during startup.

    It must recover/end setup when the primary got offline.
    ","162908","test_crash_during_cluster_setup","tests.integration.high_availability","Thu Aug 21 01:58:04 UTC 2025","passed","Thu Aug 21 02:00:47 UTC 2025","","test_crash_during_setup","",""
"Test to write to primary, and read the same data back from replicas.","26752","test_check_consistency","tests.integration.high_availability","Thu Aug 21 02:01:46 UTC 2025","passed","Thu Aug 21 02:02:13 UTC 2025","","test_replication_data_consistency","",""
"Ensure connections (with and without ssl) are possible before relating with TLS operator.","","test_connection_before_tls","tests.integration","","unknown","","","test_tls","",""
"Test to restore a backup to the same mysql cluster.","163724","test_restore_on_same_cluster","tests.integration","Thu Aug 21 02:00:43 UTC 2025","passed","Thu Aug 21 02:03:26 UTC 2025","","test_backup_aws","",""
"Delete the pod in a single unit deployment and write data to new pod.","231021","test_single_unit_pod_delete","tests.integration.high_availability","Thu Aug 21 02:02:00 UTC 2025","passed","Thu Aug 21 02:05:51 UTC 2025","","test_self_healing_pod","",""
"Simple test to ensure that the mysql and application charms get deployed.","193064","test_deploy_stable","tests.integration.high_availability","Thu Aug 21 01:58:04 UTC 2025","passed","Thu Aug 21 02:01:17 UTC 2025","","test_upgrade_from_stable","",""
"Run the create replication and wait for the applications to settle.","153613","test_create_replication","tests.integration.high_availability","Thu Aug 21 02:02:02 UTC 2025","passed","Thu Aug 21 02:04:36 UTC 2025","","test_async_replication","",""
"Rotate password and confirm changes.","11185","test_password_rotation","tests.integration","Thu Aug 21 02:08:19 UTC 2025","passed","Thu Aug 21 02:08:30 UTC 2025","","test_charm","",""
"Test the existence of databases and tables created by osm-pol's migrations.","34265","test_osm_pol_operations","tests.integration","Thu Aug 21 02:00:16 UTC 2025","passed","Thu Aug 21 02:00:51 UTC 2025","","test_osm_integration_bundle","",""
"Test removing and re-relating the two mysql clusters.","292239","test_remove_relation_and_relate","tests.integration.high_availability","Thu Aug 21 02:11:06 UTC 2025","passed","Thu Aug 21 02:15:58 UTC 2025","","test_async_replication","",""
"Simple test to ensure that the mysql and application charms get deployed.","126543","test_build_and_deploy","tests.integration.high_availability","Thu Aug 21 01:57:46 UTC 2025","passed","Thu Aug 21 01:59:53 UTC 2025","","test_upgrade_rollback_incompat","",""
"Test to send a SIGSTOP to the primary db process and ensure that the cluster self heals.","438130","test_freeze_db_process","tests.integration.high_availability","Thu Aug 21 02:01:23 UTC 2025","passed","Thu Aug 21 02:08:41 UTC 2025","","test_self_healing_process_frozen","",""
"Pitr tests.","","test_pitr_aws","tests.integration","","unknown","","","test_backup_pitr_gcp","",""
"Test that the pre-upgrade-check action runs successfully.","5113","test_pre_upgrade_check","tests.integration.high_availability","Thu Aug 21 01:59:53 UTC 2025","passed","Thu Aug 21 01:59:58 UTC 2025","","test_upgrade_rollback_incompat","",""
