"DESCRIPTION","DURATION IN MS","NAME","PARENT SUITE","START TIME","STATUS","STOP TIME","SUB SUITE","SUITE","TEST CLASS","TEST METHOD"
"Simple test to ensure that the MySQL and application charms get deployed.","143884","test_deploy_highly_available_cluster","tests.integration.high_availability","2025-11-07","passed","2025-11-07","","test_self_healing_restart_graceful","",""
"Simple test to ensure that the MySQL and application charms get deployed.","137193","test_deploy_highly_available_cluster","tests.integration.high_availability","2025-11-07","passed","2025-11-07","","test_self_healing_stop_all","",""
"Test to restore a backup on a new mysql cluster.","542410","test_restore_on_new_cluster","tests.integration","2025-11-07","passed","2025-11-07","","test_backup_gcp","",""
"Query database for custom variables.","24832","test_custom_variables","tests.integration","2025-11-07","passed","2025-11-07","","test_charm","",""
"Test the database-level DBA role.","60225","test_charmed_dba_role","tests.integration.roles","2025-11-07","passed","2025-11-07","","test_database_dba_role","",""
"Simple test to ensure that the MySQL and application charms get deployed.","125864","test_deploy_highly_available_cluster","tests.integration.high_availability","2025-11-07","passed","2025-11-07","","test_replication_reelection","",""
"Simple test to ensure that the mysql charm gets deployed.","185473","test_build_and_deploy","tests.integration","2025-11-07","passed","2025-11-07","","test_backup_gcp","",""
"Rotate password and confirm changes.","11169","test_password_rotation","tests.integration","2025-11-07","passed","2025-11-07","","test_charm","",""
"Confirm that a new primary is elected when the current primary is tear down.","373004","test_kill_primary_check_reelection","tests.integration.high_availability","2025-11-07","passed","2025-11-07","","test_replication_reelection","",""
"Run the create-replication action and wait for the applications to settle.","131200","test_create_replication","tests.integration.high_availability","2025-11-07","passed","2025-11-07","","test_async_replication_upgrade","",""
"Test to send SIGTERM to primary instance and then verify recovery.","163189","test_graceful_crash_of_primary","tests.integration.high_availability","2025-11-07","passed","2025-11-07","","test_self_healing_stop_primary","",""
"Simple test to ensure that the MySQL and application charms get deployed.","147878","test_deploy_highly_available_cluster","tests.integration.high_availability","2025-11-07","passed","2025-11-07","","test_self_healing_node_drain","",""
"Test to create a backup and list backups.","72273","test_backup","tests.integration","2025-11-07","passed","2025-11-07","","test_backup_ceph","",""
"Test an upgrade failure and its rollback.","428538","test_fail_and_rollback","tests.integration.high_availability","2025-11-07","passed","2025-11-07","","test_upgrade","",""
"Build the charm and deploy 3 units to ensure a cluster is formed.","5399","test_build_and_deploy","tests.integration.relations","2025-11-07","passed","2025-11-07","","test_mysql_root","",""
"Test that the primary node can be switched over.","11577","test_cluster_switchover","tests.integration.high_availability","2025-11-07","passed","2025-11-07","","test_primary_switchover","",""
"Test to write to primary, and read the same data back from replicas.","21104","test_data_replication","tests.integration.high_availability","2025-11-07","passed","2025-11-07","","test_async_replication_upgrade","",""
"Test switchover on primary cluster fail.","296317","test_failover","tests.integration.high_availability","2025-11-07","passed","2025-11-07","","test_async_replication","",""
"Build the charm and deploy 3 units to ensure a cluster is formed.","142709","test_build_and_deploy","tests.integration","2025-11-07","passed","2025-11-07","","test_tls","",""
"Simple test to ensure that the mysql and data-integrator charms get deployed.","151169","test_build_and_deploy","tests.integration.roles","2025-11-07","passed","2025-11-07","","test_instance_roles","",""
"Test that the pre-upgrade-check action runs successfully.","18047","test_pre_upgrade_check","tests.integration.high_availability","2025-11-07","passed","2025-11-07","","test_upgrade","",""
"Upgrade the two MySQL clusters.","699800","test_upgrade_from_edge","tests.integration.high_availability","2025-11-07","passed","2025-11-07","","test_async_replication_upgrade","",""
"Simple test to ensure that the MySQL and application charms get deployed.","152974","test_deploy_stable","tests.integration.high_availability","2025-11-07","passed","2025-11-07","","test_upgrade_from_stable","",""
"Test the DBA predefined role.","30693","test_charmed_dba_role","tests.integration.roles","2025-11-07","passed","2025-11-07","","test_instance_dba_role","",""
"Test for encryption enablement when relation to TLS charm.","62298","test_enable_tls","tests.integration","2025-11-07","passed","2025-11-07","","test_tls","",""
"Test the promote-to-primary command after losing the majority of nodes, with force flag.","258712","test_cluster_failover_after_majority_loss","tests.integration.high_availability","2025-11-07","passed","2025-11-07","","test_primary_switchover","",""
"Relate all the applications to the database.","225371","test_relate_all","tests.integration","2025-11-07","passed","2025-11-07","","test_multi_relations","",""
"Simple test to ensure that the mysql charm gets deployed.","217557","test_build_and_deploy","tests.integration","2025-11-07","passed","2025-11-07","","test_backup_aws","",""
"Test for a network cut affecting an instance.","147940","test_network_cut_affecting_an_instance","tests.integration.high_availability","2025-11-07","passed","2025-11-07","","test_self_healing_network_cut","",""
"Simple test to ensure that the MySQL and application charms get deployed.","127242","test_deploy_highly_available_cluster","tests.integration.high_availability","2025-11-07","passed","2025-11-07","","test_replication_scaling","",""
"Relate the two MySQL clusters.","43464","test_async_relate","tests.integration.high_availability","2025-11-07","passed","2025-11-07","","test_async_replication","",""
"Simple test to ensure that the mysql and data-integrator charms get deployed.","157548","test_build_and_deploy","tests.integration.roles","2025-11-07","passed","2025-11-07","","test_database_dba_role","",""
"Test for cluster data isolation.

    This test creates a new cluster, create a new table on both cluster, write a single record with
    the application name for each cluster, retrieve and compare these records, asserting they are
    not the same.
    ","85815","test_cluster_data_isolation","tests.integration.high_availability","2025-11-07","passed","2025-11-07","","test_replication_data_isolation","",""
"Simple test to ensure that the MySQL and application charms get deployed.","129629","test_deploy_highly_available_cluster","tests.integration.high_availability","2025-11-07","passed","2025-11-07","","test_replication_data_isolation","",""
"Simple test to ensure that the MySQL and application charms get deployed.","126929","test_build_and_deploy","tests.integration.high_availability","2025-11-07","passed","2025-11-07","","test_upgrade_rollback_incompat","",""
"Simple test to ensure that the MySQL application charms get deployed.","168286","test_build_and_deploy","tests.integration.high_availability","2025-11-07","passed","2025-11-07","","test_async_replication","",""
"Build the charm and deploy 1 units to ensure a cluster is formed.","6641","test_build_and_deploy","tests.integration","2025-11-07","passed","2025-11-07","","test_saturate_max_connections","",""
"Test to restore a backup on a new mysql cluster.","517822","test_restore_on_new_cluster","tests.integration","2025-11-07","passed","2025-11-07","","test_backup_ceph","",""
"Test rejoin invalidated cluster with.","30969","test_rejoin_invalidated_cluster","tests.integration.high_availability","2025-11-07","passed","2025-11-07","","test_async_replication","",""
"Build and deploy for AWS.","211357","test_build_and_deploy_gcp","tests.integration","2025-11-07","passed","2025-11-07","","test_backup_pitr_gcp","",""
"Pitr tests.","254670","test_pitr_aws","tests.integration","2025-11-07","passed","2025-11-07","","test_backup_pitr_aws","",""
"Deploy the test application.","30673","test_deploy_test_app","tests.integration.high_availability","2025-11-07","passed","2025-11-07","","test_async_replication_upgrade","",""
"Simple test to ensure that the MySQL and application charms get deployed.","150077","test_deploy_latest","tests.integration.high_availability","2025-11-07","passed","2025-11-07","","test_upgrade","",""
"Build and deploy for AWS.","209505","test_build_and_deploy_aws","tests.integration","2025-11-07","passed","2025-11-07","","test_backup_pitr_aws","",""
"Relate the two MySQL clusters.","41194","test_async_relate","tests.integration.high_availability","2025-11-07","passed","2025-11-07","","test_async_replication_upgrade","",""
"Delete the pod in a single unit deployment and write data to new pod.","777824","test_single_unit_pod_delete","tests.integration.high_availability","2025-11-07","passed","2025-11-07","","test_self_healing_pod","",""
"Confirm that a new primary is elected when the current primary is torn down.","266322","test_scale_up_and_down","tests.integration","2025-11-07","passed","2025-11-07","","test_charm","",""
"Test graceful promotion of a standby cluster to primary.","38673","test_standby_promotion","tests.integration.high_availability","2025-11-07","passed","2025-11-07","","test_async_replication","",""
"Test to send a SIGKILL to the primary db process and ensure that the cluster self heals.","72789","test_kill_db_process","tests.integration.high_availability","2025-11-07","passed","2025-11-07","","test_self_healing_process_killed","",""
"Simple test to ensure that the MySQL and application charms get deployed.","116635","test_deploy_highly_available_cluster","tests.integration.high_availability","2025-11-07","passed","2025-11-07","","test_replication_data_consistency","",""
"Remove relation and wait for the expected changes in status.","23010","test_relation_broken","tests.integration.relations","2025-11-07","passed","2025-11-07","","test_database","",""
"Scale database and routers.","281610","test_scale_in","tests.integration","2025-11-07","passed","2025-11-07","","test_multi_relations","",""
"Relate charms and wait for the expected changes in status.","22153","test_relation_creation","tests.integration.relations","2025-11-07","passed","2025-11-07","","test_database","",""
"Simple test to ensure that the mysql charm gets deployed.","170846","test_build_and_deploy","tests.integration","2025-11-07","passed","2025-11-07","","test_backup_ceph","",""
"Test that data is preserved during scale up and scale down.","206419","test_scaling_without_data_loss","tests.integration.high_availability","2025-11-07","passed","2025-11-07","","test_replication_scaling","",""
"The cluster manual re-join test.

    A graceful restart is performed in one of the instances (choosing Primary to make it painful).
    In order to verify that the instance can come back ONLINE, after disabling automatic re-join
    ","218564","test_cluster_manual_rejoin","tests.integration.high_availability","2025-11-07","passed","2025-11-07","","test_self_healing_restart_graceful","",""
"Test that the pre-upgrade-check action runs successfully.","16133","test_pre_upgrade_check","tests.integration.high_availability","2025-11-07","passed","2025-11-07","","test_upgrade_from_stable","",""
"Relate charms before they have time to properly start.

    It simulates a Terraform-like deployment strategy
    ","146276","test_relation_creation_eager","tests.integration.relations","2025-11-07","passed","2025-11-07","","test_mysql_root","",""
"Test primary crash during startup.

    It must recover/end setup when the primary got offline.
    ","104997","test_crash_during_cluster_setup","tests.integration.high_availability","2025-11-07","passed","2025-11-07","","test_self_healing_setup_crash","",""
"Ensure connections (with and without ssl) are possible before relating with TLS operator.","2225","test_connection_before_tls","tests.integration","2025-11-07","passed","2025-11-07","","test_tls","",""
"Test to send a SIGSTOP to the primary db process and ensure that the cluster self heals.","168826","test_freeze_db_process","tests.integration.high_availability","2025-11-07","passed","2025-11-07","","test_self_healing_process_frozen","",""
"Test upgrade rollback to a healthy revision.","344872","test_rollback","tests.integration.high_availability","2025-11-07","passed","2025-11-07","","test_upgrade_rollback_incompat","",""
"","43683","test_upgrade_to_failing","tests.integration.high_availability","2025-11-07","passed","2025-11-07","","test_upgrade_rollback_incompat","",""
"Test to restore a backup on a new mysql cluster.","515848","test_restore_on_new_cluster","tests.integration","2025-11-07","passed","2025-11-07","","test_backup_aws","",""
"Simple test to ensure that the MySQL and application charms get deployed.","146832","test_deploy_highly_available_cluster","tests.integration.high_availability","2025-11-07","passed","2025-11-07","","test_self_healing_network_cut","",""
"Test the charmed_read predefined role.","66654","test_charmed_read_role","tests.integration.roles","2025-11-07","passed","2025-11-07","","test_instance_roles","",""
"Test behavior when node drains - pod is evicted and pvs are rotated.","102643","test_pod_eviction_and_pvc_deletion","tests.integration.high_availability","2025-11-07","passed","2025-11-07","","test_self_healing_node_drain","",""
"Simple test to ensure that the mysql and data-integrator charms get deployed.","155208","test_build_and_deploy","tests.integration.roles","2025-11-07","passed","2025-11-07","","test_instance_dba_role","",""
"Ensure scaling down to zero and back up works.","129585","test_scale_up_from_zero","tests.integration","2025-11-07","passed","2025-11-07","","test_charm","",""
"Relate charms and wait for the expected changes in status.","0","test_relation_creation_databag","tests.integration.relations","2025-11-07","skipped","2025-11-07","","test_database","",""
"Test removing and re-relating the two mysql clusters.","325762","test_unrelate_and_relate","tests.integration.high_availability","2025-11-07","passed","2025-11-07","","test_async_replication","",""
"Test that the pre-upgrade-check action runs successfully.","5556","test_pre_upgrade_check","tests.integration.high_availability","2025-11-07","passed","2025-11-07","","test_upgrade_rollback_incompat","",""
"Simple test to ensure that the MySQL and application charms get deployed.","134698","test_deploy_highly_available_cluster","tests.integration.high_availability","2025-11-07","passed","2025-11-07","","test_self_healing_stop_primary","",""
"Test to restore a backup to the same mysql cluster.","206874","test_restore_on_same_cluster","tests.integration","2025-11-07","passed","2025-11-07","","test_backup_ceph","",""
"Update the second cluster.","256966","test_upgrade_from_edge","tests.integration.high_availability","2025-11-07","passed","2025-11-07","","test_upgrade","",""
"Build the mysql charm and deploy it.","122924","test_build_and_deploy","tests.integration","2025-11-07","passed","2025-11-07","","test_charm","",""
"Test the deployment and relation with osm bundle with mysql replacing mariadb.","166082","test_deploy_and_relate_osm_bundle","tests.integration","2025-11-07","passed","2025-11-07","","test_osm_integration_bundle","",""
"Simple test to ensure that the MySQL and application charms get deployed.","62264","test_deploy_single_unit_cluster","tests.integration.high_availability","2025-11-07","passed","2025-11-07","","test_self_healing_setup_crash","",""
"Confirm that data is replicated from the primary node to all the replicas.","21358","test_consistent_data_replication_across_cluster","tests.integration.high_availability","2025-11-07","passed","2025-11-07","","test_replication_data_consistency","",""
"Test the labeling of k8s endpoints when apps with same cluster-name deployed.","5441","test_labeling_of_k8s_endpoints","tests.integration.high_availability","2025-11-07","passed","2025-11-07","","test_replication_unit_endpoints","",""
"Update the second cluster.","351871","test_upgrade_from_stable","tests.integration.high_availability","2025-11-07","passed","2025-11-07","","test_upgrade_from_stable","",""
"Verify rotating tls private keys restarts cluster with new certificates.

    This test rotates tls private keys to randomly generated keys.
    ","41082","test_rotate_tls_key","tests.integration","2025-11-07","passed","2025-11-07","","test_tls","",""
"Rotate password and confirm changes.","11175","test_password_rotation_silent","tests.integration","2025-11-07","passed","2025-11-07","","test_charm","",""
"Build the charm and deploy 1 units to ensure a cluster is formed.","32388","test_build_and_deploy","tests.integration","2025-11-07","passed","2025-11-07","","test_multi_relations","",""
"Test to restore a backup to the same mysql cluster.","251842","test_restore_on_same_cluster","tests.integration","2025-11-07","passed","2025-11-07","","test_backup_gcp","",""
"Test to create a backup and list backups.","58292","test_backup","tests.integration","2025-11-07","passed","2025-11-07","","test_backup_gcp","",""
"Test the log rotation of text files.","5438","test_log_rotation","tests.integration.high_availability","2025-11-07","passed","2025-11-07","","test_replication_logs_rotation","",""
"Confirm storage reuse works.","75623","test_scale_up_after_scale_down","tests.integration","2025-11-07","passed","2025-11-07","","test_charm","",""
"","58663","test_deploy_and_relate_test_app","tests.integration","2025-11-07","passed","2025-11-07","","test_saturate_max_connections","",""
"Simple test to ensure that the MySQL and application charms get deployed.","1211348","test_deploy_highly_available_cluster_2","tests.integration.high_availability","2025-11-07","broken","2025-11-07","","test_replication_unit_endpoints","",""
"Simple test to ensure that the MySQL and application charms get deployed.","133871","test_deploy_highly_available_cluster","tests.integration.high_availability","2025-11-07","passed","2025-11-07","","test_replication_logs_rotation","",""
"Rotate password and confirm changes.","13183","test_password_rotation_root_user_implicit","tests.integration","2025-11-07","passed","2025-11-07","","test_charm","",""
"Relate charms before they have time to properly start.

    It simulates a Terraform-like deployment strategy
    ","171279","test_relation_creation_eager","tests.integration.relations","2025-11-07","passed","2025-11-07","","test_database","",""
"Tries deploying an arm64 charm on amd64 host.","60393","test_arm_charm_on_amd_host","tests.integration","2025-11-07","passed","2025-11-07","","test_architecture","",""
"Confirm that data is replicated from the primary node to all the replicas.","4240","test_consistent_data_replication_across_cluster","tests.integration","2025-11-07","passed","2025-11-07","","test_charm","",""
"Test to create a backup and list backups.","51867","test_backup","tests.integration","2025-11-07","passed","2025-11-07","","test_backup_aws","",""
"Pause test.

    A graceful simultaneous restart of all instances,
    check primary election after the start, write and read data
    ","125065","test_graceful_full_cluster_crash","tests.integration.high_availability","2025-11-07","passed","2025-11-07","","test_self_healing_stop_all","",""
"Test that endpoints are running.","3965","test_exporter_endpoints","tests.integration","2025-11-07","passed","2025-11-07","","test_charm","",""
"Test to restore a backup to the same mysql cluster.","243679","test_restore_on_same_cluster","tests.integration","2025-11-07","passed","2025-11-07","","test_backup_aws","",""
"Deploy the router and the test application.","62969","test_deploy_router_and_app","tests.integration.high_availability","2025-11-07","passed","2025-11-07","","test_async_replication","",""
"Test the existence of databases and tables created by osm-pol's migrations.","33312","test_osm_pol_operations","tests.integration","2025-11-07","passed","2025-11-07","","test_osm_integration_bundle","",""
"Simple test to ensure that the MySQL and application charms get deployed.","132689","test_deploy_highly_available_cluster_1","tests.integration.high_availability","2025-11-07","passed","2025-11-07","","test_replication_unit_endpoints","",""
"Simple test to ensure that the MySQL and application charms get deployed.","142609","test_deploy_highly_available_cluster","tests.integration.high_availability","2025-11-07","passed","2025-11-07","","test_self_healing_pod","",""
"Scale database and routers.","895964","test_scale_out","tests.integration","2025-11-07","passed","2025-11-07","","test_multi_relations","",""
"Test COS integrations formed before mysql is allocated and deployed.","91291","test_deploy_bundle_with_cos_integrations","tests.integration","2025-11-07","passed","2025-11-07","","test_cos_integration_bundle","",""
"Tries deploying an amd64 charm on arm64 host.","0","test_amd_charm_on_arm_host","tests.integration","2025-11-07","skipped","2025-11-07","","test_architecture","",""
"Run the create-replication action and wait for the applications to settle.","143004","test_create_replication","tests.integration.high_availability","2025-11-07","passed","2025-11-07","","test_async_replication","",""
"Test to write to primary, and read the same data back from replicas.","20294","test_data_replication","tests.integration.high_availability","2025-11-07","passed","2025-11-07","","test_async_replication","",""
"","6760","test_saturate_max_connections","tests.integration","2025-11-07","passed","2025-11-07","","test_saturate_max_connections","",""
"Test the charmed_dml role.","85822","test_charmed_dml_role","tests.integration.roles","2025-11-07","passed","2025-11-07","","test_instance_roles","",""
"","30196","test_disable_tls","tests.integration","2025-11-07","passed","2025-11-07","","test_tls","",""
"Simple test to ensure that the MySQL application charms get deployed.","178747","test_build_and_deploy","tests.integration.high_availability","2025-11-07","passed","2025-11-07","","test_async_replication_upgrade","",""
"Simple test to ensure that the MySQL and application charms get deployed.","145245","test_deploy_highly_available_cluster","tests.integration.high_availability","2025-11-07","passed","2025-11-07","","test_self_healing_process_frozen","",""
"Build the charm and deploy 3 units to ensure a cluster is formed.","6680","test_build_and_deploy","tests.integration.relations","2025-11-07","passed","2025-11-07","","test_database","",""
"Simple test to ensure that the MySQL and application charms get deployed.","140178","test_deploy_highly_available_cluster","tests.integration.high_availability","2025-11-07","passed","2025-11-07","","test_self_healing_process_killed","",""
"Pitr tests.","260208","test_pitr_aws","tests.integration","2025-11-07","passed","2025-11-07","","test_backup_pitr_gcp","",""
