"DESCRIPTION","DURATION IN MS","NAME","PARENT SUITE","START TIME","STATUS","STOP TIME","SUB SUITE","SUITE","TEST CLASS","TEST METHOD"
"Test switchover on primary cluster fail.","0","test_failover","tests.integration.high_availability","Fri May 30 01:37:47 UTC 2025","skipped","Fri May 30 01:37:47 UTC 2025","","test_async_replication","",""
"Scale database and routers.","465229","test_scale_out","tests.integration","Fri May 30 01:31:30 UTC 2025","passed","Fri May 30 01:39:15 UTC 2025","","test_multi_relations","",""
"Test to create a backup and list backups.","44286","test_backup","tests.integration","Fri May 30 01:31:00 UTC 2025","passed","Fri May 30 01:31:44 UTC 2025","","test_backup_gcp","",""
"Tries deploying an amd64 charm on arm64 host.","0","test_amd_charm_on_arm_host","tests.integration","Fri May 30 01:29:58 UTC 2025","skipped","Fri May 30 01:29:58 UTC 2025","","test_architecture","",""
"Simple test to ensure that the mysql and application charms get deployed.","125336","test_build_and_deploy","tests.integration.high_availability","Fri May 30 01:28:17 UTC 2025","passed","Fri May 30 01:30:22 UTC 2025","","test_upgrade_rollback_incompat","",""
"Simple test to ensure that the mysql and application charms get deployed.","167508","test_deploy_latest","tests.integration.high_availability","Fri May 30 01:29:06 UTC 2025","passed","Fri May 30 01:31:54 UTC 2025","","test_upgrade","",""
"Test to restore a backup on a new mysql cluster.","548686","test_restore_on_new_cluster","tests.integration","Fri May 30 01:34:40 UTC 2025","passed","Fri May 30 01:43:49 UTC 2025","","test_backup_aws","",""
"","300612","test_rollback","tests.integration.high_availability","Fri May 30 01:31:15 UTC 2025","passed","Fri May 30 01:36:16 UTC 2025","","test_upgrade_rollback_incompat","",""
"Test to create a backup and list backups.","39544","test_backup","tests.integration","Fri May 30 01:31:57 UTC 2025","passed","Fri May 30 01:32:37 UTC 2025","","test_backup_ceph","",""
"Test COS integrations formed before mysql is allocated and deployed.","80990","test_deploy_bundle_with_cos_integrations","tests.integration","Fri May 30 01:28:37 UTC 2025","passed","Fri May 30 01:29:58 UTC 2025","","test_cos_integration_bundle","",""
"Test to kill the primary under load and ensure re-election of primary.","219564","test_kill_primary_check_reelection","tests.integration.high_availability","Fri May 30 01:31:42 UTC 2025","passed","Fri May 30 01:35:22 UTC 2025","","test_replication_reelection","",""
"Simple test to ensure that the mysql charm gets deployed.","117755","test_build_and_deploy","tests.integration","Fri May 30 01:29:58 UTC 2025","passed","Fri May 30 01:31:55 UTC 2025","","test_backup_ceph","",""
"Relate all the applications to the database.","160338","test_relate_all","tests.integration","Fri May 30 01:28:50 UTC 2025","passed","Fri May 30 01:31:30 UTC 2025","","test_multi_relations","",""
"Build the charm and deploy 3 units to ensure a cluster is formed.","181413","test_build_and_deploy","tests.integration.relations","Fri May 30 01:28:15 UTC 2025","passed","Fri May 30 01:31:17 UTC 2025","","test_database","",""
"Test the labeling of k8s endpoints when apps with same cluster-name deployed.","415958","test_labeling_of_k8s_endpoints","tests.integration.high_availability","Fri May 30 01:29:02 UTC 2025","passed","Fri May 30 01:35:58 UTC 2025","","test_k8s_endpoints","",""
"Confirm storage reuse works.","95502","test_scale_up_after_scale_down","tests.integration","Fri May 30 01:35:47 UTC 2025","passed","Fri May 30 01:37:23 UTC 2025","","test_charm","",""
"Test to create a backup and list backups.","47264","test_backup","tests.integration","Fri May 30 01:30:56 UTC 2025","passed","Fri May 30 01:31:43 UTC 2025","","test_backup_aws","",""
"Test behavior when node drains - pod is evicted and pvs are rotated.","186161","test_pod_eviction_and_pvc_deletion","tests.integration.high_availability","Fri May 30 01:32:35 UTC 2025","passed","Fri May 30 01:35:41 UTC 2025","","test_node_drain","",""
"Build and deploy for AWS.","230379","test_build_and_deploy_gcp","tests.integration","Fri May 30 01:28:26 UTC 2025","passed","Fri May 30 01:32:17 UTC 2025","","test_backup_pitr_gcp","",""
"Pitr tests.","284830","test_pitr_aws","tests.integration","Fri May 30 01:32:17 UTC 2025","passed","Fri May 30 01:37:01 UTC 2025","","test_backup_pitr_aws","",""
"Relate the two mysql clusters.","4914","test_async_relate","tests.integration.high_availability","Fri May 30 01:31:18 UTC 2025","passed","Fri May 30 01:31:23 UTC 2025","","test_async_replication","",""
"Test to restore a backup to the same mysql cluster.","163140","test_restore_on_same_cluster","tests.integration","Fri May 30 01:32:39 UTC 2025","passed","Fri May 30 01:35:22 UTC 2025","","test_backup_ceph","",""
"Simple test to ensure that the mysql charm gets deployed.","112487","test_build_and_deploy","tests.integration","Fri May 30 01:29:01 UTC 2025","passed","Fri May 30 01:30:54 UTC 2025","","test_backup_aws","",""
"","48617","test_upgrade_to_failling","tests.integration.high_availability","Fri May 30 01:30:26 UTC 2025","passed","Fri May 30 01:31:15 UTC 2025","","test_upgrade_rollback_incompat","",""
"Test to restore a backup on a new mysql cluster.","499759","test_restore_on_new_cluster","tests.integration","Fri May 30 01:34:59 UTC 2025","passed","Fri May 30 01:43:19 UTC 2025","","test_backup_gcp","",""
"Ensure scaling down to zero and back up works.","189516","test_scale_up_from_zero","tests.integration","Fri May 30 01:37:23 UTC 2025","passed","Fri May 30 01:40:32 UTC 2025","","test_charm","",""
"Test to ensure that writes to one cluster do not replicate to another cluster.","78878","test_no_replication_across_clusters","tests.integration.high_availability","Fri May 30 01:31:47 UTC 2025","passed","Fri May 30 01:33:06 UTC 2025","","test_replication_data_isolation","",""
"","260384","test_fail_and_rollback","tests.integration.high_availability","Fri May 30 01:36:04 UTC 2025","passed","Fri May 30 01:40:24 UTC 2025","","test_upgrade","",""
"Test removing and re-relating the two mysql clusters.","0","test_remove_relation_and_relate","tests.integration.high_availability","Fri May 30 01:37:47 UTC 2025","skipped","Fri May 30 01:37:47 UTC 2025","","test_async_replication","",""
"Run the create replication and wait for the applications to settle.","303474","test_create_replication","tests.integration.high_availability","Fri May 30 01:32:44 UTC 2025","broken","Fri May 30 01:37:47 UTC 2025","","test_async_replication","",""
"Ensure connections (with and without ssl) are possible before relating with TLS operator.","2276","test_connection_before_tls","tests.integration","Fri May 30 01:30:33 UTC 2025","passed","Fri May 30 01:30:35 UTC 2025","","test_tls","",""
"Test to send a SIGSTOP to the primary db process and ensure that the cluster self heals.","320424","test_freeze_db_process","tests.integration.high_availability","Fri May 30 01:32:21 UTC 2025","passed","Fri May 30 01:37:42 UTC 2025","","test_self_healing_process_frozen","",""
"","30239","test_disable_tls","tests.integration","Fri May 30 01:32:19 UTC 2025","passed","Fri May 30 01:32:49 UTC 2025","","test_tls","",""
"Simple test to ensure that the mysql and application charms get deployed.","179387","test_build_and_deploy","tests.integration.high_availability","Fri May 30 01:28:19 UTC 2025","passed","Fri May 30 01:31:18 UTC 2025","","test_async_replication","",""
"Scale database and routers.","215175","test_scale_in","tests.integration","Fri May 30 01:39:15 UTC 2025","passed","Fri May 30 01:42:51 UTC 2025","","test_multi_relations","",""
"Simple test to ensure that the mysql charm gets deployed.","113977","test_build_and_deploy","tests.integration","Fri May 30 01:29:04 UTC 2025","passed","Fri May 30 01:30:58 UTC 2025","","test_backup_gcp","",""
"","52196","test_deploy_and_relate_test_app","tests.integration","Fri May 30 01:28:32 UTC 2025","passed","Fri May 30 01:29:24 UTC 2025","","test_saturate_max_connections","",""
"Rotate password and confirm changes.","11157","test_password_rotation","tests.integration","Fri May 30 01:40:32 UTC 2025","passed","Fri May 30 01:40:44 UTC 2025","","test_charm","",""
"Test that the pre-upgrade-check action runs successfully.","17611","test_pre_upgrade_check","tests.integration.high_availability","Fri May 30 01:31:33 UTC 2025","passed","Fri May 30 01:31:51 UTC 2025","","test_upgrade_from_stable","",""
"Test to restore a backup to the same mysql cluster.","192321","test_restore_on_same_cluster","tests.integration","Fri May 30 01:31:47 UTC 2025","passed","Fri May 30 01:34:59 UTC 2025","","test_backup_gcp","",""
"Build and deploy for AWS.","237792","test_build_and_deploy_aws","tests.integration","Fri May 30 01:28:19 UTC 2025","passed","Fri May 30 01:32:17 UTC 2025","","test_backup_pitr_aws","",""
"Confirm that data is replicated from the primary node to all the replicas.","4371","test_consistent_data_replication_across_cluster","tests.integration","Fri May 30 01:31:19 UTC 2025","passed","Fri May 30 01:31:24 UTC 2025","","test_charm","",""
"Test to ensure that data is preserved when a unit is scaled up and then down.

    Ensures that there are no running continuous writes as the extra data in the
    database makes scaling up slower.
    ","188039","test_scaling_without_data_loss","tests.integration.high_availability","Fri May 30 01:32:19 UTC 2025","passed","Fri May 30 01:35:27 UTC 2025","","test_replication_scaling","",""
"Relate charms and wait for the expected changes in status.","0","test_relation_creation_databag","tests.integration.relations","Fri May 30 01:31:17 UTC 2025","skipped","Fri May 30 01:31:17 UTC 2025","","test_database","",""
"Test that the pre-upgrade-check action runs successfully.","4064","test_pre_upgrade_check","tests.integration.high_availability","Fri May 30 01:30:22 UTC 2025","passed","Fri May 30 01:30:26 UTC 2025","","test_upgrade_rollback_incompat","",""
"Test updating from stable channel.","195693","test_upgrade_from_stable","tests.integration.high_availability","Fri May 30 01:31:53 UTC 2025","passed","Fri May 30 01:35:09 UTC 2025","","test_upgrade_from_stable","",""
"Test for a network cut affecting an instance.","269147","test_network_cut_affecting_an_instance","tests.integration.high_availability","Fri May 30 01:32:05 UTC 2025","passed","Fri May 30 01:36:34 UTC 2025","","test_self_healing_network_cut","",""
"Rotate password and confirm changes.","13196","test_password_rotation_root_user_implicit","tests.integration","Fri May 30 01:40:55 UTC 2025","passed","Fri May 30 01:41:08 UTC 2025","","test_charm","",""
"Test to restore a backup on a new mysql cluster.","536587","test_restore_on_new_cluster","tests.integration","Fri May 30 01:35:22 UTC 2025","passed","Fri May 30 01:44:19 UTC 2025","","test_backup_ceph","",""
"Build the charm and deploy 1 units to ensure a cluster is formed.","28239","test_build_and_deploy","tests.integration","Fri May 30 01:28:22 UTC 2025","passed","Fri May 30 01:28:50 UTC 2025","","test_multi_relations","",""
"Confirm that a new primary is elected when the current primary is torn down.","263824","test_scale_up_and_down","tests.integration","Fri May 30 01:31:24 UTC 2025","passed","Fri May 30 01:35:47 UTC 2025","","test_charm","",""
"Build the charm and deploy 3 units to ensure a cluster is formed.","127637","test_build_and_deploy","tests.integration","Fri May 30 01:28:25 UTC 2025","passed","Fri May 30 01:30:33 UTC 2025","","test_tls","",""
"Pitr tests.","251267","test_pitr_aws","tests.integration","Fri May 30 01:32:17 UTC 2025","passed","Fri May 30 01:36:28 UTC 2025","","test_backup_pitr_gcp","",""
"Verify rotating tls private keys restarts cluster with new certificates.

    This test rotates tls private keys to randomly generated keys.
    ","40998","test_rotate_tls_key","tests.integration","Fri May 30 01:31:38 UTC 2025","passed","Fri May 30 01:32:19 UTC 2025","","test_tls","",""
"Test the log rotation of text files.

    Run continuous writes to ensure that audit log plugin is loaded and active
    when mysql-test-app runs start-continuous-writes (by logging into mysql).
    ","5542","test_log_rotation","tests.integration.high_availability","Fri May 30 01:31:30 UTC 2025","passed","Fri May 30 01:31:36 UTC 2025","","test_log_rotation","",""
"Test to send a SIGKILL to the primary db process and ensure that the cluster self heals.","111605","test_kill_db_process","tests.integration.high_availability","Fri May 30 01:31:39 UTC 2025","passed","Fri May 30 01:33:31 UTC 2025","","test_self_healing_process_killed","",""
"Delete the pod in a single unit deployment and write data to new pod.","262341","test_single_unit_pod_delete","tests.integration.high_availability","Fri May 30 01:31:31 UTC 2025","passed","Fri May 30 01:35:53 UTC 2025","","test_self_healing_pod","",""
"Tries deploying an arm64 charm on amd64 host.","59465","test_arm_charm_on_amd_host","tests.integration","Fri May 30 01:28:59 UTC 2025","passed","Fri May 30 01:29:58 UTC 2025","","test_architecture","",""
"Test for encryption enablement when relation to TLS charm.","62714","test_enable_tls","tests.integration","Fri May 30 01:30:35 UTC 2025","passed","Fri May 30 01:31:38 UTC 2025","","test_tls","",""
"Test the deployment and relation with osm bundle with mysql replacing mariadb.","141487","test_deploy_and_relate_osm_bundle","tests.integration.relations","Fri May 30 01:28:57 UTC 2025","passed","Fri May 30 01:31:19 UTC 2025","","test_mysql_root","",""
"Test the existence of databases and tables created by osm-pol's migrations.","34465","test_osm_pol_operations","tests.integration.relations","Fri May 30 01:31:19 UTC 2025","passed","Fri May 30 01:31:53 UTC 2025","","test_mysql_root","",""
"Test to write to primary, and read the same data back from replicas.","0","test_data_replication","tests.integration.high_availability","Fri May 30 01:37:47 UTC 2025","skipped","Fri May 30 01:37:47 UTC 2025","","test_async_replication","",""
"Build the charm and deploy 1 units to ensure a cluster is formed.","6579","test_build_and_deploy","tests.integration","Fri May 30 01:28:25 UTC 2025","passed","Fri May 30 01:28:32 UTC 2025","","test_saturate_max_connections","",""
"Test to write to primary, and read the same data back from replicas.","37183","test_check_consistency","tests.integration.high_availability","Fri May 30 01:32:23 UTC 2025","passed","Fri May 30 01:33:00 UTC 2025","","test_replication_data_consistency","",""
"Test to send SIGTERM to all units and then ensure that the cluster recovers.","278089","test_graceful_full_cluster_crash_test","tests.integration.high_availability","Fri May 30 01:32:21 UTC 2025","passed","Fri May 30 01:36:59 UTC 2025","","test_self_healing_stop_all","",""
"Build the mysql charm and deploy it.","145284","test_build_and_deploy","tests.integration","Fri May 30 01:28:54 UTC 2025","passed","Fri May 30 01:31:19 UTC 2025","","test_charm","",""
"Test rejoin invalidated cluster with.","0","test_rejoin_invalidated_cluster","tests.integration.high_availability","Fri May 30 01:37:47 UTC 2025","skipped","Fri May 30 01:37:47 UTC 2025","","test_async_replication","",""
"","14697","test_saturate_max_connections","tests.integration","Fri May 30 01:29:24 UTC 2025","passed","Fri May 30 01:29:39 UTC 2025","","test_saturate_max_connections","",""
"The cluster manual re-join test.

    A graceful restart is performed in one of the instances (choosing Primary to make it painful).
    In order to verify that the instance can come back ONLINE, after disabling automatic re-join
    ","72054","test_cluster_manual_rejoin","tests.integration.high_availability","Fri May 30 01:31:22 UTC 2025","passed","Fri May 30 01:32:34 UTC 2025","","test_self_healing_restart_graceful","",""
"Test that the pre-upgrade-check action runs successfully.","20622","test_pre_upgrade_check","tests.integration.high_availability","Fri May 30 01:31:54 UTC 2025","passed","Fri May 30 01:32:14 UTC 2025","","test_upgrade","",""
"","219225","test_upgrade_from_edge","tests.integration.high_availability","Fri May 30 01:32:18 UTC 2025","passed","Fri May 30 01:35:57 UTC 2025","","test_upgrade","",""
"Test primary crash during startup.

    It must recover/end setup when the primary got offline.
    ","182405","test_crash_during_cluster_setup","tests.integration.high_availability","Fri May 30 01:28:15 UTC 2025","passed","Fri May 30 01:31:17 UTC 2025","","test_crash_during_setup","",""
"Test to restore a backup to the same mysql cluster.","175334","test_restore_on_same_cluster","tests.integration","Fri May 30 01:31:45 UTC 2025","passed","Fri May 30 01:34:40 UTC 2025","","test_backup_aws","",""
"Relate charms and wait for the expected changes in status.","30660","test_relation_creation","tests.integration.relations","Fri May 30 01:31:17 UTC 2025","passed","Fri May 30 01:31:47 UTC 2025","","test_database","",""
"Test to send SIGTERM to primary instance and then verify recovery.","99471","test_graceful_crash_of_primary","tests.integration.high_availability","Fri May 30 01:31:42 UTC 2025","passed","Fri May 30 01:33:21 UTC 2025","","test_self_healing_stop_primary","",""
"Simple test to ensure that the mysql and application charms get deployed.","193527","test_deploy_stable","tests.integration.high_availability","Fri May 30 01:28:20 UTC 2025","passed","Fri May 30 01:31:33 UTC 2025","","test_upgrade_from_stable","",""
"Remove relation and wait for the expected changes in status.","29298","test_relation_broken","tests.integration.relations","Fri May 30 01:31:47 UTC 2025","passed","Fri May 30 01:32:17 UTC 2025","","test_database","",""
"Query database for custom variables.","25111","test_custom_variables","tests.integration","Fri May 30 01:41:12 UTC 2025","passed","Fri May 30 01:41:37 UTC 2025","","test_charm","",""
"Rotate password and confirm changes.","11161","test_password_rotation_silent","tests.integration","Fri May 30 01:40:44 UTC 2025","passed","Fri May 30 01:40:55 UTC 2025","","test_charm","",""
"Test that endpoints are running.","3966","test_exporter_endpoints","tests.integration","Fri May 30 01:41:08 UTC 2025","passed","Fri May 30 01:41:12 UTC 2025","","test_charm","",""
"Deploy the router and the test application.","80767","test_deploy_router_and_app","tests.integration.high_availability","Fri May 30 01:31:23 UTC 2025","passed","Fri May 30 01:32:44 UTC 2025","","test_async_replication","",""
"Test graceful promotion of a standby cluster to primary.","0","test_standby_promotion","tests.integration.high_availability","Fri May 30 01:37:47 UTC 2025","skipped","Fri May 30 01:37:47 UTC 2025","","test_async_replication","",""
