"DESCRIPTION","DURATION IN MS","NAME","PARENT SUITE","START TIME","STATUS","STOP TIME","SUB SUITE","SUITE","TEST CLASS","TEST METHOD"
"Rotate password and confirm changes.","11182","test_password_rotation","tests.integration.integration","2025-12-07","passed","2025-12-07","","test_charm","",""
"","38599","test_upgrade_to_failing","tests.integration.integration.high_availability","2025-12-07","passed","2025-12-07","","test_upgrade_rollback_incompat","",""
"Relate charms and wait for the expected changes in status.","0","test_relation_creation_databag","tests.integration.integration.relations","2025-12-07","skipped","2025-12-07","","test_database","",""
"Simple test to ensure that the MySQL and application charms get deployed.","132735","test_deploy_highly_available_cluster","tests.integration.integration.high_availability","2025-12-07","passed","2025-12-07","","test_self_healing_node_drain","",""
"Test the charmed_read predefined role.","28759","test_charmed_read_role","tests.integration.integration.roles","2025-12-07","passed","2025-12-07","","test_instance_roles","",""
"Tries deploying an amd64 charm on arm64 host.","0","test_amd_charm_on_arm_host","tests.integration.integration","2025-12-07","skipped","2025-12-07","","test_architecture","",""
"Simple test to ensure that the MySQL application charms get deployed.","159523","test_build_and_deploy","tests.integration.integration.high_availability","2025-12-07","passed","2025-12-07","","test_async_replication","",""
"Simple test to ensure that the mysql charm gets deployed.","190991","test_build_and_deploy","tests.integration.integration","2025-12-07","passed","2025-12-07","","test_backup_gcp","",""
"","3679","test_saturate_max_connections","tests.integration.integration","2025-12-07","passed","2025-12-07","","test_saturate_max_connections","",""
"Simple test to ensure that the mysql charm gets deployed.","182984","test_build_and_deploy","tests.integration.integration","2025-12-07","passed","2025-12-07","","test_backup_ceph","",""
"Test behavior when node drains - pod is evicted and pvs are rotated.","101802","test_pod_eviction_and_pvc_deletion","tests.integration.integration.high_availability","2025-12-07","passed","2025-12-07","","test_self_healing_node_drain","",""
"Test to restore a backup to the same mysql cluster.","212050","test_restore_on_same_cluster","tests.integration.integration","2025-12-07","passed","2025-12-07","","test_backup_ceph","",""
"Test that the primary node can be switched over.","14602","test_cluster_switchover","tests.integration.integration.high_availability","2025-12-07","passed","2025-12-07","","test_primary_switchover","",""
"Confirm that a new primary is elected when the current primary is tear down.","356736","test_kill_primary_check_reelection","tests.integration.integration.high_availability","2025-12-07","passed","2025-12-07","","test_replication_reelection","",""
"Test to restore a backup on a new mysql cluster.","580808","test_restore_on_new_cluster","tests.integration.integration","2025-12-07","passed","2025-12-07","","test_backup_gcp","",""
"Test the DBA predefined role.","18930","test_charmed_dba_role","tests.integration.integration.roles","2025-12-07","passed","2025-12-07","","test_instance_dba_role","",""
"Test rejoin invalidated cluster with.","87025","test_rejoin_invalidated_cluster","tests.integration.integration.high_availability","2025-12-07","passed","2025-12-07","","test_async_replication","",""
"Test for cluster data isolation.

    This test creates a new cluster, create a new table on both cluster, write a single record with
    the application name for each cluster, retrieve and compare these records, asserting they are
    not the same.
    ","83733","test_cluster_data_isolation","tests.integration.integration.high_availability","2025-12-07","passed","2025-12-07","","test_replication_data_isolation","",""
"Build the charm and deploy 3 units to ensure a cluster is formed.","156708","test_build_and_deploy","tests.integration.integration","2025-12-07","passed","2025-12-07","","test_tls","",""
"","67342","test_deploy_and_relate_test_app","tests.integration.integration","2025-12-07","passed","2025-12-07","","test_saturate_max_connections","",""
"Simple test to ensure that the MySQL and application charms get deployed.","119805","test_deploy_highly_available_cluster","tests.integration.integration.high_availability","2025-12-07","passed","2025-12-07","","test_replication_reelection","",""
"Simple test to ensure that the MySQL application charms get deployed.","167815","test_build_and_deploy","tests.integration.integration.high_availability","2025-12-07","passed","2025-12-07","","test_async_replication_upgrade","",""
"Run the create-replication action and wait for the applications to settle.","150651","test_create_replication","tests.integration.integration.high_availability","2025-12-07","passed","2025-12-07","","test_async_replication_upgrade","",""
"Simple test to ensure that the MySQL and application charms get deployed.","125727","test_deploy_highly_available_cluster","tests.integration.integration.high_availability","2025-12-07","passed","2025-12-07","","test_self_healing_stop_all","",""
"Simple test to ensure that the MySQL and application charms get deployed.","113436","test_build_and_deploy","tests.integration.integration.high_availability","2025-12-07","passed","2025-12-07","","test_upgrade_rollback_incompat","",""
"Build the mysql charm and deploy it.","125541","test_build_and_deploy","tests.integration.integration","2025-12-07","passed","2025-12-07","","test_charm","",""
"Test to restore a backup to the same mysql cluster.","220953","test_restore_on_same_cluster","tests.integration.integration","2025-12-07","passed","2025-12-07","","test_backup_gcp","",""
"Test removing and re-relating the two mysql clusters.","302949","test_unrelate_and_relate","tests.integration.integration.high_availability","2025-12-07","passed","2025-12-07","","test_async_replication","",""
"Test to restore a backup on a new mysql cluster.","495157","test_restore_on_new_cluster","tests.integration.integration","2025-12-07","passed","2025-12-07","","test_backup_ceph","",""
"Confirm that data is replicated from the primary node to all the replicas.","5348","test_consistent_data_replication_across_cluster","tests.integration.integration","2025-12-07","passed","2025-12-07","","test_charm","",""
"Simple test to ensure that the MySQL and application charms get deployed.","131930","test_deploy_highly_available_cluster","tests.integration.integration.high_availability","2025-12-07","passed","2025-12-07","","test_self_healing_process_frozen","",""
"Pause test.

    A graceful simultaneous restart of all instances,
    check primary election after the start, write and read data
    ","142250","test_graceful_full_cluster_crash","tests.integration.integration.high_availability","2025-12-07","passed","2025-12-07","","test_self_healing_stop_all","",""
"Verify rotating tls private keys restarts cluster with new certificates.

    This test rotates tls private keys to randomly generated keys.
    ","42056","test_rotate_tls_key","tests.integration.integration","2025-12-07","passed","2025-12-07","","test_tls","",""
"Confirm that data is replicated from the primary node to all the replicas.","22199","test_consistent_data_replication_across_cluster","tests.integration.integration.high_availability","2025-12-07","passed","2025-12-07","","test_replication_data_consistency","",""
"Test to write to primary, and read the same data back from replicas.","22979","test_data_replication","tests.integration.integration.high_availability","2025-12-07","passed","2025-12-07","","test_async_replication_upgrade","",""
"Pitr tests.","235737","test_pitr_aws","tests.integration.integration","2025-12-07","passed","2025-12-07","","test_backup_pitr_gcp","",""
"Upgrade the two MySQL clusters.","647743","test_upgrade_from_edge","tests.integration.integration.high_availability","2025-12-07","passed","2025-12-07","","test_async_replication_upgrade","",""
"Test the existence of databases and tables created by osm-pol's migrations.","34341","test_osm_pol_operations","tests.integration.integration","2025-12-07","passed","2025-12-07","","test_osm_integration_bundle","",""
"Test to send a SIGKILL to the primary db process and ensure that the cluster self heals.","91898","test_kill_db_process","tests.integration.integration.high_availability","2025-12-07","passed","2025-12-07","","test_self_healing_process_killed","",""
"Relate the two MySQL clusters.","35127","test_async_relate","tests.integration.integration.high_availability","2025-12-07","passed","2025-12-07","","test_async_replication","",""
"Test the charmed_dml role.","61298","test_charmed_dml_role","tests.integration.integration.roles","2025-12-07","passed","2025-12-07","","test_instance_roles","",""
"Relate all the applications to the database.","225417","test_relate_all","tests.integration.integration","2025-12-07","passed","2025-12-07","","test_multi_relations","",""
"Remove relation and wait for the expected changes in status.","12685","test_relation_broken","tests.integration.integration.relations","2025-12-07","passed","2025-12-07","","test_database","",""
"Confirm that a new primary is elected when the current primary is torn down.","312958","test_scale_up_and_down","tests.integration.integration","2025-12-07","passed","2025-12-07","","test_charm","",""
"Test upgrade rollback to a healthy revision.","326682","test_rollback","tests.integration.integration.high_availability","2025-12-07","passed","2025-12-07","","test_upgrade_rollback_incompat","",""
"Simple test to ensure that the mysql and data-integrator charms get deployed.","143288","test_build_and_deploy","tests.integration.integration.roles","2025-12-07","passed","2025-12-07","","test_database_dba_role","",""
"Build and deploy for AWS.","250204","test_build_and_deploy_aws","tests.integration.integration","2025-12-07","passed","2025-12-07","","test_backup_pitr_aws","",""
"Build the charm and deploy 1 units to ensure a cluster is formed.","5909","test_build_and_deploy","tests.integration.integration","2025-12-07","passed","2025-12-07","","test_saturate_max_connections","",""
"Run the create-replication action and wait for the applications to settle.","381168","test_create_replication","tests.integration.integration.high_availability","2025-12-07","broken","2025-12-07","","test_async_replication","",""
"Test to restore a backup to the same mysql cluster.","222507","test_restore_on_same_cluster","tests.integration.integration","2025-12-07","passed","2025-12-07","","test_backup_aws","",""
"Test that data is preserved during scale up and scale down.","178609","test_scaling_without_data_loss","tests.integration.integration.high_availability","2025-12-07","passed","2025-12-07","","test_replication_scaling","",""
"Simple test to ensure that the MySQL and application charms get deployed.","132688","test_deploy_highly_available_cluster","tests.integration.integration.high_availability","2025-12-07","passed","2025-12-07","","test_replication_scaling","",""
"Simple test to ensure that the mysql and data-integrator charms get deployed.","127250","test_build_and_deploy","tests.integration.integration.roles","2025-12-07","passed","2025-12-07","","test_instance_dba_role","",""
"Build the charm and deploy 1 units to ensure a cluster is formed.","37821","test_build_and_deploy","tests.integration.integration","2025-12-07","passed","2025-12-07","","test_multi_relations","",""
"Simple test to ensure that the MySQL and application charms get deployed.","136211","test_deploy_highly_available_cluster","tests.integration.integration.high_availability","2025-12-07","passed","2025-12-07","","test_self_healing_process_killed","",""
"Test the log rotation of text files.","5084","test_log_rotation","tests.integration.integration.high_availability","2025-12-07","passed","2025-12-07","","test_replication_logs_rotation","",""
"Simple test to ensure that the MySQL and application charms get deployed.","139110","test_deploy_highly_available_cluster","tests.integration.integration.high_availability","2025-12-07","passed","2025-12-07","","test_replication_data_consistency","",""
"Test to restore a backup on a new mysql cluster.","544550","test_restore_on_new_cluster","tests.integration.integration","2025-12-07","passed","2025-12-07","","test_backup_aws","",""
"Test the deployment and relation with osm bundle with mysql replacing mariadb.","170680","test_deploy_and_relate_osm_bundle","tests.integration.integration","2025-12-07","passed","2025-12-07","","test_osm_integration_bundle","",""
"Simple test to ensure that the MySQL and application charms get deployed.","68189","test_deploy_single_unit_cluster","tests.integration.integration.high_availability","2025-12-07","passed","2025-12-07","","test_self_healing_setup_crash","",""
"Deploy the router and the test application.","60523","test_deploy_router_and_app","tests.integration.integration.high_availability","2025-12-07","passed","2025-12-07","","test_async_replication","",""
"Scale database and routers.","750532","test_scale_out","tests.integration.integration","2025-12-07","passed","2025-12-07","","test_multi_relations","",""
"Test to create a backup and list backups.","44659","test_backup","tests.integration.integration","2025-12-07","passed","2025-12-07","","test_backup_ceph","",""
"Simple test to ensure that the MySQL and application charms get deployed.","126323","test_deploy_highly_available_cluster","tests.integration.integration.high_availability","2025-12-07","passed","2025-12-07","","test_self_healing_network_cut","",""
"Scale database and routers.","271772","test_scale_in","tests.integration.integration","2025-12-07","passed","2025-12-07","","test_multi_relations","",""
"Test to create a backup and list backups.","59920","test_backup","tests.integration.integration","2025-12-07","passed","2025-12-07","","test_backup_aws","",""
"Ensure scaling down to zero and back up works.","154528","test_scale_up_from_zero","tests.integration.integration","2025-12-07","passed","2025-12-07","","test_charm","",""
"Test to send a SIGSTOP to the primary db process and ensure that the cluster self heals.","243987","test_freeze_db_process","tests.integration.integration.high_availability","2025-12-07","passed","2025-12-07","","test_self_healing_process_frozen","",""
"Simple test to ensure that the MySQL and application charms get deployed.","124597","test_deploy_highly_available_cluster","tests.integration.integration.high_availability","2025-12-07","passed","2025-12-07","","test_replication_logs_rotation","",""
"Test COS integrations formed before mysql is allocated and deployed.","103961","test_deploy_bundle_with_cos_integrations","tests.integration.integration","2025-12-07","passed","2025-12-07","","test_cos_integration_bundle","",""
"Confirm storage reuse works.","85760","test_scale_up_after_scale_down","tests.integration.integration","2025-12-07","passed","2025-12-07","","test_charm","",""
"Test that the pre-upgrade-check action runs successfully.","18041","test_pre_upgrade_check","tests.integration.integration.high_availability","2025-12-07","passed","2025-12-07","","test_upgrade","",""
"Update the second cluster.","370091","test_upgrade_from_edge","tests.integration.integration.high_availability","2025-12-07","passed","2025-12-07","","test_upgrade","",""
"Simple test to ensure that the mysql and data-integrator charms get deployed.","127845","test_build_and_deploy","tests.integration.integration.roles","2025-12-07","passed","2025-12-07","","test_instance_roles","",""
"Test to create a backup and list backups.","49099","test_backup","tests.integration.integration","2025-12-07","passed","2025-12-07","","test_backup_gcp","",""
"Test primary crash during startup.

    It must recover/end setup when the primary got offline.
    ","112516","test_crash_during_cluster_setup","tests.integration.integration.high_availability","2025-12-07","passed","2025-12-07","","test_self_healing_setup_crash","",""
"Ensure connections (with and without ssl) are possible before relating with TLS operator.","2197","test_connection_before_tls","tests.integration.integration","2025-12-07","passed","2025-12-07","","test_tls","",""
"Rotate password and confirm changes.","11163","test_password_rotation_silent","tests.integration.integration","2025-12-07","passed","2025-12-07","","test_charm","",""
"Simple test to ensure that the mysql charm gets deployed.","167926","test_build_and_deploy","tests.integration.integration","2025-12-07","passed","2025-12-07","","test_backup_aws","",""
"Test that the pre-upgrade-check action runs successfully.","","test_pre_upgrade_check","tests.integration.integration.high_availability","","unknown","","","test_upgrade_from_stable","",""
"Update the second cluster.","","test_upgrade_from_stable","tests.integration.integration.high_availability","","unknown","","","test_upgrade_from_stable","",""
"","30169","test_disable_tls","tests.integration.integration","2025-12-07","passed","2025-12-07","","test_tls","",""
"Test the labeling of k8s endpoints when apps with same cluster-name deployed.","4662","test_labeling_of_k8s_endpoints","tests.integration.integration.high_availability","2025-12-07","passed","2025-12-07","","test_replication_unit_endpoints","",""
"Simple test to ensure that the MySQL and application charms get deployed.","166389","test_deploy_latest","tests.integration.integration.high_availability","2025-12-07","passed","2025-12-07","","test_upgrade","",""
"Simple test to ensure that the MySQL and application charms get deployed.","","test_deploy_stable","tests.integration.integration.high_availability","","unknown","","","test_upgrade_from_stable","",""
"Simple test to ensure that the MySQL and application charms get deployed.","135049","test_deploy_highly_available_cluster","tests.integration.integration.high_availability","2025-12-07","passed","2025-12-07","","test_replication_data_isolation","",""
"Delete the pod in a single unit deployment and write data to new pod.","744851","test_single_unit_pod_delete","tests.integration.integration.high_availability","2025-12-07","passed","2025-12-07","","test_self_healing_pod","",""
"Test for encryption enablement when relation to TLS charm.","72039","test_enable_tls","tests.integration.integration","2025-12-07","passed","2025-12-07","","test_tls","",""
"Test the database-level DBA role.","31285","test_charmed_dba_role","tests.integration.integration.roles","2025-12-07","passed","2025-12-07","","test_database_dba_role","",""
"The cluster manual re-join test.

    A graceful restart is performed in one of the instances (choosing Primary to make it painful).
    In order to verify that the instance can come back ONLINE, after disabling automatic re-join
    ","169300","test_cluster_manual_rejoin","tests.integration.integration.high_availability","2025-12-07","passed","2025-12-07","","test_self_healing_restart_graceful","",""
"Test an upgrade failure and its rollback.","417892","test_fail_and_rollback","tests.integration.integration.high_availability","2025-12-07","passed","2025-12-07","","test_upgrade","",""
"Build the charm and deploy 3 units to ensure a cluster is formed.","7642","test_build_and_deploy","tests.integration.integration.relations","2025-12-07","passed","2025-12-07","","test_mysql_root","",""
"Test to write to primary, and read the same data back from replicas.","20558","test_data_replication","tests.integration.integration.high_availability","2025-12-07","passed","2025-12-07","","test_async_replication","",""
"Test switchover on primary cluster fail.","300164","test_failover","tests.integration.integration.high_availability","2025-12-07","passed","2025-12-07","","test_async_replication","",""
"Test graceful promotion of a standby cluster to primary.","45535","test_standby_promotion","tests.integration.integration.high_availability","2025-12-07","passed","2025-12-07","","test_async_replication","",""
"Simple test to ensure that the MySQL and application charms get deployed.","149083","test_deploy_highly_available_cluster","tests.integration.integration.high_availability","2025-12-07","passed","2025-12-07","","test_self_healing_restart_graceful","",""
"Simple test to ensure that the MySQL and application charms get deployed.","149863","test_deploy_highly_available_cluster_1","tests.integration.integration.high_availability","2025-12-07","passed","2025-12-07","","test_replication_unit_endpoints","",""
"Test for a network cut affecting an instance.","124651","test_network_cut_affecting_an_instance","tests.integration.integration.high_availability","2025-12-07","passed","2025-12-07","","test_self_healing_network_cut","",""
"Rotate password and confirm changes.","13169","test_password_rotation_root_user_implicit","tests.integration.integration","2025-12-07","passed","2025-12-07","","test_charm","",""
"Build the charm and deploy 3 units to ensure a cluster is formed.","8853","test_build_and_deploy","tests.integration.integration.relations","2025-12-07","passed","2025-12-07","","test_database","",""
"Tries deploying an arm64 charm on amd64 host.","61143","test_arm_charm_on_amd_host","tests.integration.integration","2025-12-07","passed","2025-12-07","","test_architecture","",""
"Relate charms before they have time to properly start.

    It simulates a Terraform-like deployment strategy
    ","159594","test_relation_creation_eager","tests.integration.integration.relations","2025-12-07","passed","2025-12-07","","test_mysql_root","",""
"Simple test to ensure that the MySQL and application charms get deployed.","137365","test_deploy_highly_available_cluster","tests.integration.integration.high_availability","2025-12-07","passed","2025-12-07","","test_self_healing_stop_primary","",""
"Deploy the test application.","38997","test_deploy_test_app","tests.integration.integration.high_availability","2025-12-07","passed","2025-12-07","","test_async_replication_upgrade","",""
"Relate the two MySQL clusters.","34369","test_async_relate","tests.integration.integration.high_availability","2025-12-07","passed","2025-12-07","","test_async_replication_upgrade","",""
"Simple test to ensure that the MySQL and application charms get deployed.","118429","test_deploy_highly_available_cluster","tests.integration.integration.high_availability","2025-12-07","passed","2025-12-07","","test_self_healing_pod","",""
"Query database for custom variables.","24873","test_custom_variables","tests.integration.integration","2025-12-07","passed","2025-12-07","","test_charm","",""
"Simple test to ensure that the MySQL and application charms get deployed.","1210920","test_deploy_highly_available_cluster_2","tests.integration.integration.high_availability","2025-12-07","broken","2025-12-07","","test_replication_unit_endpoints","",""
"Test to send SIGTERM to primary instance and then verify recovery.","201183","test_graceful_crash_of_primary","tests.integration.integration.high_availability","2025-12-07","passed","2025-12-07","","test_self_healing_stop_primary","",""
"Pitr tests.","279088","test_pitr_aws","tests.integration.integration","2025-12-07","passed","2025-12-07","","test_backup_pitr_aws","",""
"Relate charms before they have time to properly start.

    It simulates a Terraform-like deployment strategy
    ","152109","test_relation_creation_eager","tests.integration.integration.relations","2025-12-07","passed","2025-12-07","","test_database","",""
"Relate charms and wait for the expected changes in status.","3604","test_relation_creation","tests.integration.integration.relations","2025-12-07","passed","2025-12-07","","test_database","",""
"Test that the pre-upgrade-check action runs successfully.","5504","test_pre_upgrade_check","tests.integration.integration.high_availability","2025-12-07","passed","2025-12-07","","test_upgrade_rollback_incompat","",""
"Test the promote-to-primary command after losing the majority of nodes, with force flag.","263303","test_cluster_failover_after_majority_loss","tests.integration.integration.high_availability","2025-12-07","passed","2025-12-07","","test_primary_switchover","",""
"Build and deploy for AWS.","254806","test_build_and_deploy_gcp","tests.integration.integration","2025-12-07","passed","2025-12-07","","test_backup_pitr_gcp","",""
"Test that endpoints are running.","4119","test_exporter_endpoints","tests.integration.integration","2025-12-07","passed","2025-12-07","","test_charm","",""
